round,hint_id,train_qid,sampling_slurm_job_id,proposal_eval_slurm_job_id,incumbent_hash,proposal_hash,final_hash,old_train,new_train,delta_train,old_heldout,new_heldout,delta_heldout,old_J,new_J,delta_J,old_tokens,new_tokens,decision,mutation,subagent_summary
6,10,3843,618.122,618.132,03b88454bbefe8b368f773ca44d44d049e482cea344efb81862348cdcd92e1e8,cb3f1fa8c186e3339bded2e1e7f9e7bbb3ce2847fe047e1e7a6863943ba96efd,03b88454bbefe8b368f773ca44d44d049e482cea344efb81862348cdcd92e1e8,0.5,0.25,-0.25,0.1875,0.1375,-0.04999999999999999,0.6875,0.3875,-0.3,190,182,discarded,replace unused duplicate-check clause with stage-vs-operation counting rule; ban special-case patching,"Fresh rollouts scored 0/8 with 7 of 8 truncated at the token cap after thousands of tokens of re-derivation. No rollout ever used the incumbent's 'each label exactly once / redo the stage' bookkeeping clause, so those tokens were dead weight; instead the dominant concrete misstep was conflating one stage with one full operation while tracing small sizes, which then made traces disagree with candidate formulas and triggered endless restarts. Two rollouts that did reach a stated value got there by patching a formula with an n=1 special case, so I reallocated the unused clause into an explicit stage-vs-operation counting rule plus a ban on special-case patching, and the result is shorter than the incumbent."
