round,hint_id,train_qid,sampling_slurm_job_id,proposal_eval_slurm_job_id,incumbent_hash,proposal_hash,final_hash,old_train,new_train,delta_train,old_heldout,new_heldout,delta_heldout,old_J,new_J,delta_J,old_tokens,new_tokens,decision,mutation,subagent_summary
4,10,3843,618.82,618.92,854dd260013d73627dad0d67ef8f749d5b41dff8237e99a470e336c555d9e388,03b88454bbefe8b368f773ca44d44d049e482cea344efb81862348cdcd92e1e8,03b88454bbefe8b368f773ca44d44d049e482cea344efb81862348cdcd92e1e8,0.5,0.5,0.0,0.1625,0.1875,0.024999999999999994,0.6625,0.6875,0.025000000000000022,194,190,kept,replace unused bit-string clause with the observed order-2 involution trap,"3/8 correct; the two cleanest wins came from pure explicit list tracing plus orbit tracking and never touched the binary/bit-string clause, while three of five failures collapsed to the same fallacy of calling the composite a product of disjoint transpositions and asserting order 2, and two failures looped to the token cap while trying to reconcile a bit-string model. I therefore deleted the bit-string verification clause no winning rollout used and spent fewer tokens on an explicit warning that the overlapping stages do not compose into disjoint swaps and the composite is not self-inverse, keeping the proven first move, invariant check, trust-the-trace rule and commit-and-stop ending intact."
5,1,28054,618.93,618.103,dbc2ee04fc1040b32c556b3902c8b24a068f4fb2a65471d780bb7cf95f06ed05,695ab47bb0748107ba23a69886281bda66bf2eed7acbca41d8e99a029d7e03f9,dbc2ee04fc1040b32c556b3902c8b24a068f4fb2a65471d780bb7cf95f06ed05,0.25,0.25,0.0,0.2,0.1875,-0.012500000000000011,0.45,0.4375,-0.012500000000000011,162,174,discarded,replace passive no-case-split warning with explicit merged-reading move plus contradiction-loop tripwire,"All 8 fresh rollouts scored 0 (train 0.000) and 5 of 8 hit the 16384-token cap with nothing committed. Every rollout that reasoned visibly did the one thing the incumbent warned against in the abstract: it pinned the reveal to sum, then to product, derived a contradiction in both branches (one rollout wrote ""impossible"" 70 times), and then thrashed or guessed. The edit turns that passive warning into an executable merged-candidate-list move and adds a concrete tripwire (repeated ""impossible"" means the knowledge model is wrong), while leaving the proven announcement-filtering and commit-and-stop clauses intact."
5,2,30302,618.94,618.104,403ac7fe6d24609478ebddf8eeef57d4a375e388b75b64df02190ca6628359fa,9c61d4740f15b2ee26ca0faf9788b29a7708fbd5b52b36c49ac95ba82bb3cd00,9c61d4740f15b2ee26ca0faf9788b29a7708fbd5b52b36c49ac95ba82bb3cd00,1.0,1.0,0.0,0.175,0.175,0.0,1.175,1.175,0.0,198,195,kept,widen trigger from phrasing-based to structural; drop unused Apollonius label,"Fresh rollouts scored 8/8 with every sample terminating normally (finish_reason stop, 3.8k-6.9k of 16384 tokens), so train accuracy has no headroom and any risk to the proven body is pure downside. Keyword scans show the students reliably execute the take-moduli first move, the k^n=|c| check, complete-the-square, and the original-equation verification, but only one of eight ever used the 'Apollonius' label, making it dead weight. I therefore made one generality edit - replacing the phrasing-dependent trigger 'For all roots lie on one circle problems' with the structural condition 'an equation equates two n-th powers of linear expressions in z' so the hint fires on locus/center/radius variants that never use the word circle - and paid for it by deleting the unused label, leaving the hint slightly shorter than the incumbent (195 vs 198 tokens)."
5,3,8554,618.95,618.105,7d558dd1246b9fa85107df156c2038c19f7eac6dcbc4d6e9796c2024f6c76b7a,cde40cad3d78c688d058a4c1b49465a4b669a468253d28c371e90239b1bd1797,cde40cad3d78c688d058a4c1b49465a4b669a468253d28c371e90239b1bd1797,0.25,0.375,0.125,0.1375,0.1,-0.037500000000000006,0.3875,0.475,0.08749999999999997,191,190,kept,"cut unused proof/minimization clauses, add explicit no-rewrite termination rule","All 8 rollouts ran 15k-16.4k tokens and 6 of 8 truncated at the 16384 cap; both successes stopped early, so the binding constraint is budget, not geometry. Failures share two visible patterns: they never attempt the 'show the far edges are too distant' proof or the 'minimize over the symmetry-reduced range' step the incumbent asks for, and instead loop on qualitative prose arguments about which placement minimizes overlap, then burn the remaining budget re-deriving and typesetting a long formatted write-up after already having a number. So I deleted those two never-followed clauses and spent the tokens on a ban on prose minimality arguments plus an explicit stop-after-one-number rule; net length is slightly shorter than the incumbent."
5,4,25003,618.96,618.106,f212db17d44fe5d49e8827b752416b5712e08e5fae6e5c30aafeee3eac2b3c99,6c910ddef52d28ac80a7a2a2ea642d67ba7be0d42ebb3a7f9b601c9d78399495,f212db17d44fe5d49e8827b752416b5712e08e5fae6e5c30aafeee3eac2b3c99,1.0,0.75,-0.25,0.1875,0.225,0.037500000000000006,1.1875,0.975,-0.21250000000000002,161,161,discarded,swap unused differencing warning for the n-vs-n+1 root-cap trap plus a no-downgrade rule,"Fresh 8 rollouts gave train 4/8 with zero truncations (all finish_reason stop, 8.4k-11.1k tokens), so the failures are a single reusable counting error, not budget. Every rollout adopted the affine-target/root-bound frame, but two failures set the per-polynomial cap to degree+1 by invoking 'n+1 points determine a degree-n polynomial', one picked an unjustified smaller cap, and one derived the correct cap then downgraded its count at the last step; no rollout ever attempted the finite-differencing dead end my incumbent warned against. I therefore deleted that dead clause and spent the identical token count (161, same as incumbent) on the explicit n-vs-n+1 cap trap and a no-downgrade commit rule, changing nothing else."
5,5,30418,618.97,618.107,b4fd32f624ae17388dbdae26f7e56c31810f77c5a9d0b0ec175f909f80debcae,ba66cff345168833de2902df7b4690d651bbbdb7600f5fb7402df474c6f35df3,b4fd32f624ae17388dbdae26f7e56c31810f77c5a9d0b0ec175f909f80debcae,0.75,0.5,-0.25,0.225,0.1375,-0.0875,0.975,0.6375,-0.3375,185,190,discarded,make the contradiction-recovery step executable via a numeric check at a given point,"6/8 rollouts scored 1; the only two failures both hit the 16384-token cap with nothing stated, and both looped for the same reason: after inverting one ratio while rewriting the log expression they reached a contradiction (or a negative discriminant), then re-derived the whole setup repeatedly instead of localizing the flip. The incumbent's 'recheck only that conversion line' was too vague to act on, so this edit replaces it with a concrete diagnostic (evaluate the curve numerically at a supplied point and repair only the line that fails) while leaving every other proven clause intact and keeping length essentially flat."
5,6,26989,618.98,618.108,f42ab52a7986f701b5f58ac0be9971ac18d82f4c450fceaa2b4bac9880f44efc,4f3a2fe985154e03155c43726da6de2f636d3279e3acbfcb297a40e3f4d911b4,f42ab52a7986f701b5f58ac0be9971ac18d82f4c450fceaa2b4bac9880f44efc,0.25,0.0,-0.25,0.1875,0.1125,-0.075,0.4375,0.1125,-0.325,146,148,discarded,replace unused state-graph clause with the k-intakes-to-depth conversion rule,"All 8 rollouts scored 0 with finish_reason stop and no truncation, so budget is not the issue; failures were conceptual. No rollout ever built the 'small state graph' the incumbent asked for, so that clause was dead weight and I deleted it. Six of eight failures came from the same two steps: mistranslating 'bottom of the shed' into a timing claim (some said last delivered, one concluded the target item could never move at all) and then falling back on a uniform-order symmetry claim to produce a bare 1/n, so I spent the freed tokens on an explicit rule converting depth into the number of intake moves preceding the first delivery, and kept the proven anti-symmetry and commit-and-stop wording unchanged."
5,7,3836,618.99,618.109,a5f0bebbf171514448d2c25b2da91ad8d8e32249a497ec55ab02a9ef2011f442,f83e3f4dd3be9f274dcfdb9272ae13fd5c372017fab12105dd2d77cd5c454f3f,a5f0bebbf171514448d2c25b2da91ad8d8e32249a497ec55ab02a9ef2011f442,0.125,0.0,-0.125,0.1875,0.15,-0.037500000000000006,0.3125,0.15,-0.1625,154,157,discarded,correct the weights-vs-polynomial-coefficients misreading and ban the two observed derailments,"All 8 fresh rollouts scored 0 and 7 of 8 hit the token cap with nothing committed; every one of them reinterpreted the unknowns as coefficients of a single polynomial in x, then burned the budget expanding elementary-symmetric coefficients, chasing harmonic sums, or hand-checking tiny analogues. The edit keeps the proven functional framing and closing commit rule but adds one clause naming that misreading and replaces the unused 'do not invert/re-index' ban with the two derailments actually observed."
5,8,23443,618.100,618.110,149cabea90724683bc818e06d11bef6dc0c07209cfe1b68f2300dc838be4613d,dde3d82bcea8956aced4f1e0a5377ee653c1705aa7c62b262d8f7ec159f8932d,149cabea90724683bc818e06d11bef6dc0c07209cfe1b68f2300dc838be4613d,1.0,0.375,-0.625,0.15,0.1625,0.012500000000000011,1.15,0.5375,-0.6124999999999999,77,72,discarded,delete unused layout clause; generalize houses to identical units and name gcd,"All 8 rollouts were correct and terminated cleanly, so train accuracy cannot rise and the only lever is transfer. Every rollout used the divide-every-stage-total clause and computed a gcd explicitly, but none ever used the equal-street layout clause (they mentioned it and then discarded it), so that clause is dead weight; one rollout burned nearly 7k tokens re-litigating the interpretation before committing. I therefore deleted the unused layout clause, replaced the problem-specific nouns (houses, construction costs) with the general identical-units / cost-components framing, named gcd since the student derives it anyway, and added a short commit-and-stop, keeping the hint no longer than the incumbent."
5,9,3980,618.101,618.111,8198f46ecb6773324be0c859c56a0ad50cefd003d11ec94e1b5845e37e7269e5,aea147c2fe37c969928ad225d0b223868c6c0aa6e63222855ef055102744f622,8198f46ecb6773324be0c859c56a0ad50cefd003d11ec94e1b5845e37e7269e5,1.0,0.75,-0.25,0.175,0.15,-0.024999999999999994,1.175,0.9,-0.275,193,197,discarded,rename affine shift to a fresh letter; require top-down coefficient matching instead of single-point substitution; drop unused q=p+const branch warning,"Fresh rollouts scored 5/8: the three failures were one truncation (a detour into rational substitution and a huge quadratic, never terminating) and two that reused the same letter for the affine shift and for the polynomial's quadratic coefficient, then substituted a single numeric point instead of matching coefficients, producing wrong coefficients from an underdetermined system. The edit renames the shift constant, makes 'match the top couple of coefficients' concretely top-down with the leading coefficient first, and explicitly bans the single-point shortcut; the branch-warning clause no rollout ever used was deleted to keep length below the incumbent."
5,10,3843,618.102,618.112,03b88454bbefe8b368f773ca44d44d049e482cea344efb81862348cdcd92e1e8,f9d39850172dc39fc4212513e218b64f5fec20e20d9cc93912cbdcb02e0eacb2,03b88454bbefe8b368f773ca44d44d049e482cea344efb81862348cdcd92e1e8,0.5,0.5,0.0,0.1875,0.15,-0.037500000000000006,0.6875,0.65,-0.03749999999999998,190,181,discarded,replace costly full-list re-verification clause with a single-label index map plus a two-size budget cap,"All 8 rollouts scored 0 this round; 7 of 8 terminated with finish_reason=length at the 16384-token cap having committed nothing, and the one that stopped guessed an off-by-one exponent after abandoning its trace. Failures were dominated by repeatedly rewriting full letter lists for n=2 and n=3, then declaring the work 'too complex' and restarting, so I deleted the incumbent's expensive per-stage bookkeeping/redo clause (which visibly fed that loop) and replaced it with an operational cheaper representation: compose the n stages into one index map for a single label and iterate only that map, capped at two sizes. The proven first move, overlap trap, trust-the-trace rule, and commit-and-stop rule are kept, and the hint is shorter than the incumbent (181 vs 190 tokens)."
6,1,28054,618.113,618.123,dbc2ee04fc1040b32c556b3902c8b24a068f4fb2a65471d780bb7cf95f06ed05,2bb207cd5f32facdd1bfa4f205e8cf23cbfd9e8f33685ee3ab55a18bd3db4cc4,dbc2ee04fc1040b32c556b3902c8b24a068f4fb2a65471d780bb7cf95f06ed05,0.25,0.25,0.0,0.2,0.2,0.0,0.45,0.45,0.0,162,166,discarded,"name the false-contradiction trap that replaces the unfollowed ""do not assume one reading"" clause","All 8 fresh rollouts scored 0 and every one failed the same way: the student fixed the product reading, derived that an agent would then know the partner value, declared the problem logically inconsistent, and closed by asserting an unverified candidate (six of eight converged on the same wrong divisor, and two also truncated at the token cap while still relitigating the reading). The incumbent's abstract prohibition ('do not case-split externally, assume one reading, and restart') was visibly ignored, so I replaced only that clause with an operational statement of what the apparent contradiction actually proves, keeping the surviving filtering and verification wording intact and adding just four net tokens."
6,2,30302,618.114,618.124,9c61d4740f15b2ee26ca0faf9788b29a7708fbd5b52b36c49ac95ba82bb3cd00,0a03e8e51b5b50177e648e0508dc1dab2d3578e29ed3e61fe399adeeefe20a48,9c61d4740f15b2ee26ca0faf9788b29a7708fbd5b52b36c49ac95ba82bb3cd00,1.0,1.0,0.0,0.175,0.15,-0.024999999999999994,1.175,1.15,-0.025000000000000133,195,188,discarded,"delete unused k=1-gives-a-line parenthetical (shorter, removes k-symbol collision)","All 8 rollouts were correct and every one used the modulus-ratio first move, the nth-root check on the constant, the x+iy/complete-the-square step, and an explicit-root numeric check against the original equation; not one rollout ever invoked the degenerate line case. Worse, all 8 independently reused k as the root INDEX (k=0..5), so the parenthetical claim about k=1 collides with their own notation and risks planting a false belief. Deleting only that clause leaves every load-bearing instruction intact while making the hint 7 tokens shorter."
6,3,8554,618.115,618.125,cde40cad3d78c688d058a4c1b49465a4b669a468253d28c371e90239b1bd1797,7f6f7154d4fb512267ac31b10ca7619afd3eece344d94fa33fc0e3a676f1b121,7f6f7154d4fb512267ac31b10ca7619afd3eece344d94fa33fc0e3a676f1b121,0.375,0.5,0.125,0.1,0.1,0.0,0.475,0.6,0.125,190,188,kept,"ban symbolic tan-angle formula, pay for it by trimming far-edge justification","All 5 of 8 failures were token-cap truncations with no value stated, and the dominant signature was the student abandoning the hint's numeric shoelace instruction to build a symbolic tilt-angle formula, then burning thousands of tokens on contradiction loops between that formula and its own numeric checks (heavy tan/theta and repeated self-correction markers; the 3 successes had far fewer). The edit names that exact trap ('pick two specific tilt angles and never build a symbolic tan-angle formula') and pays for the words by deleting the far-edge justification clause, which is inert reasoning no rollout used, leaving the hint slightly shorter than the incumbent."
6,4,25003,618.116,618.126,f212db17d44fe5d49e8827b752416b5712e08e5fae6e5c30aafeee3eac2b3c99,8ece9093831a58cdbf5dd3659098096f871d8fb7c6df9889d9bb867c9f2e769b,f212db17d44fe5d49e8827b752416b5712e08e5fae6e5c30aafeee3eac2b3c99,1.0,0.75,-0.25,0.1875,0.15,-0.037500000000000006,1.1875,0.9,-0.2875,161,167,discarded,"name the exact root-cap degree (n, not n-1 or n+1)","Fresh rollouts scored 5/8 with no truncation (all finish_reason stop); every failure was the same single misstep, mis-sizing the per-polynomial root cap by taking the finite-difference degree n-1 or the interpolation point count n+1 instead of deg(P-L)=n, then multiplying that wrong cap by the family size. All five successes used the caps value correctly. I therefore replaced the vague trap clause about differencing with an explicit statement that subtracting an affine function preserves the leading term so the cap is exactly n, and named both off-by-one distractors; the rest of the proven text is unchanged."
6,5,30418,618.117,618.127,b4fd32f624ae17388dbdae26f7e56c31810f77c5a9d0b0ec175f909f80debcae,96a1d676223d38da10a9b3942f69b0619801749bb3ca48310f09910aac8b9cdb,b4fd32f624ae17388dbdae26f7e56c31810f77c5a9d0b0ec175f909f80debcae,0.75,0.625,-0.125,0.225,0.2,-0.024999999999999994,0.975,0.825,-0.15000000000000002,185,196,discarded,add back-substitution sanity check on fitted constants,"Both failing rollouts of 8 fit the curve constants correctly, then wrote the curve with numerator and denominator swapped, hit a self-contradiction, and spent the entire 16384-token budget re-deriving without ever stating a value (finish_reason=length); the six correct rollouts differed only in getting that substitution right. The edit adds one concrete check (re-evaluate a given point in the original expression right after fitting) and folds the anti-looping stop rule into the existing repair clause, leaving the proven reduce-to-one-unknown and shoelace text intact."
6,6,26989,618.118,618.128,f42ab52a7986f701b5f58ac0be9971ac18d82f4c450fceaa2b4bac9880f44efc,13155263e5b9e43df8ae8b429afa6b04f70775469a76699a87a27296b68fc70f,13155263e5b9e43df8ae8b429afa6b04f70775469a76699a87a27296b68fc70f,0.25,0.375,0.125,0.1875,0.1625,-0.024999999999999994,0.4375,0.5375,0.09999999999999998,146,155,kept,replace multi-part reporting rule: single graded value from the first labelled part,"All eight rollouts scored 0 with finish_reason stop (no truncation), so this is not a budget problem. Two rollouts derived the first part correctly using the state/timing framing the hint already teaches, but then presented a second part's value last, so the graded extraction picked the wrong number - the incumbent's 'one value per part' instruction actively invited that. I therefore replaced only that closing clause with an explicit single-graded-value rule, and paid for it by trimming the 'legal moves form a small state graph' phrase that no rollout visibly used, leaving the proven state-representation, LIFO-timing, path-product, and anti-uniformity clauses untouched."
6,7,3836,618.119,618.129,a5f0bebbf171514448d2c25b2da91ad8d8e32249a497ec55ab02a9ef2011f442,90beb60238fb9a54900010e713dbe9cb70b3d75b9ca3b601cf15b6611a571703,a5f0bebbf171514448d2c25b2da91ad8d8e32249a497ec55ab02a9ef2011f442,0.125,0.0,-0.125,0.1875,0.1125,-0.075,0.3125,0.1125,-0.2,154,159,discarded,sharpen stop-trigger and inline the unprescribed-monomial rule,"All 8 rollouts hit the 16384-token cap with finish_reason=length and produced no stated value, so reward was 0/8 despite several rollouts reaching a correct closed form mid-trace and then discarding it to re-derive or sanity-check it again. The incumbent's standalone 'note which monomial is NOT prescribed ... never use it' sentence was visibly misparsed into confusion about vanishing at nodes, so it is folded into the product-construction step, and the vague 'commit to one value' tail is replaced by an event-triggered stop ('the moment a closed form appears ... do not re-derive it') that fires exactly where the traces stalled; net length is +5 tokens."
6,8,23443,618.120,618.130,149cabea90724683bc818e06d11bef6dc0c07209cfe1b68f2300dc838be4613d,a78f91bad260281d8a3715b2b4ce30af1a7f0f0efb42138a35db5820dbca1ec4,149cabea90724683bc818e06d11bef6dc0c07209cfe1b68f2300dc838be4613d,1.0,0.875,-0.125,0.15,0.1,-0.04999999999999999,1.15,0.975,-0.17499999999999993,77,76,discarded,replace vague 'maximum-feasible-count interpretation' with the concrete gcd move; generalize street/house nouns to units/groups,"All 8 fresh rollouts scored reward 1 and terminated cleanly (no truncation), so train accuracy cannot rise and the only lever is transfer. Multiple rollouts visibly stalled re-reading the incumbent's abstract clause about the 'intended maximum-feasible-count interpretation' before independently deriving the gcd themselves, so that clause was the weakest text; I replaced it with the concrete technique it was gesturing at and generalized the domain-specific 'street/house' wording to 'equal-group/identical units', ending one token shorter than the incumbent."
6,9,3980,618.121,618.131,8198f46ecb6773324be0c859c56a0ad50cefd003d11ec94e1b5845e37e7269e5,f7844bf7c3f0653288307033435c3402b66f2ae9289ba8476fea62fc6118e6df,8198f46ecb6773324be0c859c56a0ad50cefd003d11ec94e1b5845e37e7269e5,1.0,0.875,-0.125,0.175,0.125,-0.04999999999999999,1.175,1.0,-0.17500000000000004,193,197,discarded,replace dead sign-slip clause with symbol-collision and identity-not-one-point traps,"5 of 8 rollouts were correct and all 8 followed the affine link and fixed the shift constant from the point values, so the core of the incumbent is working; the clause warning about sign slips when re-expanding q was dead weight because every rollout already evaluated through q = -p + b. Both non-truncation failures instead died the same way: they reused the same letter for the shift constant and for a coefficient of p, then imposed the collapsed relation at a single input rather than as an identity, under-determining the coefficients and guessing. I swapped only that one unused clause for those two traps, keeping the rest of the proven wording and the length essentially unchanged."
