round,hint_id,train_qid,sampling_slurm_job_id,proposal_eval_slurm_job_id,incumbent_hash,proposal_hash,final_hash,old_train,new_train,delta_train,old_heldout,new_heldout,delta_heldout,old_J,new_J,delta_J,old_tokens,new_tokens,decision,mutation,subagent_summary
1,1,28054,618.22,618.23,98f0bbb6f87c7e50634956da8a0905b30a66997aa33a5e4bc67a2609ec487ed8,dbc2ee04fc1040b32c556b3902c8b24a068f4fb2a65471d780bb7cf95f06ed05,dbc2ee04fc1040b32c556b3902c8b24a068f4fb2a65471d780bb7cf95f06ed05,0.0,0.25,0.25,0.175,0.2,0.025000000000000022,0.175,0.45,0.275,77,162,kept,"replace abstract set-filtering recipe with a concrete first move, the sum/product ambiguity trap, and an anti-looping directive","Fresh rollouts on execution 618.22 scored 2/8. All four zero-reward failures with finish_reason=length never reached a final answer: they oscillated over whether 2002 was the sum or the product, repeatedly declared a contradiction and restarted the analysis from scratch until the 16k budget ran out. The two zero-reward finishers did pick one reading, enumerated factor pairs, then chose an arbitrary member of a pair without checking that rivals were excluded. The incumbent hint described set filtering abstractly and said nothing about the ambiguous reveal or about not restarting, so the revision names the concrete first move (write each agent knowledge state, keep both readings inside the uncertainty), states the uniqueness check, and warns against relitigating eliminations."
1,2,30302,618.14,618.24,e926ca1d6f04d597d4b99af9d15b2597417b40fc28c3c0397d67f147cfa99917,9138cd5979de483d23029b8e4c72d6e198252a7e38b0ad951230b784f87a090b,9138cd5979de483d23029b8e4c72d6e198252a7e38b0ad951230b784f87a090b,0.75,0.875,0.125,0.1625,0.15,-0.012500000000000011,0.9125,1.025,0.11249999999999993,81,189,kept,generalize to Apollonius-modulus method; replace parametrize-and-eliminate step with x+iy complete-the-square,"All 8 fresh rollouts (execution_id 618.14) scored reward 1, so the incumbent is already on-task; the win is transfer, not train accuracy. Every trace independently found the ratio substitution unaided, so those words are wasted; the observable risk was the follow-on step, where rollouts that parametrized the ratio angle and eliminated it produced long, shaky algebra and inconsistent center signs (some reported the center mirrored) while still landing the radius. The revision therefore drops the problem-specific substitution scaffolding, states the general modulus/Apollonius-circle framing for any (z-a)^n = c(z-b)^n, prescribes the safer x+iy complete-the-square route, and adds the degenerate-case and verification checks."
1,3,8554,618.18,618.25,00f433b6ea19dfe2336efbb3476fea529c0993179016a67ce16e4288905f3cd0,d69272dd32d75bb109b8f90ec51dbfc046caef43ffec91aebfcc7655b32b70ce,d69272dd32d75bb109b8f90ec51dbfc046caef43ffec91aebfcc7655b32b70ce,0.0,0.125,0.125,0.1875,0.125,-0.0625,0.1875,0.25,0.0625,86,161,kept,replace piecewise-minimization framing with a concrete shoelace-two-angles procedure plus anti-loop and budget guards,"All 8 rollouts scored 0 and every one terminated with finish_reason=length at the 16384-token cap, with zero reaching a final boxed answer; the incumbent hint's instruction to build a piecewise overlap function over critical angles caused the students to re-derive the rotated square's edge equations dozens of times (11-59 separate angle substitutions per rollout, 53-81 self-corrections) and oscillate between contradictory qualitative claims. The revision therefore drops the piecewise-minimization framing and instead prescribes a terminating computation: prune the far edges, shoelace an explicit vertex list at two angles, and use the observed equality to trigger a symmetry proof, plus explicit anti-restart and box-early guards aimed squarely at the length failure."
1,4,25003,618.16,618.26,93b35723e9cc953d39ac835ae67c34590b0c25060143ab50c99c75c21cbb1ff2,f212db17d44fe5d49e8827b752416b5712e08e5fae6e5c30aafeee3eac2b3c99,f212db17d44fe5d49e8827b752416b5712e08e5fae6e5c30aafeee3eac2b3c99,0.0,1.0,1.0,0.2,0.1875,-0.012500000000000011,0.2,1.1875,0.9875,94,161,kept,"name the two observed failure traps up front, then give the concrete P-minus-affine-target root-counting recipe","All 8 rollouts scored 0. The dominant failure was taking the finite difference P(x+1)-P(x) of a single polynomial, finding it non-constant, and declaring the progression impossible or collapsing to a tiny answer (2, 5, 6); the second failure was assuming each polynomial can be used only once and answering with the count of polynomials (10). Two runs also burned the full token budget oscillating between these two wrong frames. The incumbent hint's abstract 'affine-in-index target' and 'suitable finite difference' language was never operationalized, so the revision states the target as affine in the INPUT, makes g = P - L and its root count the explicit first move, and warns against the exact two traps observed."
1,5,30418,618.15,618.27,b807d87e8e00cc91a6166db0fb3921c3d3651d016bdd936e3700d0c9bde5fa81,b4fd32f624ae17388dbdae26f7e56c31810f77c5a9d0b0ec175f909f80debcae,b4fd32f624ae17388dbdae26f7e56c31810f77c5a9d0b0ec175f909f80debcae,0.75,0.75,0.0,0.15,0.225,0.07500000000000001,0.9,0.975,0.07499999999999996,73,185,kept,replace generic recipe with one-unknown translation setup plus log offset sign trap and no-restart rule,"Fresh rollouts scored 5/8; all three failures ended with finish_reason='length' at the 16384-token cap, and each had the same root cause: the additive log offset was applied in the wrong direction when equating the two graph conditions, producing an impossible identity or a negative discriminant, after which the model looped for thousands of tokens guessing configurations instead of rechecking that one line. Successful rollouts all did the same thing early: parametrize one vertex, translate it by the displacement, convert the offset multiplicatively, drop the degenerate root, then shoelace. The revised hint front-loads that one-unknown reduction, names the sign/direction trap explicitly, and forbids the restart spiral, while dropping incumbent words spent on parameter fitting that every rollout already did correctly."
1,6,26989,618.19,618.28,99c30a3f882f054f77512e4fdca1d19befb3e5426d7d857d52f4369a95c4f820,3187f2a53030cbfb51c900ebffe00401cce79e1a38087f368354a4aa2449afc0,99c30a3f882f054f77512e4fdca1d19befb3e5426d7d857d52f4369a95c4f820,0.125,0.0,-0.125,0.2125,0.1875,-0.024999999999999994,0.3375,0.1875,-0.15000000000000002,83,166,discarded,add explicit anti-uniformity warning plus concrete move-string enumeration recipe,"Only 1 of 8 rollouts was correct; 6 of the 8 failures collapsed the whole process to 'the shed order is a uniformly random permutation' and then answered 1/24 or 1/4 by symmetry, and one asserted a specific bag could never reach the bottom. The incumbent hint's abstract 'state graph / dynamic programming' framing was never actually executed by the student, so I replaced it with an explicit named-representation recipe (enumerable move strings, forced-move probability 1 vs 1/2, stack reversal on transfer) and a direct warning against the uniform-permutation leap that caused every observed failure."
1,7,3836,618.20,618.29,39e2668fb5cca7669288765276aabe0dba01769397daa33b16a9dd7c0174a8f4,df2b6c0bb67ee7a7318408c81bd24cd991a087e82515c0f9894388200cdd9dc7,39e2668fb5cca7669288765276aabe0dba01769397daa33b16a9dd7c0174a8f4,0.125,0.125,0.0,0.175,0.175,0.0,0.3,0.3,0.0,82,186,discarded,"name the test-polynomial first move and the two observed failure modes (Vandermonde detour, all-zero conclusion)","All 8 fresh rollouts scored 0 and 7 of 8 exhausted the 16384-token budget; the incumbent hint's abstract 'linear functional / Lagrange interpolation' framing was quoted back but never operationalized, so runs looped for thousands of tokens re-deriving whether the Vandermonde system was consistent instead of picking a concrete test polynomial. Two recurring failure modes: interpreting the exponent as a coefficient index and concluding all weights vanish, or building the right root product but losing the sign/normalization while trying to solve for every weight at once. The revision therefore states the degree-vs-index reading, the missing k=0 moment implying a forced root at 0, an explicit single-weight test-polynomial first move, and the two traps to reject, so the solver commits early instead of exploring until truncation."
1,8,23443,618.17,618.30,149cabea90724683bc818e06d11bef6dc0c07209cfe1b68f2300dc838be4613d,3150ffa9989e11a4e8fc3a502bd2e997dfad35884aee7e9a655faaddd0c6470b,149cabea90724683bc818e06d11bef6dc0c07209cfe1b68f2300dc838be4613d,1.0,0.625,-0.375,0.15,0.1,-0.04999999999999999,1.15,0.725,-0.42499999999999993,77,162,discarded,"generalize to reusable unknown-divisor + percentage-base recipe, drop problem-specific scaffolding","Fresh run scored 8/8 at train_i 1.0 with no truncations, so the on-task job is done and the gap is transfer (heldout 0.15). Rollouts showed the incumbent's problem-specific phrases ('equal-street layout constrains H', 'maximum-feasible-count interpretation') being quoted back and puzzled over for many tokens, and the recurring genuine hesitation was which base the percentage applies to; so I replaced the bespoke scaffolding with a general 'group size is an unknown common divisor, take the gcd, verify integrality' recipe plus an explicit markup-base formula and a warning to ignore decorative layout wording."
1,9,3980,618.21,618.31,d95dbbc2898bc6c58c3684891a45d7c76fe4e0835ddd91bed1a4955ddf89942a,4f1f9baf5c0ee54e69e21910d4c53ff35a80a21cf99453fae5e77e4e344dd246,4f1f9baf5c0ee54e69e21910d4c53ff35a80a21cf99453fae5e77e4e344dd246,0.0,0.375,0.375,0.0875,0.1375,0.05000000000000002,0.0875,0.5125,0.42499999999999993,71,171,kept,"give an explicit affine-ansatz first move plus symmetry identity, warn against expanding the composition","All 8 rollouts engaged the incumbent hint but its abstract phrases ('shared affine coordinate', 'common iterate') gave no executable first move: 6 of 8 spent the entire 16k budget cycling through dead ends (are they inverses? are they linear? maybe drop the quadratic term?) and hit the length cap with no answer, and the one non-length failure did the same. The single success only broke through after guessing the concrete ansatz q = -p + const, then exploiting the resulting reflection symmetry, so the revision names that ansatz and the symmetry identity outright and warns against expanding the degree-9 composition."
1,10,3843,618.13,618.32,95005ec62835dbef2cc6b52c26e1bc8efa75d3d939090ada63716aa06be7a5b5,e51af9be832378e0a6ce8a00f813b534bb184fc849d29822c6773cc7f6a81266,95005ec62835dbef2cc6b52c26e1bc8efa75d3d939090ada63716aa06be7a5b5,0.25,0.125,-0.125,0.1125,0.15,0.03749999999999999,0.3625,0.275,-0.08749999999999997,72,149,discarded,replace abstract bitwise-affine framing with explicit brute-force-first orbit tracing plus the observed involution/half-shift trap warning,"All 3 correct rollouts explicitly built the full position-to-position map for a small size, then traced a single forward orbit to its return; all 5 failures shared one root cause, collapsing the composition of stages into 'a product of disjoint 2-cycles' or 'a half-shift' because each individual stage is an involution, and 3 of those burned the entire 16384-token budget looping on inconsistent hand computations. The incumbent hint's 'bitwise affine permutation' framing was never used by any rollout, so it was replaced with a concrete simulate-first, trace-one-orbit procedure and an explicit warning against the involution/half-shift shortcut, plus a tiebreak rule to trust simulation over pattern guesses to stop the loops."
2,1,28054,618.33,618.43,dbc2ee04fc1040b32c556b3902c8b24a068f4fb2a65471d780bb7cf95f06ed05,7204cd1115e5d9d5a5bcdca1ec79d232fcaf8055b4aad7e59df7ce3b7834db0a,dbc2ee04fc1040b32c556b3902c8b24a068f4fb2a65471d780bb7cf95f06ed05,0.25,0.0,-0.25,0.2,0.1125,-0.08750000000000001,0.45,0.1125,-0.3375,162,181,discarded,replace abstract no-case-split rule with executable partner-set first move plus ordered filter and commit,"Fresh run scored 0/8 (execution 618.33): five of eight rollouts hit the 16384-token cap and three finished only after long thrash, and every rollout that did box an answer had first derived 'both readings are impossible' and then guessed a factor pair. The incumbent hint stated the no-external-case-split principle abstractly but gave no computable first step, so the student never built the candidate-partner set; the revision leads with C(x) = {N-x, N/x}, names 'you will contradict both readings then guess' as the concrete trap, and orders the announcement filter into one forward sweep ending in a commit."
2,2,30302,618.34,618.44,9138cd5979de483d23029b8e4c72d6e198252a7e38b0ad951230b784f87a090b,fad519d5df8c79bed93cda1aeff9f3e875b36bbc185cc1cb6999b9dd9ac812c6,fad519d5df8c79bed93cda1aeff9f3e875b36bbc185cc1cb6999b9dd9ac812c6,0.875,1.0,0.125,0.15,0.15,0.0,1.025,1.15,0.125,189,196,kept,replace parametrization warning with the n-th-root-of-c trap and an original-equation verification,"All 8 rollouts terminated normally (finish_reason stop, 3.4k-7.8k tokens), so budget is not the issue; 7 of 8 were correct and every rollout visibly followed the incumbent's take-moduli-then-complete-the-square recipe. The single failure came from taking the modulus without extracting the n-th root of the constant, which produced a self-consistent-but-wrong circle that survived its own internal check and even the incumbent's suggested substitution check, because the derived equation was verified rather than the original. I therefore cut the dead-weight clause warning against a parametrization no rollout used, and spent those tokens on an explicit k^n = |c| sanity check plus a verification anchored to the original equation."
2,3,8554,618.35,618.45,d69272dd32d75bb109b8f90ec51dbfc046caef43ffec91aebfcc7655b32b70ce,c4dd1b82d059c3f8b2daf62a558f310c24b06608381aa1310b08df841616cf5a,d69272dd32d75bb109b8f90ec51dbfc046caef43ffec91aebfcc7655b32b70ce,0.125,0.0,-0.125,0.125,0.1125,-0.012499999999999997,0.25,0.1125,-0.1375,161,149,discarded,add hard stopping rule and cap re-verification to kill truncation,"All 8 fresh rollouts (execution_id 618.35) finished with finish_reason=length at the full 16384-token cap and scored 0; 6 of 8 never even emitted a </think>, and the two that did ran out of room mid-write-up after already having a correct value in the reasoning. The failure is pure non-termination from endless re-verification ('Wait' appears 34-71 times per rollout, and the incumbent's 'otherwise minimize over the symmetry-reduced range' plus 'confirm it by pairing congruent pieces' invited an open-ended angle scan), not bad geometry, so I removed the extra confirmation branch and replaced it with an explicit two-sample-then-stop rule plus an immediate-box and three-line-write-up cap."
2,4,25003,618.36,618.46,f212db17d44fe5d49e8827b752416b5712e08e5fae6e5c30aafeee3eac2b3c99,26029fbd81b4e715c4dacce95acb742b451d983f7981645e574325645139ff30,f212db17d44fe5d49e8827b752416b5712e08e5fae6e5c30aafeee3eac2b3c99,1.0,0.25,-0.75,0.1875,0.1625,-0.024999999999999994,1.1875,0.4125,-0.775,161,173,discarded,fix the degree-of-difference off-by-one and add commit rule,"On my 8 fresh rollouts (execution_id 618.36) only 3 were correct; the 5 failures split into two clusters that both mis-set the per-polynomial cap: two computed deg(P-L)=deg P-1 (treating the affine subtraction as if it dropped the leading term) and so undercounted roots, and two collapsed to one input per polynomial after wrongly arguing reuse is impossible; one more never terminated and hit the 16384-token cap with no boxed answer. The incumbent named the g=P-L move but never pinned the degree, so I state deg g = deg P exactly as the headline trap, keep the reuse warning, and add an explicit commit-and-box rule to stop the looping rollout."
2,5,30418,618.37,618.47,b4fd32f624ae17388dbdae26f7e56c31810f77c5a9d0b0ec175f909f80debcae,de35af1b9485c4e475e5b8eabaf2b9c038698ded8b0d5c49627b7ee4e10e9cce,b4fd32f624ae17388dbdae26f7e56c31810f77c5a9d0b0ec175f909f80debcae,0.75,0.625,-0.125,0.225,0.0875,-0.1375,0.975,0.7125,-0.26249999999999996,185,180,discarded,replace discriminant-panic loop with a bounded one-flip repair rule,"All 4 of 8 failures were finish_reason=length at the full 16384-token cap, and every one of them hit a negative discriminant, then spent thousands of tokens re-verifying identical algebra and restarting with renamed variables instead of correcting the sign of the displacement; the 4 successes reached the same quadratic with the offset oriented the right way and finished in 8-12k tokens. The incumbent already said ""do not restart"" but gave no bounded repair action, so the revision names the exact fix (negate the displacement, redo only the cross-multiplication), caps it at one flip, and states the base-c<1 direction explicitly as the concrete first move."
2,6,26989,618.38,618.48,99c30a3f882f054f77512e4fdca1d19befb3e5426d7d857d52f4369a95c4f820,3b7dd0a97c3f3813409d80289a1bb8d56888bcc31282fb51bd4793373bbdd53e,99c30a3f882f054f77512e4fdca1d19befb3e5426d7d857d52f4369a95c4f820,0.125,0.0,-0.125,0.2125,0.175,-0.037500000000000006,0.3375,0.175,-0.16250000000000003,83,145,discarded,"replace abstract state-graph DP with explicit push/pop stack encoding, the two observed traps, and a one-value stopping rule stated without answer-marker language","All 8 fresh rollouts scored 0 under the incumbent state-graph/DP hint and none actually built that state graph: 4 declared the resulting order forced (probability 1), 3 treated it as uniform over 4!, and 1 blew the 16384-token cap enumerating sequences ad hoc. So the revision names the concrete push/pop stack encoding and the per-step 1/2-versus-forced weighting as the opening move, explicitly negates the two observed traps, and closes with a commit-to-one-value-and-stop rule, since the one rollout that did reach the correct value lost reward by continuing on to emit a second marked result for the later part."
2,7,3836,618.39,618.49,39e2668fb5cca7669288765276aabe0dba01769397daa33b16a9dd7c0174a8f4,f0622c32ca141caff2750dea3976ff8ea777646e3c40a7aa78842990bf4b2aee,39e2668fb5cca7669288765276aabe0dba01769397daa33b16a9dd7c0174a8f4,0.125,0.0,-0.125,0.175,0.15,-0.024999999999999994,0.3,0.15,-0.15,82,178,discarded,replace abstract functional language with an executable test-polynomial first move plus anti-looping rule,"All 8 rollouts scored 0 and 7 of 8 terminated by hitting the 16384-token cap with no boxed answer; the incumbent's abstract 'linear functional / vanishing moments' framing gave no executable first step, so the student repeatedly conflated the weights a_i with coefficients of a polynomial in x, declared the system inconsistent, and looped through tiny n=2,3,4 cases guessing patterns. The revision names the exact misreading to avoid, gives the concrete first move (weight the equations by c_k to build a test polynomial and evaluate at the nodes), specifies choosing f to vanish at 0 and at all other nodes so one weight survives, and adds an explicit do-not-restart-and-box-early rule to fix the non-termination that dominated the failures."
2,8,23443,618.40,618.50,149cabea90724683bc818e06d11bef6dc0c07209cfe1b68f2300dc838be4613d,987ab6157a1ffc7104a9192b0d2ed24aeeae4c30aaab76f559099512f0fbd80a,149cabea90724683bc818e06d11bef6dc0c07209cfe1b68f2300dc838be4613d,1.0,0.625,-0.375,0.15,0.175,0.024999999999999994,1.15,0.8,-0.34999999999999987,77,171,discarded,generalize divisor-count technique and add anti-relitigation / single-pass markup rules,"Fresh training run scored 8/8 with no truncation, so the incumbent is already on-task and the remaining cost is wasted reasoning, not error: the longest rollouts burned thousands of tokens oscillating between the aggregate and per-unit readings of the same figures, and several recomputed the markup twice (before and after dividing) to confirm the identical result. The revision drops problem-specific scaffolding (street layout, the interpretation label) in favour of a reusable rule set - resolve aggregate-vs-per-unit once, convert integrality into a divides/gcd condition, take the largest admissible count without enumerating divisors, apply the markup as one (1+p) multiplication - which should preserve on-task accuracy while transferring to any integrality-pinned counting problem."
2,9,3980,618.41,618.51,4f1f9baf5c0ee54e69e21910d4c53ff35a80a21cf99453fae5e77e4e344dd246,a9e3ad7f15584dbf0896713391ae22473faca6c44aa8f31ea85f093c451284cc,4f1f9baf5c0ee54e69e21910d4c53ff35a80a21cf99453fae5e77e4e344dd246,0.375,0.125,-0.25,0.1375,0.175,0.03749999999999998,0.5125,0.3,-0.21249999999999997,171,191,discarded,replace abstract affine framing with executable degree-reduction first move plus anti-looping commit rule,"All 5 failing rollouts ended with finish_reason=length at the 16384-token cap and no boxed answer; every one of them had accepted the affine link q=a*p+b but then either tried to match coefficients of the degree-9 composition or blindly guessed constants, and two burned thousands of tokens re-deriving the leading-term condition after an earlier arithmetic slip. The 3 successful rollouts all shared one move the incumbent hint never named: substituting u=p(x) to reduce the identity to a single-variable equation, ruling out the a=+1 branch quickly, and letting the leftover cubic coefficient cancel. The revision therefore trades the incumbent's abstract 'reduces to commuting with an affine involution' language for that concrete degree-reduction step, a one-line branch test, and an explicit box-and-never-restart rule targeting the observed non-termination."
