round,hint_id,train_qid,sampling_slurm_job_id,proposal_eval_slurm_job_id,incumbent_hash,proposal_hash,final_hash,old_train,new_train,delta_train,old_heldout,new_heldout,delta_heldout,old_J,new_J,delta_J,old_tokens,new_tokens,decision,mutation,subagent_summary
2,10,3843,618.42,618.52,95005ec62835dbef2cc6b52c26e1bc8efa75d3d939090ada63716aa06be7a5b5,dd13dfdbf01ce17b82749c8a21248b69e4fc454c46da7dfa1dea17c016ff54c0,dd13dfdbf01ce17b82749c8a21248b69e4fc454c46da7dfa1dea17c016ff54c0,0.25,0.5,0.25,0.1125,0.1,-0.012499999999999997,0.3625,0.6,0.2375,72,166,kept,"replace abstract 'compose into bitwise affine permutation' with concrete explicit-list first move, ban piecewise patching, add commit-and-box rule","Fresh rollouts scored 3/8: four of five failures hit the 16384-token cap (finish_reason=length) after producing mutually inconsistent hand traces for small sizes and then oscillating between several candidate closed forms, and the one terminating failure trusted a sloppy small-case trace over verification. The incumbent named the destination (bitwise affine permutation, cycle structure, minimality proof) but no executable first move, so the revision front-loads an explicit position-list trace of a couple of small sizes plus orbit tracking, uses the bit-string map only as a cross-check, and adds the observed-failure guard: a disagreement between sizes means the trace is wrong rather than the answer being piecewise, plus an explicit stop-exploring-and-box rule to fight non-termination."
3,1,28054,618.53,618.63,dbc2ee04fc1040b32c556b3902c8b24a068f4fb2a65471d780bb7cf95f06ed05,0a939b889f004f00c4e5135b7926e9542ebb4f06a178328cbeca8e14484adaea,dbc2ee04fc1040b32c556b3902c8b24a068f4fb2a65471d780bb7cf95f06ed05,0.25,0.0,-0.25,0.2,0.1625,-0.037500000000000006,0.45,0.1625,-0.2875,162,183,discarded,add tabulate-survivors first move and role-swap trap,"Fresh run scored 0/8: no rollout ever built the survivor table the hint implies, and all eight instead enumerated factor pairs, declared contradictions, then committed to the same wrong value anyway; two hit the token cap relitigating the same pairs. The dominant confusion was treating uncertainty about which agent holds which number as the ignorance source, so I added one concrete first move (tabulate own-values against surviving partner values) and one explicit trap naming that role-swap is not doubt, keeping the rest of the proven text intact."
3,2,30302,618.54,618.64,fad519d5df8c79bed93cda1aeff9f3e875b36bbc185cc1cb6999b9dd9ac812c6,403ac7fe6d24609478ebddf8eeef57d4a375e388b75b64df02190ca6628359fa,403ac7fe6d24609478ebddf8eeef57d4a375e388b75b64df02190ca6628359fa,1.0,1.0,0.0,0.15,0.175,0.024999999999999994,1.15,1.175,0.025000000000000133,196,198,kept,make divide-then-take-moduli the explicit first move; replace unused real-root check with a general numeric spot-check,"All 8 rollouts scored 1, but one burned ~14.6k completion tokens (vs ~4-5k for the other seven) because it took moduli of the whole equation and raised the constant to the n-th power instead of taking its n-th root - exactly the trap my incumbent named but did not give an operational way to avoid. The seven fast rollouts all divided by (z-b)^n first and got the right ratio immediately, so I promoted that to the explicit first move; separately, no rollout ever used the incumbent's problem-specific 'solve for its real root' verification, so I replaced that dead clause with a shorter, more transferable numeric spot-check against the original equation."
3,3,8554,618.55,618.65,d69272dd32d75bb109b8f90ec51dbfc046caef43ffec91aebfcc7655b32b70ce,7d558dd1246b9fa85107df156c2038c19f7eac6dcbc4d6e9796c2024f6c76b7a,7d558dd1246b9fa85107df156c2038c19f7eac6dcbc4d6e9796c2024f6c76b7a,0.125,0.25,0.125,0.125,0.1375,0.012500000000000011,0.25,0.3875,0.1375,161,191,kept,replace weak terminal clause with hard stop rule; add containment trap; drop unused congruence-proof step,"All 8 fresh rollouts ended with finish_reason=length at the 16384-token cap and stated no value, despite several repeatedly computing the correct total mid-stream: the failure is pure non-termination plus self-doubt (50-70 'Wait' pivots each), not bad geometry. Two recurring sinks were (a) an incorrect leap that the small square is entirely contained, which reset the whole analysis, and (b) the incumbent's request to confirm angle-independence by pairing congruent pieces, which no rollout completed. I kept the proven coordinate/pruning/shoelace core verbatim, added the one-line containment trap, and swapped the vague 'well before you run long' clause for an explicit trust-the-numbers, never-restart, commit-once-and-stop rule."
3,4,25003,618.56,618.66,f212db17d44fe5d49e8827b752416b5712e08e5fae6e5c30aafeee3eac2b3c99,ece2d41e0b5c583435549ed7cfd49fd3e975e09b305d3fe7f757a4f07ccf88b0,f212db17d44fe5d49e8827b752416b5712e08e5fae6e5c30aafeee3eac2b3c99,1.0,0.625,-0.375,0.1875,0.2,0.012500000000000011,1.1875,0.825,-0.36250000000000004,161,184,discarded,pin the per-polynomial cap to deg g = n and name the two off-by-one confusions,"Fresh rollouts gave 5/8 with no truncation (all finish_reason stop), so the loss is purely a numeric off-by-one in the per-polynomial cap, not budget or looping. All three failures reached the correct P-L framing the incumbent prescribes but then substituted the wrong root bound: one used the interpolation count (n+1 points determine a degree-n polynomial) and two used the finite-difference degree (n-1), each multiplying that wrong cap by the family size. The edit adds one sentence justifying deg g = n from the untouched leading term and explicitly rules out those two named confusions, leaving the proven framing, traps, and construction clauses intact."
3,5,30418,618.57,618.67,b4fd32f624ae17388dbdae26f7e56c31810f77c5a9d0b0ec175f909f80debcae,26f3fe9a766cb87c5bf71bf486803059b0c6c5ef3e8959097f05321e8fcb5ce5,b4fd32f624ae17388dbdae26f7e56c31810f77c5a9d0b0ec175f909f80debcae,0.75,0.75,0.0,0.225,0.225,0.0,0.975,0.975,0.0,185,199,discarded,turn the negative-discriminant recovery into an executable move and ban re-deriving confirmed parameters / guessing from magnitudes,"5 of 8 correct; every rollout recovered the curve parameters, so the split came entirely from the direction of the log offset conversion. All three failures produced a negative discriminant and then burned the budget re-verifying parameters they had already back-substituted and confirmed (two hit the 16384-token cap stating nothing) or abandoned the algebra and guessed an area from a side length times a vertical gap. The incumbent diagnosed the inverted offset but prescribed no action, so I made the recovery a concrete one-line swap and added explicit bans on the two observed budget sinks, trimming other wording to stay under the token cap."
3,6,26989,618.58,618.68,99c30a3f882f054f77512e4fdca1d19befb3e5426d7d857d52f4369a95c4f820,f42ab52a7986f701b5f58ac0be9971ac18d82f4c450fceaa2b4bac9880f44efc,f42ab52a7986f701b5f58ac0be9971ac18d82f4c450fceaa2b4bac9880f44efc,0.125,0.25,0.125,0.2125,0.1875,-0.024999999999999994,0.3375,0.4375,0.09999999999999998,83,146,kept,"add LIFO position-to-timing translation and ban the uniform-position symmetry shortcut, dropping the unfollowed DP clauses","2 of 8 rollouts scored 1 and none truncated (all finish_reason stop, 9.3k-15.6k completion tokens), so termination and budget were not the failure mode. Five of the six failures abandoned the state graph partway and asserted a hand-wavy 'each bag is equally likely in each position' shortcut yielding 1/n-style values, and several never converted the requested stack position into a statement about which deposit happened when; the incumbent's dynamic-programming and 'probabilities sum to one' clauses were visibly followed by no rollout. I therefore swapped that dead weight for the LIFO position-to-timing translation plus per-step 1/2 path multiplication that both successful rollouts actually used, and an explicit warning against the uniform-position shortcut, leaving the proven opening representation clauses intact."
3,7,3836,618.59,618.69,39e2668fb5cca7669288765276aabe0dba01769397daa33b16a9dd7c0174a8f4,dd95402df947d00f5c8ac73ae1a2c2936969be8763e70319b332d984b7584b97,39e2668fb5cca7669288765276aabe0dba01769397daa33b16a9dd7c0174a8f4,0.125,0.125,0.0,0.175,0.125,-0.04999999999999999,0.3,0.25,-0.04999999999999999,82,182,discarded,make the vague index shift an explicit first move; add no-restart/commit rule,"Fresh rollouts scored 0/8 with 7 of 8 hitting the token cap: every rollout tried a polynomial/Lagrange framing but none ever performed the incumbent's unnamed 'useful index shift', so the vanishing conditions still started at exponent one and the derivation stalled. They then burned 40-90 self-corrections on hastily mis-stated small cases, concluded the system was inconsistent, and either truncated or committed to an obviously wrong value. The edit keeps the proven functional/Lagrange wording but makes the shift a concrete executable move and adds an explicit do-not-restart-then-commit rule."
3,8,23443,618.60,618.70,149cabea90724683bc818e06d11bef6dc0c07209cfe1b68f2300dc838be4613d,2b5d69a9bd31ab8a2f954a48388e457c8cfb083f85faefdc9442b76d887e8b82,149cabea90724683bc818e06d11bef6dc0c07209cfe1b68f2300dc838be4613d,1.0,0.75,-0.25,0.15,0.175,0.024999999999999994,1.15,0.925,-0.22499999999999987,77,140,discarded,generalize problem-specific nouns to a reusable gcd-from-integrality move; add anti-churn rule that markup commutes with division,"Fresh rollouts were 8/8 correct with every rollout finishing on stop (2715-6928 tokens), so on-task the incumbent is saturated and the only available gain is transfer, consistent with heldout 0.15 versus train 1.0. Every rollout visibly followed the divide-every-total / gcd / take-maximum clause, so I kept that logic but restated it in unit-agnostic vocabulary instead of the problem's own nouns. Several rollouts wasted 1-3k tokens repeatedly re-asking whether the percentage markup applies before or after dividing, so I added one clause stating that it commutes and to fix an order, replacing the incumbent's vaguer 'apply the stated markup multiplicatively'."
3,9,3980,618.61,618.71,4f1f9baf5c0ee54e69e21910d4c53ff35a80a21cf99453fae5e77e4e344dd246,8198f46ecb6773324be0c859c56a0ad50cefd003d11ec94e1b5845e37e7269e5,8198f46ecb6773324be0c859c56a0ad50cefd003d11ec94e1b5845e37e7269e5,0.375,1.0,0.625,0.1375,0.175,0.03749999999999998,0.5125,1.175,0.6625000000000001,171,193,kept,replace unused antisymmetry clause with branch-pruning plus evaluate-through-the-relation,"Fresh rollouts scored 4/8; all three zero-reward failures that hit the token cap burned their budget grinding the a=+1 (q = p + constant) branch, and the one non-truncated failure got the first requested value right but slipped a sign while re-expanding q coefficient by coefficient. No rollout ever used the incumbent antisymmetry/fixed-point clause, so I spent those tokens on pruning the impossible branch immediately and on evaluating each target through the affine relation instead of a fresh expansion."
3,10,3843,618.62,618.72,dd13dfdbf01ce17b82749c8a21248b69e4fc454c46da7dfa1dea17c016ff54c0,854dd260013d73627dad0d67ef8f749d5b41dff8237e99a470e336c555d9e388,854dd260013d73627dad0d67ef8f749d5b41dff8237e99a470e336c555d9e388,0.5,0.5,0.0,0.1,0.1625,0.0625,0.6,0.6625,0.0625,166,194,kept,"add per-stage bijectivity check, replace piecewise-formula trap with unverified-shortcut trap","5 of 8 rollouts correct; both zero-reward truncations (finish_reason length at the cap) came from position-by-position bookkeeping that produced non-injective maps (several positions all sent to one slot), after which the student looped and restarted instead of stating anything, and the one early-stopping failure adopted an unverified shortcut claim about the operation's net effect. So I kept the proven first-move/binary-map/commit text and made two surgical swaps: a per-stage 'every label exactly once' bijectivity check that catches exactly the corrupted trace, and a trap clause aimed at unverified shortcut claims (with trace-over-formula precedence) in place of the piecewise-formula clause no rollout followed."
4,1,28054,618.73,618.83,dbc2ee04fc1040b32c556b3902c8b24a068f4fb2a65471d780bb7cf95f06ed05,eec4613d14e1b659333aca94da67b01cc5d23bce88ad8a334957f96a23ce589d,dbc2ee04fc1040b32c556b3902c8b24a068f4fb2a65471d780bb7cf95f06ed05,0.25,0.25,0.0,0.2,0.175,-0.025000000000000022,0.45,0.425,-0.025000000000000022,162,156,discarded,"make the anti-case-split clause executable: one divisor table as the first move, plus rival-elimination check","Train reward was 1/8; seven failures shared one pattern: the student read ""I do not know"" as merely ""the revealed number has several factor pairs"", which discriminates nothing, then committed to an arbitrary mid-sized factor pair, and several first split into external sum-vs-product cases and declared one contradictory despite the incumbent forbidding it. The edit keeps the incumbent's proven framing but replaces the abstract no-case-split and verify clauses with an executable first move (one table of own-values x, ambiguity requires both readings legal so x must divide N) and a rival-elimination check, and is slightly shorter than the incumbent."
4,2,30302,618.74,618.84,403ac7fe6d24609478ebddf8eeef57d4a375e388b75b64df02190ca6628359fa,ab043133f56d9ac630d47a269b7d7aa7282f3351ce363520498ce8627e2ebc78,403ac7fe6d24609478ebddf8eeef57d4a375e388b75b64df02190ca6628359fa,1.0,1.0,0.0,0.175,0.1375,-0.03749999999999998,1.175,1.1375,-0.03750000000000009,198,198,discarded,replace unused algebra micro-step with a broader locus/aggregate trigger,"All 8 fresh rollouts scored reward 1 with finish_reason stop and no truncation, so the hint's first move, the k-trap and the commit-and-stop rule are all working and were left verbatim. Clause-level inspection showed zero rollouts used the 'collect the x^2+y^2 terms, divide by their coefficient' micro-step (they went straight from squaring to completing the square), so that dead clause was deleted and its tokens spent widening the opening trigger from the narrow 'all roots lie on one circle' phrasing to any locus-or-aggregate request, targeting the weak held-out transfer rather than the already-saturated training score. Total length is unchanged at 198 tokens, so the shared book does not grow."
4,3,8554,618.75,618.85,7d558dd1246b9fa85107df156c2038c19f7eac6dcbc4d6e9796c2024f6c76b7a,85acd68689c1a2fdd859b865a54118b0394becf8ccc75aa07dbfeb7787e8420c,7d558dd1246b9fa85107df156c2038c19f7eac6dcbc4d6e9796c2024f6c76b7a,0.25,0.125,-0.125,0.1375,0.1375,0.0,0.3875,0.2625,-0.125,191,188,discarded,name the quadrilateral-vs-triangle clipping trap; drop redundant trust clause,"Fresh rollouts scored 1/8 with 6 of 8 truncating at the 16384-token cap: the student repeatedly looped hunting for a rotation that shrinks the overlap instead of finishing one numeric case. The two that terminated both reduced the clipped region to a triangle through the two exit rays, dropping the small-square corner that lies between them, so one reported a too-small overlap. The edit replaces the vague per-angle instruction with an explicit axis-parallel first move and a named clipping trap (include every enclosed corner; the region is usually a quadrilateral), and deletes the redundant trust-the-shoelace clause to stay near the incumbent length."
4,4,25003,618.76,618.86,f212db17d44fe5d49e8827b752416b5712e08e5fae6e5c30aafeee3eac2b3c99,06304fdaf55721d1abf45c33a396401b80749988bde002d02d6a9e808fab2fa4,f212db17d44fe5d49e8827b752416b5712e08e5fae6e5c30aafeee3eac2b3c99,1.0,0.5,-0.5,0.1875,0.15,-0.037500000000000006,1.1875,0.65,-0.5375,161,171,discarded,pin deg(P-L)=n exactly (not n-1) and forbid retreating from the matched bound,"Fresh rollouts scored 3/8 with two dominant, distinct failure modes: three rollouts mis-set deg(P-L)=n-1 instead of n and so undercounted the per-polynomial root cap, while two others derived the correct cap but then abandoned it, arguing that consecutive inputs force each polynomial to be used only once. One rollout looped to the token cap after concluding impossibility. The edit keeps the proven affine-target/root-counting skeleton and replaces only the vague ""compare degrees to show g is not identically zero"" clause with the exact leading-coefficient argument, plus a short guard against retreating from an already-matched bound."
4,5,30418,618.77,618.87,b4fd32f624ae17388dbdae26f7e56c31810f77c5a9d0b0ec175f909f80debcae,fc2fc2f5f3ac71dac1973b82092fff45906d144057bf8c8cc93377f5bfee139e,b4fd32f624ae17388dbdae26f7e56c31810f77c5a9d0b0ec175f909f80debcae,0.75,0.5,-0.25,0.225,0.1875,-0.037500000000000006,0.975,0.6875,-0.2875,185,184,discarded,swap the vague sign-flip warning for a concrete root self-test with targeted recovery,"All three failures (3/8) hit the 16384-token cap after deriving the same offset direction backwards, producing a negative discriminant and then spending 6000+ tokens doubting the curve parameters and the parallelogram reading instead of the one conversion line; the incumbent told them the flip was the dominant failure mode but gave no way to detect it. The revision names an executable detector (a given vertex must be a root of the reduced scalar equation) plus a one-line recovery, and drops the diffuse do-not-restart wording to stay shorter than the incumbent."
4,6,26989,618.78,618.88,f42ab52a7986f701b5f58ac0be9971ac18d82f4c450fceaa2b4bac9880f44efc,33dd81a061a382dadf20c2841c3f2d2b573b1322b41507b5ca356f07f988695b,f42ab52a7986f701b5f58ac0be9971ac18d82f4c450fceaa2b4bac9880f44efc,0.25,0.125,-0.125,0.1875,0.125,-0.0625,0.4375,0.25,-0.1875,146,147,discarded,replace vague 'trace the realizing sequences' with the concrete conditioning move: count loading moves before the first delivery move,"All 8 rollouts scored 0, but not from truncation or bad arithmetic: 6 of 8 correctly derived the first sub-answer via the state/forced-move accounting the incumbent already teaches, then answered the second sub-part with a bare 1/n symmetry claim, which the grader reads as the emitted value. They also all reached the correct last-in-first-out timing claim but had no executable way to identify WHICH item satisfies it, so they defaulted to symmetry despite the incumbent's explicit prohibition. I therefore replaced the vague 'trace only the move sequences that realize that event' clause with the concrete conditioning step (count the loading moves preceding the first delivery move), keeping the proven state-graph, timing-claim, anti-symmetry, and commit clauses and holding length at the incumbent's 146-147 tokens."
4,7,3836,618.79,618.89,39e2668fb5cca7669288765276aabe0dba01769397daa33b16a9dd7c0174a8f4,a5f0bebbf171514448d2c25b2da91ad8d8e32249a497ec55ab02a9ef2011f442,a5f0bebbf171514448d2c25b2da91ad8d8e32249a497ec55ab02a9ef2011f442,0.125,0.125,0.0,0.175,0.1875,0.012500000000000011,0.3,0.3125,0.012500000000000011,82,154,kept,replace abstract Lagrange/verify clauses with one explicit test-polynomial construction plus a stop rule,"Fresh rollouts scored 0/8 with 7 of 8 truncating at the 16384-token cap: the student latched onto the functional framing but never had an executable first move, so it churned on Vandermonde inversion and on self-contradictory small analogues (wrong equation/unknown counts) until it ran out of room, and the several rollouts that did emit a value had silently swapped node index for exponent. I therefore kept the proven functional/moment framing and the product-of-node-differences endpoint, but swapped the vague 'apply Lagrange interpolation after any useful index shift' and the verify-the-highest-moment clause (no rollout followed either productively; the latter fed the looping) for a single concrete construction plus an explicit no-restart, commit-and-stop rule."
4,8,23443,618.80,618.90,149cabea90724683bc818e06d11bef6dc0c07209cfe1b68f2300dc838be4613d,935885c8e23ec1c736517eeec62bdad804b4f94c87114262fa3defdc1555c0f6,149cabea90724683bc818e06d11bef6dc0c07209cfe1b68f2300dc838be4613d,1.0,0.5,-0.5,0.15,0.15,0.0,1.15,0.65,-0.4999999999999999,77,76,discarded,replace problem-specific layout clause with general no-extra-constraint rule,"All 8/8 rollouts were correct with finish_reason stop and no truncation, so the divisibility + maximum-count + multiplicative-markup core is proven and untouched. The one clause the rollouts implicated as harmful was the assertion that the layout constrains H arithmetically: rollouts revisited that wording 1 to 41 times each, repeatedly asking what constraint it imposed before concluding it imposed none, which is pure wasted budget. I replaced that single clause with a general rule that grouping/layout wording adds no constraint unless it forces divisibility, and generalized 'stage' to 'component' for transfer, keeping the hint at the same length (76 vs 77 tokens)."
4,9,3980,618.81,618.91,8198f46ecb6773324be0c859c56a0ad50cefd003d11ec94e1b5845e37e7269e5,e929c6fa403cd283b1955edb9b80a4423ef61e41a2e6c8731f7f4cf3cb55c79e,8198f46ecb6773324be0c859c56a0ad50cefd003d11ec94e1b5845e37e7269e5,1.0,0.875,-0.125,0.175,0.075,-0.09999999999999999,1.175,0.95,-0.2250000000000001,193,193,discarded,swap unused branch-elimination clause for a warning against pinning coefficients from a single x,"6 of 8 rollouts were correct; both failures shared one mechanism: after correctly deriving the affine link they abandoned coefficient matching and instead plugged a single x value into the commuting identity, which under-determines the system, produced a huge spurious coefficient, and led to one non-terminating rollout (hit the 16384-token cap) and one confidently wrong result. Meanwhile the incumbent clause telling the student not to explore the q = p + constant branch is dead weight - essentially no rollout ever pursued that branch - so I deleted it and spent those tokens on the concrete trap the rollouts actually fell into, keeping total length at the incumbent's."
