round,hint_id,train_qid,sampling_slurm_job_id,proposal_eval_slurm_job_id,incumbent_hash,proposal_hash,final_hash,old_train,new_train,delta_train,old_heldout,new_heldout,delta_heldout,old_J,new_J,delta_J,old_tokens,new_tokens,decision,mutation,subagent_summary
15,3,8554,148.298,148.308,7b7b4483667ba6211d89e8b29e80c7dfcb9f10060d9ffc62b3bffc74e364b566,bfa570cba75d467ffef5fdd47e4bc4f435a73682899bcab0225b7e6e037271da,7b7b4483667ba6211d89e8b29e80c7dfcb9f10060d9ffc62b3bffc74e364b566,0.625,0.625,0.0,0.225,0.175,-0.05000000000000002,2.875,2.375,-0.5,169,167,discarded,replace-ignored-box-first-ordering-with-three-line-write-up-budget,"Rollouts scored 4/8. Every one of the eight write-ups after the reasoning block closed ignored the incumbent's box-first ordering: each restarted a full multi-step re-derivation and only reached the box 2000-2500 characters later. Two of the four failures were truncated mid-restart with no box at all, despite already holding the right value inside the reasoning. So the losing clause is inert as worded, while the underlying gate is real. This edit keeps box-first but makes it executable as a concrete length budget (at most three lines, box in the first) and attaches the consequence, which should transfer to any problem where a verbose recap eats the answer."
15,4,25003,148.299,148.309,e0ca78c56f30a95ccffa6bbca03e866e7e92dfbb723570c1181e9524f64d335b,d2b3463cb97bcb8bd851a3b5da1a9b71ac7dc7a4efa05afa874b0e2f22239321,e0ca78c56f30a95ccffa6bbca03e866e7e92dfbb723570c1181e9524f64d335b,0.875,0.25,-0.625,0.225,0.125,-0.1,3.125,1.5,-1.625,146,141,discarded,restore-explicit-partition-of-inputs-by-handling-polynomial-before-degree-count-141-vs-146-tokens,"Five of eight rollouts (148.299) were correct; all three failures shared one mode: they never split the inputs into per-polynomial parts, so they imposed P(x)=A+Bx as an identity for all x, derived that a degree-5 polynomial must be constant or linear, and either answered the menu size or looped to the token limit. The correct ones all explicitly assigned each polynomial its own block of inputs first. This edit names that partition as an executable step before the degree count, restoring a grouping step the round-12 rewrite had dropped, and does so in 141 tokens versus the incumbent's 146."
15,5,30418,148.300,148.310,1eb4e3cdd613a791abc5a6eca1cdc1c28a39f7f417b75d407c5cfcb7ed4ed992,8da298d5ad23951ca82b1df9f87973a974a6a73a611b19330bbea55b9136b7f0,1eb4e3cdd613a791abc5a6eca1cdc1c28a39f7f417b75d407c5cfcb7ed4ed992,0.75,0.75,0.0,0.25,0.15,-0.1,3.25,2.25,-1.0,70,70,discarded,retarget-terminal-box-from-candidate-to-quantity-it-yields,"5/8 correct; all three misses hit finish_reason=length with no boxed answer. Each pinned the constants and reached the right single-unknown equation, then treated finding the admissible root as the goal: they never converted it into the quantity actually requested, instead sliding into decimal probing (105 and 143 approximation signs in two misses versus 0-3 in every success) and testing sample values until the budget ran out. All five successes went straight from the root to the requested quantity. The incumbent's closing line says to box the candidate, which is what the failures did; retargeting it to the quantity the candidate yields keeps the same length while naming the missing final step, and it transfers to any problem where the solved unknown is a means, not the answer."
15,6,26989,148.301,148.311,e64f97e23626cd3b726aa52d8740f627fe7f8a230645491fa857bd91465c19e1,02bcd31f5a32601b74222f946c2ab97edd89c3cf8e2a2568583168c1d857294f,e64f97e23626cd3b726aa52d8740f627fe7f8a230645491fa857bd91465c19e1,0.125,0.0,-0.125,0.2625,0.225,-0.037500000000000006,2.75,2.25,-0.5,176,173,discarded,strict-lossless-compression-176-to-173-tokens-function-words-only-no-clause-dropped,"Fresh rollouts scored 1/8. The failure is one error repeated in all eight: every rollout wrote that the shed's bottom bag is the one delivered LAST, then priced that, giving 1/4 (five runs), 1/24, 1/16 or 1 - and eight of eight reached it via an equally-likely-permutation claim. The incumbent already states the correct fact adjacently (round 14's win) and forbids the uniform shortcut, so no new wording of either idea is untested here: rounds 12 and 13 already lost by editing that bottom fact, and rounds 2-5, 10, 11 lost by adding content. Clause grep shows labeling 7/8, stacks 8/8, push/pop 5/8, one-half 8/8 all in use, while sum-to-one and red-flag appear 0/8 yet rounds 6 and 7 lost held-out when those were cut. So this round changes no strategy: every content phrase stays byte-identical and only four redundant function words go, banking a 3-token tiebreak at zero transfer risk."
15,7,3836,148.302,148.312,ab86313389de277c671789977242ca71390d684323c6bdbaf69bed67b8fdd067,b9ce98cdf8c504b47566accc60b524c9daf4d206e73926120e244bce4706a7b3,ab86313389de277c671789977242ca71390d684323c6bdbaf69bed67b8fdd067,0.25,0.0,-0.25,0.175,0.1125,-0.062499999999999986,2.0,1.125,-0.875,70,70,discarded,name-the-shrink-target-as-rebuild-whole-problem-at-size-n,"Fresh rollouts scored 1/8; seven produced no correct boxed value. The sole winner rebuilt the problem at sizes 3 and 4, eliminated, recorded the two values with signs and generalized. Five losers instead shrank the wrong thing or kept a mismatched equation ladder, hit a degenerate 0=1 case, declared 'contradiction / must be a mistake' and abandoned the table for Vandermonde theory to the 16k cap. One loser paraphrased the incumbent as 'the coefficients are set to 2, 3, 4', the same misreading logged in round 7: 'the huge parameter' never says WHICH quantity shrinks. So I rename only that target - rebuild the whole problem at size n, which scales unknowns and equations together - and keep the ratio clause and closing verbatim since replacing either lost held-out in rounds 7, 9, 10 and 13. The twin prohibitions are merged, a rewording round 11 measured held-out-neutral, so this stays no longer than the incumbent."
15,8,23443,148.303,148.313,0250077d8944cf1436c3e3ecd3d488e1d97a5eb76f0be7756ba8677ce1f1d77e,3fddb896dd02282ac8d6e6f55ed7d44d9910dc0f9b4d6028e142f0dd052a9036,0250077d8944cf1436c3e3ecd3d488e1d97a5eb76f0be7756ba8677ce1f1d77e,0.75,0.375,-0.375,0.1625,0.125,-0.037500000000000006,2.375,1.625,-0.75,123,123,discarded,replace-inert-grouping-and-substitute-last-clauses-with-per-given-equation-setup-and-unused-condition-selection,"Fresh rollouts scored 6/8; all 8 reached the gcd and enumerated the divisor candidates, but zero of 8 ever used the incumbent's grouping clause or its substitute-numbers-last clause, so both are inert transfer tax. The two failures picked among surviving candidates by which one 'looked reasonable', and one even contradicted its own divisor list. The edit swaps the two ignored clauses for a concrete first move rollouts already half-do (write one total = count x per-item equation per given) plus an executable selection rule (evaluate every candidate, then decide with an as-yet-unused stated condition instead of plausibility). Same length as the incumbent, 123 tokens."
15,9,3980,148.304,148.314,391f18d0a38c1a07058f9782b12c580bfb7fb5aae04b069b173f7d17d3e75563,7a9b27b95e51891a81414d0627f3cd82e51750d68b1265b2edd2aa77b25f57fc,391f18d0a38c1a07058f9782b12c580bfb7fb5aae04b069b173f7d17d3e75563,0.375,0.5,0.125,0.2625,0.2,-0.0625,3.0,2.5,-0.5,147,146,discarded,replace-inert-avoid-coefficients-clause-with-keep-free-parameter-symbolic,"4 of 8 correct. Every winner carried the leftover parameter as a letter and let its coefficient vanish in the requested values; all three length-capped failures instead pinned it to a concrete number early, then drowned in fractional arithmetic and looped on ""contradiction"" (5-12 times each, 39-83 ""Wait"") with nothing boxed, and the one wrong finisher was the heaviest numeric guesser of all. Meanwhile the incumbent tail ""rather than solving for every coefficient"" appears in no trace and is contradicted by the winners, who do solve the reduced relations. Swapping that inert clause for the single discipline the successes share - keep the free parameter symbolic - is a positive move that transfers to any underdetermined family whose requested quantity is parameter-independent, at 146 tokens versus the incumbent 147."
15,10,3843,148.305,148.315,8f7b8e1d1d6e2d9340e42495d567be9a197bd3fa8ed7642d587f47ff305db523,b4625f41b606ccf2c7016dbf4b2ecc78323f2a9c9491361dc7cea908b65814ce,b4625f41b606ccf2c7016dbf4b2ecc78323f2a9c9491361dc7cea908b65814ce,0.625,0.5,-0.125,0.15,0.1625,0.012500000000000011,2.125,2.125,0.0,102,101,kept,de-specialize-to-any-asked-quantity-and-require-every-row-from-a-written-case,"5/8 correct. Both budget-death failures spent the entire completion arguing abstractly about structure - never writing a concrete case - and emitted no boxed answer; a third asserted a structure it had not written out and boxed the wrong value. The incumbent's core instruction only fires when the asked quantity is a return count, so on unseen problems asking for something else its central step is inert. This edit keeps the same procedure (settle the setup, work the smallest case literally, tabulate more sizes, fit and check one formula, box it) but retargets it at whatever quantity is asked and makes 'every row comes from a case you actually wrote out' the load-bearing rule, replacing the period-specific clause the rollouts never used. It is also 1 token shorter than the incumbent."
16,1,28054,148.316,148.326,98f0bbb6f87c7e50634956da8a0905b30a66997aa33a5e4bc67a2609ec487ed8,cf124f5baec4c77a6d97f67329169c4881477a3cc66c5b62775f8f2afd152c64,98f0bbb6f87c7e50634956da8a0905b30a66997aa33a5e4bc67a2609ec487ed8,0.125,0.0,-0.125,0.25,0.2125,-0.037500000000000006,2.625,2.125,-0.5,77,76,discarded,name-the-speakers-own-private-value-in-the-grouping-key-one-token-shorter,"Execution 148.316 scored 2 of 8. The recurring failure is not arithmetic: in six of eight rollouts the student evaluated 'does not know' using only the public number, repeatedly writing that a speaker 'knows the sum/product is 2002' while never crediting the speaker with their own value. Because everyone then looks ignorant, no group is ever eliminated, and those runs stall (three hit the 16384-token cap with no boxed answer) or settle on a familiar wrong number. The incumbent's phrase 'the value that speaker privately knows' is too abstract to fix this; the revision states the grouping key operationally as public number plus own value, keeping every other incumbent step intact. Making the private coordinate explicit is what any two-speaker announcement puzzle needs, and this version is one token shorter than the incumbent."
16,2,30302,148.317,148.327,a2617d5cf40e8a99a8f74a784b3ae2a8d34000cee46fba8c99104d13b42a8740,cd769b3e899f1cf61c7554c525a2b3810a2126442023706a770ed7d0190972ab,a2617d5cf40e8a99a8f74a784b3ae2a8d34000cee46fba8c99104d13b42a8740,1.0,0.75,-0.25,0.225,0.1625,-0.0625,3.25,2.375,-0.875,70,69,discarded,replace-parameter-elimination-with-two-antipodal-roots-diameter-shortcut-at-69-tokens,"Fresh rollouts (148.317) scored 7/8; the sole failure hit the 16384-token cap after the incumbent's 'characterize the image locus by an equation in x and y' step led it to an unnormalized quadratic, where it looped for thousands of tokens arguing circle-versus-ellipse and never boxed an answer. Six of the other seven also spent most of their budget parametrizing w=Re^{iθ} and eliminating θ. This edit swaps that costly, error-prone elimination for one concrete cheap move a 1.7B student can execute: evaluate the two real extreme values of w, note their images bound a diameter of the symmetric root circle, and halve the distance. It should transfer to any equal-powers-of-two-linear-expressions problem with real coefficients, and at 69 tokens it is shorter than the 70-token incumbent."
16,3,8554,148.318,148.337,7b7b4483667ba6211d89e8b29e80c7dfcb9f10060d9ffc62b3bffc74e364b566,dac8830cd66f7203b5fa07e4c6c707a34bb1e618520d16eaec5f0a6233feedcd,7b7b4483667ba6211d89e8b29e80c7dfcb9f10060d9ffc62b3bffc74e364b566,0.625,0.125,-0.5,0.225,0.1625,-0.0625,2.875,1.75,-1.125,169,165,discarded,function-word-only-compression-of-the-inert-box-first-ordering-clause,"Fresh rollouts scored 4/8: one never closed the reasoning block, one was truncated mid-write-up with no box, and two closed cleanly but boxed a value asserted in prose from a containment claim rather than a computed intersection. Every one of the eight write-ups put its box LAST, at 99-100 percent of the write-up, so the incumbent's 'as the very first thing' ordering was disobeyed 8/8, as in rounds 6, 8 and 15. Deleting that clause (round 8) and rewording it (rounds 6, 15) both lost held-out, and rounds 7 and 13 already tried replacing the setup clause to fix the prose-assertion failure and also lost. So this makes the one untested conservative move: remove three function words from that measurably inert clause, leaving every content phrase byte-identical and every step in its original order, at roughly 165 tokens against the incumbent's 169."
16,4,25003,148.319,148.329,e0ca78c56f30a95ccffa6bbca03e866e7e92dfbb723570c1181e9524f64d335b,9a6dbd714caa5d1e7bcde4398e98f49b86b47ab8f4defe13badf33e54ee477be,e0ca78c56f30a95ccffa6bbca03e866e7e92dfbb723570c1181e9524f64d335b,0.875,0.5,-0.375,0.225,0.25,0.024999999999999994,3.125,3.0,-0.125,146,144,discarded,lossless-function-word-compression-drop-Then-connective-and-nominalize-count-of-inputs-144-vs-146-tokens,"Fresh rollouts (148.319) scored 6/8. Both failures collapse the count: one applies the degree bound to the whole called-out stretch and drops the menu, the other decides two inputs already force linearity and multiplies the menu by two. Grepping all eight rollouts, every clause of the incumbent is quoted and used, including the ban and the never-one-factor-alone reminder, so nothing is inert and cutting any step would be the round-6 mistake. My manifest also shows every semantic re-scoping of the counting step already lost (rounds 2, 13, 15) and the pointwise-agreement idea lost in round 5, so I did not re-test those. This is therefore a strictly lossless compression: only the discourse connective 'Then' and the nominalization 'count of inputs' to 'input count' change, every math phrase byte-identical, 144 versus 146 tokens, so a held-out tie now breaks my way."
16,5,30418,148.320,148.330,1eb4e3cdd613a791abc5a6eca1cdc1c28a39f7f417b75d407c5cfcb7ed4ed992,168cf8bb177dbcb95c68fee97b56c630ba69161d111e0b0bb30fb28ae3b17eba,1eb4e3cdd613a791abc5a6eca1cdc1c28a39f7f417b75d407c5cfcb7ed4ed992,0.75,0.625,-0.125,0.25,0.1375,-0.11249999999999999,3.25,2.0,-1.25,70,68,discarded,swap-inert-relabel-clause-for-recheck-solved-values-in-defining-equation,"Seven of eight rollouts were correct. The single failure pinned the constants and even substituted them back, then solved for the remaining point's coordinate and evaluated the defining relation with a flipped exponent sign, never rechecking that derived value against the equation it came from, so a wrong coordinate propagated straight into the final quantity. Meanwhile no rollout in this round or the previous one ever referenced the incumbent's 'relabel, not restart' clause, so that text is inert transfer tax. This edit swaps the inert clause for one concrete positive step - recheck every solved value in the defining equation, not just the constants - which should transfer to any unseen problem where later coordinates are derived from a pinned relation, and lands two tokens shorter than the incumbent."
16,6,26989,148.321,148.331,e64f97e23626cd3b726aa52d8740f627fe7f8a230645491fa857bd91465c19e1,8f07220eb7325437c1f4217985ed9e3633ca515cdbcdc2ca53db3e94419d2946,e64f97e23626cd3b726aa52d8740f627fe7f8a230645491fa857bd91465c19e1,0.125,0.0,-0.125,0.2625,0.1875,-0.07500000000000001,2.75,1.875,-0.875,176,175,discarded,convert-target-stack-into-required-delivery-order-175-vs-176-tokens,"Fresh rollouts scored 1/8 and all eight made the same error: each wrote that the shed's bottom bag is the one delivered LAST, and all eight got there by an equally-likely-permutation claim (1/4 five times, plus 1/24, 1/16, 0, 1). The incumbent already states the correct fact adjacently (round 14's win) and already forbids the uniform shortcut, yet no rollout ever wrote down which sequence of deliveries the event demands, so it had nothing to price and fell back on counting permutations. Rounds 12 and 13 lost by restating that fact passively and round 15 by pure compression, so this edit instead makes it an executable first move: read the demanded final stack bottom-to-top and that is the required delivery order. Both directions of the fact are kept (round 12 lost by dropping the 'last' half), S1/S3/S4 are byte-identical, and it lands at 175 tokens versus 176."
16,7,3836,148.322,148.332,ab86313389de277c671789977242ca71390d684323c6bdbaf69bed67b8fdd067,b06f1c8d6381a330cc83095ca823e88c322c3093fb5071d85d588b9cc6eafbbc,ab86313389de277c671789977242ca71390d684323c6bdbaf69bed67b8fdd067,0.25,0.125,-0.125,0.175,0.0875,-0.0875,2.0,1.0,-1.0,70,70,discarded,replace-inert-word-elimination-with-the-concrete-operation-subtract-consecutive-equations,"Fresh round-16 rollouts scored 1/8; seven hit the 16384-token cap with no boxed value. The incumbent's word 'elimination' is measurably inert: 'eliminat' appears only inside the quoted hint in six of eight traces and never as an action. The sole winner instead performed and named the concrete operation, subtracting one equation from the next seven times, which collapsed its small systems and produced the table the rest of the hint needs; the losers circled matrix and Vandermonde language for tens of thousands of characters and never reduced anything. So I spend the inert abstract noun on the concrete move that worked, and reclaim the token by merging the two prohibitions (heldout-neutral when tested alone in round 11), keeping the hint at the incumbent's length. Subtracting consecutive relations is the generic reduction step for any small-case ladder, so it should transfer."
16,8,23443,148.323,148.333,0250077d8944cf1436c3e3ecd3d488e1d97a5eb76f0be7756ba8677ce1f1d77e,6da630b8ba1bf5f2888b8f9a32c843cb8d3dca61be21035214e1d23f9e168228,0250077d8944cf1436c3e3ecd3d488e1d97a5eb76f0be7756ba8677ce1f1d77e,0.75,0.25,-0.5,0.1625,0.1125,-0.05,2.375,1.375,-1.0,123,121,discarded,add-concrete-percent-base-and-sum-then-divide-once-funded-by-compression-not-clause-deletion,"Round 16 scored 6/8. All 8 rollouts reached the gcd step and built the same divisor list, so those clauses are load-bearing and must stay. Both failures broke only at selection: with no rule for choosing among survivors they grabbed the count the text states for groups and divided by it, while the six successes finished the computation they had set up. History says explicit selection rules are a dead end here (four tried, all lost held-out), whereas the concrete percent-base plus sum-before-dividing-once appeared in this hint's two best held-out observations but only in rounds that paid for it by deleting the grouping clause. This keeps every clause the successes use, adds those two executable arithmetic instructions, and still lands two tokens under the incumbent."
16,9,3980,148.324,148.334,391f18d0a38c1a07058f9782b12c580bfb7fb5aae04b069b173f7d17d3e75563,2212795ae889ad5574257074cb2ef6aa5b3be7f214bcc31ed41a8538838470d0,391f18d0a38c1a07058f9782b12c580bfb7fb5aae04b069b173f7d17d3e75563,0.375,0.625,0.25,0.2625,0.1125,-0.15000000000000002,3.0,1.75,-1.25,147,144,discarded,state-linking-relation-as-pointwise-sum-identity-instead-of-abstract-affine-involution-notation,"3 of 8 correct. All three winners wrote the maps-sum-to-a-constant form g = s - f as a pointwise identity (19-43 times each) and finished under 12k tokens. Four of the five failures never reached it: they read the incumbent's abstract 'affine involution, f = L(g) with L(t) = s - t' as a reflection of the ARGUMENT and burned the full 16384-token cap cycling through variants like g(x) = f(s - x) + k (42 and 54 restatements in two rollouts), boxing nothing. The 'reflect the maps not the argument' warning alone does not prevent this, so this edit replaces the abstract L-notation with the pointwise sum identity the successes actually execute, keeping every other clause and the warning intact. Naming the linking relation as a concrete equation should transfer to any pair of maps tied by an identity, and it is 144 tokens versus the incumbent's 147."
16,10,3843,148.325,148.335,b4625f41b606ccf2c7016dbf4b2ecc78323f2a9c9491361dc7cea908b65814ce,f35723e4dc2afe2c9e6b06cc17fbe624bd14c7dc195ef432ec15398d3a5af454,f35723e4dc2afe2c9e6b06cc17fbe624bd14c7dc195ef432ec15398d3a5af454,0.5,0.25,-0.25,0.1625,0.225,0.0625,2.125,2.5,0.375,101,100,kept,commit-each-measured-size-and-advance-instead-of-re-running-the-same-size,"3/8 correct. All five failures did write the smallest case out literally, so the incumbent's 'every row from a case you wrote out' step already fires; what killed them was re-running that same smallest size again and again, getting two or three conflicting values for it, and burning the whole budget relitigating one size instead of ever reaching a second or third. The successes recorded the small value once and immediately moved up in size. So I replace the redundant 'not a structural argument' qualifier with the concrete missing move: commit the value and advance to the next size, never re-running a size already written out. It is one token shorter than the incumbent and should transfer to any tabulate-and-fit problem."
