round,hint_id,train_qid,sampling_slurm_job_id,proposal_eval_slurm_job_id,incumbent_hash,proposal_hash,final_hash,old_train,new_train,delta_train,old_heldout,new_heldout,delta_heldout,old_J,new_J,delta_J,old_tokens,new_tokens,decision,mutation,subagent_summary
4,7,3836,148.79,148.91,b2294ffb06fe64f3e4a994bbe4afab5fca8a5e3f5ff31f073862a0e8ad1b932e,74f69952b9f10938e319d80089c7d99dc7fc02f1799860576f387015e63ac6ae,74f69952b9f10938e319d80089c7d99dc7fc02f1799860576f387015e63ac6ae,0.125,0.125,0.0,0.125,0.125,0.0,1.375,1.375,0.0,78,73,kept,front-load-three-small-cases-and-ban-full-size-symbolic-work,"Fresh round-4 rollouts under the incumbent scored 1/8. The only winner was also the only rollout that reached three exact small cases and tabulated the requested value before generalizing; every zero either stopped after two cases or delayed the shrink until deep into the trace after long symbolic work at full size, and four hit the generation cap. The incumbent's ban on the single-polynomial model is now partly obeyed, but students substitute an equally fatal habit: manipulating the huge parameter symbolically. This edit makes the shrink the literal first action, sets a concrete quota of three tabulated entries before generalizing, and extends the ban to full-size symbolic work, going 78 to 73 tokens since shorter has won every kept round."
4,8,23443,148.83,148.92,5d81acfa76bdabfdb99f63430333dd6dd355a1f99836aca600e4e52914a2ac08,538dabf979d737299b46ec9cccc3220992771aaa6fd508db51e4942a55bdc867,5d81acfa76bdabfdb99f63430333dd6dd355a1f99836aca600e4e52914a2ac08,0.75,0.125,-0.625,0.15,0.1625,0.012500000000000011,2.25,1.75,-0.5,136,133,discarded,swap-grouping-clause-for-no-plausibility-elimination-rule,"Fresh round-4 rollouts on the incumbent scored 5/8, and all three failures shared one mechanism: they divided the stage totals by a grouping count stated in the text and justified it as the more realistic figure; two had already derived the full common-divisor list and abandoned it, one skipped divisibility outright. The incumbent's grouping-count sentence is abstract bookkeeping and demonstrably does not stop this, so I swapped it for a reusable elimination discipline: a candidate may only be discarded by a stated condition, never by apparent plausibility. Round 3 taught me that patching this failure with an added tiebreak rule saturates train but destroys transfer, while compressing and deleting wins; this revision adds no rule and lands at 133 tokens versus 136."
4,9,3980,148.80,148.93,3177fd8ccc06120f7993d61571961edc2bb39f823ba9696ca131a1da2bfbe076,c5373efff4f0b30022f9f0d189b5f89014ec39efc94ef09d9d12af2eed5b6aef,3177fd8ccc06120f7993d61571961edc2bb39f823ba9696ca131a1da2bfbe076,0.375,0.375,0.0,0.2375,0.1625,-0.07499999999999998,2.75,2.0,-0.75,152,189,discarded,add-fixed-point-substitution-of-requested-input-and-stop-and-commit-rule,"Fresh training on the incumbent scored 4/8 and all four failures ran to the 16384-token cap. Two derived the reflection constant by averaging the inputs they were asked to evaluate instead of from the given data, one abandoned the symmetry for multinomial coefficient matching, and one actually reached the correct values through a fixed-point equation but then burned the rest of its budget re-expanding the composition numerically and never committed an answer. The edit keeps the involution ansatz that earns the current score and adds the two general moves the failures lacked: plug a requested input into the identity itself, which typically reduces to a solvable fixed-point equation in one unknown, and stop after one small symmetry check rather than re-verifying the composition."
4,10,3843,148.84,148.94,f772ab29bcbea76311626f4c1f77eaac463c18fdba2a1be7222f1d266cb3e565,6ee9b632ef42deca7cc0a228d4445631081f7c08f4ff76cb9717535f772a841a,f772ab29bcbea76311626f4c1f77eaac463c18fdba2a1be7222f1d266cb3e565,0.5,0.5,0.0,0.125,0.075,-0.05,1.75,1.25,-0.5,108,108,discarded,count-applications-until-return-and-ban-the-symbolic-position-algebra-detour,"Fresh round-4 rollouts under the incumbent scored 4/8. All three cap-exhausted failures abandoned their literal run partway and looped inside symbolic transposition and cycle bookkeeping, re-deriving jargon instead of counting; the one finished failure declared the stages disjoint transpositions and read the period off a single stage. Every success instead re-applied the entire operation repeatedly on the two smallest sizes, counted applications until the state returned, and fit the parameter. The incumbent's 'describe it as a single map and check the two agree' clause is what invites that fatal symbolic detour, so I replace it with an explicit count-applications-until-return loop plus a ban on position algebra, holding length at 108 tokens because my two long caution-list proposals both cut held-out."
5,1,28054,148.95,148.105,98f0bbb6f87c7e50634956da8a0905b30a66997aa33a5e4bc67a2609ec487ed8,1dddd1e17dcd95dc1b2789115965f70e98122231b9c369c964c52ef0b1a67374,98f0bbb6f87c7e50634956da8a0905b30a66997aa33a5e4bc67a2609ec487ed8,0.125,0.25,0.125,0.25,0.2,-0.04999999999999999,2.625,2.25,-0.375,77,101,discarded,evaluate-candidates-by-local-private-information-and-require-each-condition-to-eliminate,"Execution 148.95 scored 2 of 8: four rollouts hit the 16384-token cap (three with no boxed answer) and the others concluded that every candidate pair is equally consistent, then named an arbitrary one. The shared error is checking a stated inability to determine against the shared public number alone, which is vacuous, instead of against what that person privately holds inside each candidate; nothing then gets eliminated, so the model loops or guesses. Rounds 1-4 all lost held-out with longer, puzzle-flavoured rewrites, so this stays terse (101 tokens) and adds two generic moves: evaluate each candidate using only the information available at that point, and treat a condition that eliminates nothing as evidence the setup is mismodelled. Both habits help ordinary constraint problems too."
5,2,30302,148.96,148.106,a2617d5cf40e8a99a8f74a784b3ae2a8d34000cee46fba8c99104d13b42a8740,4a89494a227f7fa7f0b563bd8ed91ca13e8cbc2d904191b3095f912ba7f7f570,a2617d5cf40e8a99a8f74a784b3ae2a8d34000cee46fba8c99104d13b42a8740,1.0,1.0,0.0,0.225,0.1375,-0.0875,3.25,2.375,-0.875,70,64,discarded,lossless-compression-of-70-token-incumbent-to-64-tokens-all-six-steps-kept,"Fresh round-5 rollouts (execution_id 148.96) scored 7/8; clause-tracing all eight shows every surviving element is load-bearing (divide by the power, the w substitution, w on a circle, inverting the Mobius relation, the x-y locus equation, exceptional values) and no clause goes unused, so nothing can honestly be deleted. The single miss was a length-cap stall, not a missing instruction: it had the correct locus quadratic early and re-derived the same center and radius at the end. Round 3 won by compressing 81 to 70 tokens with every step intact while round 1 (169 tok), round 2 (139 tok) and round 4 (147 tok) all expanded and lost held-out, so the only lever left is length. This proposal restates the identical six steps in 64 tokens, six below the incumbent."
5,3,8554,148.97,148.107,696e4bd374fc53e4ff449724af00cf5f5446cd0eea489d9ede25197ca26e394b,7b7b4483667ba6211d89e8b29e80c7dfcb9f10060d9ffc62b3bffc74e364b566,7b7b4483667ba6211d89e8b29e80c7dfcb9f10060d9ffc62b3bffc74e364b566,0.75,0.625,-0.125,0.15,0.225,0.07500000000000001,2.25,2.875,0.625,122,169,kept,box-first-then-explain-after-closing-plus-coordinate-extent-setup,"Round-5 rollouts under the incumbent scored 5/8, and all three failures were output-protocol failures, not method failures: two never closed the reasoning block at all and one closed it at 97 percent of its budget then started a fresh derivation and was truncated mid-calculation, even though it already held the correct exact value. The five successes closed late too, so the incumbent's 'stop by the halfway mark' instruction is never obeyed and its 'do not re-derive' clause is not enough. This revision makes the boxed value the first token after closing with all prose placed after the box, so late closing and truncation become harmless; it also adds a coordinate-and-extent setup step because one failure drifted into assuming one figure was wholly contained in the other, and keeps the reusable invariance and covered-equals-sum-minus-overlap rules."
5,4,25003,148.98,148.108,c3cbe0705047c147d73e4cc6abba5206011053ba9a5bfc3d932d36a3d2abb469,e11dccc361594c956709f8afc2bcb33f5efef9a15844d6f72ae6684b8d4f1a50,c3cbe0705047c147d73e4cc6abba5206011053ba9a5bfc3d932d36a3d2abb469,0.875,0.625,-0.25,0.225,0.1625,-0.0625,3.125,2.25,-0.875,153,142,discarded,cut-jam-clearing-jsoncross-differencing-ban-and-grouping-clause-add-pointwise-only-agreement-142-vs-153-tokens,"Fresh round-5 rollouts (execution 148.98) scored 5/8 with the incumbent. All three failures share one jam: they demand that a polynomial serving several inputs be affine on that stretch or have constant consecutive differences, which is impossible above degree one, so they override the deg-P root cap they already derived and report one factor alone (a cap of two, the menu size, or a coefficient-count of six). Both truncated rollouts spent their tail oscillating there. The revision is 142 tokens versus 153: it drops the cross-polynomial differencing ban and the grouping instruction, which every rollout already performs unaided, and spends the freed words on the single clause that agreement with the shared affine target is required only pointwise at the inputs actually handed to the polynomial."
5,5,30418,148.99,148.109,b807d87e8e00cc91a6166db0fb3921c3d3651d016bdd936e3700d0c9bde5fa81,2594a66b434a98d51cbfafd00c73846710ca34d7235ea242704b58838a65b1f7,b807d87e8e00cc91a6166db0fb3921c3d3651d016bdd936e3700d0c9bde5fa81,1.0,0.625,-0.375,0.15,0.125,-0.024999999999999994,2.5,1.875,-0.625,73,73,discarded,flipped-direction-diagnostic-on-surd-discriminant-or-zero-area,"Five of eight rollouts scored. All three failures shared one new mechanism: they flipped the direction of the stated vector relation, then either hit an irrational discriminant and burned the full token budget grinding radicals, or got a shoelace sum of zero and declared a contradiction instead of relabeling. Every success ran the same chain: exponentiate the two given points into linear equations, solve and verify the parameters, copy the vector relation in the exact letter order given, force both unknowns onto the curve, subtract the two equations so one exponentiation clears the logs, factor the quadratic, drop the root reproducing a given point, then shoelace in cyclic order. This revision keeps that chain and adds the one diagnostic the failures needed: a surd discriminant or vanishing area signals a flipped direction, not broken algebra. Held at incumbent length; a 186-token draft sitting at my path was replaced since every long proposal so far has lost."
5,6,26989,148.101,148.110,67d122a90af2e0710ab939322c2a6639c7d9434bfc510d8f18475e267a2103c9,3e3e99381f8c91d94f8968669b8bbd91d9ac9cab895dd77b3beaf94c4494739e,67d122a90af2e0710ab939322c2a6639c7d9434bfc510d8f18475e267a2103c9,0.0,0.125,0.125,0.2125,0.1375,-0.07499999999999998,2.125,1.5,-0.625,185,193,discarded,"generalize-to-state-and-path-pricing: drop stack jargon, require explicit path construction and small-case check before claiming impossible/certain","All 8 rollouts scored 0 and none built a state at all: four priced the target as one or two isolated coin flips (1/2^n, 1/4, 1/2), two flipped to bare symmetry (1/n), and two asserted the worker has no real choice and returned certain/impossible, with two runs looping to the token limit re-arguing that claim. The incumbent's stack-shunting/push-pop-word vocabulary was simply not used, so this edit drops the domain jargon and states the transferable habit instead: name the state as ordered contents, price each step from the options legal in that state, build an explicit path or a small case before declaring anything impossible, and stop and box each part."
5,7,3836,148.100,148.111,74f69952b9f10938e319d80089c7d99dc7fc02f1799860576f387015e63ac6ae,ab86313389de277c671789977242ca71390d684323c6bdbaf69bed67b8fdd067,ab86313389de277c671789977242ca71390d684323c6bdbaf69bed67b8fdd067,0.125,0.25,0.125,0.125,0.175,0.04999999999999999,1.375,2.0,0.625,73,70,kept,say-what-to-extract-from-the-table-ratio-plus-sign-and-forbid-leaving-it,"Fresh round-5 rollouts under the incumbent scored 2/8, up from 1/8. Both winners got three exact numeric small cases and read the rule off them. The six zeros split into two habits: three ignored the shrink order for tens of thousands of characters while manipulating a polynomial in x, and three obeyed the shrink but then abandoned their table for polynomial and Vandermonde theory and thrashed to the 16384-token cap or guessed. So the incumbent's shrink order now lands, but it never says what to do with the table, which is where students bail out. This edit keeps the ban on the polynomial model, adds an explicit extraction step (ratio of consecutive entries with the sign tracked separately), and forbids leaving the table for theory, at 70 tokens versus the incumbent's 73 since shorter has won every kept round."
5,8,23443,148.104,148.112,5d81acfa76bdabfdb99f63430333dd6dd355a1f99836aca600e4e52914a2ac08,0250077d8944cf1436c3e3ecd3d488e1d97a5eb76f0be7756ba8677ce1f1d77e,0250077d8944cf1436c3e3ecd3d488e1d97a5eb76f0be7756ba8677ce1f1d77e,0.75,0.75,0.0,0.15,0.1625,0.012500000000000011,2.25,2.375,0.125,136,123,kept,restore-gcd-handle-fold-substitute-once-delete-unit-clause,"Fresh round-5 rollouts on the incumbent scored 3/8, and the split is mechanical: all three successes computed the gcd of the stage totals, took its divisors as the candidate counts, and used the stated grouping count only as a consistency filter; three of the five failures never derived a candidate set at all and two abandoned one for the stated grouping count. So the incumbent's abstract phrase 'the candidates are their common divisors' is not converting into a computation, while naming the gcd (present in the round-1 wording that scored my best held-out, 0.1875) does. This revision restores only that concrete handle, keeps the grouping clause whose deletion cost 0.625 of train in round 4, folds substitute-once into the opening sentence, and deletes the requested-unit reminder no rollout ever needed. 123 tokens versus 136, with no new rule added."
5,9,3980,148.102,148.113,3177fd8ccc06120f7993d61571961edc2bb39f823ba9696ca131a1da2bfbe076,b49f49fadf6eb7b4728a14dfbe1e15c6a420466740868567eaeb50fe6da94dff,3177fd8ccc06120f7993d61571961edc2bb39f823ba9696ca131a1da2bfbe076,0.375,0.0,-0.375,0.2375,0.2,-0.03749999999999998,2.75,2.0,-0.75,152,156,discarded,generalize-to-any-for-all-inputs-identity-plus-half-budget-cutoff-and-always-commit-boxed-answer,"All eight fresh rollouts on the incumbent scored 0 and every one died on the 16384-token cap without ever emitting a boxed answer: they used the reflection idea only as narration, slid back into coefficient-by-coefficient matching of the composition, then looped on 'contradiction'/'mistake' self-corrections and re-derivations of the same lines. Prior rounds show that adding more problem-specific machinery (191-195 tokens) hurt held-out, so this edit instead shortens and generalises: it frames any for-all-inputs identity as a symmetry-hunt with cheap invariants first, keeps the derive-the-constant and free-parameter-cancels rules, adds recheck-the-line-before-switching, and adds an explicit half-budget cutoff plus an always-commit-a-boxed-answer rule aimed straight at the no-answer length failures."
5,10,3843,148.103,148.114,f772ab29bcbea76311626f4c1f77eaac463c18fdba2a1be7222f1d266cb3e565,9cdd67d9e170af475974f25e0fade36078ce543ee23df7b3981101311f96d0a7,f772ab29bcbea76311626f4c1f77eaac463c18fdba2a1be7222f1d266cb3e565,0.5,0.25,-0.25,0.125,0.1,-0.024999999999999994,1.75,1.25,-0.5,108,156,discarded,require-exhibited-and-certified-structure-ban-unrun-table-entries,"Fresh round-5 rollouts under the incumbent scored 1/8. Four failures never wrote out any case: they simply declared the composite a product of disjoint transpositions and reported a period read off a single part. A fifth tabulated small-case values it had not actually run, then fit a formula to those invented numbers. Only two failures were cap exhaustion. So the dominant error is asserting or fabricating structure rather than exhibiting it, which the incumbent's 'describe it as a single map' clause licenses. This revision bans unexhibited structure, requires every tabulated value to be a run actually carried out, and requires certifying any named structure by substituting it back - all phrased for any construct-and-verify problem, not this operation, since my long problem-specific caution lists have repeatedly cut held-out."
6,1,28054,148.115,148.125,98f0bbb6f87c7e50634956da8a0905b30a66997aa33a5e4bc67a2609ec487ed8,07363e1a841cc22086b50fc6f756f5491f820240a7de3386db6f2d2e809f93aa,98f0bbb6f87c7e50634956da8a0905b30a66997aa33a5e4bc67a2609ec487ed8,0.125,0.0,-0.125,0.25,0.0875,-0.1625,2.625,0.875,-1.75,77,64,discarded,lossless-compression-77-to-64-tokens-plus-commit-early,"Execution 148.115 scored 3 of 8. Three failures hit the 16384-token cap with no boxed answer, and the other two wrote a survivor after already re-arguing the same cases dozens of times. Every rollout, winning or losing, spent most of its budget on repeated self-correction, so the deciding factor is finishing, not method. Rounds 1-5 all tried longer rewrites (101-167 tokens) and every one lost held-out against this 77-token incumbent; no round has yet tried going shorter. This proposal keeps all four incumbent steps (enumerate cases, group by private value, read a knowledge claim as a group-size test, re-filter in spoken order) in plainer words at 64 tokens, drops the inert 'do not reason from the original set' clause no rollout ever acted on, and replaces it with the one behaviour the rollouts actually lacked: commit and box early rather than re-check settled cases."
6,2,30302,148.116,148.126,a2617d5cf40e8a99a8f74a784b3ae2a8d34000cee46fba8c99104d13b42a8740,3747f51d073cc5b72c346ca33fd930b1d1a71cf4aace1e8d4586515cb4332581,a2617d5cf40e8a99a8f74a784b3ae2a8d34000cee46fba8c99104d13b42a8740,1.0,1.0,0.0,0.225,0.1125,-0.1125,3.25,2.125,-1.125,70,70,discarded,generalize-hardcoded-substitution-to-ratio-of-the-two-linear-expressions-at-equal-length,"Fresh rollouts (execution_id 148.116) scored 7/8; the single miss was a 16384-token length-cap stall that had the correct locus quadratic and the correct center and radius early, then looped 55 times on circle-versus-ellipse doubt and never boxed anything. Rounds 2 and 4 already showed that appending normalize/certify guards for exactly that stall ties or loses held-out, and round 5 showed pure compression below 70 tokens loses too, so this round attacks the one clause that provably cannot transfer: the hardcoded w=(z-1)/z. Held-out problems in this class pair different linear expressions, and the traces show the student constructs the ratio itself unaided, so naming the ratio generically instead of memorizing one instance should raise transfer at the same 70 tokens."
6,3,8554,148.117,148.127,7b7b4483667ba6211d89e8b29e80c7dfcb9f10060d9ffc62b3bffc74e364b566,70e92eec74d6dcf8f6624639a1d393445e640adfce0f2e3be5299461444364e2,7b7b4483667ba6211d89e8b29e80c7dfcb9f10060d9ffc62b3bffc74e364b566,0.625,0.625,0.0,0.225,0.15,-0.07500000000000001,2.875,2.125,-0.75,169,162,discarded,align-output-protocol-wording-with-observed-behavior-and-compress,"All 8 rollouts scored correct (8/8), and every one closed its reasoning block and finished with a short write-up whose box sits at the very END, not first: the incumbent's 'box first, explanation after the box' clause was disobeyed 8/8 times, so it is inert text paying transfer tax. The word 'extent' likewise appeared in 1 of 8 traces while coordinates appeared 130-170 times each. This edit therefore restates the same protocol in wording the student already follows (close early, keep the write-up to a few lines, end on the box) and replaces 'write each object's extent' with plain 'note how far each object actually reaches', while adding the origin-at-the-shared-point setup step that traces do execute. Net result is 162 tokens versus the incumbent's 169 with every load-bearing step preserved."
6,4,25003,148.118,148.128,c3cbe0705047c147d73e4cc6abba5206011053ba9a5bfc3d932d36a3d2abb469,e9e462c72de55318f06b0393d9f04334f27ede7924b599b8c166e80a10516177,c3cbe0705047c147d73e4cc6abba5206011053ba9a5bfc3d932d36a3d2abb469,0.875,0.125,-0.75,0.225,0.15,-0.07500000000000001,3.125,1.625,-1.5,153,152,discarded,widen-existing-differencing-ban-to-cover-within-one-polynomial-and-compress-tail-152-vs-153-tokens,"Fresh round-6 rollouts (execution 148.118) scored 5/8 with the incumbent. All three failures share one root cause: after correctly setting up the shared affine target, they switch to differencing WITHIN a single polynomial's own block, demanding its consecutive differences be constant or that it be affine there. One then caps a block at one input and reports the menu size, one solves that spurious constant-difference system and undercounts the cap by one, and the truncated pair oscillate on the impossibility of a high-degree polynomial being linear. The incumbent bans differencing only ACROSS polynomials, which leaves this door open. The edit widens that same existing clause to forbid differencing within one polynomial too, and compresses the closing clause, so the proposal is shorter than the incumbent (152 vs 153 tokens) with every prior step preserved."
