round,hint_id,train_qid,sampling_slurm_job_id,proposal_eval_slurm_job_id,incumbent_hash,proposal_hash,final_hash,old_train,new_train,delta_train,old_heldout,new_heldout,delta_heldout,old_J,new_J,delta_J,old_tokens,new_tokens,decision,mutation,subagent_summary
1,1,28054,148.19,148.23,98f0bbb6f87c7e50634956da8a0905b30a66997aa33a5e4bc67a2609ec487ed8,432d12bf7bac345c08bcc0647a4af003bcd315371d47cc16efeadeac06c97f4c,98f0bbb6f87c7e50634956da8a0905b30a66997aa33a5e4bc67a2609ec487ed8,0.125,0.0,-0.125,0.25,0.1875,-0.0625,2.625,1.875,-0.75,77,150,discarded,treat-revealed-quantity-ambiguity-as-shared-unknown-and-forbid-self-contradicting-commit,"In the fresh rollouts (execution 148.19, 1 of 8 correct) the failures were interpretive, not arithmetic: every losing run first fixed the revealed value's identity as an external fact, which makes each speaker able to compute the partner immediately and so produced contradictions in both branches. Several runs then committed to a candidate while explicitly writing that it contradicts the stated ignorance, and two exhausted the 16384-token cap re-arguing cases they had already settled. The incumbent's generic candidate-set-and-delete-unique-groups wording never flags that the reading itself is unknown to the speakers, so it addresses neither failure; the revision names that shared ambiguity as the coordinate to keep open, defines can/cannot-determine as survivor counts, and adds a transferable rule against reporting a candidate already shown to fail."
1,2,30302,148.22,148.24,e926ca1d6f04d597d4b99af9d15b2597417b40fc28c3c0397d67f147cfa99917,6edcdbd2b61f4fd9f52c4ac87eaad1604d049ac9ac126b5aa0ad69243bffaed7,e926ca1d6f04d597d4b99af9d15b2597417b40fc28c3c0397d67f147cfa99917,1.0,1.0,0.0,0.2,0.0875,-0.11250000000000002,3.0,1.875,-1.125,81,169,discarded,generalize-trigger-plus-modulus-shortcut-and-normalize-before-completing-square,"Fresh rollouts (execution_id 148.22) scored 8/8, so the incumbent is not failing on train; the gap is transfer (heldout_i=0.2) because it hardcodes one substitution and a Mobius-image detour. Seven of eight traces followed that detour, enumerating all roots and parametrizing the circle before recovering the locus, while the one trace that took moduli at once reached a ratio-of-distances circle in a few lines. Traces also repeatedly landed on a quadratic whose x^2+y^2 coefficient was not 1, the natural spot to misread a radius, so the revision states the general trigger, routes straight to the modulus step, requires normalizing before completing the square, names the degenerate equal-distance case, and keeps two cheap validity checks."
1,3,8554,148.20,148.25,00f433b6ea19dfe2336efbb3476fea529c0993179016a67ce16e4288905f3cd0,918623ddf49b0ec8c88e8becd4d23b6c8423864ccda8f888c55e8989ee25135c,918623ddf49b0ec8c88e8becd4d23b6c8423864ccda8f888c55e8989ee25135c,0.125,0.5,0.375,0.1375,0.15,0.012499999999999983,1.5,2.0,0.5,86,147,kept,invariance-check-before-case-analysis-plus-commit-early,"All 8 rollouts ran to the 16384-token cap with reward 0, and 6 of 8 never emitted a boxed answer at all, yet 7 of 8 had already reached the correct value early (median roughly 17 percent into the trace) and then abandoned it; traces show 23-64 'Alternatively' restarts each and heavy dead-end exploration of tangency configurations. The bottleneck is budget and commitment rather than method, and the incumbent's instruction to build a piecewise expression over critical angles actively feeds the loop, so the revision front-loads a cheap two-position invariance test, demands numeric verification via coordinates and shoelace instead of prose, and orders the solver to stop and answer once two computations agree."
1,4,25003,148.21,148.26,93b35723e9cc953d39ac835ae67c34590b0c25060143ab50c99c75c21cbb1ff2,3f7a40ea94795e85eeacaf7eb371e77a133709fb15b5eb9c6c9aea2f3cc76b62,3f7a40ea94795e85eeacaf7eb371e77a133709fb15b5eb9c6c9aea2f3cc76b62,0.0,0.5,0.5,0.1875,0.2125,0.024999999999999994,1.875,2.625,0.75,94,162,kept,replace-difference-chasing-with-shared-affine-target-and-per-polynomial-root-count,"All 8 fresh training rollouts (execution 148.21) scored 0/8 with an identical failure mode: they tried to enforce the progression by differencing consecutive terms produced by DIFFERENT polynomials, concluded a degree-5 polynomial 'would have to be linear or constant', and then guessed a tiny value or the menu size; half also exhausted the token budget re-deriving that dead end. None made the decisive move of writing the target progression as one shared affine function of the input and counting roots of P(x)-L(x) per polynomial. The revision names the wrong path explicitly, supplies the index-equals-input observation that legitimizes the shared affine target, gives the degree-based per-polynomial cap and menu-size multiplication, and asks for a matching construction, all phrased for any finite-menu fixed-degree family."
1,5,30418,148.15,148.27,b807d87e8e00cc91a6166db0fb3921c3d3651d016bdd936e3700d0c9bde5fa81,0e09ab52d1a561b032d1a8b6ebc24d434c2788bd3d1f84cc0b85ba26b97363d6,b807d87e8e00cc91a6166db0fb3921c3d3651d016bdd936e3700d0c9bde5fa81,1.0,0.5,-0.5,0.15,0.1125,-0.03749999999999999,2.5,1.625,-0.875,73,172,discarded,generalize-to-class-procedure-with-ugly-root-error-signal,"Seven of eight rollouts were correct; the one failure mis-paired the cross-multiplication when clearing a fractional equation, turned rational roots into surds, then spent the whole 16384-token budget manipulating those radicals and never committed to a boxed result. The incumbent hint was written around this problem's specific machinery, which is noise on unseen questions, so this edit replaces it with a transferable procedure: pin parameters and verify, exploit symmetry or an invariant, cross-multiply pairwise, treat ugly roots as an error signal rather than pressing on, discard degenerate or out-of-domain solutions, confirm the target quantity a second way, and commit concisely."
1,6,26989,148.13,148.28,99c30a3f882f054f77512e4fdca1d19befb3e5426d7d857d52f4369a95c4f820,67d122a90af2e0710ab939322c2a6639c7d9434bfc510d8f18475e267a2103c9,67d122a90af2e0710ab939322c2a6639c7d9434bfc510d8f18475e267a2103c9,0.0,0.0,0.0,0.175,0.2125,0.037500000000000006,1.75,2.125,0.375,83,185,kept,stack-shunting push/pop word framing plus bottom-equals-arrived-first rule and forced-move weight one,"Across the eight fresh rollouts (2/8 correct) every failure abandoned state tracking and substituted a uniform-permutation hand-wave, giving 1/24 or 1/16 on part (a) and 1/4 on part (b) from the claim that each item is equally likely to be moved last; the two rewarded rollouts only loosely counted free binary choices rather than tracking states. The incumbent hint's abstract state-graph-plus-dynamic-programming language was ignored because the student never built a state, so the revision names the concrete representation (a push/pop word over three ordered stacks), explicitly flags the equally-likely-permutation shortcut as an error, and supplies the two facts the failures lacked: a destination stack's bottom is whatever arrived first, and forced moves carry probability one."
1,7,3836,148.14,148.29,39e2668fb5cca7669288765276aabe0dba01769397daa33b16a9dd7c0174a8f4,d68fa31e9792546c3135f2ddf7835bb7b7aabcff3c3dfca6c128f72afd44c362,39e2668fb5cca7669288765276aabe0dba01769397daa33b16a9dd7c0174a8f4,0.0,0.0,0.0,0.125,0.1125,-0.012499999999999997,1.25,1.125,-0.125,82,167,discarded,normalize-then-small-cases-verify-and-commit,"All 8 training rollouts scored 0: six ran the generation budget to the cap circling abstract linear-functional and Vandermonde language without ever computing a value, and the two that terminated asserted an answer from vague orthogonality or an unchecked small-size pattern. The incumbent named the right machinery but supplied no procedure, so the revision orders normalization first, then exactly solved small cases with an explicit conjecture, states the product-of-node-differences invariant with sign and factorial bookkeeping, and requires substitution-based rejection plus committing to a finished exact value before the budget runs out."
1,8,23443,148.18,148.30,149cabea90724683bc818e06d11bef6dc0c07209cfe1b68f2300dc838be4613d,b2978873c5591981a1c31bc9bd3f65c56e9dc8e7a037ff47aa156c6b908886d9,b2978873c5591981a1c31bc9bd3f65c56e9dc8e7a037ff47aa156c6b908886d9,1.0,0.25,-0.75,0.1125,0.1875,0.075,2.125,2.125,0.0,77,157,kept,generalize-to-reusable-setup-integrality-percent-base-verify,"All 8 fresh training rollouts were graded correct, so train_i is saturated at 1.0 and every remaining unit of J at lambda=10 must come from transfer; the incumbent hint spends most of its budget describing this one scenario (street layout, stage list, an opaque named 'maximum-feasible-count interpretation'), which is consistent with held-out accuracy sitting near floor. Reading the rollouts, the load-bearing moves were all family-level: recover an implicit count, read per-unit wholeness as simultaneous divisibility and reduce it via gcd to a short divisor list, use the problem's own extremal wording to select, and fix the percentage base before multiplying. The revision states exactly that procedure plus a back-substitution and unit check, with no reference to the training instance."
1,9,3980,148.16,148.31,d95dbbc2898bc6c58c3684891a45d7c76fe4e0835ddd91bed1a4955ddf89942a,3177fd8ccc06120f7993d61571961edc2bb39f823ba9696ca131a1da2bfbe076,3177fd8ccc06120f7993d61571961edc2bb39f823ba9696ca131a1da2bfbe076,0.125,0.375,0.25,0.175,0.2375,0.0625,1.875,2.75,0.875,71,152,kept,replace-vague-affine-advice-with-explicit-reflection-involution-ansatz-and-budget-warning,"All eight fresh training rollouts scored 0 and every one terminated on the token cap (finish_reason=length) while grinding through brute-force coefficient expansion of the composition; two also wrongly concluded no such polynomials exist after a bad ansatz. The incumbent hint gestured at a 'shared affine coordinate' without saying what to do, so the revision names the reusable move concretely: reflect one map into the other via the affine involution L(t)=s-t, impose the point-symmetry condition, and read off requested values from that identity, plus an explicit warning not to expand and not to declare the system unsolvable."
1,10,3843,148.17,148.32,95005ec62835dbef2cc6b52c26e1bc8efa75d3d939090ada63716aa06be7a5b5,75d054dfb4abe65b686664a5c0fec486fa8f7d50954b69633bb81451de2e08cc,95005ec62835dbef2cc6b52c26e1bc8efa75d3d939090ada63716aa06be7a5b5,0.25,0.375,0.125,0.1375,0.0875,-0.05000000000000002,1.625,1.25,-0.375,72,175,discarded,sequential-composition-warning-plus-budgeted-tracing-to-closed-form,"In the eight fresh rollouts (2/8 correct) four hit the 16384-token cap while hand-tracing individual positions and never emitted an answer, and both finished failures asserted the stages are independent disjoint transpositions and reported order 2. The revision names that specific misread - stages act sequentially on the already-modified word and move whole current prefix blocks, not independent swaps - flags the 'order 2' conclusion as a red flag, and caps tracing at one small instance before demanding a closed form, since unbudgeted tracing caused the other four failures."
2,1,28054,148.33,148.45,98f0bbb6f87c7e50634956da8a0905b30a66997aa33a5e4bc67a2609ec487ed8,bb0df50d9f37d4e4da6b89751c01c40bfcea3ba9139ef8bda99f82d0bd5a2f97,98f0bbb6f87c7e50634956da8a0905b30a66997aa33a5e4bc67a2609ec487ed8,0.125,0.25,0.125,0.25,0.125,-0.125,2.625,1.5,-1.125,77,167,discarded,add-budget-and-anti-loop-commit-discipline-to-information-set-elimination,"Fresh rollouts (execution 148.33) scored 0 of 8: four runs burned the entire 16384-token cap re-arguing the same two or three cases verbatim and never emitted a boxed answer, and the four that stopped all declared every branch contradictory yet still committed to one wrong survivor. The incumbent gives the elimination recipe but no budget, no loop-detection, and no rule for what to do when all branches look impossible, so the student spends its context restating settled cases instead of relaxing the extra assumption it imposed. This edit keeps the ordered information-set filtering, adds a legality check on implied values, forbids re-arguing settled cases, tells the student to relax its own added assumption when everything contradicts, and requires one final boxed answer - all failure modes that recur in any multi-round announcement puzzle, so it should transfer."
2,2,30302,148.34,148.46,e926ca1d6f04d597d4b99af9d15b2597417b40fc28c3c0397d67f147cfa99917,65a3143b67c4efefc96c6cb7ecb00f78c29056919869d624e8a4915786db8f07,e926ca1d6f04d597d4b99af9d15b2597417b40fc28c3c0397d67f147cfa99917,1.0,1.0,0.0,0.2,0.2,0.0,3.0,3.0,0.0,81,139,discarded,keep-incumbent-verbatim-append-nonorigin-warning-and-normalize-quadratic-before-completing-square,"Fresh round-2 rollouts (execution_id 148.34) again scored 8/8, so the incumbent's substitution-plus-Mobius-image scaffold is exactly what works and must be preserved; the only leverage left is transfer. Six of eight traces spent effort on the false premise that the image is origin-centered (that |z| is constant), and the 13153-token outlier burned roughly double the median budget discovering and repairing that error mid-solution, while all eight landed on a quadratic whose x^2 and y^2 coefficients were not 1, the precise place a radius gets misread. This revision therefore leaves every word of the incumbent intact and only appends the non-origin warning plus an explicit normalize-then-complete-the-square step and a one-root check, unlike round 1's discarded rewrite which deleted the scaffold in favour of a generalized modulus shortcut and more than halved held-out accuracy."
2,3,8554,148.35,148.47,918623ddf49b0ec8c88e8becd4d23b6c8423864ccda8f888c55e8989ee25135c,01a6e3920855c7b7b53bd6e8e1441abd27cbc980f4388c788c6ef7a9d4af953c,918623ddf49b0ec8c88e8becd4d23b6c8423864ccda8f888c55e8989ee25135c,0.5,0.375,-0.125,0.15,0.1375,-0.012499999999999983,2.0,1.75,-0.25,147,183,discarded,ban-the-tangency-search-name-the-rotation-invariance-and-box-the-first-exact-value,"Fresh round-2 rollouts scored 1/8: 7 of 8 hit the 16384-token cap and 5 of 8 emitted no boxed answer at all, yet 6 of 8 had already computed the exact overlap and correct total within the first 8-17 percent of the trace before abandoning it, so the bottleneck is still termination, not method. The dominant sink is a non-terminating search for a tangency or degenerate placement (20-70 tangency mentions and 28-53 'Alternatively' restarts per rollout); the single success was the one rollout that instead argued rotation cannot reduce the overlap and answered. The incumbent's abstract two-position invariance test was never actually executed (zero shoelace or invariance mentions), so this revision names the specific dead end to refuse, states the rotation-about-the-pinned-point argument that makes the overlap orientation-independent, and replaces 'commit at the end' with boxing the first exact value immediately."
2,4,25003,148.36,148.48,3f7a40ea94795e85eeacaf7eb371e77a133709fb15b5eb9c6c9aea2f3cc76b62,768ae73eec274d285f5cc219e658f36224d2075b963213d15b2a3ebc4fd9def9,3f7a40ea94795e85eeacaf7eb371e77a133709fb15b5eb9c6c9aea2f3cc76b62,0.5,0.5,0.0,0.2125,0.175,-0.037500000000000006,2.625,2.25,-0.375,162,192,discarded,add-block-not-one-term-guard-ban-menu-size-answer-and-stop-rederiving,"Fresh round-2 rollouts (execution 148.36) scored 5/8, up from 0/8 at round 0, confirming the kept round-1 hint eliminated the cross-polynomial differencing dead end. All three remaining failures share one residual error: after correctly deriving the per-polynomial cap of deg P roots, and in one case even writing the menu-size-times-degree product, they collapse to the menu size because they treat each polynomial as supplying a single term rather than a whole block; the two that hit the 16384-token ceiling spent the tail looping over that same already-settled doubt. The revision keeps the working scaffold and adds the block-not-one-term correction, an explicit ban on answering the menu size, and a stop-re-deriving instruction to reclaim the truncated budget."
2,5,30418,148.37,148.49,b807d87e8e00cc91a6166db0fb3921c3d3651d016bdd936e3700d0c9bde5fa81,a3b6361f353d9c8dd3faaacd4881b9116e80c389b939e0bd3b1c1e3dfa48c10a,b807d87e8e00cc91a6166db0fb3921c3d3651d016bdd936e3700d0c9bde5fa81,1.0,0.75,-0.25,0.15,0.1625,0.012500000000000011,2.5,2.375,-0.125,73,166,discarded,literal-constraint-reading-plus-cross-product-area,"All eight rollouts were correct but every one burned thousands of tokens on two avoidable detours: inventing an unstated structural assumption (a named special shape / bisecting diagonals), hitting a contradiction, and then doubting the correct algebra instead of the assumption; and mis-pairing shoelace terms so the sum came out zero before a rescue via the cross product. The edit keeps the incumbent's concrete setup-then-area skeleton but replaces problem-specific machinery with two transferable rules - read only the stated constraint, and get area from a cross product at one vertex - so unseen constrained-points-on-a-curve problems avoid the same two dead ends."
2,6,26989,148.38,148.50,67d122a90af2e0710ab939322c2a6639c7d9434bfc510d8f18475e267a2103c9,ba7bff8965bae28c2a663b88f024c7f1573b40f6e286b803162f69bce9ff8b17,67d122a90af2e0710ab939322c2a6639c7d9434bfc510d8f18475e267a2103c9,0.0,0.125,0.125,0.2125,0.1625,-0.04999999999999999,2.125,1.75,-0.375,185,196,discarded,"reachability-first: free interleaving of pushes/pops, no premature impossible/certain, short-prefix decides bottom","All 8 fresh round-2 rollouts scored 0/8, and the round-1 uniform-permutation error was largely suppressed: only one rollout still used 1/k, while the new dominant failure was a reachability error in the opposite direction, four rollouts asserting the buffer must be fully drained in truck order and so declared the target outcome outright impossible (probability 0) or the reverse order certain (probability 1), and two more looped to the length limit oscillating over the same claim. The revision therefore keeps the stack-shunting word framing and the bottom-equals-arrived-first rule but front-loads the missing fact that pushes and pops interleave freely with several items buffered, forbids declaring an outcome impossible or certain before exhibiting an admissible word, and states that the bottom event is settled by a short prefix so the student stops enumerating whole runs and terminates."
2,7,3836,148.39,148.51,39e2668fb5cca7669288765276aabe0dba01769397daa33b16a9dd7c0174a8f4,e7c324836b08be85943644739effd86f1e05d5ef2b2b0b5e5c1eea42055a7b1a,39e2668fb5cca7669288765276aabe0dba01769397daa33b16a9dd7c0174a8f4,0.0,0.125,0.125,0.125,0.1125,-0.012499999999999997,1.25,1.25,0.0,82,172,discarded,drop-domain-machinery-for-general-setup-check-leverage-verify-commit,"All 8 rollouts scored 0: six ran to the 16k generation cap without producing an answer, several built a wrong model of the setup (treating the unknown weights as polynomial coefficients) and then thrashed after deriving a contradiction or a free parameter, and the two that stopped guessed a value from an unconfirmed small-case pattern. Round 1 showed that adding more domain-specific interpolation machinery lowered held-out accuracy, so this edit removes the narrow vocabulary and instead installs a general procedure -- restate and count constraints, distrust a contradictory setup, hunt for one cancelling substitution rather than brute force, verify against the strongest given condition, and commit to one exact boxed value within budget -- which targets the thrash-and-overrun failure mode that should recur across unseen problems."
2,8,23443,148.40,148.52,b2978873c5591981a1c31bc9bd3f65c56e9dc8e7a037ff47aa156c6b908886d9,502f2cdeb5bc30eb92133a590d1858c6eed05992c152e2df31bf69be768e8526,b2978873c5591981a1c31bc9bd3f65c56e9dc8e7a037ff47aa156c6b908886d9,0.25,1.0,0.75,0.1875,0.1125,-0.075,2.125,2.125,0.0,157,199,discarded,add-subgroup-count-trap-rule-and-largest-admissible-tiebreak,"Fresh round-2 rollouts on the current incumbent scored 4/8, and all four failures shared one mechanism: the rollout read the stated subgroup count as the unknown item count, so it divided the totals by that number instead of by an admissible common divisor; two of them even skipped the gcd step entirely. The successes all did the same two extra things, which the incumbent only implied: they treated the stated subgroup count purely as a multiple-of filter on candidate counts, and when several divisors survived they resolved the ambiguity by taking the largest admissible one rather than guessing. This revision states both rules explicitly as reusable, noun-free checks while keeping the round-1 wins (gcd-of-totals divisibility, percent-base fixing, per-item integer back-check), which is the same generalization direction that raised held-out from 0.1125 to 0.1875."
