round,hint_id,train_qid,sampling_slurm_job_id,proposal_eval_slurm_job_id,incumbent_hash,proposal_hash,final_hash,old_train,new_train,delta_train,old_heldout,new_heldout,delta_heldout,old_J,new_J,delta_J,old_tokens,new_tokens,decision,mutation,subagent_summary
17,1,28054,148.338,148.348,98f0bbb6f87c7e50634956da8a0905b30a66997aa33a5e4bc67a2609ec487ed8,2aa9278aefedda0e7142a8047ff9ea9f5a02992a20a5de22b770989cc8c5c6fe,2aa9278aefedda0e7142a8047ff9ea9f5a02992a20a5de22b770989cc8c5c6fe,0.125,0.125,0.0,0.25,0.25,0.0,2.625,2.625,0.0,77,75,kept,make-passive-closing-sentence-an-executable-report-and-stop-at-two-tokens-shorter,"Fresh rollouts (148.338) scored 0/8: four of eight exhausted the 16384-token cap still weighing the same two readings and never emitted an answer, and the four that did stop only committed after long re-litigation of cases they had already settled. This truncation-without-commitment mode recurs in my history (4,3,2,4,4 capped runs across rounds 13-17). The incumbent's closing sentence is a passive statement of fact that no rollout ever acts on; this edit makes it an executable instruction to report and stop, and pays for it by tightening the original-set clause so the hint is two tokens shorter than the incumbent with all six elimination steps intact."
17,2,30302,148.339,148.349,a2617d5cf40e8a99a8f74a784b3ae2a8d34000cee46fba8c99104d13b42a8740,3b33f12f82aebc1eddbff187b91199e3b1236630704393a9bcb38de2e022112a,a2617d5cf40e8a99a8f74a784b3ae2a8d34000cee46fba8c99104d13b42a8740,1.0,1.0,0.0,0.225,0.1625,-0.0625,3.25,2.625,-0.625,70,70,discarded,replace-inert-geometrically-branch-with-complete-the-square-at-equal-70-tokens,"Fresh rollouts (148.339) scored 8/8, so train is saturated and only transfer matters. Seven of eight traces first computed |z| from the parametrized image, found it varied with the angle, and stalled announcing the locus was not a circle of fixed radius; every trace that recovered did so by reducing to an x,y equation and completing the square, and no trace ever used the 'geometrically' branch as anything but a vague detour label. This edit spends those inert tokens on the one step all eight rollouts actually executed, naming completing the square as the terminal move so the student stops probing |z| and goes straight to center-and-radius. Held at exactly the incumbent's 70 tokens, so nothing is paid in length."
17,3,8554,148.340,148.350,7b7b4483667ba6211d89e8b29e80c7dfcb9f10060d9ffc62b3bffc74e364b566,4da4fc53185944b6dc25d029559083ac27b5073031ae19edd2c25612b6e37e98,7b7b4483667ba6211d89e8b29e80c7dfcb9f10060d9ffc62b3bffc74e364b566,0.625,0.625,0.0,0.225,0.075,-0.15000000000000002,2.875,1.375,-1.5,169,162,discarded,replace-inert-symmetry-clause-with-alternatively-wait-branch-budget-rule,"Rollouts scored 8/8, so method is not the problem: every trace still burned 12.0k-16.3k tokens (one within 42 tokens of the cap) with 25-51 'Alternatively' and 39-70 'Wait' restarts and 14-41 tangency detours, even though all eight held the correct exact value by roughly 10 percent of the trace. The incumbent's symmetry clause is inert here (0-1 mentions of any symmetry/invariance word in eight traces, 'extent' zero), while coordinates were used constantly, so I replaced only that clause with a branch-budget rule keyed to the literal words the student actually emits dozens of times: compute the case exactly or abandon it in one line. That converts the book's repeated non-closing failure mode into one executable move, keeps every clause the successes rely on, and is shorter than the incumbent."
17,4,25003,148.341,148.351,e0ca78c56f30a95ccffa6bbca03e866e7e92dfbb723570c1181e9524f64d335b,8b7a9b45ebc743c76a107088f5674b1053bb2c2a188fad094ab2e385d616f72f,e0ca78c56f30a95ccffa6bbca03e866e7e92dfbb723570c1181e9524f64d335b,0.875,0.75,-0.125,0.225,0.175,-0.05000000000000002,3.125,2.5,-0.625,146,138,discarded,delete-inert-one-more-forcing-P=L-identically-edge-case-clause-138-vs-146-tokens,"Fresh rollouts (148.341) scored 3/8. Grepping all eight, the incumbent's trailing 'one more forcing P=L identically' clause is used by NO correct rollout (own-use counts 1,0,0 outside quoting the hint) but drives the two worst failures: after correctly getting the deg P cap they push the edge case, conclude the polynomial would have to be identically linear, declare a contradiction, and report the degree factor alone; one burnt ~15k tokens looping on exactly that. So the clause is inert where the hint works and a cul-de-sac where it fails. This edit deletes only that clause; every step the correct rollouts lean on (shared affine target, solution count of P(x)=A+Bx, sum across the menu, per-polynomial block) is kept byte-identical. Never tested before: rounds 5, 13 and 15 all retained it. 138 vs 146 tokens."
17,5,30418,148.342,148.352,1eb4e3cdd613a791abc5a6eca1cdc1c28a39f7f417b75d407c5cfcb7ed4ed992,f0951c575622a8ca8c401ef9db9722bd7e0178db4ab049dcf790f187ece7cfa5,1eb4e3cdd613a791abc5a6eca1cdc1c28a39f7f417b75d407c5cfcb7ed4ed992,0.75,0.75,0.0,0.25,0.1875,-0.0625,3.25,2.625,-0.625,70,70,discarded,replace-inert-relabel-clause-with-numericize-unknowns-before-computing-target,"Five of eight rollouts were correct; all three failures shared one mode: they reached the unknown point but left its coordinate as an unevaluated logarithm or surd, then tried to compute the requested quantity symbolically in that leftover symbol, thrashed on radicals and decimal guesses, and hit the 16384-token cap with no boxed answer. The incumbent's 'a zero or impossible intermediate means relabel, not restart' clause is inert - the word relabel and that behaviour appear in none of the eight rollouts, in this round or the last. Swapping it for a positive, executable instruction to numericize every unknown before computing the target costs no extra tokens (70 either way) and should transfer: any find-the-quantity problem is helped by resolving unknowns to explicit values first rather than propagating symbols."
17,6,26989,148.343,148.353,e64f97e23626cd3b726aa52d8740f627fe7f8a230645491fa857bd91465c19e1,754c6b060a5cb6845de0a51bec58b9553d03e32f0c4169e01455f756768741f2,e64f97e23626cd3b726aa52d8740f627fe7f8a230645491fa857bd91465c19e1,0.125,0.0,-0.125,0.2625,0.15,-0.11250000000000002,2.75,1.5,-1.25,176,176,discarded,move-anti-uniform-warning-to-final-position-adjacent-to-problem-no-clause-changed,"Fresh rollouts scored 1/8. The single error in all eight is the uniform shortcut: every rollout asserted each bag is equally likely to be the first (or last) one delivered and priced that, giving 1/4 five times plus 1/24, 1/16 and 1/2. The incumbent already forbids this, yet clause grep shows its warning is never used (red-flag 0/8, unreachable 0/8) while the setup, forced-move and one-half clauses are (8/8, 7/8, 8/8). Since the cheatsheet sits before the problem, the hint's last sentence is the one nearest the question, and round 14 won here purely by moving a clause next to what it governs. So this edit only moves the anti-uniform sentence to the end, so it is the last thing read before the problem, and leaves the pricing directive right after the event restatement it feeds. No clause is added, dropped or reworded; token count is 176, equal to the incumbent."
17,7,3836,148.344,148.354,ab86313389de277c671789977242ca71390d684323c6bdbaf69bed67b8fdd067,f77e3fefd305b9fb2741483d73f2196d4c4f6e231616b54b7ec1b2b7c5533481,ab86313389de277c671789977242ca71390d684323c6bdbaf69bed67b8fdd067,0.25,0.0,-0.25,0.175,0.125,-0.04999999999999999,2.0,1.25,-0.75,70,70,discarded,replace-inert-leave-the-table-ban-with-formula-must-reproduce-every-entry,"All 8 rollouts scored 0 and none stayed in the table: every one jumped to a symbolic construction, and the two that terminated added a false side condition (forcing a constant term to vanish), then boxed a wrong closed form without ever checking it against the small sizes they had already solved correctly by hand. The blanket 'never leave the table for theory' clause is inert -- no rollout obeys it -- so it is pure transfer tax. Replacing it with a positive back-check (whatever formula you write must reproduce every entry you recorded) keeps the table useful at the moment the student actually abandons it, catches exactly the unjustified-assumption failure, and costs the same 70 tokens as the incumbent."
17,8,23443,148.345,148.355,0250077d8944cf1436c3e3ecd3d488e1d97a5eb76f0be7756ba8677ce1f1d77e,d99ec6b8b05e2cc64419bf4ae4d72be8a43cb6987166438c254697e0132a5eaf,0250077d8944cf1436c3e3ecd3d488e1d97a5eb76f0be7756ba8677ce1f1d77e,0.75,0.5,-0.25,0.1625,0.125,-0.037500000000000006,2.375,1.75,-0.625,123,120,discarded,add-largest-admissible-gcd-selection-rule-funded-by-compression-keeping-grouping-clause,"Fresh rollouts scored 6/8. Every rollout, correct or not, built the divisor list correctly; both failures broke at the selection step, one forcing a bogus extra equation to pin the count at 1 and one picking the stated grouping number because it 'looked reasonable'. All six successes instead took the largest admissible count. The incumbent's closing clause only says to check the result against stated conditions, which is inert here because several candidates pass, so the student is left guessing. This edit tells it up front that multiple survivors are normal and names the concrete choice (the largest, i.e. the gcd), a positive rule rather than a prohibition. It is funded by compressing the tagging and grouping sentences, so the hint is 120 tokens versus the incumbent's 123."
17,9,3980,148.346,148.356,391f18d0a38c1a07058f9782b12c580bfb7fb5aae04b069b173f7d17d3e75563,8d573a01e8dd8cdbf6fde199bcbfe58fbdf001268ee5af64c810b216a6f41526,8d573a01e8dd8cdbf6fde199bcbfe58fbdf001268ee5af64c810b216a6f41526,0.375,0.25,-0.125,0.2625,0.2875,0.024999999999999967,3.0,3.125,0.125,147,146,kept,drop-inert-leading-term-clause-and-make-evaluation-concrete-pair-arguments-summing-to-s,"Fresh run: 4/8 correct. All four failures hit the 16384-token cap; three of them burned thousands of tokens on the hint's 'match leading terms' step, deriving e = +/- a and case-splitting on it, which never contributes anything once the sum-to-s ansatz is used, and the winners barely touch it. The failures also had the reflection relation in hand but never used it to evaluate, whereas every winner paired an argument with its reflection or evaluated the fixed centre. So I removed the inert leading-term clause and replaced the vague 'rather than solving for every coefficient' with the concrete move that actually produced the wins: pair arguments that sum to s. Same length, less wasted setup, more executable finish."
17,10,3843,148.347,148.357,f35723e4dc2afe2c9e6b06cc17fbe624bd14c7dc195ef432ec15398d3a5af454,9bac2374283cf1f22a1a2fa42304d6735fea31b9eba8a72b048a5a136c03b4f4,f35723e4dc2afe2c9e6b06cc17fbe624bd14c7dc195ef432ec15398d3a5af454,0.25,0.5,0.25,0.225,0.1875,-0.037500000000000006,2.5,2.375,-0.125,100,99,discarded,guess-formula-after-two-rows-then-test-a-third-instead-of-fitting-after-three,"Fresh rollouts scored 3/8; all five failures spent the whole 16384-token budget re-deriving the composite's structure symbolically and oscillating between rival closed forms, several re-checking sizes they had already worked out, and never reached the incumbent's fit step. The one short success instead worked two sizes, immediately guessed the simplest pattern, and used a third size only as a check. This edit moves the commitment point earlier: guess the formula after two measured rows and let the third size test the prediction rather than be a third full derivation, which should transfer to any parameterized process question where budget, not insight, is the binding constraint. It is also one token shorter than the incumbent."
18,1,28054,148.358,148.368,2aa9278aefedda0e7142a8047ff9ea9f5a02992a20a5de22b770989cc8c5c6fe,39d9407aed20458bff9c93375d22822dc9bc34d88a7052061d58195656eeafc2,2aa9278aefedda0e7142a8047ff9ea9f5a02992a20a5de22b770989cc8c5c6fe,0.125,0.25,0.125,0.25,0.1875,-0.0625,2.625,2.125,-0.5,75,72,discarded,replace-abstract-group-by-private-value-with-executable-per-own-value-partner-count,"All eight rollouts (execution 148.358, 1/8 correct) hit the same wall: they enumerate factor pairs, then globally decide the shown number is the product, which lets each speaker divide and know the partner at once, so both branches 'contradict' and the run hand-waves to a guess; two also burned the token cap looping. None ever tabulates, for one speaker, the several partner values that speaker's own view still permits, which is what the incumbent's abstract 'group candidates by the value that speaker privately knows' and 'groups whose relevant coordinate is already unique' ask for but no rollout executes. This edit swaps that jargon for the concrete count they already half-perform, at the same length and with the same ordered-elimination skeleton, so it should transfer to any announcement puzzle."
18,2,30302,148.359,148.369,a2617d5cf40e8a99a8f74a784b3ae2a8d34000cee46fba8c99104d13b42a8740,01068a402831b092ac9c9034d5f709ca6ec284f7a0304ad92df957445051403a,a2617d5cf40e8a99a8f74a784b3ae2a8d34000cee46fba8c99104d13b42a8740,1.0,1.0,0.0,0.225,0.1375,-0.0875,3.25,2.375,-0.875,70,69,discarded,orthography-only-lossless-compression-ascii-Mobius-69-vs-70-tokens-every-content-word-byte-identical,"Fresh rollouts (148.359) scored 7/8; the single miss was not a strategy failure but a length overrun: that trace reached the correct x,y quadratic and then spent thousands of tokens looping on whether unequal-looking x^2/y^2 coefficients meant ellipse or circle, and never emitted a boxed answer. Rounds 4, 15 and 17 already tried adding a normalize/certify-the-circle clause to fix exactly that loop and all three lost held-out badly, so I am not re-testing that idea. Instead this is a strictly orthographic compression: the only byte changed is the diaeresis in Moebius, which costs 4 Qwen tokens as 'Mobius' costs 2. Every content word, step and ordering is byte-identical, so held-out should tie and win the shorter-hint tiebreak at 69 vs 70 tokens. No rollout ever reproduced the diacritic itself."
18,3,8554,148.360,148.370,7b7b4483667ba6211d89e8b29e80c7dfcb9f10060d9ffc62b3bffc74e364b566,07c5863456956ea66321795478d8e17eb3e5b419aecd6f0debe0fe63c11f72fd,7b7b4483667ba6211d89e8b29e80c7dfcb9f10060d9ffc62b3bffc74e364b566,0.625,0.5,-0.125,0.225,0.1375,-0.0875,2.875,1.875,-1.0,169,160,discarded,replace-inert-symmetry-clause-with-construction-plus-one-line-bound-stop-condition-and-drop-inert-extent-phrase,"Rollouts scored 4/8: three failures burned the entire 16384-token budget and never closed the reasoning block (20-43 'Alternatively', 47-82 'Wait' each) even though one of them had already stated the correct exact value and then kept searching; the fourth closed but boxed a total from an overlap it asserted in prose rather than computed. Across all eight traces the incumbent's free-rotation/symmetry clause drew 0-2 symmetry or invariance words and 'extent' zero, so both are inert transfer tax, while coordinates and the sum-minus-overlap formula were used constantly and are left byte-identical. I replaced only the inert symmetry clause with the construction-plus-one-line-bound stop condition (the wording that produced this hint's second-best held-out) and deleted the inert 'extent' phrase, giving an observable reason to stop searching on any extremum problem at 160 tokens versus the incumbent's 169."
18,4,25003,148.361,148.371,e0ca78c56f30a95ccffa6bbca03e866e7e92dfbb723570c1181e9524f64d335b,c1fc4633c5c4c4a9da98c0851ea6bbf8951083daa9de4ad8a9bfe3c4ba2c7490,e0ca78c56f30a95ccffa6bbca03e866e7e92dfbb723570c1181e9524f64d335b,0.875,0.125,-0.75,0.225,0.1875,-0.037500000000000006,3.125,2.0,-1.125,146,141,discarded,license-one-polynomial-to-serve-many-inputs-before-the-degree-count,"Fresh rollouts (148.361) scored 6/8. Both failures silently assume each polynomial handles exactly ONE input: one then treats the whole stretch as roots of a single difference and reports the degree alone, the other assigns one term per polynomial and reports the menu size alone. Every correct rollout instead reasons about a polynomial covering a stretch of inputs. The incumbent's counting step asks how many inputs satisfy P(x)=A+Bx but never says a polynomial may be reused for several, so the one-input reading survives and the 'never one factor alone' reminder gets quoted without effect. This edit adds that one positive licensing clause where it is needed, keeps every step the correct rollouts lean on byte-identical, and is shorter than the incumbent (668 vs 697 characters)."
18,5,30418,148.362,148.372,1eb4e3cdd613a791abc5a6eca1cdc1c28a39f7f417b75d407c5cfcb7ed4ed992,fcf2006bcdf9b5c6952ef9dfb52a88362575c361395723ebb22425486a8c9827,1eb4e3cdd613a791abc5a6eca1cdc1c28a39f7f417b75d407c5cfcb7ed4ed992,0.75,0.625,-0.125,0.25,0.1625,-0.0875,3.25,2.25,-1.0,70,70,discarded,sharpen-defining-equation-into-evaluate-at-the-solved-value,"Six of eight rollouts were correct. Both failures solved for the unknown input value correctly, then filled in the matching output by copying/mirroring a given point's value instead of evaluating the defining relation at that input; the resulting figure was degenerate, and one rollout then spent its whole token budget doubting the setup without ever committing. This edit sharpens the incumbent's existing clause in place so the defining equation is named as the thing to evaluate at the solved value, not merely a condition to satisfy. It is one positive instruction, adds no prohibition or checklist, costs zero extra tokens (70, same as the incumbent), and leaves every clause the six successful rollouts rely on untouched, so it should transfer to any problem recovering unknown points from a curve or rule."
18,6,26989,148.363,148.373,e64f97e23626cd3b726aa52d8740f627fe7f8a230645491fa857bd91465c19e1,45e5abceb25df724b78ac56151f55739f8b5fefcc57063576a849b5803e1d906,e64f97e23626cd3b726aa52d8740f627fe7f8a230645491fa857bd91465c19e1,0.125,0.0,-0.125,0.2625,0.125,-0.1375,2.75,1.25,-1.5,176,167,discarded,replace-passive-bottom-fact-with-rewrite-destination-stack-after-each-landing-and-drop-inert-sum-to-one-check-167-vs-176-tokens,"All 8 rollouts failed (0/8) and 6 of them explicitly asserted that a destination stack's bottom is the LAST item placed there, then priced that inverted event; the incumbent already states the correct fact abstractly but the student never applies it, so it reads the sentence and still flips the direction. The edit replaces the passive restatement with one executable action - rewrite the destination stack after every landing and see the new item sit on top - which makes arrived-first-is-bottom something the student derives rather than recalls, and drops the sum-to-one branch check that zero of 32 rollouts across four rounds ever performed, leaving the hint shorter than the incumbent."
18,7,3836,148.364,148.374,ab86313389de277c671789977242ca71390d684323c6bdbaf69bed67b8fdd067,cdc5c396d5ccbfe2991db243e02690a259f02728d353a1c46a06e9dd22ee4d9e,ab86313389de277c671789977242ca71390d684323c6bdbaf69bed67b8fdd067,0.25,0.25,0.0,0.175,0.1375,-0.03749999999999998,2.0,1.625,-0.375,70,66,discarded,replace-never-executed-ratio-clause-with-write-the-shrunken-instance-as-numbered-equations,"All 8 rollouts ran to the 16k cap with no boxed answer. Six did try the shrink, but never wrote the reduced instance down: they spent most of the budget in prose re-questioning how the small case should be indexed, and three drifted into an abstract closed-form guess and then argued with themselves about it. Meanwhile the incumbent's ratio-of-consecutive-entries clause needs three solved sizes and no rollout reached even two, so it never fired. This edit spends those tokens instead on the concrete first move the rollouts lack: write the shrunken instance out as numbered equations, then solve it. Committing the small system to paper is what stops the re-derivation loop, and it transfers to any problem with an oversized parameter."
18,8,23443,148.365,148.375,0250077d8944cf1436c3e3ecd3d488e1d97a5eb76f0be7756ba8677ce1f1d77e,0910c285e17e9e22ed4ffe04e21405a6752e193b1a3bc3675da11233e7e83111,0250077d8944cf1436c3e3ecd3d488e1d97a5eb76f0be7756ba8677ce1f1d77e,0.75,0.75,0.0,0.1625,0.1375,-0.024999999999999994,2.375,2.125,-0.25,123,121,discarded,replace-divisor-candidate-list-with-deterministic-divide-by-gcd,"Seven of eight rollouts were correct; the loss, and both round-17 losses, failed the same way: the student correctly reduced whole-per-item to divisibility and got the gcd, then the incumbent's candidate-list framing ('the candidates are the divisors of their gcd') manufactured several options with no way to resolve them, and it spiralled and picked one arbitrarily. This replaces that enumerate-then-guess framing with a single deterministic computation - divide each total by the gcd to read off the per-item amounts - so the integrality step terminates in one value instead of a menu. Unlike rounds 2, 6 and 17 this adds no selection or tiebreak rule on top of a candidate list; it removes the list, and is two tokens shorter than the incumbent."
