round,hint_id,train_qid,sampling_slurm_job_id,proposal_eval_slurm_job_id,incumbent_hash,proposal_hash,final_hash,old_train,new_train,delta_train,old_heldout,new_heldout,delta_heldout,old_J,new_J,delta_J,old_tokens,new_tokens,decision,mutation,subagent_summary
6,5,30418,148.119,148.129,b807d87e8e00cc91a6166db0fb3921c3d3651d016bdd936e3700d0c9bde5fa81,1eb4e3cdd613a791abc5a6eca1cdc1c28a39f7f417b75d407c5cfcb7ed4ed992,1eb4e3cdd613a791abc5a6eca1cdc1c28a39f7f417b75d407c5cfcb7ed4ed992,1.0,0.75,-0.25,0.15,0.25,0.1,2.5,3.25,0.75,73,70,kept,drop-problem-specific-machinery-for-shorter-generic-procedure,"Five of eight rollouts scored; all three failures ended in finish_reason=length with no boxed answer. Each one first invented an unstated property (a named special shape, bisecting diagonals), derived a degenerate or contradictory intermediate from it, and then doubted its own correct algebra instead of the invented assumption; one even computed the right value from a relabelled ordering and kept searching past it. The incumbent spends most of its tokens naming this problem's specific machinery (logarithm elimination, determinant area, correct branches), which cannot transfer. This replacement is 70 tokens versus the incumbent's 73 and keeps only class-level moves the successes actually used: pin and verify constants, assume nothing unstated, reduce to one variable on the curve, filter by domain and non-degeneracy, treat a zero or impossible intermediate as a labelling slip, and commit early."
6,6,26989,148.120,148.130,67d122a90af2e0710ab939322c2a6639c7d9434bfc510d8f18475e267a2103c9,7a9a1f4d67974dba17ab594038cdf89ff10bf6c7763e4c7ba3216f96ee5c7094,67d122a90af2e0710ab939322c2a6639c7d9434bfc510d8f18475e267a2103c9,0.0,0.125,0.125,0.2125,0.1125,-0.09999999999999999,2.125,1.25,-0.875,185,173,discarded,"lossless-compression-185-to-173-tokens: keep stack setup, arrived-first-is-bottom, uncovering, forced-vs-free pricing; cut n!/red-flag verbiage and the sum-to-one check no rollout ever ran","All 8 fresh rollouts scored 0. Part (a) was sometimes right but part (b) failed in every run: three priced 'this item reaches the destination first' as one or two isolated coin flips (1/4), one used bare symmetry 1/n, one said 1/2, and three asserted the source must be drained in order and returned certain/impossible (1 and 0); two of those looped to the 16k token limit re-arguing that claim. Rounds 2-5 all proposed LONGER hints and all four lost heldout, so this round instead compresses: every clause the rollouts actually acted on is preserved (three ordered stacks, top-only moves, bottom = arrived first, clear what covers a buried item, weight 1 at forced steps and 1/2 only at free ones, no equally-likely shortcut, no impossible/certain without a legal run) while the unused n!/red-flag and sum-to-one text is dropped, and a stop-and-box instruction is added to curb the runaway loops."
6,7,3836,148.121,148.131,ab86313389de277c671789977242ca71390d684323c6bdbaf69bed67b8fdd067,f332340234baba8c8f46ef03df0743ffb1602c58c49e94eb1682a4eb1e562962,ab86313389de277c671789977242ca71390d684323c6bdbaf69bed67b8fdd067,0.25,0.0,-0.25,0.175,0.1125,-0.062499999999999986,2.0,1.125,-0.875,70,68,discarded,shrink-before-any-restatement-and-explicit-stop-and-box,"Fresh round-6 rollouts under the incumbent scored 0/8, and the mechanism is uniform: every rollout spent its first 10k-32k characters restating the setup and grinding polynomial-in-x, Vandermonde and Lagrange theory before it ever shrank the parameter, so seven of eight hit the 16384-token generation cap and only one ever emitted a boxed value at all. The incumbent's shrink order and its ban on theory both arrive too late to beat that opening. This edit moves the shrink ahead of any restatement, makes the three small cases the literal first writing, and replaces the vague 'commit' with an explicit stop-and-box instruction, which targets the budget-overrun and no-final-answer failure that recurs across unseen problems. 68 tokens versus the incumbent's 70."
6,8,23443,148.122,148.132,0250077d8944cf1436c3e3ecd3d488e1d97a5eb76f0be7756ba8677ce1f1d77e,6de3a7fa3ec883b0054c58255eea7352572b4f22aba2638d5072b2ecd0d45403,0250077d8944cf1436c3e3ecd3d488e1d97a5eb76f0be7756ba8677ce1f1d77e,0.75,0.75,0.0,0.1625,0.15,-0.012500000000000011,2.375,2.25,-0.125,123,119,discarded,swap-inert-grouping-clause-for-largest-admissible-gcd-tiebreak,"Fresh round-6 rollouts scored 6/8 and both failures were pure selection failures: each computed the gcd of the totals and listed its divisors as candidate counts, then chose wrong - one adopted the stated grouping count as a reasonable assumption, the other reversed itself into the degenerate count. All six successes took the largest admissible candidate, the gcd itself. So the incumbent's grouping-count sentence is inert bookkeeping that demonstrably fails to stop the trap it names, while the positive tiebreak every winner used is missing. This revision swaps that clause for the largest-admissible/gcd rule with the anti-plausibility guard folded into the same sentence, and drops 'substitute numbers only at the end', which no rollout obeyed. 119 tokens versus 123, no sentence added."
6,9,3980,148.123,148.133,3177fd8ccc06120f7993d61571961edc2bb39f823ba9696ca131a1da2bfbe076,283e2f1ee456a0bd5f4e45ed52104a714bc577162afc24cb08b70bd754343c92,3177fd8ccc06120f7993d61571961edc2bb39f823ba9696ca131a1da2bfbe076,0.375,0.0,-0.375,0.2375,0.1625,-0.07499999999999998,2.75,1.625,-1.125,152,149,discarded,state-ansatz-as-sum-to-constant-instead-of-indirect-involution-wording-and-shorten,"4/8 correct; all four failures ran to the 16384-token cap with no committed answer. Every winner used the same move: assume the two maps sum to a constant, reduce to the one-variable symmetry condition, expand it once, and let the leftover free coefficient cancel. The failures instead misread the incumbent's indirect 'f = L(g), g(s - x) = s - g(x)' phrasing - one spent most of its budget testing symmetry of a single map and derived a bogus degenerate-leading-coefficient contradiction, two guessed the constant numerically (including averaging the two inputs they were asked to evaluate), one reverted to full coefficient matching. The edit therefore states the ansatz directly as g = s - f, names the derived condition it implies, and says where the constant comes from, while dropping two clauses no rollout acted on so the hint is shorter than the incumbent."
6,10,3843,148.124,148.134,f772ab29bcbea76311626f4c1f77eaac463c18fdba2a1be7222f1d266cb3e565,c114dde1b09adf25ca78c933cba74a999d4e75ce2bcfbaaecc757f2887473b0c,c114dde1b09adf25ca78c933cba74a999d4e75ce2bcfbaaecc757f2887473b0c,0.5,0.375,-0.125,0.125,0.15,0.024999999999999994,1.75,1.875,0.125,108,106,kept,define-one-application-up-front-self-consistency-check-and-commit-to-one-formula,"Fresh round-6 rollouts under the incumbent scored 5/8; all three failures were cap exhaustion with the same shape. Each conflated one application with one sub-step, so its own passes at the same small size produced contradicting counts; instead of settling that once it drifted into transposition talk, then spent thousands of tokens enumerating and rejecting rival formulas and never boxed anything. Successes counted whole-operation applications until return at two sizes and committed. So I replace the incumbent's literal-versus-single-map cross-check (which invites the symbolic detour) with an up-front definition of one application plus a self-consistency check across your own passes, and add an explicit commit-to-one-formula-not-rivals close. Phrased operation-agnostically and 2 tokens shorter than the incumbent, since every longer proposal I made lost held-out."
7,1,28054,148.135,148.146,98f0bbb6f87c7e50634956da8a0905b30a66997aa33a5e4bc67a2609ec487ed8,acfc7e4f9f2e5cd5a761ca5ee0568cb0472c14f079e168cd9f60e7d47b1f0a35,98f0bbb6f87c7e50634956da8a0905b30a66997aa33a5e4bc67a2609ec487ed8,0.125,0.125,0.0,0.25,0.175,-0.07500000000000001,2.625,1.875,-0.75,77,75,discarded,finish-one-interpretation-before-another-and-keep-the-one-leaving-a-survivor,"Execution 148.135 scored 1 of 8. Five rollouts hit the 16384-token cap with no boxed answer, oscillating between the two readings of the public value instead of carrying either to a conclusion; the two terminating failures picked the reading they had just argued was impossible and boxed a value from it. The one success carried a single reading through to the end. The incumbent says to enumerate interpretations but never says to finish one before opening another, nor which one to keep, so the student thrashes. This adds those two moves in place of the 'do not reason from the original set' clause only 2 of 8 rollouts echoed, and comes in shorter than the incumbent (75 vs 77 tokens). Branch discipline and a survivor-based test for choosing among readings help any multi-case problem."
7,2,30302,148.136,148.147,a2617d5cf40e8a99a8f74a784b3ae2a8d34000cee46fba8c99104d13b42a8740,0581251ae20a9b95c29850d8c26d413e0a6208e514e755b2ba2efbf5f03fadb5,a2617d5cf40e8a99a8f74a784b3ae2a8d34000cee46fba8c99104d13b42a8740,1.0,0.875,-0.125,0.225,0.15,-0.07500000000000001,3.25,2.375,-0.875,70,69,discarded,replace-vague-geometrically-branch-with-eliminate-the-angle-then-normalize-and-complete-the-square,"Fresh rollouts (execution_id 148.136) scored 7/8. The one miss never formed a locus equation at all: it substituted individual roots, compared their moduli one at a time, found them unequal, declared the locus an ellipse 28 times over 13948 tokens, and boxed a guess. All seven passing traces instead did the same concrete thing the incumbent only gestures at with 'characterize the locus geometrically': parametrize, eliminate the angle to one x,y quadratic, divide by the common x^2,y^2 coefficient, complete the square. That vague branch is the clause the failing trace could not execute, so this edit names the executable route instead, at 69 tokens versus the incumbent's 70. Rounds 2 and 4 showed appending guards for this stall loses, and round 6 showed removing the concrete w=(z-1)/z anchor loses, so both are preserved."
7,3,8554,148.137,148.148,7b7b4483667ba6211d89e8b29e80c7dfcb9f10060d9ffc62b3bffc74e364b566,f3118e89b75a2d71c17650d4998bc51d97566711c2b42f6bbc4a134b39457a67,7b7b4483667ba6211d89e8b29e80c7dfcb9f10060d9ffc62b3bffc74e364b566,0.625,0.5,-0.125,0.225,0.1875,-0.037500000000000006,2.875,2.375,-0.5,169,169,discarded,replace-vague-containment-warning-with-corner-inequality-containment-test,"Fresh rollouts scored 4/8. One never closed its reasoning block; two closed at 96-98 percent of budget and were truncated part-way through a long multi-section write-up before reaching any box; one failed on method, asserting the small figure lay wholly inside the large one by comparing center-to-side distances (32 such mentions) and boxing the containment value. The incumbent's setup clause is the weak link: 'extent' appeared 0-3 times per trace and its bare prohibition 'do not assume one figure sits inside another' did not stop that containment error. This edit replaces that vague gesture with one executable test - list the corners, decide containment by plugging corners into inequalities rather than comparing sizes - which is checkable on any placement/overlap problem. Round 6 showed rewording the output protocol costs held-out, so the protocol text is left untouched and the tail is trimmed to hold total length at the incumbent's 169 tokens."
7,4,25003,148.138,148.149,c3cbe0705047c147d73e4cc6abba5206011053ba9a5bfc3d932d36a3d2abb469,34e73890280115dc122f5de6ef326fd0076bd3af160b41f071c42e56023e6505,c3cbe0705047c147d73e4cc6abba5206011053ba9a5bfc3d932d36a3d2abb469,0.875,0.5,-0.375,0.225,0.15,-0.07500000000000001,3.125,2.0,-1.125,153,152,discarded,replace-vague-match-L-on-its-own-block-with-explicit-witness-formula,"Fresh round-7 rollouts (execution 148.138) scored 5/8. All three failures collapse to one factor because they believe a high-degree polynomial cannot agree with the affine target on several inputs without being linear: one caps a block at a single input and reports the menu size, one shrinks the cap by one, and one abandons the affine target entirely for finite differences of consecutive terms. The incumbent's closing clause only vaguely says to make each polynomial 'match L on its own block', giving no way to see that is possible. The edit spends those words on the explicit witness P=L+c(x-x_1)...(x-x_k), which visibly keeps degree deg P while equalling L on the whole block, and is one token shorter than the incumbent (152 vs 153)."
7,5,30418,148.139,148.150,1eb4e3cdd613a791abc5a6eca1cdc1c28a39f7f417b75d407c5cfcb7ed4ed992,198b1e1ac4da9bd8ace1359f186888d61981b1d577f0756a2eb8ff3fe5a6d422,1eb4e3cdd613a791abc5a6eca1cdc1c28a39f7f417b75d407c5cfcb7ed4ed992,0.75,0.5,-0.25,0.25,0.1375,-0.11249999999999999,3.25,1.875,-1.375,70,70,discarded,replace-inert-relabel-clause-with-re-expand-suspect-line-and-verify-survivors,"Three of eight rollouts scored; four of the five failures ended in finish_reason=length. Each failure pinned the constants and set up the right single-unknown equation, then dropped a sign while expanding the cross-multiplied product, got no real roots, and spent the rest of the budget re-litigating the setup and the problem's validity instead of re-expanding that one algebraic line. The one correct rollout that hit the same dead end simply re-expanded the line, found the sign error and finished; another stopped early with a coordinate it never rechecked on the curve. The incumbent's 'relabel, not restart' clause is inert - no rollout ever relabels - so it is replaced by the concrete recovery move (re-expand the suspect line, then verify each surviving value) at identical length."
7,6,26989,148.140,148.151,67d122a90af2e0710ab939322c2a6639c7d9434bfc510d8f18475e267a2103c9,1966d88916fa96a04ce34322f6e0546d068f743f255d9e9684624ac5528c90f6,67d122a90af2e0710ab939322c2a6639c7d9434bfc510d8f18475e267a2103c9,0.0,0.0,0.0,0.2125,0.1625,-0.04999999999999999,2.125,1.625,-0.5,185,184,discarded,swap-inert-sum-to-one-check-for-concrete-opening-construction,"Fresh rollouts scored 2/8, the best in this hint's history, and the surviving failure is uniform: part (b) is priced without ever building the opening moves. Four rollouts answered a bare 1/n or 1/4 from an equally-likely-permutation claim, and two declared the placement impossible; several also read 'bottom' as arrived last rather than arrived first. No rollout in this or the prior round ever ran the incumbent's sum-to-one branch check, so that clause is inert transfer tax. This edit spends those tokens instead on the concrete first move the student lacks (push until the wanted item tops the buffer, then pop it, event settled) and capitalises FIRST, not last, to block the direction error. Net result is shorter than the incumbent, 184 vs 185 tokens, with no clause the successful rollouts relied on removed."
7,7,3836,148.141,148.152,ab86313389de277c671789977242ca71390d684323c6bdbaf69bed67b8fdd067,652dc396336d33140d54f904f48ffc6c20deb38ea90a2edeac78fc4d38a66576,ab86313389de277c671789977242ca71390d684323c6bdbaf69bed67b8fdd067,0.25,0.125,-0.125,0.175,0.1125,-0.062499999999999986,2.0,1.25,-0.75,70,69,discarded,name-what-to-shrink-and-replace-ignored-ratio-clause-with-formula-in-n,"Fresh round-7 rollouts under the incumbent scored 0/8: six hit the 16384-token generation cap with no boxed value, and every rollout built the polynomial-in-x / Vandermonde model first, only mentioning a smaller case 8k-40k characters in. Two diagnostics: the phrase 'set the huge parameter to 2' is systematically misread (one trace read it as setting the coefficients to 2,3,4) because the hint never says WHICH quantity shrinks, and the divide-consecutive-entries/ratio clause is inert - 'ratio' appears exactly once (the quotation itself) in six traces and zero times in another. This edit names the shrink target concretely (number of unknowns) and swaps the ignored ratio clause for a single executable extraction step (one formula in n fitting every entry, signs included) plus an explicit box, at 69 tokens versus the incumbent's 70."
7,8,23443,148.142,148.153,0250077d8944cf1436c3e3ecd3d488e1d97a5eb76f0be7756ba8677ce1f1d77e,1a3bcdc05dd14c1ee22f40153a3f4af79b176f2205d9a9a4957d21f3b7de3513,0250077d8944cf1436c3e3ecd3d488e1d97a5eb76f0be7756ba8677ce1f1d77e,0.75,0.625,-0.125,0.1625,0.15,-0.012500000000000011,2.375,2.125,-0.25,123,123,discarded,make-grouping-clause-executable-as-multiple-of-filter,"Fresh round-7 rollouts scored 5/8. Every one of the eight derived the gcd of the stage totals and listed its divisors as candidate counts, so that machinery works; all three failures then substituted the stated grouping count itself as the item count, calling it a reasonable assumption. The incumbent's clause 'it constrains the unknown count without being it' is an abstract negative that no rollout ever acted on, while the single rollout that applied the grouping count as a divisibility filter on the candidate list answered correctly. This edit replaces that inert clause with the same idea stated as one executable operation on a list the student has already written down, adding no tiebreak rule and no prohibition (both of which cost held-out in rounds 2, 4 and 6) and holding length at the incumbent's 123 tokens."
7,9,3980,148.143,148.154,3177fd8ccc06120f7993d61571961edc2bb39f823ba9696ca131a1da2bfbe076,722569ddcaf97de07c48e1fda9d6864d795da3bb386d99d4017b4fd0664da179,3177fd8ccc06120f7993d61571961edc2bb39f823ba9696ca131a1da2bfbe076,0.375,0.75,0.375,0.2375,0.1875,-0.04999999999999999,2.75,2.625,-0.125,152,144,discarded,replace-verify-numerically-and-retry-another-symmetry-clause-with-free-parameter-normal-plus-stop-and-box,"4/8 correct. All four failures ran to the 16384-token cap with nothing boxed, and two of them had already reached correct values before dying: they obeyed the incumbent's closing 'verify the identity at one numeric input' and spent the whole remaining budget evaluating the degree-9 composition with huge numbers. The other two acted on the same clause's 'test a different symmetry' licence and thrashed between restarts and full multinomial coefficient matching. No winning rollout ever ran a numeric verification; each read the values off the relation and stopped. So this keeps the involution ansatz wording the winners echo verbatim and swaps only that harmful trailing clause for the positive first move it lacked: treat a leftover free parameter as expected and commit a boxed answer as soon as it cancels. Net 8 tokens shorter."
7,10,3843,148.144,148.155,c114dde1b09adf25ca78c933cba74a999d4e75ce2bcfbaaecc757f2887473b0c,3a9b9e957bfb7df4ad48f40037232d7ce19cb093aa417900157eeffeb9d31249,c114dde1b09adf25ca78c933cba74a999d4e75ce2bcfbaaecc757f2887473b0c,0.375,0.0,-0.375,0.15,0.125,-0.024999999999999994,1.875,1.25,-0.625,106,98,discarded,written-states-outrank-structural-argument-tiebreak,"Fresh rollouts under the incumbent scored 1/8, and six of eight died at the completion cap with one shared shape: the student did carry out the literal run and got counts, then a cycle-structure/disjoint-transposition argument contradicted those counts, and it spent thousands of tokens asking where the contradiction was instead of proceeding; the one finished failure overrode its own simulation with an invented cycle-order story. The lone success simply counted at small sizes and committed. So the missing instruction is a tie-break rule, not another prohibition: I replace the incumbent's pass-versus-pass convention clause and its bare 'a composite does not inherit the period of its parts' line (which rollouts recite verbatim and then ignore) with an explicit rule that the written-out states beat any structural argument, so keep the count and move on. Kept operation-agnostic and 8 tokens shorter than the incumbent."
8,1,28054,148.156,148.166,98f0bbb6f87c7e50634956da8a0905b30a66997aa33a5e4bc67a2609ec487ed8,fb2777671f3346be72163ae4329816bfbebcb88df4f3d7099f9270b1e87b1a4d,98f0bbb6f87c7e50634956da8a0905b30a66997aa33a5e4bc67a2609ec487ed8,0.125,0.0,-0.125,0.25,0.225,-0.024999999999999994,2.625,2.25,-0.375,77,66,discarded,lossless-compression-drop-inert-do-not-reason-from-original-set-clause-77-to-66-tokens,"Execution 148.156 scored 3 of 8; three failures hit the 16384-token cap and the terminating failures named a candidate they had just argued was impossible. Checking which incumbent clauses the rollouts actually execute, the trailing 'do not reason from the original set after later statements' clause appears only inside verbatim recitations of the hint - no rollout, winning or losing, ever performs it as a distinct step, and two of the three successes never mention it at all; it is redundant with 'recomputing information sets after every deletion' anyway. So this is a pure lossless compression: all four working steps (enumerate interpretations as a candidate set, group by each speaker's private value, read not-knowing as deleting size-one groups, re-filter in chronological order, survivor gives the answer) are kept word for word at 66 tokens instead of 77. Rounds 6 and 7 also dropped this clause but each added new clauses alongside; nothing has yet tested the deletion on its own."
