round,hint_id,train_qid,sampling_slurm_job_id,proposal_eval_slurm_job_id,incumbent_hash,proposal_hash,final_hash,old_train,new_train,delta_train,old_heldout,new_heldout,delta_heldout,old_J,new_J,delta_J,old_tokens,new_tokens,decision,mutation,subagent_summary
20,7,3836,148.404,148.414,ab86313389de277c671789977242ca71390d684323c6bdbaf69bed67b8fdd067,717370c014a1ab57391db446ad360d58e4a3a8b306bcae00a7d4b7904f66cb6c,ab86313389de277c671789977242ca71390d684323c6bdbaf69bed67b8fdd067,0.25,0.0,-0.25,0.175,0.1375,-0.03749999999999998,2.0,1.375,-0.625,70,67,discarded,swap-inert-ratio-clause-for-back-substitute-each-small-case-before-recording,"Seven of eight rollouts did shrink to sizes 2, 3, 4 but recorded wrong values for those tiny cases, then could not fit any rule to their own inconsistent table and guessed a plausible-looking fraction; the one correct rollout is the one whose small-case entries were self-consistent. The incumbent's divide-consecutive-entries ratio clause was quoted verbatim and never executed by any rollout, so it is inert. Replacing it with one concrete executable check - substitute each small-case solution back into that case's own equations before recording it - fixes the garbage-table failure at its source and should transfer to any unseen problem solved by a small-case ladder, at three tokens shorter than the incumbent."
20,8,23443,148.405,148.415,0250077d8944cf1436c3e3ecd3d488e1d97a5eb76f0be7756ba8677ce1f1d77e,aa6edc303f15d901b2c2aa202fb1882db6d00c9d88a53cf7f94a391016a2052f,0250077d8944cf1436c3e3ecd3d488e1d97a5eb76f0be7756ba8677ce1f1d77e,0.75,0.5,-0.25,0.1625,0.1625,0.0,2.375,2.125,-0.25,123,121,discarded,replace-inert-substitute-last-clause-with-verify-then-commit-and-box,"Rollouts scored 7/8. All eight built the symbolic setup, reached the gcd and listed its divisors, and the grouping clause held; the single failure differed only at the end - it had already derived and written the correct per-item figures, then spent the longest trace of the eight re-litigating its own candidate table and boxed a different candidate. Meanwhile 'substitute numbers only at the end' appeared in zero of eight traces again, as in rounds 10, 11, 15 and 19. So I delete that inert clause and spend the tokens on the missing terminal move: verify against the stated conditions, then commit and box. Adding a selection or tiebreak rule has lost held-out here four times, so this adds no such rule and keeps every load-bearing clause. It is 121 tokens versus the incumbent's 123."
20,9,3980,148.406,148.416,8d573a01e8dd8cdbf6fde199bcbfe58fbdf001268ee5af64c810b216a6f41526,9f53f4873eec8e4a40ef6f4858e4b5c6d7c0cd4e1d127991e45f47b7cb26aeaf,8d573a01e8dd8cdbf6fde199bcbfe58fbdf001268ee5af64c810b216a6f41526,0.25,0.5,0.25,0.2875,0.125,-0.16249999999999998,3.125,1.75,-1.375,146,146,discarded,replace-inert-look-for-shared-symmetry-with-substitute-ansatz-and-name-inner-value-y-to-reach-one-variable-reflection-identity,"All three correct rollouts made the same decisive move: they plugged the affine-involution ansatz into the composition identity, set y equal to the inner map's value, and thereby reduced it to the single-variable reflection identity, which pinned the coefficients quickly. All five failures never reached that one-variable form; they stalled substituting s - x into the two-argument identity, re-derived that it merely reproduces itself, and four hit the token cap without any boxed answer. The incumbent's 'look for a shared symmetry' clause was inert (essentially unused in the rollouts), so I spent those tokens naming the concrete reduction step the winners used instead. This is a general reduction for any for-all-x functional identity, so it should transfer."
20,10,3843,148.407,148.417,f35723e4dc2afe2c9e6b06cc17fbe624bd14c7dc195ef432ec15398d3a5af454,9713cdff538bc6b7917bea2178425d35be75e5084b20b10c3b43db12d9817380,f35723e4dc2afe2c9e6b06cc17fbe624bd14c7dc195ef432ec15398d3a5af454,0.25,0.5,0.25,0.225,0.1875,-0.037500000000000006,2.5,2.375,-0.125,100,99,discarded,running-best-formula-after-each-row-replaces-inert-three-row-fit-and-check,"Four of my eight rollouts (1/8 correct) burned the whole budget arguing about cycle structure and ended mid-sentence with no boxed answer at all; two more boxed a wrong exponent after thrashing between rival candidates. Across five rounds of my rollouts none ever built the incumbent's three-row table or ran its 'check every row' step, so that terminal clause is inert transfer tax while budget death is the real failure. The edit makes the formula a running best-so-far written after each measured size, so a committed answer always exists before room runs out; it is shorter than the incumbent and keeps every clause the successful rollouts use."
