round,hint_id,train_qid,sampling_slurm_job_id,proposal_eval_slurm_job_id,incumbent_hash,proposal_hash,final_hash,old_train,new_train,delta_train,old_heldout,new_heldout,delta_heldout,old_J,new_J,delta_J,old_tokens,new_tokens,decision,mutation,subagent_summary
11,7,3836,148.222,148.232,ab86313389de277c671789977242ca71390d684323c6bdbaf69bed67b8fdd067,3467c1b9845521896a41037bcc0fd1d40cc69c64e9bb42c250dadf2be0ba4d1f,ab86313389de277c671789977242ca71390d684323c6bdbaf69bed67b8fdd067,0.25,0.125,-0.125,0.175,0.175,0.0,2.0,1.875,-0.125,70,68,discarded,lossless-compression-merge-twin-prohibitions-70-to-68-tokens,"Fresh rollouts scored 0/8: all eight quoted the hint verbatim in the first paragraph and then built the polynomial-in-x model anyway; six hit the 16384-token cap with no boxed value, and the two that terminated reached the right factored structure but botched the final coefficient extraction. One rollout did compute two exact small-case entries by elimination, then declared the pattern 'not obvious' and abandoned the table for theory. Nine consecutive strategy edits to this hint have already lost held-out (rounds 6-10 tried replacing the ratio clause, the starting size, and the closing clause), so I did not attempt another. This is a strictly lossless compression: the two 'never' prohibitions are merged with 'or' and the terminal period dropped, keeping every step, meaning, and order intact at 68 tokens versus the incumbent's 70, which wins the length tie-break if held-out is unchanged."
11,8,23443,148.223,148.233,0250077d8944cf1436c3e3ecd3d488e1d97a5eb76f0be7756ba8677ce1f1d77e,b2e314268ef516a61fdcdea0707a2f72166edcec13560cc3a6018dd33bb829fc,0250077d8944cf1436c3e3ecd3d488e1d97a5eb76f0be7756ba8677ce1f1d77e,0.75,0.875,0.125,0.1625,0.1125,-0.05,2.375,2.0,-0.375,123,122,discarded,replace-vague-final-check-with-executable-per-item-rebuild,"Fresh round-11 rollouts scored 5/8. All eight computed the gcd of the stage totals and listed its divisors as candidate counts, so that machinery fires reliably, and all three failures were again the selection fork - a fork I tried to patch in rounds 2, 4, 6 and 7 and lost held-out every time, so I left it untouched. New evidence: not one of the eight ever rebuilt its per-item amounts from the count it picked, so the incumbent's closing 'check the result against every stated condition' is a vague gesture the student never executes. This edit replaces only that gesture with the same check stated as one concrete operation on numbers already written down, adding no rule, prohibition or tiebreak, and lands at 122 tokens versus 123."
11,9,3980,148.224,148.234,3177fd8ccc06120f7993d61571961edc2bb39f823ba9696ca131a1da2bfbe076,391f18d0a38c1a07058f9782b12c580bfb7fb5aae04b069b173f7d17d3e75563,391f18d0a38c1a07058f9782b12c580bfb7fb5aae04b069b173f7d17d3e75563,0.375,0.375,0.0,0.2375,0.2625,0.025000000000000022,2.75,3.0,0.25,152,147,kept,disambiguate-involution-target-reflect-the-maps-not-the-argument-drop-inert-trailing-clause,"7 of 8 rollouts died on the 16384-token cap with nothing boxed; the lone winner finished in 8k. The dominant, previously undiagnosed failure is that they applied the reflection to the argument instead of to the maps: they substituted s - x into p(q(x)) = q(p(x)) itself, which is a tautology, and then looped rediscovering that it gave no new information (one rollout said so 15 times) until the budget ran out. The winner tried that once, abandoned it for the map-level relation f = s - g, and solved it. Meanwhile no rollout this round mentioned a numeric verification, tried a different symmetry, or claimed no such polynomials exist, so the incumbent trailing clause is inert here and pays for the new line. Net 147 tokens versus the incumbent 152."
11,10,3843,148.225,148.235,8f7b8e1d1d6e2d9340e42495d567be9a197bd3fa8ed7642d587f47ff305db523,51b7b8e6b893cd138905f0beb57b7700024ed815d84fd4e4881abc479668474a,8f7b8e1d1d6e2d9340e42495d567be9a197bd3fa8ed7642d587f47ff305db523,0.625,0.625,0.0,0.15,0.1375,-0.012499999999999983,2.125,2.0,-0.125,102,97,discarded,drop-inert-table-clause-for-rewrite-state-after-every-substep-and-compare-to-start,"Fresh rollouts scored 2/8; five of six failures hit the 16384-token cap without ever boxing anything. The cause is corrupted per-application bookkeeping: they collapse an application's sub-steps onto one line, silently lose a swap, get a state that appears to return early, then thrash thousands of tokens re-deriving it (one concluded the period is 2 from a botched two-application run). Meanwhile the incumbent's 'build a table ... fill three rows' clause is inert - none of the eight rollouts wrote a table and none reached a third size. I cut that clause and spent the space on the concrete move they lack: rewrite the whole state after every individual step, and after each finished application compare it to the starting state, first match being the count. This is operation-agnostic and 5 tokens shorter than the incumbent."
12,1,28054,148.236,148.246,98f0bbb6f87c7e50634956da8a0905b30a66997aa33a5e4bc67a2609ec487ed8,272e1a438e83c1d7c8b5e3d3034a0d4c32184a613b352c2dc7891736c5ec2c00,98f0bbb6f87c7e50634956da8a0905b30a66997aa33a5e4bc67a2609ec487ed8,0.125,0.125,0.0,0.25,0.1625,-0.0875,2.625,1.75,-0.875,77,72,discarded,minimum-disturbance-lossless-compression-77-to-72-only-sentence-4-tail-tightened,"All 8 rollouts (execution 148.236, 0 of 8) failed identically: each fixed one reading of the public value, argued that inside it a speaker who knows their own number can compute the partner, called it contradictory, and then either looped to the 16384-token cap (4 of 8) or boxed an unprincipled value. Rounds 1, 9 and 10 all attacked exactly this with cross-reading wording and each lost held-out (0.1875, 0.175, 0.200), so that strategy edit is retested and refuted, not untried. Rounds 6, 8 and 11 compressed but reworded every sentence. This proposal is the untested minimum-disturbance case: sentences 1-3 and 5 are byte-identical to the incumbent and only the redundant trailing sub-clause of sentence 4 is tightened - 'after later statements' is entailed by chronological order plus recomputing after every deletion - giving 72 tokens instead of 77 with every step intact."
12,2,30302,148.237,148.247,a2617d5cf40e8a99a8f74a784b3ae2a8d34000cee46fba8c99104d13b42a8740,16f3bb009c4ec812770e1682f39c2fb99da5f06d134d405532318b52cb7a6183,a2617d5cf40e8a99a8f74a784b3ae2a8d34000cee46fba8c99104d13b42a8740,1.0,1.0,0.0,0.225,0.1125,-0.1125,3.25,2.125,-1.125,70,69,discarded,function-word-only-lossless-compression-69-vs-70-tokens-every-content-phrase-byte-identical,"Fresh rollouts (148.237) scored 8/8 with no stalls, so nothing is missing and no clause can honestly be cut: clause-tracing all eight shows every element is used (divide by the power 5-13x, the w substitution 5-17x, |w| on a circle 7-39x, inverting the Mobius relation 3-41x, an x,y equation 1-15x, exceptional/excluded values 6/8, and 5/8 literally quote the opening clause back). Every semantic variant has already lost for this hint (r1 modulus shortcut, r2/r4 appended guards, r6 generalized w, r7 replaced the geometric fork, r8/r10 touched exceptional values, r9 changed the closing verb), and the two prior compressions that lost (r5 at 64, r11 at 68) both altered content-bearing wording. So this edit changes only a discourse subject, 'The equation' to 'This', leaving every content phrase byte-identical at 69 tokens versus 70. Realistically it wins mainly by tying held-out and taking the shortness tie-break; I put that near 25 percent."
12,3,8554,148.238,148.248,7b7b4483667ba6211d89e8b29e80c7dfcb9f10060d9ffc62b3bffc74e364b566,4c19f8db163ff2491648d6bee2566b9c0435afe440bdeee382a9c009f6bbe448,7b7b4483667ba6211d89e8b29e80c7dfcb9f10060d9ffc62b3bffc74e364b566,0.625,0.625,0.0,0.225,0.125,-0.1,2.875,1.875,-1.0,169,160,discarded,replace-declarative-symmetry-invariance-clause-with-evaluate-two-concrete-positions-keep-better,"Rollouts scored 7/8; all eight closed the reasoning block and boxed a value, so the output-protocol clauses work and are left byte-identical. The single failure asserted in prose that the overlap was fixed at the whole smaller figure regardless of orientation and boxed the resulting total - the same containment/invariance assertion that caused the lone method failure in rounds 7 and 10. The incumbent's symmetry clause licenses exactly that move: it tells the student an invariance can be declared, and here the quantity really does depend on the free rotation. This edit replaces that declarative gesture with the concrete executable move the successful traces already make - evaluate the quantity at two actual positions and keep the better number - and lands at 160 tokens against the incumbent's 169, so it also wins the length tiebreak."
12,4,25003,148.239,148.249,c3cbe0705047c147d73e4cc6abba5206011053ba9a5bfc3d932d36a3d2abb469,e0ca78c56f30a95ccffa6bbca03e866e7e92dfbb723570c1181e9524f64d335b,e0ca78c56f30a95ccffa6bbca03e866e7e92dfbb723570c1181e9524f64d335b,0.875,0.875,0.0,0.225,0.225,0.0,3.125,3.125,0.0,153,146,kept,recast-per-polynomial-cap-as-solution-count-of-equation-P(x)=A+Bx-146-vs-153-tokens,"Fresh round-12 rollouts (148.239) scored 3/8. Three of the five failures make the same mechanical slip: they compute the degree of P(x)-L(x) by subtracting degrees, call it fourth-degree with at most four roots, undercount the per-polynomial capacity by one, then burn the whole token budget oscillating and never commit; a fourth abandons the affine target for cross-polynomial differencing and reports the menu size. Round 8 warned against the subtraction directly and held-out fell, so instead of a prohibition this edit removes the subtraction step entirely: the capacity is now counted as solutions of the equation P(x)=A+Bx, whose degree is deg P by construction, so the wrong degree is unreachable. It is shorter than the incumbent (146 vs 153 tokens) with every other step preserved."
12,5,30418,148.240,148.250,1eb4e3cdd613a791abc5a6eca1cdc1c28a39f7f417b75d407c5cfcb7ed4ed992,7a2efe433f4d47502507ff8ca3bf845cbe407f8a9810a6d918cbd0cfb9d8b564,1eb4e3cdd613a791abc5a6eca1cdc1c28a39f7f417b75d407c5cfcb7ed4ed992,0.75,0.75,0.0,0.25,0.1125,-0.1375,3.25,1.875,-1.375,70,69,discarded,lossless-compression-fold-pin-and-verify-into-one-clause,"5/8 correct; all three failures shared one mechanism: after reducing to a single unknown they mis-signed one term while clearing the fraction, got a surd discriminant instead of the clean factorable quadratic the five successes hit, then spent the whole budget on radicals and never boxed anything. Every incumbent clause is executed by the rollouts, and eleven rounds of clause swaps here have all lost held-out, so I made no strategy change: this is a strictly lossless compression (70 -> 69 tokens) folding 'pin unknown constants first, then verify' into 'pin and verify unknown constants first'. Same steps, same order, nothing dropped; it wins only on the length tiebreak."
12,6,26989,148.241,148.251,95b6a4b6d1196cbe4413c62b9b8de2f2fc8e18a7553bd9c85f62337bf84d3d7e,394792ff67591ddc4df08ed26a7968a7d2f0b32ef64cdee0ff8f83e9e726541d,95b6a4b6d1196cbe4413c62b9b8de2f2fc8e18a7553bd9c85f62337bf84d3d7e,0.25,0.0,-0.25,0.25,0.2,-0.04999999999999999,2.75,2.0,-0.75,177,175,discarded,replace-two-directional-bottom-fact-with-arrival-list-construction-175-vs-177-tokens,"Fresh rollouts scored 3/8, this hint's best, and all eight terminated normally, so the runaway-loop failure is gone. The one systematic error left is direction: five of eight stated the destination's bottom is the LAST item delivered and priced that, yielding 1/4 or 1/2. The incumbent already asserts the correct fact but packs 'arrived first' and 'arrived last' into one sentence, so the 1.7B student mis-binds 'last' to 'bottom'. This edit replaces that passive two-directional fact with a single concrete action it can execute while walking a run - maintain the destination as an arrival list, append each item as it lands, entry one is the bottom - and drops the confusable 'top is whatever arrived last' half. No clause the rollouts use is cut (labeling 8/8, push/pop 7/8, forced-move 8/8, one-half 8/8) and it lands at 175 tokens versus the incumbent's 177."
12,7,3836,148.242,148.252,ab86313389de277c671789977242ca71390d684323c6bdbaf69bed67b8fdd067,5cbc7aa1d4672bbea864b0ce2cd4610b7b34a13ed5f61ef1d8300174496c7749,ab86313389de277c671789977242ca71390d684323c6bdbaf69bed67b8fdd067,0.25,0.0,-0.25,0.175,0.1375,-0.03749999999999998,2.0,1.375,-0.625,70,63,discarded,delete-the-never-leave-the-table-for-theory-clause-that-forbids-the-winner-move,"Fresh round-12 rollouts scored 1/8; seven hit the 16384-token cap with no boxed value. The sole winner did the shrink-and-eliminate steps at sizes 3 and 4, recorded the values with signs, and then generalized to a closed form in n - i.e. it won precisely by leaving its table for theory, the one thing the incumbent forbids. That clause is also inert as a restraint: all eight rollouts run general theory anyway and none echoes the ban. The two losers that reached exact small-case entries then declared the pattern untrustworthy and never generalized, which is exactly the behaviour this clause encourages. So I delete only that clause and keep every step the winner used verbatim, 70 to 63 tokens."
12,8,23443,148.243,148.253,0250077d8944cf1436c3e3ecd3d488e1d97a5eb76f0be7756ba8677ce1f1d77e,04e5bc2ec6dc12c63bd8898bfd763f263f5a45b1d844c077f2054e73a8d25421,0250077d8944cf1436c3e3ecd3d488e1d97a5eb76f0be7756ba8677ce1f1d77e,0.75,0.125,-0.625,0.1625,0.2125,0.04999999999999999,2.375,2.25,-0.125,123,122,discarded,drop-inert-grouping-clause-restore-concrete-percent-base-and-sum-before-dividing,"All 8 rollouts executed the incumbent's symbolic-setup and gcd steps cleanly and produced the same short candidate list; the 3 failures all died at selection, adopting the stated grouping count as the item count and stopping there. The incumbent's grouping sentence is aimed at exactly that error and demonstrably does not prevent it, and no passing rollout visibly uses it, so it is transfer tax; rounds 2, 6, 7 and 11 already proved that rewriting or sharpening the selection rule loses held-out. I therefore spend those tokens restoring the two concrete moves from this hint's best-ever held-out version (0.1875): an instantiated percent base (a percent of cost multiplies cost, not price) and summing parts before a single division. Both generalize to many more unseen word problems than a divisor rule does, and at 122 tokens versus 123 the proposal also wins the shortness tie-break. Honest odds of beating the incumbent: maybe 25 percent."
12,9,3980,148.244,148.254,391f18d0a38c1a07058f9782b12c580bfb7fb5aae04b069b173f7d17d3e75563,3304b5d1d770dab2177789c30ae034a3b88d8904cb99b4e930d5b49477a7a350,391f18d0a38c1a07058f9782b12c580bfb7fb5aae04b069b173f7d17d3e75563,0.375,0.25,-0.125,0.2625,0.175,-0.08750000000000002,3.0,2.0,-1.0,147,147,discarded,replace-inert-read-outputs-clause-with-expand-the-reflection-identity-alone-and-free-coefficient-cancels,"3/8 correct; all five failures ran to the 16384-token cap with nothing boxed. Every rollout adopted the involution and most derived s correctly, so that wording works. The failures then had no next step: the incumbent's 'read the outputs straight from the symmetry relation rather than solving for every coefficient' forbids the one move all three winners made, namely expand only the one-variable reflection identity, accept that one coefficient stays free, and let it cancel in the requested values. Lacking it, failures reverted to full composition matching, guessed s numerically, or declared contradictions. This swaps that misdirecting clause for the concrete positive step plus the underdetermined-is-normal reassurance, at 147 tokens versus the incumbent's 147."
12,10,3843,148.245,148.255,8f7b8e1d1d6e2d9340e42495d567be9a197bd3fa8ed7642d587f47ff305db523,7325b0a5db3bea0f75213a1861822560dcad6d64a54c58b03404a712381874a5,8f7b8e1d1d6e2d9340e42495d567be9a197bd3fa8ed7642d587f47ff305db523,0.625,0.75,0.125,0.15,0.1125,-0.03749999999999999,2.125,1.875,-0.25,102,102,discarded,one-row-per-completed-application-not-per-step,"Fresh rollouts scored 2/8; four hit the 16384-token cap and both finished failures answered from corrupted counts. The shared cause is per-application bookkeeping: they write a row after every individual step and then count those rows as applications (one literally logs 'after 3 switcheroos (k=0,k=1,k=0)'), so a mid-sequence state gets counted, the measured counts contradict each other, and they thrash or fit a formula to the wrong numbers. The incumbent defines what one application is but never says how to keep the tally, which is why every rollout recites the definition and still miscounts. I add that one concrete move - one row per completed application, not per step - and pay for it by compressing the table clause rather than deleting it, since cutting it lost held-out last round. Same length as the incumbent, 102 tokens."
13,1,28054,148.256,148.266,98f0bbb6f87c7e50634956da8a0905b30a66997aa33a5e4bc67a2609ec487ed8,9ac06f0c24e9ad625c25c538b6390bfd16c72cbade70f48ae397e3844b708b63,98f0bbb6f87c7e50634956da8a0905b30a66997aa33a5e4bc67a2609ec487ed8,0.125,0.0,-0.125,0.25,0.15,-0.1,2.625,1.5,-1.125,77,73,discarded,name-explicit-candidate-list-as-first-move-and-drop-inert-original-set-clause,"Fresh rollouts (148.256, 2 of 8 correct) failed the same way: six runs never wrote any explicit candidate list, instead oscillating in prose between the two readings of the public number and re-arguing the same paragraph, with four hitting the generation cap and emitting no boxed answer. The two winners were the only runs that eventually enumerated candidates line by line. Meanwhile no rollout in this or the last four rounds ever used the incumbent clause about not reasoning from the original set, and repeated pure compressions of that clause (rounds 8, 11, 12) all lost held-out. So this edit keeps every piece of machinery the winners used, drops that inert clause, spends the saved tokens naming the concrete first move the losers lack (write the list out before arguing), and makes the terminal action boxing the survivor."
13,2,30302,148.257,148.267,a2617d5cf40e8a99a8f74a784b3ae2a8d34000cee46fba8c99104d13b42a8740,48669f79f1b0bbf4475074ac476d9357551b5461f120c1ac4500eec2e2b87334,a2617d5cf40e8a99a8f74a784b3ae2a8d34000cee46fba8c99104d13b42a8740,1.0,0.875,-0.125,0.225,0.175,-0.05000000000000002,3.25,2.625,-0.625,70,70,discarded,replace-vague-characterize-image-locus-with-explicit-distance-relation-in-z-at-equal-70-tokens,"Fresh rollouts (148.257) scored 8/8, so train is saturated and only transfer matters. All eight traces reached w on a fixed circle and inverted the map fast, then stalled on the vague ""characterize the image locus"" step: every one parametrized w by an angle, computed |z| as a function of that angle, and looped on the fact that root moduli are not constant (one burned 11845 tokens). The three fastest traces escaped only by pushing the |w|=R condition back onto z as a distance relation. This edit names that conversion as the concrete next move, so the student never enters the angle parametrization. History says pure compression is exhausted (rounds 5, 11, 12 lost) and appended guards lost, so the untested lever is making the one vague clause executable at equal length: 70 tokens, same as the incumbent."
13,3,8554,148.258,148.268,7b7b4483667ba6211d89e8b29e80c7dfcb9f10060d9ffc62b3bffc74e364b566,05e68a9098aeb7d33e8bafe3b40c59606505607729315af3f3d4870a4481fae6,7b7b4483667ba6211d89e8b29e80c7dfcb9f10060d9ffc62b3bffc74e364b566,0.625,0.5,-0.125,0.225,0.125,-0.1,2.875,1.75,-1.125,169,168,discarded,replace-inert-containment-prohibition-with-solve-for-boundary-crossings-first-move,"Rollouts scored 4/8. Two failures were method failures of the same kind: each asserted an overlap value in prose (one claimed the shared region vanishes, one claimed a floor for it) without ever solving for a single boundary crossing, then boxed the resulting total. The other two ran the budget out on tilted placements. The incumbent's remedy for this is a bare prohibition plus the word 'extent', which appeared 0-2 times per trace while coordinates appeared 15-31 times, so it is inert. This edit replaces that prohibition with the positive executable move the four successes actually made - solve for where the boundaries cross and read the overlap off those points - which applies to any overlap, union or region-area problem, and lands at 168 tokens versus the incumbent's 169."
13,4,25003,148.259,148.269,e0ca78c56f30a95ccffa6bbca03e866e7e92dfbb723570c1181e9524f64d335b,bc8c324a4e2548bbdaac437e2612e3ebec0b4176393880c87db317f09397833c,e0ca78c56f30a95ccffa6bbca03e866e7e92dfbb723570c1181e9524f64d335b,0.875,0.625,-0.25,0.225,0.175,-0.05000000000000002,3.125,2.375,-0.75,146,139,discarded,replace-vague-match-on-own-block-with-explicit-split-into-blocks-of-degP-one-per-polynomial-139-vs-146-tokens,"Fresh round-13 rollouts (148.259) scored 6/8. Both failures are token-ceiling truncations with the same cause: they never form the partition, so they keep re-asking whether a high-degree polynomial can serve a whole stretch, and finally report a single factor (the per-polynomial capacity, or the menu size) instead of the total. All six correct rollouts talk about blocks heavily; the two failures barely mention them, so the closing clause is the load-bearing step and its current wording ('attain it by letting each polynomial match L on its own block') is too vague to execute. This edit spends words on the concrete constructive move - split the inputs into consecutive blocks of deg P, one per polynomial - and names the product to box, while keeping every earlier step and coming in shorter than the incumbent (139 vs 146 tokens)."
