round,hint_id,train_qid,sampling_slurm_job_id,proposal_eval_slurm_job_id,incumbent_hash,proposal_hash,final_hash,old_train,new_train,delta_train,old_heldout,new_heldout,delta_heldout,old_J,new_J,delta_J,old_tokens,new_tokens,decision,mutation,subagent_summary
2,9,3980,148.41,148.53,3177fd8ccc06120f7993d61571961edc2bb39f823ba9696ca131a1da2bfbe076,a436d35c2b78fbe7459d53249929d9f5eeb139f8522429f13885ff1454a2ea1e,3177fd8ccc06120f7993d61571961edc2bb39f823ba9696ca131a1da2bfbe076,0.375,0.25,-0.125,0.2375,0.125,-0.11249999999999999,2.75,1.5,-1.25,152,191,discarded,pin-s-from-constant-terms-plus-centered-odd-power-form-and-stop-when-free-parameter-cancels,"The kept round-1 hint lifted fresh training from 0/8 to 4/8, and all four winners now terminate normally in 7.4k-10.8k tokens instead of every rollout hitting the 16384 cap, confirming that naming the involution ansatz concretely stopped the thrashing. The four residual failures split into three modes: one picked the reflection constant by guessing a midpoint of the two evaluation inputs rather than deriving it from the given constant terms, two abandoned the ansatz and reverted to multinomial coefficient matching of the composition, and one reached the correct values but then spent the rest of its cap re-verifying the composition with large numbers. This revision therefore gives the exact formula for the reflection constant, supplies the centered odd-power form that reduces the map to a single free parameter, and adds an explicit stopping rule once that parameter cancels."
2,10,3843,148.42,148.54,95005ec62835dbef2cc6b52c26e1bc8efa75d3d939090ada63716aa06be7a5b5,c206aa15732f30d374b40ee630b700b8e21bf5c784000cb8b6f36baa3aa980e1,95005ec62835dbef2cc6b52c26e1bc8efa75d3d939090ada63716aa06be7a5b5,0.25,0.375,0.125,0.1375,0.1125,-0.02500000000000001,1.625,1.5,-0.125,72,152,discarded,simulate-and-count-ground-truth-then-fit-and-confirm-instead-of-symbolic-derivation,"In the fresh round-2 rollouts under the incumbent (2/8 correct) five of the six failures exhausted the completion cap: steered by the incumbent toward symbolic positional/bitwise algebra they mis-derived cycle structures, oscillated between rival closed forms, and never committed to an answer; the one finishing failure trusted an unverified decomposition and reported the period of a single sub-step. Budget exhaustion from abstract derivation now dominates, so this revision replaces that directive with one bounded concrete procedure - simulate literally on the smallest sizes, count repetitions to recurrence, fit and then confirm on an unused size - and treats measured counts as overruling any structural shortcut. Round 1 showed that stacking problem-specific cautions raised train but cut held-out, so this is phrased operation-agnostically and kept short."
3,1,28054,148.55,148.65,98f0bbb6f87c7e50634956da8a0905b30a66997aa33a5e4bc67a2609ec487ed8,fca4bd1d6a9f67c25921a76afac302fc18734f80ffaa1504e69fd9c50b977430,98f0bbb6f87c7e50634956da8a0905b30a66997aa33a5e4bc67a2609ec487ed8,0.125,0.0,-0.125,0.25,0.1875,-0.0625,2.625,1.875,-0.75,77,102,discarded,shorten-and-force-explicit-candidate-list-with-count-based-knowledge-test,"In the fresh rollouts (execution 148.55, 2 of 8 correct) no run ever built the candidate list the incumbent asks for: each treated the open readings of the revealed number as two whole branches, argued abstractly that a speaker's own value pins the partner down, declared both branches contradictory, then committed to a guessed pair, and three of eight ran to the 16384-token cap doing so. Both prior revisions targeted this but were long (150 and 167 tokens) and each lost held-out accuracy against the 77-token incumbent, so this round stays near incumbent length and only makes the first move concrete: enumerate the list explicitly, treat can/cannot-determine as counting written entries, re-count after each statement in order, and never report an eliminated entry."
3,2,30302,148.56,148.66,e926ca1d6f04d597d4b99af9d15b2597417b40fc28c3c0397d67f147cfa99917,a2617d5cf40e8a99a8f74a784b3ae2a8d34000cee46fba8c99104d13b42a8740,a2617d5cf40e8a99a8f74a784b3ae2a8d34000cee46fba8c99104d13b42a8740,1.0,1.0,0.0,0.2,0.225,0.024999999999999994,3.0,3.25,0.25,81,70,kept,lossless-compression-of-incumbent-same-steps-70-tokens-instead-of-81,"Fresh round-3 rollouts (execution_id 148.56) again scored 8/8, so every step of the incumbent scaffold is load-bearing and nothing on train is failing; round 1 showed that narrowing the scaffold to a modulus/distance-ratio route cut held-out from 0.200 to 0.0875, and round 2 showed that appending guards ties J and held-out exactly yet still loses the shortness tie-break at 139 tokens. The only remaining lever is therefore length, so this proposal preserves all six semantic elements (divide by the power, name the ratio, w confined to a finite set on a circle, invert the Möbius relation, characterize the image locus geometrically or via an x-y equation, use all roots and check exceptional values before extracting the parameter) while cutting redundant wording, giving 70 tokens against the incumbent's 81."
3,3,8554,148.57,148.67,918623ddf49b0ec8c88e8becd4d23b6c8423864ccda8f888c55e8989ee25135c,ea0de89d46159fe72a241356863ce6ba7e423c83cc4601c4c42002382aefb1f8,918623ddf49b0ec8c88e8becd4d23b6c8423864ccda8f888c55e8989ee25135c,0.5,0.375,-0.125,0.15,0.15,0.0,2.0,1.875,-0.125,147,112,discarded,shorten-to-evaluate-a-few-concrete-positions-and-box-the-best,"Fresh round-3 rollouts under the 147-token incumbent scored 2/8: both successes stopped normally near 13.6k tokens after boxing a value, while all six failures hit the 16384-token cap and four boxed nothing, even though six of eight had already computed the correct exact value within the first 8-17 percent of the trace before abandoning it. The sink is an unbounded hunt for a better rotation or tangency placement (20-59 tangency mentions, 34-53 'Alternatively' restarts), and the incumbent's invariance/shoelace machinery was essentially never executed (at most one mention per trace), so this revision drops the unused recipe for a shorter, more actionable rule: refuse symbolic parameter optimization, score two or three concrete positions, keep the best, and box it. Round 2 taught that lengthening a working hint with extra prohibitions lost both train and held-out, so this proposal is 112 tokens against the incumbent's 147."
3,4,25003,148.58,148.68,3f7a40ea94795e85eeacaf7eb371e77a133709fb15b5eb9c6c9aea2f3cc76b62,c3cbe0705047c147d73e4cc6abba5206011053ba9a5bfc3d932d36a3d2abb469,c3cbe0705047c147d73e4cc6abba5206011053ba9a5bfc3d932d36a3d2abb469,0.5,0.875,0.375,0.2125,0.225,0.012500000000000011,2.625,3.125,0.5,162,153,kept,shorten-and-fix-per-polynomial-cap-off-by-one-plus-total-count-framing,"Fresh round-3 rollouts (execution 148.58) scored 4/8 with the incumbent. Every one of the four failures reports a single factor instead of the product: two derive the correct per-polynomial root cap and then answer that cap itself, one takes the cap as degree-plus-one (points that determine the polynomial) and one reverts to cross-polynomial differencing and answers the menu size; the two truncated rollouts loop on that settled doubt to the token ceiling. The revision is shorter than the incumbent (153 vs 162 tokens), replaces the vague multiply instruction with an explicit statement that the quantity sought is the total input count summed across the menu, and adds the one-line root-cap tightening that matching at one more input would force the polynomial to equal the affine target."
3,5,30418,148.59,148.69,b807d87e8e00cc91a6166db0fb3921c3d3651d016bdd936e3700d0c9bde5fa81,d4ed5b8b4121e56b651045c8a380123b014402abb0b4e03e47e95fbbc58e1658,b807d87e8e00cc91a6166db0fb3921c3d3651d016bdd936e3700d0c9bde5fa81,1.0,0.75,-0.25,0.15,0.1625,0.012500000000000011,2.5,2.375,-0.125,73,72,discarded,subtract-equations-then-exponentiate-once,"Six of eight rollouts were correct. Both failures shared one mechanism: instead of subtracting the two curve equations, they resubstituted the shifted coordinate and folded the constant output difference into the logarithm term by term, misplacing the base and producing a quadratic with an irrational or negative discriminant, then burned the whole 16384-token budget on those radicals with no boxed value. Every success instead subtracted the two equations, exponentiated once to get a ratio equation, and hit a cleanly factorable quadratic, so the revision names that subtraction as the concrete first move, flags a bad discriminant as a sign error rather than a reason to press on, and points at a single cross product for area, which also removes the redundant vertex-ordering and shoelace re-derivations that cost thousands of tokens in every rollout."
3,6,26989,148.60,148.70,67d122a90af2e0710ab939322c2a6639c7d9434bfc510d8f18475e267a2103c9,15733a313be67302fbdaf7568ee30f896eca907ed8c7a070db51b1d5bb1c9ea2,67d122a90af2e0710ab939322c2a6639c7d9434bfc510d8f18475e267a2103c9,0.0,0.0,0.0,0.2125,0.15,-0.0625,2.125,1.5,-0.625,185,188,discarded,"constructive-word-reconstruction: 2n-move ballot word, greedy unique word for a target order, forced-vs-free step pricing","All 8 fresh round-3 rollouts scored 0. Two distinct errors dominated: three rollouts undercounted a run as n moves and returned 1/2^n or a bare 1/k for both parts, while three others asserted the worker has no real choice and declared the reversed order certain and the target placement impossible; two of those looped to the token limit re-arguing that claim. The incumbent already forbids bare 1/k and states the forced-move rule, so the revision instead adds the two missing constructive facts: a run is a 2n-move push/pop word whose prefixes never have more pops than pushes, and a demanded destination order determines that word uniquely by a greedy rebuild, which both supplies a terminating procedure and settles reachability without guessing."
3,7,3836,148.61,148.71,39e2668fb5cca7669288765276aabe0dba01769397daa33b16a9dd7c0174a8f4,b2294ffb06fe64f3e4a994bbe4afab5fca8a5e3f5ff31f073862a0e8ad1b932e,b2294ffb06fe64f3e4a994bbe4afab5fca8a5e3f5ff31f073862a0e8ad1b932e,0.0,0.125,0.125,0.125,0.125,0.0,1.25,1.375,0.125,82,78,kept,forbid-single-polynomial-model-order-small-case-elimination-first,"Fresh round-3 rollouts under the incumbent scored 2/8, and the split is unambiguous: both winners immediately replaced the huge parameter by its smallest values, solved each tiny system by exact elimination, tabulated the requested quantity and generalized, while all six zeros instead built a single polynomial in x out of the unknowns and ground through interpolation and Vandermonde expansions until they hit the 16384-token generation cap. The incumbent actively supplies that losing machinery, so this edit bans the single-polynomial model in one clause and names exactly one concrete first move, staying at 78 tokens versus the incumbent's 82 after two longer procedure-list revisions were already discarded."
3,8,23443,148.62,148.72,b2978873c5591981a1c31bc9bd3f65c56e9dc8e7a037ff47aa156c6b908886d9,5d81acfa76bdabfdb99f63430333dd6dd355a1f99836aca600e4e52914a2ac08,5d81acfa76bdabfdb99f63430333dd6dd355a1f99836aca600e4e52914a2ac08,0.25,0.75,0.5,0.1875,0.15,-0.037500000000000006,2.125,2.25,0.125,157,136,kept,compress-to-symbolic-first-move-drop-extremal-crutch,"Fresh round-3 rollouts on the incumbent scored 4/8, and all four failures shared one mechanism: they divided the totals by the stated grouping count instead of by an admissible common divisor, and three derived the divisor list first and then abandoned it, so the incumbent's vague 'let the problem's extremal wording pick' clause does no work and reads as license to swap in an arbitrary stated number. Round 2 showed that patching this with an explicit trap rule plus a largest-admissible tiebreak saturated train at 8/8 but cut held-out from 0.1875 to 0.1125, so this revision instead deletes the crutch and duplicated unit bookkeeping, keeping only the moves that earned the round-1 transfer gain (symbolic target first, whole-per-item means simultaneous divisibility, percent base named, substitute once, verify), and folds the grouping-versus-unknown distinction into one noun-free sentence. At 136 tokens versus 157 it also wins the shortness tie-break both prior ties turned on."
3,9,3980,148.63,148.73,3177fd8ccc06120f7993d61571961edc2bb39f823ba9696ca131a1da2bfbe076,711d5e7644026d5e43c141d175eda0e0090c6dbd4850e756369e42c0c9056cfc,3177fd8ccc06120f7993d61571961edc2bb39f823ba9696ca131a1da2bfbe076,0.375,0.375,0.0,0.2375,0.1875,-0.04999999999999999,2.75,2.25,-0.5,152,195,discarded,keep-involution-ansatz-add-derive-s-underdetermined-free-parameter-cancels-no-restart,"Fresh training on the incumbent scored 3/8, and all five failures ran to the 16384-token cap; the three correct rollouts each derived the reflection constant from the given data, accepted that one coefficient stayed free, and let it cancel in the requested values. Failures either guessed candidate reflection constants numerically or, after getting the constant right, hit an equation that appeared to force a degenerate leading coefficient, declared a contradiction, and restarted with brute-force multinomial coefficient matching. The revision keeps the involution ansatz that earned the current score and adds only the two general rules the failures lacked: derive the constant instead of guessing, and treat a leftover free coefficient or an apparently degenerate equation as expected rather than grounds to abandon the ansatz."
3,10,3843,148.64,148.74,95005ec62835dbef2cc6b52c26e1bc8efa75d3d939090ada63716aa06be7a5b5,f772ab29bcbea76311626f4c1f77eaac463c18fdba2a1be7222f1d266cb3e565,f772ab29bcbea76311626f4c1f77eaac463c18fdba2a1be7222f1d266cb3e565,0.25,0.5,0.25,0.1375,0.125,-0.012500000000000011,1.625,1.75,0.125,72,108,kept,cross-check-literal-run-against-single-map-then-commit,"Under the incumbent the fresh round-3 rollouts scored 2/8: four exhausted the 16384-token cap after their literal run and their symbolic composition disagreed, whereupon they looped indefinitely re-deriving mapping direction and indexing instead of settling it, and the two finishing failures skipped composing altogether and declared the parts independent so the period equalled a single part's. Both successes hit the same literal-versus-symbolic mismatch but reconciled it once and continued. This revision therefore prescribes running both descriptions on one small instance, resolving a disagreement once and freezing the convention, and forbids reading the composite's period off its pieces; it is kept short and operation-agnostic because my two prior long caution-list proposals each lifted train but lowered held-out."
4,1,28054,148.75,148.85,98f0bbb6f87c7e50634956da8a0905b30a66997aa33a5e4bc67a2609ec487ed8,8e4a94225794f2b1d6738192b467448fb4aa309c821d93befe2b23cbbba776e2,98f0bbb6f87c7e50634956da8a0905b30a66997aa33a5e4bc67a2609ec487ed8,0.125,0.125,0.0,0.25,0.1875,-0.0625,2.625,2.0,-0.625,77,125,discarded,generalize-to-case-enumeration-with-count-test-verify-and-forced-boxed-commit,"Execution 148.75 scored 3 of 8. Three failures ran into the 16384-token cap with no boxed answer at all; the two that stopped declared every branch contradictory and then named an arbitrary candidate. The recurring logical error is treating ""cannot determine"" as a claim to refute rather than a survivor count over cases the speakers themselves cannot distinguish. Rounds 1-3 all attacked this with longer, more puzzle-specific wording (150/167/102 tokens) and each lost held-out accuracy against the 77-token incumbent, so this edit stays terse and deliberately generic: name what the data leaves open, enumerate cases as a list, read knowledge claims as counts, recheck the survivor against all conditions, stop when reasoning repeats, and always emit one boxed answer. The verify, anti-loop and commit clauses help ordinary problems too, so it should transfer instead of over-fitting."
4,2,30302,148.76,148.86,a2617d5cf40e8a99a8f74a784b3ae2a8d34000cee46fba8c99104d13b42a8740,fdeed1fe8fb4c4da801317e624426159f544e08e866ac89049244e1cad3bed80,a2617d5cf40e8a99a8f74a784b3ae2a8d34000cee46fba8c99104d13b42a8740,1.0,1.0,0.0,0.225,0.15,-0.07500000000000001,3.25,2.5,-0.75,70,147,discarded,certify-circle-from-equal-square-coefficients-to-stop-ellipse-stall,"Fresh rollouts (execution_id 148.76) scored 7/8, the incumbent's first train miss in four rounds: the failed trace derived the correct locus quadratic early, then spent over 30k characters insisting the unnormalized A(x^2+y^2)+Bx+D form was an ellipse and that |z| should be constant, looping through recomputed sample roots until it hit the length cap with no boxed answer. Six of the seven passing traces also paid for that same doubt before normalizing. Round 2 showed a bare normalize-and-non-origin warning only ties held-out, so this edit instead supplies the missing certification (equal square coefficients and no xy term mean circle regardless of scale or center) that terminates the stall, then keeps the divide-by-A, complete-the-square, and box-the-answer steps."
4,3,8554,148.77,148.87,918623ddf49b0ec8c88e8becd4d23b6c8423864ccda8f888c55e8989ee25135c,696e4bd374fc53e4ff449724af00cf5f5446cd0eea489d9ede25197ca26e394b,696e4bd374fc53e4ff449724af00cf5f5446cd0eea489d9ede25197ca26e394b,0.5,0.75,0.25,0.15,0.15,0.0,2.0,2.25,0.25,147,122,kept,target-the-grading-gate-close-reasoning-by-halfway-then-one-boxed-line-no-rewrite,"Fresh round-4 rollouts under the 147-token incumbent scored 1/8. Reward requires a boxed value after the reasoning block closes: four of eight never closed it, and two closed it then began a long fresh write-up and were cut off mid-derivation, despite having already boxed the correct value inside the reasoning. Six of eight held the correct exact value by 7-16 percent of the trace, so the loss is the output protocol, not the method; the incumbent's shoelace/invariance recipe was executed essentially never (0-1 mentions). Rounds 2-3 showed extra prohibitions and a generic case-scoring rule both lose, so this revision names the grading gate, caps reasoning at the halfway mark, forbids re-deriving in the write-up, and compresses the geometry to one reusable wedge fact at 122 tokens versus 147."
4,4,25003,148.78,148.88,c3cbe0705047c147d73e4cc6abba5206011053ba9a5bfc3d932d36a3d2abb469,b549f8862c7f5a527ed865e260e7829d3f8ebbf128d18842cc92fe66e3aabbea,c3cbe0705047c147d73e4cc6abba5206011053ba9a5bfc3d932d36a3d2abb469,0.875,0.25,-0.625,0.225,0.1625,-0.0625,3.125,1.875,-1.25,153,150,discarded,shorten-jointly-calibrate-cap-both-directions-and-kill-block-boundary-doubt,"Fresh round-4 rollouts (execution 148.78) scored 2/8 with the incumbent. All six failures report one factor instead of the total, from two root causes: a belief that handing off between polynomials breaks the progression at block boundaries, which makes them discard the product they had already written and fall back to the per-polynomial cap (the two rollouts that hit the token ceiling spent their whole tail on that false contradiction), and an off-by-one in the cap in both directions, once as degree-minus-one and once as degree-plus-one interpolation points. The revision is shorter than the incumbent (150 vs 153 tokens): it drops the redundant grouping clause, pins the cap as exactly deg P in both directions, and states that all blocks lie on the same affine target so concatenation cannot break the spacing."
4,5,30418,148.81,148.89,b807d87e8e00cc91a6166db0fb3921c3d3651d016bdd936e3700d0c9bde5fa81,e05b57c7d669a0db1886b3c4e959885aeb66901d7bb3967f5a8aced472e428ee,b807d87e8e00cc91a6166db0fb3921c3d3651d016bdd936e3700d0c9bde5fa81,1.0,0.75,-0.25,0.15,0.125,-0.024999999999999994,2.5,2.0,-0.5,73,73,discarded,keep-subtract-then-exponentiate-restore-shoelace-in-cyclic-order,"Seven of eight rollouts were correct; the lone failure never subtracted the two curve equations, folded the constant output difference into the logarithm term by term, produced an irrational discriminant, and burned all 16384 tokens with no boxed value. Every success ran one identical chain: pin parameters and verify, translate the vector relation into coordinates, subtract the two curve equations so a single exponentiation clears the logs, factor the resulting quadratic, drop the root reproducing a given point, then shoelace over all four vertices in cyclic order. My discarded rounds 2 and 3 replaced that last step with a cross product at one vertex, which no success uses, and both lost training accuracy while gaining held-out. This revision keeps the transferable subtraction move and restores the shoelace finish the successes rely on, at incumbent length."
4,6,26989,148.82,148.90,67d122a90af2e0710ab939322c2a6639c7d9434bfc510d8f18475e267a2103c9,968771af184b8f79eb55626dc9d8f2a232d3e8bba1d01623922e841b4a91ff3a,67d122a90af2e0710ab939322c2a6639c7d9434bfc510d8f18475e267a2103c9,0.0,0.0,0.0,0.2125,0.1875,-0.024999999999999994,2.125,1.875,-0.25,185,193,discarded,"uncovering-first: chosen item must be uncovered, so the event is a multi-move run to write out and price, not one coin flip","All 8 fresh rollouts scored 0, and every one mis-priced part (b): six treated ""a chosen item arrives at the destination first"" as a single coin flip or a symmetry claim and answered 1/2, 1/4 or 1/k, while two declared it outright impossible. None noticed that the item must first be uncovered, i.e. that the items above it have to be relayed out of the way, so the event is a multi-move run rather than one choice. The incumbent already supplies bottom-equals-arrived-first and the forced-move weight, so this edit adds the missing uncovering step and requires the run to be written out and priced move by move, a general habit for any relay/shunting process rather than a fact about one problem."
