round,hint_id,train_qid,sampling_slurm_job_id,proposal_eval_slurm_job_id,incumbent_hash,proposal_hash,final_hash,old_train,new_train,delta_train,old_heldout,new_heldout,delta_heldout,old_J,new_J,delta_J,old_tokens,new_tokens,decision,mutation,subagent_summary
9,10,3843,148.185,148.195,c114dde1b09adf25ca78c933cba74a999d4e75ce2bcfbaaecc757f2887473b0c,3bfd6b4833a0cd966f0d693c927f5c63ad2d955e21d7d59d10a516d74033bcf2,c114dde1b09adf25ca78c933cba74a999d4e75ce2bcfbaaecc757f2887473b0c,0.375,0.625,0.25,0.15,0.125,-0.024999999999999994,1.875,1.875,0.0,106,106,discarded,replace-inert-convention-clause-with-carry-labels-not-index-maps,"Fresh rollouts under the incumbent scored 2/8 and four of the six failures died at the completion cap the same way: the student abandoned the literal row of labels for an index-to-index map, could not decide whether a slot sends or receives, derived a cycle structure that then contradicted its own written row, and spent thousands of tokens relitigating that contradiction instead of counting. The incumbent's 'if two of your own passes disagree, settle the convention once and move on' is the inert clause: every rollout detects the disagreement and none settles it. I replace it with the concrete first move that prevents the ambiguity from arising at all, keep the count-until-return loop and the composite clause that successes rely on, and hold length at the incumbent's 106 tokens."
10,1,28054,148.196,148.206,98f0bbb6f87c7e50634956da8a0905b30a66997aa33a5e4bc67a2609ec487ed8,182688b2978efaea7c9520589e85f290498e8718258a2de1381d7432e6da44f9,98f0bbb6f87c7e50634956da8a0905b30a66997aa33a5e4bc67a2609ec487ed8,0.125,0.0,-0.125,0.25,0.2,-0.04999999999999999,2.625,2.0,-0.625,77,76,discarded,replace-inert-grouping-clause-with-executable-indistinguishable-candidate-count,"Execution 148.196 scored 0 of 8: four rollouts hit the 16384-token cap and all four finishers collapsed each reading of the public value first, then argued a speaker who knows their own number can compute the partner directly, called both readings contradictory, and boxed the same wrong value. Across rounds 3, 5 and 9 no rollout has ever executed the incumbent's 'group candidates by the value that speaker privately knows' step, because that phrasing does not say what a group contains. This edit replaces the inert grouping clause with the same test stated as an executable count over the written list - how many candidates a speaker cannot tell apart, given only the public value plus their own private one - which mechanically keeps candidates from different readings in one count. It is one token shorter than the incumbent, and counting indistinguishable cases transfers to any knowledge-announcement problem."
10,2,30302,148.197,148.207,a2617d5cf40e8a99a8f74a784b3ae2a8d34000cee46fba8c99104d13b42a8740,b457348e7880e530cba5adba4b368a84a9410855245fbf913554434cb07a8e73,a2617d5cf40e8a99a8f74a784b3ae2a8d34000cee46fba8c99104d13b42a8740,1.0,1.0,0.0,0.225,0.1625,-0.0625,3.25,2.625,-0.625,70,70,discarded,swap-inert-exceptional-values-clause-for-complete-the-square-at-equal-70-tokens,"Fresh rollouts (148.197) scored 7/8; the single miss again derived the correct locus quadratic, then spent a 16384-token budget calling the unnormalized form an ellipse 55 times and hit the length cap. Clause-tracing all eight traces shows 'check exceptional values' is inert (0/8 mention any exceptional value) while completing the square is what every trace actually does (8/8, 1-7 times each) to turn its x,y equation into center-radius form. This edit therefore swaps only that one dead clause for the move the rollouts rely on, at the identical 70 tokens, keeping the w=(z-1)/z anchor (round 6 lost by generalizing it) and the geometric-or-xy fork (round 7 lost by replacing it), and appending no guard (rounds 2 and 4 lost that way)."
10,3,8554,148.198,148.208,7b7b4483667ba6211d89e8b29e80c7dfcb9f10060d9ffc62b3bffc74e364b566,7ce930f9d228f3afa1f25143713e5ab8315a49084950be279a3396a8418b4cc9,7b7b4483667ba6211d89e8b29e80c7dfcb9f10060d9ffc62b3bffc74e364b566,0.625,0.5,-0.125,0.225,0.1375,-0.0875,2.875,1.875,-1.0,169,161,discarded,lossless-compression-same-eight-clauses-169-to-161-tokens,"Rollouts scored 4/8. One never closed the reasoning block; two closed at 96-98 percent of budget and were truncated part-way through a long recap before reaching any box, and one asserted the small figure lay wholly inside the large one and boxed the containment value. So all three of this hint's clause families (close-early, box-first, coordinates-and-extent) are still the right targets. But rounds 6-9 tried replacing or deleting each of them in turn and every attempt lost held-out (0.225 down to 0.1375-0.1875), so no clause here is safely removable or improvable by rewording. The one untested move is a strictly meaning-preserving compression: same eight instructions in the same order, no step weakened, 161 Qwen tokens against the incumbent's 169. That cuts the transfer tax on ten unseen problems and wins the length tiebreak."
10,4,25003,148.199,148.209,c3cbe0705047c147d73e4cc6abba5206011053ba9a5bfc3d932d36a3d2abb469,472365c3125039f4464a79184a7b90806eb2d84e60f24d139d91cb0a01fc0de8,c3cbe0705047c147d73e4cc6abba5206011053ba9a5bfc3d932d36a3d2abb469,0.875,0.5,-0.375,0.225,0.175,-0.05000000000000002,3.125,2.25,-0.875,153,145,discarded,lossless-compression-145-vs-153-tokens-every-step-preserved,"Fresh round-10 rollouts (148.199) scored 5/8. All three failures repeat the one jam this hint has fought for six rounds: they insist a high-degree polynomial must be affine on its own block, then report a single factor (the menu size, or a per-block cap of 4, or degree-plus-one from differencing the whole sequence). Rounds 5, 6 and 7 each added a dedicated clause against exactly that jam and held-out fell every time (0.225 -> 0.1625, 0.15, 0.15), so I did not attack it again. This is instead a strictly lossless compression: 145 vs 153 tokens with every step preserved (differencing ban, index=input, shared affine target, grouping, deg-P root cap, the one-more-forces-P=L tightening, sum-across-the-menu total, block construction). Fewer tokens of identical strategy should transfer at least as well and wins the length tiebreak."
10,5,30418,148.200,148.210,1eb4e3cdd613a791abc5a6eca1cdc1c28a39f7f417b75d407c5cfcb7ed4ed992,91dab76d88c50fdfde42ff95a277ef42ad08c62dda0c077a72de55bd8b72d6a7,1eb4e3cdd613a791abc5a6eca1cdc1c28a39f7f417b75d407c5cfcb7ed4ed992,0.75,0.75,0.0,0.25,0.1875,-0.0625,3.25,2.625,-0.625,70,70,discarded,move-inert-constant-verify-into-impose-defining-equation-at-every-point,"Seven of eight rollouts were correct and none ran out of budget. The sole failure pinned the constants correctly, derived the right single-variable equation and the right root, then evaluated the defining relation at that root with a flipped sign and built the last vertex by pure vector arithmetic, never putting either derived point back through the defining equation; it boxed the resulting wrong area. Round 9's instructive failure broke the same way, so this is a twice-observed systematic weakness. The incumbent's unattached ""then verify"" sits on the constants, which all eight rollouts got right, so it is inert there; those exact tokens are moved into the operative step to name what actually needs checking - the defining equation must hold at every point, derived ones included. All other clauses, including relabel, are kept verbatim, and length is exactly at incumbent parity, 70 tokens."
10,6,26989,148.201,148.211,95b6a4b6d1196cbe4413c62b9b8de2f2fc8e18a7553bd9c85f62337bf84d3d7e,d1df3f1d6aafdbe15c8af35d52f9804d596eead56adaab2942fbac39dbae9534,95b6a4b6d1196cbe4413c62b9b8de2f2fc8e18a7553bd9c85f62337bf84d3d7e,0.25,0.25,0.0,0.25,0.1,-0.15,2.75,1.25,-1.5,177,176,discarded,replace-vague-per-step-product-with-count-the-free-moves-and-take-one-half-to-that-power,"Fresh rollouts scored 2/8 and the split is clean: both rewarded runs priced the event by writing a run of moves, noticing most moves were forced, counting only the genuinely free binary choices, and taking one half to that count. The six failures never priced a run at all: four substituted a uniform guess (1/24, 1/16, 1/4, 1/2) and two thrashed over reachability until the token limit. A clause grep of all eight shows labeling, forced-move, arrived-first and one-half language present 6-8/8 while 'sum to one', 'red flag' and 'unreachable' appear 1/8, so no clause was cut. The edit changes only the closing directive: the incumbent's abstract 'multiply true per-step probabilities along each admissible word' becomes the concrete move the winners found unaided - write the run, mark each move forced or free, count the free ones, chance is one half to that power - at 176 tokens vs 177."
10,7,3836,148.202,148.212,ab86313389de277c671789977242ca71390d684323c6bdbaf69bed67b8fdd067,beff10554e3fe5fbd0eb3e7b13a6db7a5edcabe887b1358021bf9d6feec860e9,ab86313389de277c671789977242ca71390d684323c6bdbaf69bed67b8fdd067,0.25,0.0,-0.25,0.175,0.1375,-0.03749999999999998,2.0,1.375,-0.625,70,70,discarded,replace-inert-confirm-then-commit-with-two-size-sufficiency-and-stop,"Fresh round-10 rollouts scored 1/8 and seven emitted no boxed value at all. The failure is not reaching the rule but refusing to accept it: the closest loser derived the correct signed rule from two exact small cases, then burned its remaining budget asking how to derive it ('but how' 30 times, 'must be a mistake' 5 times) and hit the cap; three others computed a correct small-case value, found a half-built theory disagreeing, declared their own arithmetic mistaken, and abandoned the table. The lone winner was the only rollout that accepted its two-size pattern and stopped. The incumbent's closing 'Confirm on one more size, then commit' feeds this: no rollout ever attempts a fourth size, and 'commit' is too vague to license stopping. I keep every clause the winner used verbatim and swap only that closing for an explicit sufficiency-plus-stop rule, at the same 70 tokens."
10,8,23443,148.203,148.213,0250077d8944cf1436c3e3ecd3d488e1d97a5eb76f0be7756ba8677ce1f1d77e,60eacc39ddfcf3f156c31699a71e14de75d3ce3d6d9724223d567bf7a3c96b3a,0250077d8944cf1436c3e3ecd3d488e1d97a5eb76f0be7756ba8677ce1f1d77e,0.75,0.625,-0.125,0.1625,0.15,-0.012500000000000011,2.375,2.125,-0.25,123,116,discarded,delete-inert-substitute-numbers-last-clause-only,"Fresh round-10 rollouts scored 7/8. All eight ran the gcd/divisor machinery and the lone failure was again a selection pick among candidates it had already listed - a fork I tried to patch in rounds 2, 4, 6 and 7 and lost held-out every time, so I left it alone. New evidence: every one of the eight summed the stage totals numerically in its opening paragraph and none introduced a symbol before arithmetic, so 'substitute numbers only at the end' is text the student never executes. This is a single-clause deletion of that inert phrase with every load-bearing move kept verbatim: no rule, prohibition, tiebreak or paraphrase added. 116 tokens versus 123, and my only two wins for this hint (rounds 3 and 5) were evidence-backed deletions."
10,9,3980,148.204,148.214,3177fd8ccc06120f7993d61571961edc2bb39f823ba9696ca131a1da2bfbe076,ffa54d84e60039ef795bd61054adb7bab0cf61601accfc3776e3582675ac8b1a,3177fd8ccc06120f7993d61571961edc2bb39f823ba9696ca131a1da2bfbe076,0.375,0.875,0.5,0.2375,0.175,-0.0625,2.75,2.625,-0.125,152,148,discarded,replace-read-outputs-from-relation-with-three-concrete-evaluation-moves-reflect-swap-fixedpoint,"0/8 this round: every rollout hit the 16384-token cap with nothing boxed. All eight adopted the symmetry ansatz, so that part works, but the incumbent's 'read the requested outputs straight from the symmetry relation' says what to achieve without naming any operation, so each fell back to solving for the cubic's coefficients, produced fractional or contradictory ones, and looped ('contradiction' 1-21 times per rollout, two concluding no such polynomials exist). This replaces that inert directive with the three concrete evaluation moves the relation actually supplies - reflect an unknown argument onto a known one, swap maps via q = s - p, and use the center as a fixed point - so values are obtainable with no coefficients at all. These moves are generic to any point-symmetry functional equation, and it is shorter than the incumbent (148 vs 152 tokens)."
10,10,3843,148.205,148.215,c114dde1b09adf25ca78c933cba74a999d4e75ce2bcfbaaecc757f2887473b0c,8f7b8e1d1d6e2d9340e42495d567be9a197bd3fa8ed7642d587f47ff305db523,8f7b8e1d1d6e2d9340e42495d567be9a197bd3fa8ed7642d587f47ff305db523,0.375,0.625,0.25,0.15,0.15,0.0,1.875,2.125,0.25,106,102,kept,tabulate-three-measured-rows-before-any-general-argument,"Six of eight rollouts (1/8 correct) hit the 16384-token cap: after measuring only the single smallest case they jumped to an open-ended symbolic composite-permutation argument and spent thousands of tokens re-litigating their own contradictory cycle bookkeeping, never boxing anything; the one success simply measured two sizes and generalized. The incumbent's 'convention slipped' sentence appears in none of the eight traces, and 'get one more size the same way' is too vague to hold them there, so both are replaced by one concrete, countable gate - three measured rows in a parameter-versus-count table before any general argument, then one formula checked against every row. This is shorter than the incumbent and should transfer to any 'in terms of n' question by forcing data collection to finish before abstraction starts."
11,1,28054,148.216,148.226,98f0bbb6f87c7e50634956da8a0905b30a66997aa33a5e4bc67a2609ec487ed8,4a6d84902d204082802cc871c8cd5d8ab0ad083a986492093013f326658c0c16,98f0bbb6f87c7e50634956da8a0905b30a66997aa33a5e4bc67a2609ec487ed8,0.125,0.0,-0.125,0.25,0.225,-0.024999999999999994,2.625,2.25,-0.375,77,65,discarded,lossless-compression-77-to-65-tokens-all-six-incumbent-steps-retained-including-original-set-clause,"Execution 148.216 scored 2 of 8. Three failures hit the 16384-token cap; the finishing failures each fixed one reading of the public value, showed inside it that a speaker who knows their own number can compute the partner, called it contradictory, and then boxed a number from that same discarded reading. Both winners did the same thing but happened to land on the right value, so the training signal here is close to noise and does not indicate any missing step. Rounds 1-5, 7, 9 and 10 all added or swapped a clause at or above incumbent length and every one lost held-out, and round 8 showed that deleting the trailing original-set clause also costs held-out, so it is not inert. This proposal therefore changes no step and drops no clause: all six moves stay in the same order and meaning, with only redundant wording removed, 77 tokens down to 65."
11,2,30302,148.217,148.227,a2617d5cf40e8a99a8f74a784b3ae2a8d34000cee46fba8c99104d13b42a8740,7bc56fd5247b663783b60935f478d5e0012e4f8fade919632c4908e90c51b256,a2617d5cf40e8a99a8f74a784b3ae2a8d34000cee46fba8c99104d13b42a8740,1.0,1.0,0.0,0.225,0.125,-0.1,3.25,2.25,-1.0,70,68,discarded,lossless-compression-of-xy-equation-phrase-68-tokens-instead-of-70,"Fresh rollouts (148.217) scored 8/8 with zero ellipse/length-cap stalls, so no instruction is missing and no clause can be honestly cut: clause-tracing all eight shows each surviving element is used (divide by the power 3-11x, the w substitution 17-49x, w on a circle, inverting the Mobius relation 4-35x, an x,y equation 2-22x, all-roots 8/8, and 6/8 reason about an excluded/degenerate value). Every semantic variant has already lost for this hint: generalizing w=(z-1)/z (r6), replacing the geometric-or-xy fork (r7), deleting or swapping the exceptional-values clause (r8, r10), changing the closing verb (r9), and appending guards (r2, r4). The only untried lever is the one that won round 3 (81->70 tokens, J 3.00->3.25): a strictly lossless compression. 'by an equation in x and y' becomes 'by an x,y equation' - identical meaning, same six steps in the same order, 68 tokens versus 70."
11,3,8554,148.218,148.228,7b7b4483667ba6211d89e8b29e80c7dfcb9f10060d9ffc62b3bffc74e364b566,e26b2dafa537713cba64a1570cb0fae51475f02dbe97712dc7a92891671fedcc,7b7b4483667ba6211d89e8b29e80c7dfcb9f10060d9ffc62b3bffc74e364b566,0.625,0.625,0.0,0.225,0.1125,-0.1125,2.875,1.75,-1.125,169,169,discarded,replace-vague-confirming-check-with-concrete-value-twice-by-two-routes-stop-rule,"Rollouts scored 8/8; every one closed the reasoning block and boxed a value, so the output-protocol clauses are working. The remaining risk is the stop criterion: each trace reached the correct exact value by 6-16 percent of its budget, then re-derived it 26-51 more times, because 'one confirming check' names no condition that can ever be observed as satisfied, and prior rounds show truncation is this hint's main failure mode when the search drags on. This edit swaps that vague phrase for the concrete, checkable event the successful traces already produce - the same exact value arriving twice by two different routes - leaving every other clause byte-identical and the hint at exactly the incumbent's 169 tokens, so nothing the successes rely on is removed and no length tax is added."
11,4,25003,148.219,148.229,c3cbe0705047c147d73e4cc6abba5206011053ba9a5bfc3d932d36a3d2abb469,d441a517d63e5fc5098ecc3692b091d3348041793e26e307a75346d3a74851bf,c3cbe0705047c147d73e4cc6abba5206011053ba9a5bfc3d932d36a3d2abb469,0.875,1.0,0.125,0.225,0.2125,-0.012500000000000011,3.125,3.125,0.0,153,150,discarded,state-the-root-count-theorem-that-licenses-the-per-polynomial-cap-150-vs-153-tokens,"Fresh round-11 rollouts (148.219) scored 5/8. The three failures all replace the per-polynomial capacity with a coefficient-counting heuristic instead of a root count: one asserts a degree-d polynomial 'passes through d+1 points because it has d+1 coefficients' and reports that, one caps a block at two inputs, one at one input and reports the menu size. Interpolation/determined-by language is dense in every failure and near-absent in the correct rollouts. The incumbent asserts the cap is deg P but never states WHY, so the student substitutes the wrong theorem. This edit inserts the one licensing fact - a nonzero degree-d polynomial has at most d roots - and is shorter than the incumbent (150 vs 153 tokens) with every prior step preserved."
11,5,30418,148.220,148.230,1eb4e3cdd613a791abc5a6eca1cdc1c28a39f7f417b75d407c5cfcb7ed4ed992,8eda59dfe658a56a0d02a73e89d5faef9f6249166bbe3cf4b8c061a13f1cfa90,1eb4e3cdd613a791abc5a6eca1cdc1c28a39f7f417b75d407c5cfcb7ed4ed992,0.75,0.875,0.125,0.25,0.1125,-0.1375,3.25,2.0,-1.25,70,68,discarded,verify-constants-in-original-conditions-replacing-inert-relabel-clause,"Three of eight rollouts scored; four failures ended in finish_reason=length. Two died from one mechanism: after pinning the unknown constants they mis-cleared a fraction, then ""verified"" the result against their own derived linear equation instead of the given data, so a wrong parameter pair propagated and consumed the whole budget. The non-length failure obeyed every clause and even computed the target two ways, but had read one value off an inverse operator with a flipped sign that no self-consistent check could catch. So the incumbent's unattached ""then verify"" is made executable: verify pinned constants in the original stated conditions, not in your own derived lines. It is funded by cutting ""a zero or impossible intermediate means relabel, not restart"", which is inert - no rollout in rounds 6-11 ever relabels. Length stays at incumbent parity."
11,6,26989,148.221,148.231,95b6a4b6d1196cbe4413c62b9b8de2f2fc8e18a7553bd9c85f62337bf84d3d7e,f2acaaaa80b3ab041f5afe08a5743d1719ca24a04ee7401116700f1da8887ff2,95b6a4b6d1196cbe4413c62b9b8de2f2fc8e18a7553bd9c85f62337bf84d3d7e,0.25,0.0,-0.25,0.25,0.1875,-0.0625,2.75,1.875,-0.875,177,176,discarded,add-two-moves-per-item-run-length-fact-inside-lossless-compression-177-to-176-tokens,"Fresh rollouts scored 2/8. The one error all eight share is run length: every rollout sized a run as one move per item (""4 moves"", 16 or 2^3 sequences) instead of a push plus a pop, and only one ever said an item moves twice. That single miscount produced every wrong answer (1/16, 1/2, 1/4, 1/24) and drove the four length-limit runs, which thrashed over reachability because their too-short words could not realize the event. The push/pop, labeling and arrived-first clauses are used 7-8/8, so nothing is cut; sum-to-one, unreachable and red-flag appear only 1/8 but rounds 6 and 7 lost held-out when those were removed, so they stay. The edit inserts one concrete counting fact early and pays for it by lossless rewording, landing at 176 tokens versus the incumbent's 177."
