round,hint_id,train_qid,sampling_slurm_job_id,proposal_eval_slurm_job_id,incumbent_hash,proposal_hash,final_hash,old_train,new_train,delta_train,old_heldout,new_heldout,delta_heldout,old_J,new_J,delta_J,old_tokens,new_tokens,decision,mutation,subagent_summary
13,5,30418,148.260,148.270,1eb4e3cdd613a791abc5a6eca1cdc1c28a39f7f417b75d407c5cfcb7ed4ed992,a4bb0dc2d504ab67946f549cafec09ae1fa9733acb34ef21a35ce6e255bf12a6,1eb4e3cdd613a791abc5a6eca1cdc1c28a39f7f417b75d407c5cfcb7ed4ed992,0.75,0.875,0.125,0.25,0.125,-0.125,3.25,2.125,-1.125,70,67,discarded,replace-inert-relabel-clause-with-stay-in-exact-fractions,"5/8 correct. The three failures are separated from the five successes by one measurable behaviour: each failure switched to decimal approximations (35, 105 and 143 numeric estimates) after reaching an awkward root, then spent the rest of the budget comparing approximate candidate values and never boxed anything; every success stayed in fractions and finished under 27k characters. Meanwhile the incumbent's 'a zero or impossible intermediate means relabel, not restart' clause appears in zero rollouts across every round I have, so it is inert transfer tax. This edit spends those tokens on a positive, executable instruction to stay in exact fractions, which should generalise to any unseen problem where an approximation invites an endless numeric search instead of a committed answer, and it is shorter than the incumbent (67 vs 70 tokens)."
13,6,26989,148.261,148.271,95b6a4b6d1196cbe4413c62b9b8de2f2fc8e18a7553bd9c85f62337bf84d3d7e,65d8c40eac29d3bc15c2f75c434fa560f0bbd5719e70c7d7a31edc8496dee487,95b6a4b6d1196cbe4413c62b9b8de2f2fc8e18a7553bd9c85f62337bf84d3d7e,0.25,0.125,-0.125,0.25,0.1875,-0.0625,2.75,2.0,-0.75,177,177,discarded,swap-inert-sum-to-one-check-for-uncovering-consequence-clause-equal-length,"3/8 correct. Every failure mishandled the buried-item part: three rollouts asserted each item is equally likely to arrive first or last and quoted 1/k, one priced a run only two moves long, and one declared the outcome impossible. The incumbent already says the destination's bottom arrived first, and one rollout used that, but none drew the missing consequence that a buried item can only arrive first after everything stacked above it has been moved, so the deciding prefix is several steps, not one choice. I add that consequence as a short clause and drop the sum-to-one branch check, which zero of eight rollouts executed here and in rounds 9-12. Net token count is unchanged, so the edit trades inert text for the fact the failures lacked."
13,7,3836,148.262,148.272,ab86313389de277c671789977242ca71390d684323c6bdbaf69bed67b8fdd067,1a6b078eece107880a89e7890c3ddeca4970897a527a55d198470e49bdeac922,ab86313389de277c671789977242ca71390d684323c6bdbaf69bed67b8fdd067,0.25,0.125,-0.125,0.175,0.1125,-0.062499999999999986,2.0,1.25,-0.75,70,70,discarded,replace-inert-fourth-size-confirm-with-backcheck-rule-against-recorded-entries,"Fresh round-13 rollouts scored 0/8. Six hit the 16384-token cap with no boxed value, and the mechanism in the two that finished is new and precise: both reached a correct structural setup, then extracted the requested coefficient from it with an unjustified step and committed to that value without ever testing it against a small case - one had already computed a small case and dismissed it as inconsistent rather than using it as a check. The incumbent closing clause is measurably inert: no rollout attempts a fourth size and lowercase confirm appears zero times in all eight traces. So I spend those tokens on the back-check the finishers were one step from doing - test the derived rule against the entries already recorded - and pay for it by merging the twin prohibitions, a rewording round 11 showed is held-out-neutral. Same 70 tokens as the incumbent."
13,8,23443,148.263,148.273,0250077d8944cf1436c3e3ecd3d488e1d97a5eb76f0be7756ba8677ce1f1d77e,73f4e61c5df1737302777f8176c7d98e78d256b71c468e08d5cfb5136cf20eaa,0250077d8944cf1436c3e3ecd3d488e1d97a5eb76f0be7756ba8677ce1f1d77e,0.75,0.125,-0.625,0.1625,0.1,-0.0625,2.375,1.125,-1.25,123,123,discarded,restore-percent-base-and-sum-then-divide-once-at-zero-token-cost,"All three failures in my 8 rollouts followed the hint correctly through the gcd step, listed the admissible divisor candidates, then abandoned that list and substituted the stated grouping count as the item count on a bare plausibility argument; the five successes instead summed the stage totals, divided once by a candidate, and applied the markup as a multiplier on cost. Explicit largest-admissible tiebreaks (rounds 2, 6) and plausibility prohibitions (round 4) all bought training and lost held-out, so instead I restore the two concrete computational moves the successes actually used - sum-then-divide-once ordering and naming the percent's base as cost rather than price - which co-occurred with this hint's best-ever held-out, and I pay for them by lexical compression so the hint is no longer than the incumbent and the grouping clause the successes rely on stays intact."
13,9,3980,148.264,148.274,391f18d0a38c1a07058f9782b12c580bfb7fb5aae04b069b173f7d17d3e75563,2f802b3935a71e45572a1af729a503825bb204dbaa72fea5caa7a60831087cd1,391f18d0a38c1a07058f9782b12c580bfb7fb5aae04b069b173f7d17d3e75563,0.375,0.125,-0.25,0.2625,0.1875,-0.07500000000000001,3.0,2.0,-1.0,147,145,discarded,lossless-function-word-compression-requiring-and-one-free-parameter,"3/8 rollouts were correct and all finished normally near 10-12k tokens; the 5 failures every one hit the 16384-token cap while re-litigating WHAT the involution links, trying q(x)=p(s-x), then q=s-p(x)+k, then guessing s by trial, or falling back to full coefficient expansion. That is the same wall seen every round since round 2, and my manifest shows all six semantic fixes for it (explicit s formula, centered odd-power form, expand-identity-alone, three evaluation moves, direct f=s-g notation, half-budget rule) each LOST held-out. So this round is a strictly lossless compression instead: every content phrase is byte-identical and only two function-word choices change (and require -> requiring; a single -> one), for 147 -> 145 tokens. It cannot raise transfer, but it converts a held-out tie into a win, which is how the last four keeps in this book happened."
13,10,3843,148.265,148.275,8f7b8e1d1d6e2d9340e42495d567be9a197bd3fa8ed7642d587f47ff305db523,b16558170a72228905bda0c1a08acbd0e75da5fb56dd9ff8db39a9af998e0073,8f7b8e1d1d6e2d9340e42495d567be9a197bd3fa8ed7642d587f47ff305db523,0.625,0.5,-0.125,0.15,0.1375,-0.012499999999999983,2.125,1.875,-0.25,102,102,discarded,replace-weak-close-with-explicit-license-to-stop-once-formula-matches-measured-rows,"Fresh rollouts scored 2/8 and five of six failures hit the 16384-token cap with one shape: each measured the two smallest sizes by writing states, then abandoned measuring for a symbolic cycle-order argument, generated several contradicting candidate periods, and kept trying to justify one rather than commit - one recited the composite clause three times and still read the period off transpositions; none boxed anything. Both successes stopped the moment a pattern fit their measured sizes and boxed immediately. So the incumbent's closing 'check it reproduces every row, and box it rather than listing rivals' is too weak: it never tells the student that agreement with the measured rows is sufficient licence to stop. I replace it with an explicit stop rule, keep the table and composite clauses the successes rely on, and hold length at the incumbent's exact 102 tokens."
14,1,28054,148.276,148.286,98f0bbb6f87c7e50634956da8a0905b30a66997aa33a5e4bc67a2609ec487ed8,8f6f9106ef30409d92554e301d73f5af9ee33d3e191d69ec56bfe481ff1440fe,98f0bbb6f87c7e50634956da8a0905b30a66997aa33a5e4bc67a2609ec487ed8,0.125,0.125,0.0,0.25,0.2125,-0.037500000000000006,2.625,2.25,-0.375,77,76,discarded,make-grouping-key-explicit-and-count-based-at-equal-or-shorter-length,"Fresh rollouts (execution 148.276, 2 of 8 correct) show the same recurring failure: three of eight hit the 16384-token cap and four of the stopping runs declared both readings of the shown number contradictory and then committed to a guessed pair anyway. Half the runs never grouped anything at all - the incumbent's 'group candidates by the value that speaker privately knows' is abstract enough that they argue uniqueness in prose instead of building groups. This edit keeps all six incumbent steps but names the group key executably (what that speaker alone sees: the public number plus their own value) and turns the not-knowing test into a group-size count, which is the same mechanical move in any announcement puzzle, at one token shorter than the incumbent."
14,2,30302,148.277,148.287,a2617d5cf40e8a99a8f74a784b3ae2a8d34000cee46fba8c99104d13b42a8740,d372e76d9f947ddaa55aef2356187944aaea2cc6c02775aa4d4aa9ab96fec173,a2617d5cf40e8a99a8f74a784b3ae2a8d34000cee46fba8c99104d13b42a8740,1.0,1.0,0.0,0.225,0.125,-0.1,3.25,2.25,-1.0,70,70,discarded,swap-inert-exceptional-values-clause-for-explicit-distance-invariant-at-equal-70-tokens,"Fresh rollouts (148.277) scored 8/8, so train is saturated and the only lever is transfer. Six of eight traces first solved the Mobius relation, parametrized w on its circle, computed |z| as a function of the angle, discovered it was not constant, and stalled ('mistake'/'Wait' in 7-8 of 8) before recovering; the traces that escaped did so by rewriting the ratio condition as the distance relation |z-1|=R|z|. Meanwhile 'check exceptional values' appeared in zero of the eight traces, so it is inert transfer tax. This edit swaps that dead clause for the concrete invariant every root satisfies, at the incumbent's exact 70 tokens, keeping the locus-characterization and all-roots steps the successful traces rely on."
14,3,8554,148.278,148.288,7b7b4483667ba6211d89e8b29e80c7dfcb9f10060d9ffc62b3bffc74e364b566,5567937431a5057a43561ade30171fee4ff7aef0395f92fd007eddf86eb16fb7,7b7b4483667ba6211d89e8b29e80c7dfcb9f10060d9ffc62b3bffc74e364b566,0.625,0.25,-0.375,0.225,0.2,-0.024999999999999994,2.875,2.25,-0.625,169,164,discarded,replace-vague-stop-check-and-symmetry-declaration-with-construction-plus-proved-bound-certificate-as-close-trigger,"Rollouts scored 4/8 and every one of the eight burned 10.7k-16.4k tokens in unbounded search (16-58 'Alternatively', 96-139 rotation mentions); two closed at 96-98 percent of budget and were truncated mid-write-up before any box, one never closed, and one boxed a value it had asserted in prose. The incumbent's stop trigger, 'one exact value plus one confirming check', names no observable event, and its symmetry clause is what let the non-closing trace declare the overlap rotation-independent without proof. This edit replaces both with the certificate a strong solver actually produces on any extremum problem - one explicit configuration plus one proved inequality nothing beats - and makes their agreement the close trigger, at 164 tokens versus 169."
14,4,25003,148.279,148.289,e0ca78c56f30a95ccffa6bbca03e866e7e92dfbb723570c1181e9524f64d335b,917c2bf108ac88a7fc271c94e7f443573766e95b3f9c6679e545e0db7bc374ff,e0ca78c56f30a95ccffa6bbca03e866e7e92dfbb723570c1181e9524f64d335b,0.875,0.75,-0.125,0.225,0.175,-0.05000000000000002,3.125,2.5,-0.625,146,142,discarded,lossless-syntactic-compression-drop-redundant-the-equation-and-copula-142-vs-146-tokens,"Fresh rollouts scored 6/8 (execution 148.279). Both failures misapplied the per-polynomial capacity: one picked a block length of 2 after briefly guessing 6, the other reported the degree factor alone and dropped the menu entirely. Every semantic fix for that gap has already been tested for this hint and lost held-out (explicit menu-size-times-degree in rounds 2 and 13, cap pinning in rounds 4, 8 and 11), so I did not re-test it. Instead this is a strictly lossless compression of the incumbent: the only change deletes the redundant words 'the equation' and the copula 'it is' where an appositive immediately restates the same thing. Every content phrase, step and ordering is byte-identical, so held-out should tie while 142 tokens beats 146 on the length tie-break, which is how the last four keeps in this book happened."
14,5,30418,148.280,148.290,1eb4e3cdd613a791abc5a6eca1cdc1c28a39f7f417b75d407c5cfcb7ed4ed992,5cc90e15c8543da6b089ddccd0bd92a003c3d9d9a23b2dbeeb23b84c46407631,1eb4e3cdd613a791abc5a6eca1cdc1c28a39f7f417b75d407c5cfcb7ed4ed992,0.75,0.75,0.0,0.25,0.1375,-0.11249999999999999,3.25,2.125,-1.125,70,68,discarded,lossless-compression-delete-two-commas-only,"3/8 correct; all four misses ended in finish_reason=length with no boxed answer. Each pinned the constants, then mis-signed or mis-paired a term while clearing the single-unknown fractional equation, landed on a surd/negative discriminant or a no-real-root dead end, and spent the remaining budget re-litigating the setup, numerically probing sample points, or guessing round values. The one non-length miss solved the whole chain correctly but built the fourth vertex by vector arithmetic and boxed a wrong area. Every incumbent clause is jointly needed and eleven straight clause swaps here have lost held-out, so I made NO strategy change. This is a strictly lossless compression: two commas removed and nothing else. The word sequence is byte-identical to the incumbent, so meaning, steps and order are provably unchanged; 68 tokens versus 70, so it can only win on the length tiebreak."
14,6,26989,148.281,148.291,95b6a4b6d1196cbe4413c62b9b8de2f2fc8e18a7553bd9c85f62337bf84d3d7e,e64f97e23626cd3b726aa52d8740f627fe7f8a230645491fa857bd91465c19e1,e64f97e23626cd3b726aa52d8740f627fe7f8a230645491fa857bd91465c19e1,0.25,0.125,-0.125,0.25,0.2625,0.012500000000000011,2.75,2.75,0.0,177,176,kept,reorder-bottom-fact-so-arrived-first-is-adjacent-to-lands-at-the-bottom-176-vs-177-tokens,"Fresh rollouts scored 3/8. The one error shared by seven of the eight is direction: they wrote that the destination's bottom is the LAST item delivered and then priced that, giving 1/4, 1/24 or 0. The incumbent states the correct fact but orders it top-then-bottom, so 'arrived last' is the nearest phrase before 'lands at the bottom' and the 1.7B student mis-binds them. This edit only swaps those two sub-clauses so 'its bottom whatever arrived first' sits immediately next to 'lands at the bottom'; no clause is added, dropped or reworded elsewhere, so every clause the three rewarded rollouts lean on (labeling 8/8, push/pop 7/8, one-half 8/8, forced 2/8) survives, and it lands at 176 tokens versus the incumbent's 177. Round 12 lost by deleting the 'arrived last' half; here it is kept."
14,7,3836,148.282,148.292,ab86313389de277c671789977242ca71390d684323c6bdbaf69bed67b8fdd067,f7962bacf113f079af339afc38d247da1aec7403c9cd134207961333daa3d20a,ab86313389de277c671789977242ca71390d684323c6bdbaf69bed67b8fdd067,0.25,0.0,-0.25,0.175,0.15,-0.024999999999999994,2.0,1.5,-0.5,70,74,discarded,shrink-with-one-equation-per-unknown-plus-merge-twin-prohibitions,"Fresh rollouts scored 1/8. Five of the eight did obey the incumbent and shrank the parameter, but shrank only the unknowns while keeping the equation ladder running past that count; the resulting over-determined tiny system forced 0=1, so they declared 'no solution / my model must be wrong' and thrashed to the 16k cap without any boxed value. The lone winner shrank both counts together and read the rule off its table. The incumbent says which parameter to shrink but never how many relations to keep, so 'one equation per unknown' supplies the missing concrete step and should transfer to any unseen problem whose small case must stay solvable. The twin prohibitions are merged into one clause (lossless in round 11) to pay part of the cost."
14,8,23443,148.283,148.293,0250077d8944cf1436c3e3ecd3d488e1d97a5eb76f0be7756ba8677ce1f1d77e,f081a6acf79c23e1b8c1fb2662a93a1c6f157b51226cd3f77fc66b733292e4fe,0250077d8944cf1436c3e3ecd3d488e1d97a5eb76f0be7756ba8677ce1f1d77e,0.75,0.5,-0.25,0.1625,0.1375,-0.024999999999999994,2.375,1.875,-0.5,123,121,discarded,drop-inert-grouping-prohibition-for-percent-base-and-sum-then-divide-once,"Fresh rollouts scored 5/8; all eight reached the same divisibility reduction and the correct divisor list, so the setup half of the hint is working and the three failures came only at selection, where the student reused a stated grouping number as the item count. The incumbent's grouping sentence does not prevent that: two of the three failures echoed it and picked the grouping number anyway, so it is an inert prohibition rather than a decider. It also crowds out the two concrete operations the one variant that ever beat this slot's held-out was carrying: naming the base a percent multiplies, and summing the parts before a single division. This edit drops the inert clause for those two executable moves and is shorter than the incumbent."
14,9,3980,148.284,148.294,391f18d0a38c1a07058f9782b12c580bfb7fb5aae04b069b173f7d17d3e75563,9e56476f0fdba062491de16b7915ad21a91d956c12009c6040a047891c04d37b,391f18d0a38c1a07058f9782b12c580bfb7fb5aae04b069b173f7d17d3e75563,0.375,0.75,0.375,0.2625,0.2,-0.0625,3.0,2.75,-0.25,147,146,discarded,replace-inert-read-outputs-clause-with-concrete-eliminate-one-map-single-coefficient-set,"3 of 8 rollouts scored; all five failures burned the full 16384-token cap. The split is a single concrete move: every winner first expressed one map as the constant minus the other and then carried only one coefficient set, while the failures either kept two independent general cubics (eight unknowns) or adopted a wrong reflected variant, then thrashed (27-46 'Alternatively' pivots versus 7-14 in winners). Meanwhile the incumbent clause 'read the requested outputs straight from the symmetry relation rather than solving for every coefficient' appears nowhere in any of the eight traces and is contradicted by the winners, who do solve reduced coefficient relations - it is inert transfer tax. Swapping it for the one move the successes actually execute should generalize to any identity-linked pair of maps, and the hint is one token shorter than the incumbent."
14,10,3843,148.285,148.295,8f7b8e1d1d6e2d9340e42495d567be9a197bd3fa8ed7642d587f47ff305db523,4d76122324845240d919069af1c69403215cf6a85720c161a8ccec8916027918,8f7b8e1d1d6e2d9340e42495d567be9a197bd3fa8ed7642d587f47ff305db523,0.625,0.25,-0.375,0.15,0.1625,0.012500000000000011,2.125,1.875,-0.25,102,101,discarded,replace-inert-composite-clause-with-row-closes-only-on-a-written-state,"Fresh rollouts scored 5/8; both failures that hit the length cap had written correct small states, then abandoned them to argue the steps are independent transpositions of order 2, and thrashed between rival exponents to the cap without boxing anything. No rollout referenced the incumbent's abstract 'a composite does not inherit the period of its parts' clause, so it is transfer tax. This edit spends those tokens on the executable version of the same idea: a table row closes only when a state you actually wrote equals the start, never on a structural argument. It keeps the definition, literal-run, three-row and box-one-formula steps the five successes relied on, and is one token shorter than the incumbent."
15,1,28054,148.296,148.306,98f0bbb6f87c7e50634956da8a0905b30a66997aa33a5e4bc67a2609ec487ed8,f3a6f63435d475a974ed8ce80cbe0fc2c91183ecfe96df0bbdd7954ce1daf8b9,98f0bbb6f87c7e50634956da8a0905b30a66997aa33a5e4bc67a2609ec487ed8,0.125,0.0,-0.125,0.25,0.1625,-0.0875,2.625,1.625,-1.0,77,68,discarded,add-converse-knowing-keeps-unique-groups-rule-and-drop-inert-original-set-clause-77-to-68-tokens,"Execution 148.296 scored 1/8. Seven of eight rollouts enumerated the candidates correctly and correctly derived that under one reading each speaker WOULD know the partner, then still reported a candidate they had just written was contradictory; the single success was the run that instead concluded that reading retains nothing and finished the other. The incumbent only states the deletion rule for 'not knowing' and never states its converse, so the student has no positive rule turning 'that speaker would know' into a kept-or-killed verdict and drifts back to an eliminated candidate. This edit adds that converse in five tokens and pays for it by dropping the 'do not reason from the original set' clause, which rounds 8 and 11 showed inert (identical held-out whether kept or removed), leaving the hint 9 tokens shorter than the incumbent with all load-bearing steps intact."
15,2,30302,148.297,148.307,a2617d5cf40e8a99a8f74a784b3ae2a8d34000cee46fba8c99104d13b42a8740,df6135fdf7996b31e51443c31a26ed39abe9bf5b83893fc05a27de1db06faab8,a2617d5cf40e8a99a8f74a784b3ae2a8d34000cee46fba8c99104d13b42a8740,1.0,0.875,-0.125,0.225,0.15,-0.07500000000000001,3.25,2.375,-0.875,70,68,discarded,swap-two-inert-clauses-for-early-modulus-inversion-plus-normalize-squared-term-coefficient-at-68-tokens,"Fresh rollouts (148.297) scored 7/8. The single failure reached the correct x,y locus equation but its squared-term coefficient was not 1, so it looped ~49 times debating ellipse versus circle, even deriving the right center and radius then re-doubting, and hit the length cap without ever boxing an answer; it had also burned most of its budget parametrizing w by angle before finally inverting to a relation in z. Two incumbent clauses are inert here: 'geometrically' appeared in 1 of 8 traces and 'exceptional values' in 0 of 8. This revision spends those tokens on the two concrete moves the evidence demands - invert to |z-1|=R|z| immediately instead of parametrizing, and normalize the common squared-term coefficient - and is 68 tokens versus the incumbent's 70."
