round,hint_id,train_qid,sampling_slurm_job_id,proposal_eval_slurm_job_id,incumbent_hash,proposal_hash,final_hash,old_train,new_train,delta_train,old_heldout,new_heldout,delta_heldout,old_J,new_J,delta_J,old_tokens,new_tokens,decision,mutation,subagent_summary
8,2,30302,148.157,148.167,a2617d5cf40e8a99a8f74a784b3ae2a8d34000cee46fba8c99104d13b42a8740,5464a8353eddc020b4ddb36a2c0a027cd5c3048e1f084775f555d6483107203d,a2617d5cf40e8a99a8f74a784b3ae2a8d34000cee46fba8c99104d13b42a8740,1.0,1.0,0.0,0.225,0.15,-0.07500000000000001,3.25,2.5,-0.75,70,69,discarded,name-the-image-of-the-whole-circle-and-drop-unused-exceptional-values-clause,"Fresh rollouts (execution_id 148.157) scored 8/8, so nothing on train is broken and the gap is transfer. Clause-tracing all eight shows two things: every trace relaxed the finite root set to the FULL circle and took the image of that circle (8/8), the step the incumbent leaves implicit behind a bare 'image locus'; and only 2 of 8 ever mentioned an exceptional value, so 'check exceptional values' is inert text that costs transfer. This edit therefore names the move the rollouts actually make and drops the unused clause, at 69 tokens versus 70. It deliberately keeps the concrete w=(z-1)/z anchor (round 6 lost by generalizing it) and keeps the geometric-or-xy fork (round 7 lost by replacing it with a rigid procedure), and it appends no guard (rounds 2 and 4 lost that way)."
8,3,8554,148.158,148.168,7b7b4483667ba6211d89e8b29e80c7dfcb9f10060d9ffc62b3bffc74e364b566,6b5cf90e1ebf7b33d6cdacb148f4bb1737cf362f311d3319b633262a9558e684,7b7b4483667ba6211d89e8b29e80c7dfcb9f10060d9ffc62b3bffc74e364b566,0.625,0.5,-0.125,0.225,0.1375,-0.0875,2.875,1.875,-1.0,169,137,discarded,delete-the-inert-box-first-ordering-clause-only,"Fresh rollouts scored 7/8; all eight closed the reasoning block and all eight ended on a box, and in every one the first box sits at 96-99 percent of the write-up, after a full 'To determine...' recap. So the incumbent's clause ordering the box first with explanation after it was disobeyed 8/8 here and 8/8 in round 6: it is inert text paying transfer tax on ten unseen problems. This edit deletes only that sentence and leaves every other word byte-identical, so the opening grading rule, the close-early rule, the no-restart rule, the coordinate/extent setup and the invariance and sum-minus-overlap facts that the successful traces actually execute are all preserved, while the hint drops from 169 to 137 tokens. The one failure was a method slip (overlap taken as the whole small square), which no output-protocol wording addresses."
8,4,25003,148.159,148.169,c3cbe0705047c147d73e4cc6abba5206011053ba9a5bfc3d932d36a3d2abb469,eee1e5f42332cbcafef2487a0df18a7f86beb451b0fa61e2a6d52f2b876c1fd1,c3cbe0705047c147d73e4cc6abba5206011053ba9a5bfc3d932d36a3d2abb469,0.875,0.625,-0.25,0.225,0.1375,-0.0875,3.125,2.0,-1.125,153,148,discarded,lossless-compress-and-pin-cap-via-surviving-leading-coefficient,"Fresh round-8 rollouts (execution 148.159) scored 5/8. All three failures share one mechanical slip: they compute the degree of P(x)-L(x) by subtracting degrees (deg P minus 1) instead of reading its surviving leading coefficient, so the per-polynomial capacity comes out one too small and the reported total is short by one menu's worth; both truncated rollouts then oscillate on whether a high-degree polynomial must be linear and never commit. The edit is a lossless compression of the incumbent (148 vs 153 tokens, every step kept) that spends the freed words on the leading-coefficient cue and pins the capacity as deg P, never deg P minus one."
8,5,30418,148.160,148.170,1eb4e3cdd613a791abc5a6eca1cdc1c28a39f7f417b75d407c5cfcb7ed4ed992,4eee59a99aa6cb1b402c1fb4c67bd5c56ef610e89b03ece46f71a48a7b6c90ca,1eb4e3cdd613a791abc5a6eca1cdc1c28a39f7f417b75d407c5cfcb7ed4ed992,0.75,0.25,-0.5,0.25,0.15,-0.1,3.25,1.75,-1.5,70,70,discarded,undo-inverse-operator-into-polynomial-form-replacing-inert-relabel-clause,"Five of eight rollouts scored. All three failures broke at one identical step: they kept the defining relation in inverse (logarithmic) form and mis-manipulated it when combining two conditions, producing a negative discriminant or a collapsed identity, then spent the rest of the budget re-litigating the setup. Every success instead converted the relation once into an inverse-free algebraic form and worked polynomially; round 7 showed the same split. So the incumbent's 'a zero or impossible intermediate means relabel, not restart' clause is replaced by that concrete first move - undo logs, roots and exponents before substituting. The clause removed is provably inert: no rollout in rounds 5-8 ever relabels. Length is unchanged at 70 tokens, and this is a positive setup instruction rather than a caution, so it should transfer to any unseen problem whose conditions hide behind an inverse operator."
8,6,26989,148.161,148.171,67d122a90af2e0710ab939322c2a6639c7d9434bfc510d8f18475e267a2103c9,95b6a4b6d1196cbe4413c62b9b8de2f2fc8e18a7553bd9c85f62337bf84d3d7e,95b6a4b6d1196cbe4413c62b9b8de2f2fc8e18a7553bd9c85f62337bf84d3d7e,0.0,0.25,0.25,0.2125,0.25,0.037500000000000006,2.125,2.75,0.625,185,177,kept,strict-lossless-compression-185-to-177-tokens-no-clause-dropped,"Fresh rollouts scored 0/8. Part (b) failed every run in one of two ways: four priced 'this bag arrives at the destination first' as one or two isolated coin flips (1/4, 1/2), and three declared the source must drain in bottom-up order so the placement is impossible (0); two ran to the token limit re-arguing that claim. Clause-level grep of the eight rollouts shows the labeling, forced-move and arrived-first clauses are used (8/8, 6/8, 7/8) while 'sum to one', 'red flag' and 'unreachable' appear 0/8. Rounds 2-7 all tried adding or swapping content and every one lost heldout, including round 7's removal of the inert sum-to-one check and round 6's partial compression. So this round changes no strategy at all: it is a pure rewording that keeps all fourteen clauses, including the inert ones, and only removes redundant phrasing, banking the 8-token tiebreak without risking a clause the working rollouts lean on."
8,7,3836,148.162,148.172,ab86313389de277c671789977242ca71390d684323c6bdbaf69bed67b8fdd067,dfb1b41ce239d440b043aded000eb9dcc19904ab0a2c775fef1e227e1ab239ac,ab86313389de277c671789977242ca71390d684323c6bdbaf69bed67b8fdd067,0.25,0.0,-0.25,0.175,0.125,-0.04999999999999999,2.0,1.25,-0.75,70,70,discarded,start-the-small-case-ladder-one-step-up-past-the-degenerate-smallest-size,"Fresh round-8 rollouts scored 1/8, and the derailment point is now precise: every rollout that reached a small case tried the incumbent's literal first size (2), found it degenerate/inconsistent, concluded its own setup or the shrink was wrong, and abandoned the table for Vandermonde/Vieta theory until the 16384-token cap; seven produced no boxed value. The single winner was the only rollout that carried the ladder past that size to the next two sizes and read the rule off three exact entries. So the failing clause is not the strategy but the starting number: the smallest instance of a parametrized family is usually degenerate. Starting one step up costs zero tokens (70, same as incumbent), keeps every clause the winner used, and transfers because degenerate smallest cases are common across unseen problems."
8,8,23443,148.163,148.173,0250077d8944cf1436c3e3ecd3d488e1d97a5eb76f0be7756ba8677ce1f1d77e,f6e4145c9692c757a76ed1b5b68df98a6720b860f2870d12f14f3eb8138829e3,0250077d8944cf1436c3e3ecd3d488e1d97a5eb76f0be7756ba8677ce1f1d77e,0.75,0.875,0.125,0.1625,0.15,-0.012500000000000011,2.375,2.375,0.0,123,116,discarded,lossless-compression-paraphrase-only-no-clause-changed,"Fresh round-8 rollouts scored 7/8, and all eight executed the same machinery: gcd of the stage totals, divisors as candidate counts, percent applied to cost. The lone failure was not a missing step but a plausibility pick among already-listed candidates. History shows every attempt to patch that fork loses held-out (added tiebreak rounds 2 and 6, executable grouping filter round 7) and deleting the grouping clause cost 0.625 train in round 4, while both wins for this hint (rounds 3 and 5) were compressions. So this is a lossless compression: all seven moves the rollouts rely on are preserved verbatim in meaning, only wording is tightened (paraphrased three noun phrases), 116 tokens versus 123, no clause added or dropped."
8,9,3980,148.164,148.174,3177fd8ccc06120f7993d61571961edc2bb39f823ba9696ca131a1da2bfbe076,8439f971e6e15103951fed0a9f9e2c617122287df38678520415104a5db1cd39,3177fd8ccc06120f7993d61571961edc2bb39f823ba9696ca131a1da2bfbe076,0.375,0.0,-0.375,0.2375,0.2,-0.03749999999999998,2.75,2.0,-0.75,152,149,discarded,replace-do-not-solve-coefficients-clause-with-expand-the-reflection-identity-alone-and-free-parameter-cancels,"1/8 correct; all seven failures died on the 16384-token cap. Every rollout did adopt the involution ansatz, so that wording works, but the incumbent's next clause tells them to read outputs off the relation 'rather than solving for every coefficient', which forbids the one step the single winner actually took: expand only the one-variable reflection identity to get coefficient relations, accept that one parameter stays free, and let it cancel in the requested values. Lacking that step the failures had nowhere to go, so six reverted to full composition coefficient matching and five declared a contradiction or that no such polynomials exist. The edit swaps that misdirecting clause for the concrete positive move and pre-empts the underdetermined-means-contradiction abort; it is 149 tokens versus the incumbent's 152."
8,10,3843,148.165,148.175,c114dde1b09adf25ca78c933cba74a999d4e75ce2bcfbaaecc757f2887473b0c,f8242bcda3df01ea5f1726f0d1a3fd818626db9123418bf28cff6bf7c19c6383,c114dde1b09adf25ca78c933cba74a999d4e75ce2bcfbaaecc757f2887473b0c,0.375,0.25,-0.125,0.15,0.125,-0.024999999999999994,1.875,1.5,-0.375,106,106,discarded,replace-vague-get-one-more-size-with-concrete-single-label-orbit-count,"Fresh rollouts under the incumbent scored 3/8. Three of the five failures never obtained a second real data point: they wrote out only the smallest case, then filled in larger sizes from an unrun structural claim and fit a formula to those invented numbers; the other two burned the cap arguing with a contradiction between their own written states and such a claim. The incumbent's 'get one more size the same way' is the inert clause here - nobody does it, because writing every state at the next size is unaffordable. I replace it with a concrete, cheap way to measure that second size: track a single label under repeated whole applications and count until it returns. This should transfer to any period/order or repeated-process question, and it holds length exactly at the incumbent's 106 tokens."
9,1,28054,148.176,148.186,98f0bbb6f87c7e50634956da8a0905b30a66997aa33a5e4bc67a2609ec487ed8,2ffa5311f1f8bf10b3dd3690d60aaa81e412b5139f2252ec9cffc076bf34bb85,98f0bbb6f87c7e50634956da8a0905b30a66997aa33a5e4bc67a2609ec487ed8,0.125,0.125,0.0,0.25,0.175,-0.07500000000000001,2.625,1.875,-0.75,77,77,discarded,keep-unstated-reading-open-inside-the-groups-instead-of-pre-splitting-outer-cases,"Execution 148.176 scored 0 of 8. Three rollouts hit the 16384-token cap with no boxed answer; all five finishers split the two possible readings of the public value into separate outer cases, settled each reading first, then found that inside a fixed reading each speaker could compute the partner directly, called both cases contradictory, and boxed the same wrong value. No rollout ever built the per-private-value groups the incumbent asks for, because collapsing the reading up front makes every group a singleton. This edit spends the tokens freed by dropping the trailing clause (round 8 evidence: echoed only in verbatim recitation, never executed as a step) on the one concrete move the rollouts lacked - keep an unstated reading open inside the groups instead of fixing it first - at essentially the incumbent's length. Deferring an unstated role assignment until the constraints are applied helps any multi-reading problem."
9,2,30302,148.177,148.187,a2617d5cf40e8a99a8f74a784b3ae2a8d34000cee46fba8c99104d13b42a8740,dbe2d0ddf96799011f325744b15230f86825b0557d3aac66eac9ec4669e56cdb,a2617d5cf40e8a99a8f74a784b3ae2a8d34000cee46fba8c99104d13b42a8740,1.0,1.0,0.0,0.225,0.1625,-0.0625,3.25,2.625,-0.625,70,70,discarded,replace-extracting-with-boxing-the-requested-parameter-same-70-tokens,"Fresh rollouts (execution_id 148.177) scored 7/8. The single miss is the same failure this hint has shown for six rounds: it derived the correct locus quadratic and even verified three roots on it, then spent the rest of a 16384-token budget calling the unnormalized form an ellipse 55 times and hit the length cap having boxed nothing. All seven passing traces normalized the common square coefficient, completed the square, and boxed a value. Rounds 2 and 4 proved that appending a normalize/certify guard for that stall loses held-out, and rounds 5-8 proved compressing or deleting clauses loses too, so this edit changes only the final verb: 'extracting' becomes 'boxing', turning the last step from an internal derivation into a required visible commitment. It is the one instruction the failing trace lacked, costs zero tokens (70 vs 70), and every held-out problem needs a boxed answer."
9,3,8554,148.178,148.188,7b7b4483667ba6211d89e8b29e80c7dfcb9f10060d9ffc62b3bffc74e364b566,5669b5999e89c724604f5669f4533b1f5b7cb0abe216b833cf158a9235391dfe,7b7b4483667ba6211d89e8b29e80c7dfcb9f10060d9ffc62b3bffc74e364b566,0.625,0.375,-0.25,0.225,0.15,-0.07500000000000001,2.875,1.875,-1.0,169,166,discarded,replace-inert-symmetry-clause-with-bound-the-tilted-case-exit-rule,"Fresh rollouts scored 4/8. All four failures burned the full 16384-token budget chasing exact coordinates of tilted/rotated placements (13-55 tangency mentions, 24-39 'Alternatively' restarts each); three never closed the reasoning block and one closed at 99 percent of budget then restarted a fresh write-up and was truncated. Two failures had already reached the correct value by a rough bounding argument and abandoned it. The incumbent's symmetry clause is the inert part: 'symmetr' appears 0-8 times per trace and it is also wrong-footed here, since the quantity does depend on the free rotation, so it offers no exit from the tilted-case search. This edit swaps it for one executable exit rule - bound the tilted case in one line rather than computing it, and drop it when that bound cannot beat the value already held - which applies to any placement/extremum problem and lands at 166 tokens versus the incumbent's 169."
9,4,25003,148.179,148.189,c3cbe0705047c147d73e4cc6abba5206011053ba9a5bfc3d932d36a3d2abb469,02e69c1969e78189725f1154fade2482956e27159126fc080bdf30bdc1261d83,c3cbe0705047c147d73e4cc6abba5206011053ba9a5bfc3d932d36a3d2abb469,0.875,0.125,-0.75,0.225,0.1125,-0.1125,3.125,1.25,-1.875,153,150,discarded,front-load-bound-then-sum-plan-generalize-ban-and-require-boxed-total,"Fresh round-9 rollouts (execution 148.179) scored 4/8. Every clause of the incumbent is exercised by all eight rollouts, so nothing is inert; the four failures instead lose the already-derived product at the very end, reporting the per-polynomial cap, the menu size, or nothing at all after the token budget runs out. Five prior rounds tried patching the cap argument itself and held-out fell every time, so this edit leaves the technical core untouched and instead front-loads the bound-one-object-then-add-capacities plan so the total is the goal from the first line, generalises the differencing ban from polynomials to objects, and asks explicitly for the total to be boxed. It is shorter than the incumbent (150 vs 153 tokens)."
9,5,30418,148.180,148.190,1eb4e3cdd613a791abc5a6eca1cdc1c28a39f7f417b75d407c5cfcb7ed4ed992,11317b5c2d8c006e4ab66f05919b75742107da874eeb48d171fd1e8ffd51059f,1eb4e3cdd613a791abc5a6eca1cdc1c28a39f7f417b75d407c5cfcb7ed4ed992,0.75,0.625,-0.125,0.25,0.15,-0.1,3.25,2.125,-1.125,70,70,discarded,retarget-terminal-acceptance-test-from-conditions-to-equations,"Three of eight rollouts scored; four of five failures ended in finish_reason=length. The instructive failure obeyed every clause - pinned the constants, reduced to one unknown, solved, rejected the root repeating a known point - then built the last vertex by arithmetic on a known point instead of evaluating the defining equation there, and boxed that value. It believed it had ""met every condition"" after only the domain and non-degeneracy filters. The successes instead put each vertex back through the defining equation. So only the incumbent terminal test is retargeted from the vague ""meeting every condition"" to the executable ""satisfying every equation""; the body is byte-identical and rounds 7 and 8 both lost by touching the relabel clause, so it is kept. Length is exactly at incumbent parity, 70 tokens."
9,6,26989,148.181,148.191,95b6a4b6d1196cbe4413c62b9b8de2f2fc8e18a7553bd9c85f62337bf84d3d7e,92f7d1d27a965bd97a4378718f105eede4cfe43be43b5b62291fe7627b71381d,95b6a4b6d1196cbe4413c62b9b8de2f2fc8e18a7553bd9c85f62337bf84d3d7e,0.25,0.125,-0.125,0.25,0.2,-0.04999999999999999,2.75,2.125,-0.625,177,170,discarded,strict-lossless-compression-177-to-170-tokens-no-clause-dropped,"Fresh rollouts scored 2/8. Four of the eight hit the token limit without ever boxing anything, and the failures again substituted a uniform guess (1/24, 1/16, 1/4, 1/2) or thrashed over whether the target outcome was reachable at all; the two rewarded rollouts did loosely price free binary steps as the hint directs. My own history says a box-and-stop clause was tried in rounds 4, 5 and 6 here and lost held-out every time, while strict lossless compression is the one mutation that ever won this slot (185 to 177 tokens, held-out 0.2125 to 0.25). So this repeats exactly that: same strategy, same clauses in the same order, nothing dropped, 177 to 170 tokens by eliding redundant words. A shorter prompt also leaves the 1.7B student more room to finish the state-by-state pricing it already starts."
9,7,3836,148.182,148.192,ab86313389de277c671789977242ca71390d684323c6bdbaf69bed67b8fdd067,d73c3687592e42b34de2455100f13db92435f4c6e0722357d1ba0a1e8a5a4ba6,ab86313389de277c671789977242ca71390d684323c6bdbaf69bed67b8fdd067,0.25,0.0,-0.25,0.175,0.1,-0.07499999999999998,2.0,1.0,-1.0,70,69,discarded,drop-two-inert-clauses-add-fit-formula-in-n-and-box-termination,"Fresh round-9 rollouts scored 1/8. Two clauses are measurably dead. The closing 'Confirm on one more size, then commit' is never executed: no rollout attempts a fourth size and 'confirm' appears zero times outside the quoted hint. The prohibition sentence is worse than dead: all eight rollouts build the polynomial in x anyway and none echoes the ban, and the single winner reached the answer precisely by leaving the table for theory. Meanwhile six of eight hit the 16384-token cap with no boxed value. So I keep the shrink and ratio clauses the winner did use, delete both inert sentences, and spend the space on the winner's actual final move: fit one formula in n covering every computed entry with signs, substitute the given size, box it. 69 tokens versus the incumbent's 70."
9,8,23443,148.183,148.193,0250077d8944cf1436c3e3ecd3d488e1d97a5eb76f0be7756ba8677ce1f1d77e,b73d211b377b17a4e07ae370514020e03f613ebf8c5dd4ac360d415ebb0c5d8b,0250077d8944cf1436c3e3ecd3d488e1d97a5eb76f0be7756ba8677ce1f1d77e,0.75,0.75,0.0,0.1625,0.1125,-0.05,2.375,1.875,-0.5,123,120,discarded,restore-lexical-integrality-trigger-words-pay-for-it-by-tightening-tagging-clause,"Fresh round-9 rollouts scored 6/8; all eight ran the incumbent's machinery (gcd of the totals, divisors as candidate counts, percent applied to cost) and both failures were selection-only picks among candidates they had already listed. Patching that fork has lost held-out for me four times (rounds 2, 4, 6, 7), so I left it alone. The transfer signal in my history is elsewhere: my best held-out ever (0.1875) came from the one version that named the trigger words integer/whole/identical/equal, and held-out dropped to 0.15 in the very compression that deleted that list. This edit restores only that lexical trigger, so the divisibility step can fire on unseen wordings, and pays for it by tightening the tagging clause; it adds no rule and is shorter than the incumbent."
9,9,3980,148.184,148.194,3177fd8ccc06120f7993d61571961edc2bb39f823ba9696ca131a1da2bfbe076,1ca5c2e7e59f7b4709968e9326bd01666df3ba33562817766bb39a230289ef5f,3177fd8ccc06120f7993d61571961edc2bb39f823ba9696ca131a1da2bfbe076,0.375,0.375,0.0,0.2375,0.15,-0.0875,2.75,1.875,-0.875,152,149,discarded,restate-involution-notation-as-direct-f-equals-s-minus-g-lossless,"1/8 correct; the other seven all died on the 16384-token cap. Every rollout reached for the involution, so the ansatz wording is doing its job, but the two-layer notation 'f = L(g) with L(t) = s - t' is what they misparse: three unpacked it as the wrong composite q = s - p(s - x), one as f(f(x)) = g(x), and they burned their budget probing those dead ends before reverting to full composition coefficient matching. The single winner stated the ansatz in the direct form instead and finished in 8k tokens. So this is a byte-minimal lossless substitution: every other character of the incumbent is untouched, and only that notation is rewritten as the plain-language equivalent it already means, f = s - g. Nothing is dropped and it is 149 tokens versus 152."
