round,hint_id,train_qid,sampling_slurm_job_id,proposal_eval_slurm_job_id,incumbent_hash,proposal_hash,final_hash,old_train,new_train,delta_train,old_heldout,new_heldout,delta_heldout,old_J,new_J,delta_J,old_tokens,new_tokens,decision,mutation,subagent_summary
18,9,3980,148.366,148.376,8d573a01e8dd8cdbf6fde199bcbfe58fbdf001268ee5af64c810b216a6f41526,7527ef55f9c765bbc336788760a9da2d0e178ecb34ef7bdc7efac35cdb6ed4d7,8d573a01e8dd8cdbf6fde199bcbfe58fbdf001268ee5af64c810b216a6f41526,0.25,0.125,-0.125,0.2875,0.2375,-0.04999999999999999,3.125,2.5,-0.625,146,146,discarded,replace-vague-sum-to-s-pairing-with-explicit-partner-rule-a-to-s-minus-a-and-self-paired-midpoint,"Three of eight rollouts solved it; the five failures all accepted the reflection ansatz and derived s correctly, then broke at the evaluation step. The incumbent's 'pairing arguments that sum to s' was read as pairing an argument with itself, so one rollout wrote p(a) = s - p(a) for an argument that was not the midpoint, got a wrong value, noticed the contradiction and boxed the bad pair anyway; the other four never formed a usable pair and burned the cap re-deriving coefficient systems. This edit states the pairing rule operationally - the partner of a is s - a, so trade an unknown argument for a known one, and only s/2 is self-paired - which should transfer to any problem where a reflection identity must be evaluated at specific inputs. Same length as the incumbent."
18,10,3843,148.367,148.377,f35723e4dc2afe2c9e6b06cc17fbe624bd14c7dc195ef432ec15398d3a5af454,68beba91ce099d919a86d0eb8076d03051ca3e124a665016be276b410ce4da73,f35723e4dc2afe2c9e6b06cc17fbe624bd14c7dc195ef432ec15398d3a5af454,0.25,0.25,0.0,0.225,0.1875,-0.037500000000000006,2.5,2.125,-0.375,100,99,discarded,settle-the-reading-by-running-one-pass-on-a-labeled-case-instead-of-arguing-about-wording,"4/8 correct. All four failures hit the completion cap with no boxed answer, and every one died the same way: they never fixed a single reading of what one pass of the process is, re-litigating the wording verbally for thousands of tokens and producing two conflicting values for the same smallest size before running out of room. The four successes instead pinned the reading immediately by applying one pass step by step to a small labeled case, then moved up in size. The incumbent's opening 'Settle what one pass does, first' names the goal but no executable move, so the student tries to settle it by argument, which never terminates. This edit supplies the concrete move (settle it by running one pass on the smallest labeled case, then hold that reading) and should transfer to any multi-step-process question whose statement admits more than one parse. It is one token shorter than the incumbent."
19,1,28054,148.378,148.388,2aa9278aefedda0e7142a8047ff9ea9f5a02992a20a5de22b770989cc8c5c6fe,b587780e78b3347f370a11261724c2acdf4ff30ad2f80b0dac46e897e05d8212,2aa9278aefedda0e7142a8047ff9ea9f5a02992a20a5de22b770989cc8c5c6fe,0.125,0.375,0.25,0.25,0.225,-0.024999999999999994,2.625,2.625,0.0,75,73,discarded,lossless-compression-delete-two-definite-articles-only-75-to-73-tokens,"Fresh rollouts (execution 148.378, 1 of 8 correct) failed the same way as prior rounds: every losing run did split the sum-shown/product-shown cases and enumerate pairs, but judged ""does not know"" against the public number alone, declared both branches contradictory, then committed to a plausible-looking pair anyway; two hit the token cap looping. That is exactly what the incumbent's private-value grouping clause targets, and rounds 10, 14, 16 and 18 all tried making that clause more executable and lost held-out every time, so re-testing it is not worthwhile. I therefore submit a strictly lossless compression instead: the only change is deleting two definite articles (""the public statements"", ""the announcements""). Every content word, clause and step order is byte-identical, so transfer should be unchanged while 73 tokens wins a held-out tie."
19,2,30302,148.379,148.389,a2617d5cf40e8a99a8f74a784b3ae2a8d34000cee46fba8c99104d13b42a8740,7f948be953ca32f0588f95cac2c3fb1293b4a3298594c7150d5d3cdd02ef64d9,a2617d5cf40e8a99a8f74a784b3ae2a8d34000cee46fba8c99104d13b42a8740,1.0,0.75,-0.25,0.225,0.1,-0.125,3.25,1.75,-1.5,70,70,discarded,replace-vague-locus-branch-and-inert-exceptional-clause-with-mobius-circle-preservation-and-three-point-fit-at-equal-70-tokens,"Fresh rollouts (148.379) scored 8/8, so training is saturated and only transfer matters. All eight took the vague 'characterize the locus' branch into theta-parametrization and parameter elimination; the two costliest traces (15843 and 12344 tokens) burned thousands of tokens doubting whether their unnormalized quadratic was an ellipse or a circle, while the cheapest clean traces just evaluated explicit roots and read off the centre. Only one of eight traces ever mentioned exceptional values, so that clause is inert tax. This edit spends the same 70 tokens to replace the vague branch and the inert clause with one executable move plus the Mobius circle-preservation fact that removes the ellipse-versus-circle stall, which should transfer to any locus-of-roots problem."
19,3,8554,148.380,148.390,7b7b4483667ba6211d89e8b29e80c7dfcb9f10060d9ffc62b3bffc74e364b566,e93bcbae85fa140ac2be288b173d8c96c1ef02a40b5dba65c80f2d6ce04d3f21,7b7b4483667ba6211d89e8b29e80c7dfcb9f10060d9ffc62b3bffc74e364b566,0.625,0.5,-0.125,0.225,0.1375,-0.0875,2.875,1.875,-1.0,169,166,discarded,replace-unobservable-close-trigger-with-countable-third-restatement-of-same-value,"Rollouts scored 4/8. All four failures burned the full 16384-token budget; three never closed the reasoning block and the fourth closed but was truncated before any box. Yet every failure already held the correct exact value by 8-10 percent of its trace and then restated it 15-27 more times while opening 24-37 'Alternatively' and 64-74 'Wait' branches, so the loss is pure non-termination, not method. The incumbent's close trigger, 'one exact value plus one confirming check', names no event the student can observe, and the four successes closed only after repeating the value many times. I replaced just that trigger with a countable event the student demonstrably generates on any problem - the third restatement of the same exact value - leaving every other clause byte-identical at 166 tokens versus the incumbent's 169."
19,4,25003,148.381,148.391,e0ca78c56f30a95ccffa6bbca03e866e7e92dfbb723570c1181e9524f64d335b,7739f77aec856b4b79a7c64f72b35f9a18c1ffe364ca23a1ab647456cc864063,e0ca78c56f30a95ccffa6bbca03e866e7e92dfbb723570c1181e9524f64d335b,0.875,0.625,-0.25,0.225,0.175,-0.05000000000000002,3.125,2.375,-0.75,146,143,discarded,replace-ignored-one-factor-prohibition-with-explicit-add-capacity-per-object-instruction,"Fresh rollouts (148.381) scored 6/8; both misses reported a single factor. One assumed the whole run came from one polynomial and stopped at its degree cap; the other differenced across polynomials, concluded each serves exactly one input, and stopped at the menu size. The incumbent's prohibition 'never reporting one factor alone' sits right where both failed and neither rollout acted on it, while all six successes explicitly performed the per-polynomial accumulation. So I replaced that ignored negative clause with the positive executable arithmetic it was gesturing at - add deg P once for every polynomial on the menu - which names the exact combining step and should transfer to any bounded-capacity-times-number-of-objects counting problem. Net slightly shorter than the incumbent."
19,5,30418,148.382,148.392,1eb4e3cdd613a791abc5a6eca1cdc1c28a39f7f417b75d407c5cfcb7ed4ed992,4f4cbb616b9cfbde902ed187a90a4628161eeeb9839c8fdc69b0f00feaf95a52,1eb4e3cdd613a791abc5a6eca1cdc1c28a39f7f417b75d407c5cfcb7ed4ed992,0.75,0.875,0.125,0.25,0.1125,-0.1375,3.25,2.0,-1.25,70,64,discarded,replace-inert-relabel-clause-with-commit-and-stop-trigger,"Round 19 fell to 3/8 and four of the five failures ran the 16384-token cap dead; one of those had already derived and boxed a correct value inside its reasoning, then restarted a fresh write-up and was cut off mid-sentence. The three others never closed reasoning at all, re-deriving the same constants and second-guessing correct algebra dozens of times. Length exhaustion has been the dominant failure in almost every round of this hint's history, yet no prior edit targeted it. Meanwhile 'a zero or impossible intermediate means relabel, not restart' is provably inert: neither word appears in any of the eight rollouts. So that clause is replaced by an explicit commit-and-stop trigger, which is shorter than the incumbent and should curb runaway rollouts on unseen questions too."
19,6,26989,148.383,148.393,e64f97e23626cd3b726aa52d8740f627fe7f8a230645491fa857bd91465c19e1,af322b2231b3d46aab489cf4e782332bcfb816504802f96d774fae42d5b96e67,e64f97e23626cd3b726aa52d8740f627fe7f8a230645491fa857bd91465c19e1,0.125,0.0,-0.125,0.2625,0.125,-0.1375,2.75,1.25,-1.5,176,163,discarded,fuse-anti-count-prohibition-into-the-pricing-directive-dropping-standalone-warning-163-vs-176-tokens,"All 8 rollouts failed (0/8) with the same error: each priced the event by dividing one by a count of orders (1/4 seven times, plus 1/24, 1/16, 1/2), asserting a random permutation of bags. Clause grep shows the incumbent's standalone anti-uniform warning is executed 0/8 (red-flag 0/8, unreachable 0/8, admissible-word 0/8) while its setup and one-half clauses are used 8/8, so the warning is inert text the student reads past. This edit fuses the prohibition into the pricing directive itself - walk each qualifying run move by move and multiply step probabilities, never divide one by a count of orders or runs - so the ban arrives attached to the action it governs instead of as a separate slogan, and lands at 163 tokens versus the incumbent's 176."
19,7,3836,148.384,148.394,ab86313389de277c671789977242ca71390d684323c6bdbaf69bed67b8fdd067,878688873864e18a31e0d2283b53c645cab664cfc81e28885282372030cc3aa8,ab86313389de277c671789977242ca71390d684323c6bdbaf69bed67b8fdd067,0.25,0.0,-0.25,0.175,0.125,-0.04999999999999999,2.0,1.25,-0.75,70,69,discarded,replace-unheeded-theory-ban-with-table-outranks-theory-precedence-rule,"Seven of eight rollouts hit the 16384-token cap. Most did build the small-size tables the hint asks for and got correct entries, then set up a competing symbolic model, saw it disagree with those entries, and spent the remaining budget hunting the discrepancy and swapping models rather than trusting the recorded numbers. The one correct rollout differed mainly by letting its table settle the clash and moving on. So the absolute ban 'never leave the table for theory', which no rollout obeys, becomes a precedence rule the student can execute mid-conflict; every step the winning rollout used is preserved and the hint is one token shorter than the incumbent."
19,8,23443,148.385,148.395,0250077d8944cf1436c3e3ecd3d488e1d97a5eb76f0be7756ba8677ce1f1d77e,e02558f4449600ee2b027f52ae3d742672e0fa7a83e3afdd6624a864ebf06aaa,0250077d8944cf1436c3e3ecd3d488e1d97a5eb76f0be7756ba8677ce1f1d77e,0.75,0.125,-0.625,0.1625,0.1875,0.024999999999999994,2.375,2.0,-0.375,123,115,discarded,delete-inert-grouping-and-substitute-last-clauses-for-named-percent-base-and-sum-then-divide-once,"Fresh rollouts scored 5/8. All eight reached the gcd and tabulated every divisor candidate, including the right one, so that machinery is load-bearing; all three failures then abandoned their own table and overrode it with a plausibility argument built on the stated grouping count. The incumbent's grouping clause targets exactly that error and prevented none of the three, and no rollout used it; 'substitute numbers only at the end' was again executed zero of eight times, as in rounds 10, 11 and 15. Adding a selection or tiebreak rule has lost held-out here four times (rounds 2, 6, 7, 17), so instead this deletes both inert clauses and spends the tokens on the two executable arithmetic moves that co-occurred with this slot's best-ever held-out: naming the base a percent multiplies, and summing parts before a single division. It is shorter than the incumbent."
19,9,3980,148.386,148.396,8d573a01e8dd8cdbf6fde199bcbfe58fbdf001268ee5af64c810b216a6f41526,68632ea526b8eaf3a0caf3d174baa5d6a1f83141ef439a82aeb4ff229191d311,8d573a01e8dd8cdbf6fde199bcbfe58fbdf001268ee5af64c810b216a6f41526,0.25,0.375,0.125,0.2875,0.1875,-0.09999999999999998,3.125,2.25,-0.875,146,145,discarded,replace-vague-fix-s-from-values-at-zero-with-explicit-one-line-sum-of-constant-terms,"Five of eight rollouts failed and the shared cause was never pinning the reflection constant s: four ran to the 16384-token cap philosophising about what the involution means, and the ones that did commit guessed s by trial instead of deriving it, while all three winners got s in one line from the two supplied constant terms and finished early. The incumbent's 'fix s from the given values at x = 0' told them where to look but not what to compute, so I replaced it with the explicit one-line formula s = f(0) + g(0); that is a concrete first move that should transfer to any unseen problem where two objects are tied by a constant-sum symmetry. I also dropped the now-redundant 'match constant terms, then look for a shared symmetry' clause, whose job the explicit formula absorbs, keeping the hint one token shorter than the incumbent."
19,10,3843,148.387,148.397,f35723e4dc2afe2c9e6b06cc17fbe624bd14c7dc195ef432ec15398d3a5af454,131d371e524001edd201d84f1912adc317e89b7d530df68c96d2f3cd72dee631,f35723e4dc2afe2c9e6b06cc17fbe624bd14c7dc195ef432ec15398d3a5af454,0.25,0.375,0.125,0.225,0.1875,-0.037500000000000006,2.5,2.25,-0.25,100,97,discarded,written-sizes-outrank-a-conflicting-structural-argument,"1/8 correct. Seven of eight rollouts did write small cases out literally, so the incumbent's core step fires, but every failure then produced a structural/permutation argument that contradicted its own written case and spent the rest of the 16384-token budget relitigating which was right, oscillating between rival exponents and mostly never boxing anything. The incumbent's removed qualifier 'not arguing abstractly' is inert - the students argue abstractly anyway, after measuring - so I spend those tokens on a precedence rule that resolves the deadlock in one move: the written value wins, so advance instead of relitigating. This should transfer to any tabulate-and-fit problem where a tempting shortcut collides with measured data, and it is 3 tokens shorter than the incumbent."
20,1,28054,148.398,148.408,2aa9278aefedda0e7142a8047ff9ea9f5a02992a20a5de22b770989cc8c5c6fe,6a42e8b57aba3a10ea8367e1bf2ba7c936fa7afba8944d937f3ec70f05ba4a34,2aa9278aefedda0e7142a8047ff9ea9f5a02992a20a5de22b770989cc8c5c6fe,0.125,0.25,0.125,0.25,0.2125,-0.037500000000000006,2.625,2.375,-0.25,75,74,discarded,name-reportable-branch-as-interpretation-that-still-leaves-a-candidate,"In all 8 rollouts (exec 148.398, 1 correct) the student did build both readings and eliminate within them, but 7 of 8 finished by picking a number on aesthetic grounds - 'not trivial', 'more interesting', 'the standard answer' - usually right after writing that every branch contradicted. The incumbent's closing 'the surviving candidate' is undefined once the student believes nothing survived, so it fills the gap by taste rather than by elimination. Naming the reportable branch as the interpretation that still leaves a candidate makes the choice between readings the executable last step. Round 17's kept edit was this same closing-sentence sharpening; the freed tokens come from the 'never from the original set' tail, which only 1 of 8 rollouts echoed, leaving the hint one token shorter than the incumbent."
20,2,30302,148.399,148.409,a2617d5cf40e8a99a8f74a784b3ae2a8d34000cee46fba8c99104d13b42a8740,1d960476311c3f000001e19e3e25c64320543a843aae312a534aedc12bd0cd4c,a2617d5cf40e8a99a8f74a784b3ae2a8d34000cee46fba8c99104d13b42a8740,1.0,1.0,0.0,0.225,0.1375,-0.0875,3.25,2.375,-0.875,70,67,discarded,delete-only-the-dead-geometrically-branch-keeping-every-other-content-phrase-byte-identical-67-vs-70-tokens,"Fresh rollouts (148.399) scored 7/8. All seven winners took exactly one route: set the ratio, invert the Mobius map, parametrize, eliminate the angle to a real x,y quadratic, complete the square, read the radius. Not one rollout used the hint's alternative 'geometrically' branch. The single failure took precisely that branch instead: it reached for a closed-form Mobius image-of-a-circle rule, admitted it could not recall one, fell back to comparing individual root moduli, decided the locus was an ellipse, and boxed a wrong value. So this branch is not merely inert transfer tax, it is the observed sink. This edit deletes only those two words and leaves every other content phrase byte-identical, so the surviving text is the exact procedure all seven winners executed, three tokens shorter. Prior rounds tested function-word-only compressions and branch substitutions, never this deletion alone."
20,3,8554,148.400,148.410,7b7b4483667ba6211d89e8b29e80c7dfcb9f10060d9ffc62b3bffc74e364b566,b3a6f72b28481bcaceef525aed390190ad682d9a6a0e1c88f50834c92439068e,7b7b4483667ba6211d89e8b29e80c7dfcb9f10060d9ffc62b3bffc74e364b566,0.625,0.75,0.125,0.225,0.1875,-0.037500000000000006,2.875,2.625,-0.25,169,169,discarded,replace-negative-containment-warning-with-encode-each-given-as-an-equation-and-discard-violating-configurations,"5 of 8 rollouts were correct. The clearest loss was a rollout that closed cleanly and boxed the sum of both areas: it talked itself into a placement where the two shapes do not overlap at all, silently abandoning the stated placement condition, so its whole computation was of an inadmissible configuration. A second failure never closed, still grinding rotated coordinates at the cap. The incumbent only warns negatively not to assume containment, which no rollout acted on; this edit replaces that with an executable first move - write every stated condition as an equation in the coordinate setup and discard any configuration that breaks one - which is general to any constrained-placement or optimization problem and costs no extra tokens."
20,4,25003,148.401,148.411,e0ca78c56f30a95ccffa6bbca03e866e7e92dfbb723570c1181e9524f64d335b,fae1638b865563e92255ecd57abb794ac380e2e79c5ef65f9836374b1c02e3ee,e0ca78c56f30a95ccffa6bbca03e866e7e92dfbb723570c1181e9524f64d335b,0.875,0.125,-0.75,0.225,0.125,-0.1,3.125,1.375,-1.75,146,144,discarded,front-load-you-assign-each-polynomial-its-own-block-before-the-degree-count-144-vs-146-tokens,"Fresh rollouts (148.401) scored 3/8. Four of the five failures collapsed to the per-polynomial capacity alone: they reasoned as if ONE polynomial had to cover the whole run, so the degree cap became the final answer and the menu was declared irrelevant; a fifth mis-set the cap one too low and then did multiply. The incumbent only mentions blocks in a trailing 'attain it' afterthought that arrives after the count is already fixed, and the failing traces never reach it. This edit moves the block assignment forward as an executable first move - you decide who handles which input, so hand each polynomial its own block of consecutive inputs - and derives the degree cap on that block, so the summing step is licensed rather than tacked on. It is also two tokens shorter and keeps every step the successful rollouts used."
20,5,30418,148.402,148.412,1eb4e3cdd613a791abc5a6eca1cdc1c28a39f7f417b75d407c5cfcb7ed4ed992,4280d855f318cce0a596668461a64c647766800731c3a0a0c8ffa8cad8df03b5,1eb4e3cdd613a791abc5a6eca1cdc1c28a39f7f417b75d407c5cfcb7ed4ed992,0.75,0.5,-0.25,0.25,0.075,-0.175,3.25,1.25,-2.0,70,70,discarded,replace-inert-relabel-clause-with-known-value-must-be-a-root-then-divide-it-out,"All three failures derived the one-unknown equation with a sign slip, landed on an irrational quadratic, then thrashed to the 16384-token cap without ever boxing anything; the five successes all reached an equation the already-known abscissa satisfies, so it factors and the second root falls out cheaply. The clause I removed is inert - no rollout ever mentions relabel or restart - whereas substituting a known value back into the derived equation is a cheap universal detector of exactly that slip, and dividing out its root is a concrete next move rather than a warning. Same token count as the incumbent."
20,6,26989,148.403,148.413,e64f97e23626cd3b726aa52d8740f627fe7f8a230645491fa857bd91465c19e1,5bad68017a53687d9f9510bdaef6098fe63a867e09920621f80a8c6d7ad87562,e64f97e23626cd3b726aa52d8740f627fe7f8a230645491fa857bd91465c19e1,0.125,0.25,0.125,0.2625,0.2125,-0.05000000000000002,2.75,2.375,-0.375,176,173,discarded,retarget-anti-uniform-warning-from-orders-and-words-to-per-item-first-or-last-symmetry-173-vs-176-tokens,"All 8 rollouts scored 0. Seven of eight collapsed the second part with the same per-item symmetry claim (""each of the 4 bags has an equal chance of being the last/first one moved to the shed""), giving 1/4, and several used the same reasoning for the whole final order. The incumbent's warning forbids assuming all n! orders or all words equally likely and flags bare 1/k, but no rollout ever reasoned about orders or words, so the warning never engaged the claim actually being made. This edit aims the same prohibition at the per-item first/last symmetry the rollouts repeatedly assert, keeping the setup, the arrived-first-is-bottom fact and the forced-vs-free pricing untouched, and comes out 3 tokens shorter. Per-item symmetry is the generic shortcut for any ordered-buffer transfer problem, so naming it should transfer."
