round,hint_id,train_qid,sampling_slurm_job_id,proposal_eval_slurm_job_id,incumbent_hash,proposal_hash,final_hash,old_train,new_train,delta_train,old_heldout,new_heldout,delta_heldout,old_J,new_J,delta_J,old_tokens,new_tokens,decision,mutation,subagent_summary
20,5,30418,149.402,149.412,9b72d775b5b90b0f4a3bb10a97778be955594fc3b27c36d41e63cc6dc4ef005f,df3a5f1f9fd6682d58b231cdae5c4c7c7409fd5f332702efc9eb57c2cb0c38cf,9b72d775b5b90b0f4a3bb10a97778be955594fc3b27c36d41e63cc6dc4ef005f,0.875,0.375,-0.5,0.1875,0.25,0.0625,1.8125,1.625,-0.1875,192,192,discarded,numeric-precheck-of-closure-equation-at-known-vertex-before-algebra,"6/8 correct (149.402); both failures hit the 16384-token cap on the SAME stage, forming the closure equation, and never reached the incumbent's root test. One slipped arithmetic inside the shifted argument (wrote t-4/3+1 as t+1/3), so its quadratic had irrational roots and the given vertex was not a root; it never tested that, and spent the rest of the budget on diagonal-midpoint restatements (15 mentions). The other inverted the factor by treating log_{1/2}A+1 as log_{1/2}(2A), got discriminant -92, then declared the problem impossible (8 'no real' passages, 15 midpoint mentions). Its earlier attempt produced a polynomial whose ONLY roots were the two given vertices, another detectable-equation bug. So the revision moves validation upstream: check the closure numerically at a given vertex before any algebra, and route failure to the shift or the factor, not to the problem."
20,6,26989,149.403,149.413,40f95ed4950fe23e751bafb0454b3a7b04b2370e997c7f4b8f29907ec9bc480e,bf712cf863d43a81ffc4f5da4cdbffd23bf2d96b5db2426f86ce87518e35b732,40f95ed4950fe23e751bafb0454b3a7b04b2370e997c7f4b8f29907ec9bc480e,0.375,0.125,-0.25,0.2,0.15,-0.05000000000000002,1.375,0.875,-0.5,175,175,discarded,"require-written-position-to-arrival-time-translation-line-with-flip-self-catch, shortened","0/8. Part b is the graded quantity and all 8 missed it. Seven (idx 0-5,7) explicitly wrote that the shed's bottom bag is the one carried LAST, then answered 1/4 by symmetry: 'each bag equally likely to move last' or 3!/4! over random permutations. Idx 6 declared the order always reversed (1, 0). Part a was template-guessed: 1/2^(n-1) (idx 0,1,2,5), 1/24 (idx 4,7), 1/256 (idx 3). Not one rollout wrote a concrete move order with per-step legality, so the incumbent's forced/free pricing never gets executed. The incumbent states arrival-rank orientation declaratively and loses to the flip every round. This revision makes the position-to-arrival-time translation a required written line with an explicit self-catch test, and trims length back toward the 91-token variant that holds the best held-out so far, since every rewrite at 175-192 tokens scored held-out 0.2 or worse."
20,7,3836,149.404,149.414,bf8917df8e428960f80d51070d9c159b26a541b8cfec74724b518f1eb812f558,0f57bb93c9cb7aeb898d1612fd6cb63e0ed8dfe80b0159fe03f76d126ddbfb0b,bf8917df8e428960f80d51070d9c159b26a541b8cfec74724b518f1eb812f558,0.625,0.25,-0.375,0.1,0.0875,-0.012500000000000011,1.125,0.6875,-0.4375,189,188,discarded,require-displayed-elimination-per-toy+first-thing-on-page-ordering-gate (asserted/recalled toy values are inadmissible; no general-size algebra until three exact solutions are shown),"0/8; 6 hit the 16384 cap. Root cause is new: not one rollout ever solved a small case. Six wrote zero small systems and went straight to full-size symbolic work (48-142 'coefficient of x' mentions, 51-80 of 2004!, Vandermonde/elementary-symmetric detours) and never emitted an answer. The two that terminated only *asserted* toy answers with no arithmetic shown -- one claimed n=3,4 give 1/2 and 1/3 and shipped 1/(n-1); the other claimed -1, 1/2, -1/4 and shipped a power-of-2 law. So the incumbent's ladder is skipped or faked, and its bans on stated-size algebra are ignored because nothing competes for the first line. This revision makes the smallest numeric case the mandatory first thing written, makes a toy value admissible only with its elimination displayed, gates law-fitting behind three displayed solutions, and keeps the proven consecutive-ratio law."
20,8,23443,149.405,149.415,d6e761f5cca43ef948238db65074ea53c3f8953ec6c1f76a4fc7f307db54c5db,fb7d3c2a0dd6bb93999d62cadff0e561e02b7f7e59e8ebc4b25d92213d57ed6e,d6e761f5cca43ef948238db65074ea53c3f8953ec6c1f76a4fc7f307db54c5db,0.875,1.0,0.125,0.175,0.0875,-0.0875,1.75,1.4375,-0.3125,185,190,discarded,replace-decide-once-with-constructive-per-unit-unknown-setup,"7/8 public rollouts scored 1 (train_i 0.875). The single failure never doubted the gcd machinery; it mis-assigned roles, reading each listed village-wide figure as a per-house cost. That made total = 525*N with total already 525, so N collapsed to 1, the integrality condition did no work, and it answered a bare cost*1.2. It burned most of 8242 tokens cycling per-house/per-street readings and calling each a contradiction. The incumbent's only defence is 'decide once whether each figure is a grand total or a per-unit amount', which tells the student to stop revisiting but not how to pick. Prior negative screens against bad readings (self-refutation, well-posedness, role-locking) all lost held-out ground, whereas the kept rounds added constructive machinery. So I swapped the passive clause for a constructive setup: name a per-unit unknown per figure and write figure = N x unknown, which fixes aggregates as aggregates by construction and makes integrality bind on the unknowns."
20,9,3980,149.406,149.416,3e5130251127f1cdd38d0a1bb8dd4fb0acfb2a10ba7588ffd823b20e7a983801,48ed1bc55051e31a5f7317bf7361f6f0129089b3ded4e9d25fdf70b249f9c465,3e5130251127f1cdd38d0a1bb8dd4fb0acfb2a10ba7588ffd823b20e7a983801,1.0,1.0,0.0,0.2,0.1,-0.1,2.0,1.5,-0.5,189,190,discarded,add-classification-of-commuting-polynomials-as-the-no-fit-fallback-instead-of-numeric-root-hunting,"7/8 correct (3.5k-5.4k tokens). The one failure hit the 16384-token cap. It centered correctly, then mis-nested the composition (re-cubing an already-cubed offset: BA^9, so B^2=A^8, B=+-A^4, 16 mentions; 120 r^3 mentions). Both corrupted branches gave high-degree equations in the center, and it spent most of its budget trial-substituting integer centers (2,3,4,5,6,-2,-3,30), then fell back to generic coefficient matching and died in a degenerate repeated-subtraction loop. All 7 correct rollouts reached A^3=B^3 on their first page and closed in one line. Rounds 9/10 (exponent audits), 14/15 (factoring), 16 (no-ratio), 17 (validate-vs-p=q), 18 (conjugation) and 19 (elimination order) all added corrective wording about that same slip and all lost heldout. So this revision leaves the proven spine intact and adds a positive escape hatch instead: name the classification of commuting polynomial families, giving a concrete next move when the centered form does not fit."
20,10,3843,149.407,149.417,1e3acbae873bc435b7dfe5ef08152ba300c78d6c321ecbd752834208236d2a85,622e528eb53675726eaa57f29b5fefa6270746ee5b99fd53e7c1e750b176e1cf,1e3acbae873bc435b7dfe5ef08152ba300c78d6c321ecbd752834208236d2a85,0.75,0.375,-0.375,0.1875,0.15,-0.037500000000000006,1.6875,1.125,-0.5625,194,189,discarded,"states-only, ban cycle/permutation notation; explicit j<->j+L block-swap rule with no intra-block swap; two-repeat order-2 refutation; count only completed repeats; grow-and-divide cross-size filter","6/8 wrong. idx1, idx6, idx7 never wrote a state: each sub-step became a transposition, the composite was called disjoint transpositions or an involution, and they boxed 2. idx7 also placed the blocks wrong, writing the length-2 block swap as (1 2)(3 4) - swapping inside a block, not block-to-block - manufacturing the disjointness. idx5 invented per-size cycle lists (6-cycle plus 2-cycle, then an 8-cycle), got 2,4,6,8, boxed 2n. idx4 fabricated 2,4,10,30 and fit a product of primes. idx2 had a correct small-size state trace, then built a permutation table giving order 2 and burned all 16k tokens arguing table versus states. Both correct rollouts just simulated whole repeats on lettered words. The incumbent invites the lcm-of-cycle-lengths cross-check that caused three failures, so the revision bans cycle notation, gives the exact j to j+L block rule with no intra-block swap, a two-repeat order-2 refutation, and a grow-and-divide filter."
