round,hint_id,train_qid,sampling_slurm_job_id,proposal_eval_slurm_job_id,incumbent_hash,proposal_hash,final_hash,old_train,new_train,delta_train,old_heldout,new_heldout,delta_heldout,old_J,new_J,delta_J,old_tokens,new_tokens,decision,mutation,subagent_summary
10,7,3836,149.204,149.214,b2a22f64742db6de717ce4677f47425adbfad7620c3372bf9f96e9c222adbfaa,1b56f1e8e122cc01c9ffccbeb3be2b96f2982b973d24f1f669f85a93d148291f,b2a22f64742db6de717ce4677f47425adbfad7620c3372bf9f96e9c222adbfaa,0.75,0.0,-0.75,0.075,0.1,0.02500000000000001,1.125,0.5,-0.625,186,143,discarded,back-substitute-each-toy-before-fitting+shorten,"My 8 rollouts scored 3/8 and all five failures hit the 16384-token cap, never a wrong-formula stop: three carried a botched small case forward (one produced a denominator of 791, one declared n=4 contradictory then looped re-solving it, one re-derived n=4 while already holding a candidate) and two drifted into polynomial-coefficient sign bookkeeping. So the ladder mechanism works but the toy solutions are unverified, and the incumbent only validates the fitted formula, never the individual cases feeding it. This revision inserts a per-case back-substitution check plus an explicit 'a stall means mis-solved toy, recheck arithmetic' rule, and trims 186 tokens to 143 since heldout accuracy across rounds 1-9 fell roughly monotonically with hint length."
10,8,23443,149.205,149.215,631be8eed5f087f7cdab1dec25cead2e9d0ae8ea0b579379c5e58836f770dc11,c95e850295d7d46363b417a65c65f3fccae7a2862d061e29125d32dbcaa06131,c95e850295d7d46363b417a65c65f3fccae7a2862d061e29125d32dbcaa06131,0.625,1.0,0.375,0.2125,0.15,-0.0625,1.6875,1.75,0.0625,169,181,kept,factor-N-as-groups-times-per-group,"6/8 public rollouts were correct; both failures shared one mode and neither was arithmetic: each asserted the stated number of equal groups as the number of units, divided every listed total by it, saw whole quotients, and never invoked gcd or maximality. The incumbent's grouping clause states the multiple constraint only as a prohibition and was ignored; rounds 5-9 all attacked this mode with extra prohibitions or divisibility apparatus at 187-190 tokens and every one collapsed heldout from 0.2125 to 0.0625-0.1375. So I kept the incumbent's spine, ordering and length and made the grouping clause constructive instead of prohibitive, naming the missing second factor via N = groups x units-per-group, and spent the budget by dropping the commute clause that no correct rollout used."
10,9,3980,149.206,149.216,3e5130251127f1cdd38d0a1bb8dd4fb0acfb2a10ba7588ffd823b20e7a983801,212fecdf7fc451953eca143b5c201d115e3379b2ac6b9efe6f5df3985c33dfd5,3e5130251127f1cdd38d0a1bb8dd4fb0acfb2a10ba7588ffd823b20e7a983801,1.0,1.0,0.0,0.2,0.1375,-0.0625,2.0,1.6875,-0.3125,189,189,discarded,derive-center-as-unknown-and-name-coefficient-vs-offset-raising,"All 8 public rollouts were correct (8/8, 3.5k-8.6k tokens, none truncated), so the training question stays saturated and every remaining point is transfer. Two residual wastes are visible: the 8.6k outlier (roughly double the median) raised the inner coefficient as well as the offset when composing the centered maps, producing a lopsided relation whose spurious extra powers it then solved by guessing four integer centers before recovering; and six of eight rollouts, having verified the solution by roughly their midpoint, spent the tail hunting for 'another fixed point' or doubting that the centered form was a legitimate assumption. This revision keeps the proven trigger, centered ansatz, factored both-branch condition, parameter-count closure and symmetric-combination steps and adds only that the center is an unknown to solve for and that composition multiplies coefficients while raising the offset, so the exponent slip and the second-center hunt both lose their cause."
10,10,3843,149.207,149.217,ce69be40ed567eba12a96f0a63ea1462e4b13c7ba9b4265dd1382a154fe82da4,e83a376f9f5f603c0eab98baa39b8fc1a5fea9c4d456c3ae07d720e2b6dea71d,ce69be40ed567eba12a96f0a63ea1462e4b13c7ba9b4265dd1382a154fe82da4,0.75,0.5,-0.25,0.1375,0.05,-0.08750000000000001,1.4375,0.75,-0.6875,181,189,discarded,copy-untouched-slots-verbatim-plus-fixed-point-audit-and-nested-block-argument,"3/8 correct with the incumbent; four of the five failures hit the 16384-token cap. The mechanical root causes were all in rewriting the state: one rollout swapped a block other than the listed one and then reported the state unchanged under further applications (impossible), one traced indices to immediate fixed points and could not settle the swap target, and the one failure that terminated dropped every sub-step but the last, got a pure involution, and answered 2. The revision therefore forces untouched slots to be copied verbatim from the previous line, adds a fixed-point/duplicate audit on the composed operation, gives the nested-growing-blocks reason the composite cannot be independent order-2 swaps, and caps rechecking at one pass before committing."
11,1,28054,149.218,149.228,201354a92ede8d8aac1cb60ea727c71fda8c2a78ad6bed1e1f28858eb6defeef,a3a9805f3b37695536ecf7628ac6a588215a3f9ca6cb77ede20cc39aa1b660f1,a3a9805f3b37695536ecf7628ac6a588215a3f9ca6cb77ede20cc39aa1b660f1,0.125,0.125,0.0,0.2125,0.225,0.012500000000000011,1.1875,1.25,0.0625,147,184,kept,announcement-as-predicate-reapplied-to-partner-slot,"My 8 public rollouts scored 1/8 (execution 149.218): six of the seven failures argued that a holder of v plus one fixed reading could just subtract or divide, declared that reading contradictory, collapsed to the other reading, and boxed an arbitrary factor (143 five times), while three burned the 16384-token cap looping on that same contradiction. None ever converted an announcement into a reusable condition on the speaker's value or re-applied it to the partner slot, and none allowed the two private values to be equal; the revision keeps the incumbent's short per-speaker frame and adds exactly those two missing steps."
11,2,30302,149.219,149.229,59b3d8b787e142b5557010de60e2aaf179f67e91a57adadbbb61e6f1a74bd7e2,d645100e37eaf014f03523c96c0b3d3aaf1829d0048bfae76fca74f2f383c933,59b3d8b787e142b5557010de60e2aaf179f67e91a57adadbbb61e6f1a74bd7e2,1.0,1.0,0.0,0.1875,0.1625,-0.024999999999999994,1.9375,1.8125,-0.125,190,191,discarded,flag-k-as-silent-failure-and-verify-by-repeated-multiplication,"Seven of eight rollouts scored 1; the single failure reached the modulus step immediately and then took the nth root of the constant by reading it as a familiar base to a smaller exponent, landing on a ratio that was too large by a factor. It ran the incumbent coordinate route flawlessly on that wrong ratio, produced a self-consistent circle, and every self-check it ran confirmed the derived condition rather than the constant, so the error never surfaced. The revision therefore keeps the kept round-7 coordinate route intact and replaces its generic ordering caveat with a named silent-failure warning plus one portable arithmetic check: multiply the candidate ratio by itself n times and require it to land exactly on the modulus of the constant, never a remembered radical."
11,3,8554,149.220,149.230,fb51b21593ed905cd5a002358e62f833d6da9e1c02aa884460885af4ac2cb21a,e706044d3f2b50b5b56d612f00e693ef4bbb86f0d16e53200f96da94b7c7109e,e706044d3f2b50b5b56d612f00e693ef4bbb86f0d16e53200f96da94b7c7109e,0.75,0.75,0.0,0.175,0.2,0.025000000000000022,1.625,1.75,0.125,194,190,kept,two-sided-overlap-bounds-plus-computed-anchor-in-corner-edge-frame,"Round-11 training scored 2/8; the six failures split into two related errors the incumbent does not block. Three argued the shapes are disjoint (overlap 0) by treating the shared point as a center and comparing a point-to-side distance against the small shape's half-width, one of them committing the summed-areas value outright; the other three burned the 16384-token cap oscillating between an unclosed tangency/far-edge-line search and a containment claim, and one had already reached a correct union before abandoning it. The incumbent forbids only overlap = all of S and gives no floor, so this revision adds the strict lower bound (a corner at an interior point covers a positive-angle sector), names the corner-vs-center distance fallacy, fixes axes on the corner's own edges so far edges are provably irrelevant, and makes the first computed orientation a committed anchor that only another computed area may displace."
11,4,25003,149.221,149.231,cfd221f96601c768c674155cae1b1bf5da8ceab825508c5ae2c116994550bf59,5f0ab097bde90aa8bc0520c9dc2be42045147eef3f5da25148a96141f87f6f51,cfd221f96601c768c674155cae1b1bf5da8ceab825508c5ae2c116994550bf59,0.75,0.25,-0.5,0.1625,0.125,-0.037500000000000006,1.5625,0.875,-0.6875,193,188,discarded,state-pointwise-only-and-reject-the-answer-is-N-chain,"My 8 public rollouts with the incumbent scored 3/8: two failures terminated normally and two of the three truncations ended the same way, all four collapsing to the family size N because they imposed the progression's common difference on a single function's own consecutive values, concluded the function 'would have to be linear', and inferred one term per function. One truncation had already derived the per-group product and then spent the rest of its budget re-litigating it against that same false obstruction. The revision keeps the proven grouping/root-bound/tightness skeleton but adds the missing fact that the constraint is purely pointwise (finitely many agreements with the target do not force equality) plus an explicit discard rule for the 'P must be linear, so the answer is N' chain."
11,5,30418,149.222,149.232,85f213d578062adcf883b7f1f27d6adaf1b87fd1ff0c18c817da13cc0a477ef6,8f8a15071d17833db936360f04060fd3672b9dd7feb4b3ced2b03bd859aaa386,85f213d578062adcf883b7f1f27d6adaf1b87fd1ff0c18c817da13cc0a477ef6,0.75,0.875,0.125,0.2,0.1625,-0.037500000000000006,1.75,1.6875,-0.0625,193,192,discarded,recompute-both-heights-independently-and-check-gap,"7/8 public rollouts correct (train_i=0.875); the lone failure fit the parameters, reduced correctly and found the right vertex abscissa, then read that vertex's height with the exponent's sign flipped and took the partner vertex's height by adding the carried gap instead of from f, so both new points were off the graph and the area was wrong. Independently evaluating f at both new vertices would have exposed it immediately, since their difference then contradicts the imposed gap, so the revision replaces the incumbent's bare take-heights-from-f line with that cheap two-point consistency closure while leaving the proven base-normalization and degenerate-root reduction levers intact."
11,6,26989,149.223,149.233,466facab1208fc7a47986ab237293f5be9ec980670b8f43f1612be39eae83ed6,c65d160c9cbf276ad4d59292391023676e023f7f4e25deb176b44df56be490db,466facab1208fc7a47986ab237293f5be9ec980670b8f43f1612be39eae83ed6,0.0,0.125,0.125,0.2125,0.0875,-0.125,1.0625,0.5625,-0.5,91,147,discarded,add-middle-pile-accumulates-arrival-rank-mechanism,"All 8 rollouts scored 0: five modelled the outcome as a uniformly random permutation (1/24) and read part b off it as 1/4, while two claimed the order is deterministic (0/1). The distinctive new failure was that three rollouts assumed the first item reaching the final pile must be the source's top item, so they answered 0 or a bare 1/2; the revision therefore keeps the incumbent's near-minimal length and its 1/2-per-free-step pricing but adds the one missing mechanism, that the middle pile accumulates so arrival rank is set by how many inward moves precede each outward move."
11,7,3836,149.224,149.234,b2a22f64742db6de717ce4677f47425adbfad7620c3372bf9f96e9c222adbfaa,5f8c07a5f219776cd397d1904f7bd1e02261283a5d6d0432f75ebf8a762c6de2,b2a22f64742db6de717ce4677f47425adbfad7620c3372bf9f96e9c222adbfaa,0.75,0.25,-0.5,0.075,0.1125,0.037500000000000006,1.125,0.8125,-0.3125,186,192,discarded,ban-symbolic-general-n+ratio-based-law+never-override-verified-toy,"3/8 correct; all three winners simply solved n=2,3,4 numerically and fit the pattern, while all five failures abandoned the numeric ladder for symbolic general-n algebra (parameterized polynomials, elementary symmetric sums, coefficient-of-x formulas) and looped on the resulting contradictions until the token cap. Two failures explicitly trusted a general-n derivation over a small case they had verified, labelling that case exceptional or the system inconsistent, and one fit a law from only two data points and so missed the growth rate entirely. The revision therefore bans symbolic/general-n work outright, demands four back-substituted numeric cases, replaces formula-guessing with consecutive ratios so the growth rate and sign come out mechanically, and makes a verified toy authoritative over any general derivation."
11,8,23443,149.225,149.235,c95e850295d7d46363b417a65c65f3fccae7a2862d061e29125d32dbcaa06131,0ff544fa1e4032661a072688113dc9e3cf7c6afe39ba35e5371fa2ef5cc0cc78,c95e850295d7d46363b417a65c65f3fccae7a2862d061e29125d32dbcaa06131,1.0,0.875,-0.125,0.15,0.1125,-0.03749999999999999,1.75,1.4375,-0.3125,181,189,discarded,commit-to-largest-no-late-downgrade,"7/8 public rollouts were correct, and the single failure was a new mode, not the old group-count substitution: it ran the incumbent's spine correctly, computed the gcd, factored N as groups times units-per-group, enumerated both admissible counts, and then declared the choice ambiguous and picked the smaller candidate in its final paragraph, reasoning that the smaller one also divided every total evenly. The incumbent asserts the maximum is intended but gives no reason to reject a rival that survives divisibility, and rounds 5-9 showed that adding more anti-substitution apparatus collapses heldout (0.2125 down to 0.0625-0.1375). So I kept the incumbent's spine, ordering and length and spent the budget on a portable maximality-commitment rule: every smaller divisor passes the same check, so passing it is not evidence, and the selection must not be reopened at the end."
11,9,3980,149.226,149.236,3e5130251127f1cdd38d0a1bb8dd4fb0acfb2a10ba7588ffd823b20e7a983801,16f0acce366bd9621c5d3a20d2b6689da4c7cd2491a0a92d07070ae6035ee40f,3e5130251127f1cdd38d0a1bb8dd4fb0acfb2a10ba7588ffd823b20e7a983801,1.0,1.0,0.0,0.2,0.1375,-0.0625,2.0,1.6875,-0.3125,189,183,discarded,add-propagate-known-values-through-the-identity,"All 8 public rollouts under the incumbent were correct (8/8, 3.5k-7.2k tokens, none truncated), so the training question is saturated and remaining gains are transfer. The jointly visible waste is jargon-free: the 7.2k outlier mis-nested the composition (raising the outer coefficient, giving AB^3=BA^9 and B=+-A^4), then integer-guessed four centers, while six of eight rollouts spent their tails hunting 'another fixed point'. Only 2 of 8 ever substituted a known-value input into the identity, and those two closed fastest. Rounds 9 and 10 both spent tokens on composition-exponent audits and both lost heldout, so this revision keeps the proven trigger, centered ansatz, factored both-branch condition, parameter-count closure and symmetric-combination steps, and adds one portable positive move - propagate known values through the identity - which gives progress on unseen functional-equation problems where no centered ansatz fits."
11,10,3843,149.227,149.237,ce69be40ed567eba12a96f0a63ea1462e4b13c7ba9b4265dd1382a154fe82da4,11b48473663dea308cd1320d20404e9fce3c03b8caf384ffe978d474247125c5,ce69be40ed567eba12a96f0a63ea1462e4b13c7ba9b4265dd1382a154fe82da4,0.75,0.5,-0.25,0.1375,0.1,-0.037500000000000006,1.4375,1.0,-0.4375,181,190,discarded,distinct-label-word-suffices-plus-divisibility-check-and-box-immediately-budget-rule,"Only 1/8 correct and 7 of 8 failures ended at the 16384-token cap; the most telling one had already reached a correct closed form inside its reasoning block, then spent the whole remaining budget restating a formal write-up from scratch and was truncated before re-boxing it. The others never committed, looping dozens of times over the same size with mutually inconsistent counts and re-arguing in prose instead of redoing one cheap simulation, and several burned tokens worrying about ""any word"". The revision keeps the incumbent's state-rewriting and anti-involution mechanisms but adds that one distinct-label word suffices, a per-label divisibility check on the count, and a budget rule to box the answer as soon as a formula fits rather than re-deriving it."
12,1,28054,149.238,149.248,a3a9805f3b37695536ecf7628ac6a588215a3f9ca6cb77ede20cc39aa1b660f1,82e59cba9e1d93cfc48d347eb86fbfc7fef24c2429090f3ac04a941004efd194,a3a9805f3b37695536ecf7628ac6a588215a3f9ca6cb77ede20cc39aa1b660f1,0.125,0.125,0.0,0.225,0.2,-0.024999999999999994,1.25,1.125,-0.125,184,190,discarded,pool-partners-across-unsettled-choices-per-private-value,"All 8 public rollouts scored 0 (execution 149.238) and every one boxed the same wrong divisor 143, none hitting the token cap this time. The shared path: open a separate self-contained case for the sum reading and for the product reading, note inside each case that a speaker's own value plus that fixed reading determines the partner, declare that case contradictory, and then collapse to the product reading and pick the factor that merely looks special. Not one rollout pooled the partners implied by both readings into a single list for one private value, and not one allowed the two private values to be equal, so none ever saw why residual ambiguity exists. The revision makes that pooled per-value count the central operation, states that pinning under each choice taken alone is not a contradiction, and turns the word ""impossible"" into a trigger to redo the pooled count instead of guessing a divisor."
12,2,30302,149.239,149.249,59b3d8b787e142b5557010de60e2aaf179f67e91a57adadbbb61e6f1a74bd7e2,ddebacefad3d1a9c3ecac3799fc8dd69e72dc55e36b66a56a5411f121856181d,59b3d8b787e142b5557010de60e2aaf179f67e91a57adadbbb61e6f1a74bd7e2,1.0,1.0,0.0,0.1875,0.15,-0.037500000000000006,1.9375,1.75,-0.1875,190,192,discarded,add-normalization-step-and-final-conversion-menu,"7 of 8 rollouts scored 1 (3.8k-5.6k tokens, 6-18 hedges). The one failure reached the modulus step at once, then nth-rooted the constant by reading it as a familiar base to a smaller exponent, inflating the ratio; it ran the incumbent coordinate route flawlessly on that wrong ratio, yielding a self-consistent circle. It then burned ~2k tokens on a false alarm: it solved the bars-drop equation on line ab, got a genuine locus point, mistook it for the center, saw a mismatch, and argued itself back into the wrong circle instead of rechecking the ratio. Correct rollouts also wasted 10-25 exponentials listing roots. Prior rounds tried symbolic k-lectures and audit rules and lost heldout, so this revision instead adds a normalization step (fold stray factors and ratio forms into c before touching moduli), where the exponent misread originates, and closes with a portable conversion menu so the locus maps to whatever a variant asks for."
12,3,8554,149.240,149.250,e706044d3f2b50b5b56d612f00e693ef4bbb86f0d16e53200f96da94b7c7109e,034632933613e4914d3950e7107fdafffcad413f140d94b4fa555ad32fcdbd1b,e706044d3f2b50b5b56d612f00e693ef4bbb86f0d16e53200f96da94b7c7109e,0.75,0.5,-0.25,0.2,0.2,0.0,1.75,1.5,-0.25,190,195,discarded,replace-containment-ban-with-two-witness-point-sign-check,"Round-12 training scored 6/8. Both failures ended cleanly (finish_reason=stop, no budget loss) on the same committed error: overlap = all of S. Each argued containment purely from reach, comparing the max distance from the shared point to S's farthest corner against the big shape's half-diagonal, then set overlap = area(S) and answered areas-sum-minus-area(S). The incumbent already forbids containment verdicts and point-to-side distances, but a bare prohibition loses to a concrete-looking radius computation, and neither failure ever tested a single point of S for coverage. So this revision converts the ban into a positive, cheap obligation: in the corner-edge frame, name one point of S with a negative coordinate (uncovered) and one strictly inside the wedge (covered), which refutes containment and disjointness at once, and explicitly voids reach/diagonal/half-width arguments as evidence about which side of a line a point lies on."
12,4,25003,149.241,149.251,cfd221f96601c768c674155cae1b1bf5da8ceab825508c5ae2c116994550bf59,71bbac004964e95216c81767dcfcedba54fed6a04125845418ad992501b8e093,71bbac004964e95216c81767dcfcedba54fed6a04125845418ad992501b8e093,0.75,1.0,0.25,0.1625,0.1625,0.0,1.5625,1.8125,0.25,193,190,kept,aim-the-tightness-device-at-the-one-index-per-function-objection,"My 8 rollouts scored 2/8: two wrong-answer stops and four truncations. Both wrong stops reported N (the family size): each computed a single function's successive difference as a polynomial, ruled it cannot be constant, and concluded one index per function. Two truncations chained adjacent board entries into a shift construction and never partitioned; one restated the hint then stalled; one had already reached the per-group product but looped doubting it as too high. So the live faults are the identity-vs-pointwise confusion feeding the N answer, plus doubt-loops after the bound. Rather than adding prohibitions (round 11's reject-rule variant collapsed to 3/8), this revision keeps the proven skeleton and points the existing construction device at that objection: P = T + c*prod(x-n_j) has full degree yet matches T across its whole block, so its own steps there really do equal T's difference."
