round,hint_id,train_qid,sampling_slurm_job_id,proposal_eval_slurm_job_id,incumbent_hash,proposal_hash,final_hash,old_train,new_train,delta_train,old_heldout,new_heldout,delta_heldout,old_J,new_J,delta_J,old_tokens,new_tokens,decision,mutation,subagent_summary
12,5,30418,149.242,149.252,85f213d578062adcf883b7f1f27d6adaf1b87fd1ff0c18c817da13cc0a477ef6,e5c0266468eee4cbc543f512482432987d987a5c0999dbcf1f16ed41cbfc2ff8,85f213d578062adcf883b7f1f27d6adaf1b87fd1ff0c18c817da13cc0a477ef6,0.75,0.5,-0.25,0.2,0.175,-0.025000000000000022,1.75,1.375,-0.375,193,189,discarded,"exponentiate-separately-instead-of-log-identities, plus back-substitute the fitted parameters, and reframe no-real-root as a fit/direction bug","6/8 correct; both failures hit the 16384-token cap after a negative discriminant, then thrashed on diagonal-midpoint restatements (12 and 5 mentions) and on the problem being contradictory. Distinct root causes, one shared step. One combined the two curve equations via log identities using log_{1/2}2 = +1, so the argument factor came out inverted (A = B/2 instead of A = 2B) and the quadratic had no real root. The other slipped arithmetic in the parameter fit (scaled only one side by 3), got wrong parameters, never substituted them back into either given point, and ground out a four-digit-coefficient quadratic. Correct rollouts instead exponentiated each point's equation on its own and checked the fit. So the revision bans log-identity combination in favour of exponentiate-then-divide, adds a back-substitution check on the fitted parameters, and reframes no real root as a fit or direction bug instead of an inconsistent problem."
12,6,26989,149.243,149.253,466facab1208fc7a47986ab237293f5be9ec980670b8f43f1612be39eae83ed6,108f23014958e1d8e006cad4beee00cb85c9a8b4269ee3bf458266997c20dd70,466facab1208fc7a47986ab237293f5be9ec980670b8f43f1612be39eae83ed6,0.0,0.125,0.125,0.2125,0.1625,-0.04999999999999999,1.0625,0.9375,-0.125,91,122,discarded,bottom-is-first-arrival-plus-run-of-choices-not-one-lone-half,"All 8 rollouts scored 0; the graded quantity is the last sub-answer, and every rollout botched it even when its earlier part used sane branch counting. Five (idx 0,1,2,4,7) declared the destination order a uniformly random permutation and read off 1/4; four of those also defined the destination bottom as the LAST item moved, inverting the pile, which makes the asked position untestable. Two (idx 5,6) stayed probabilistic but priced the event with a single lone 1/2, as if only one step mattered. So the live defects are the orientation flip and undercounting how many genuine choices the event forces. This revision keeps the incumbent's near-minimal length and its 1/2-per-free-step pricing, adding only bottom=first arrival and the fact that delivering a buried item first needs a run of consecutive same-direction moves, each a separate choice. Rounds 1-11 show every rewrite past ~130 tokens lost held-out, so this stays at 122."
12,7,3836,149.244,149.254,b2a22f64742db6de717ce4677f47425adbfad7620c3372bf9f96e9c222adbfaa,c20fb0175aec46632a86274276e007415c578c472275efa772ddddee50f04cbd,b2a22f64742db6de717ce4677f47425adbfad7620c3372bf9f96e9c222adbfaa,0.75,0.375,-0.375,0.075,0.125,0.05,1.125,1.0,-0.125,186,168,discarded,commit-toy-setup-once-by-count-matching+ban-renegotiation,"3/8 correct; all three winners just solved n=2,3,4 numerically and fit the pattern. The dominant waste in the five failures is not the fit but the setup: four spent 1500+ tokens circularly re-arguing how many conditions a toy with n unknowns should carry, oscillating between n and n+1, then declared the resulting over-determined toy inconsistent and abandoned the ladder for symbolic Vandermonde/elementary-symmetric/harmonic-sum work (two hit the cap mid-loop, one degenerated into literal token repetition). Two carried unverified toy values (denominators 19 and 791) forward. One built no toy at all, guessed the family from a theorem name, and got the sign and offset wrong. So this revision makes the scaling rule a one-time count-matching commitment that must not be renegotiated, forces per-case back-substitution, and derives growth plus sign from consecutive ratios."
12,8,23443,149.245,149.255,c95e850295d7d46363b417a65c65f3fccae7a2862d061e29125d32dbcaa06131,5c470b3bf37b404fecf605bbc79dc9e6db5b633409a828085d076d1b9c1063b0,c95e850295d7d46363b417a65c65f3fccae7a2862d061e29125d32dbcaa06131,1.0,0.875,-0.125,0.15,0.1375,-0.012499999999999983,1.75,1.5625,-0.1875,181,190,discarded,supply-reason-maximal-divisor-is-intended,"All 8 rollouts scored reward 1 (train_i=1.0), so headroom is transfer only (incumbent heldout 12/80). The rollouts derive the divisor set fast, then burn hundreds of tokens asking WHY the maximum common divisor is intended, quoting the hint's 'maximum feasible count' clause back as bare authority (7-22 'wait' backtracks, up to 6.7k tokens). Prior rounds show what happens when that reason is absent: r10/r11 rollouts reached the same divisor list, then picked the small candidate 'because the problem is likely designed to have a unique answer' and landed on the wrong scale. Restating the rule harder (r5, r6, r9, r11) did not help. So I keep the kept-hint spine (gcd, groups x units-per-group) and supply the missing justification: smaller divisors also divide evenly, so divisibility cannot select them, and a stated integrality condition is informative only if it pins one value. I also add a check-if-N-is-given branch so the gcd machinery is not forced onto problems that state the count."
12,9,3980,149.246,149.256,3e5130251127f1cdd38d0a1bb8dd4fb0acfb2a10ba7588ffd823b20e7a983801,e96a6ba41a883c4427867ee75b19a4d671f81a50bef36a7a45fa6fabb9a83bbc,3e5130251127f1cdd38d0a1bb8dd4fb0acfb2a10ba7588ffd823b20e7a983801,1.0,1.0,0.0,0.2,0.125,-0.07500000000000001,2.0,1.625,-0.375,189,195,discarded,lift-symmetric-combination-from-numbers-to-functions-p+q-constant-reflection,"7 of 8 rollouts correct (3.1k-6.6k tokens). The single failure burned the full 16384-token cap: composing the centered maps it re-cubed an already-cubed offset, getting BA^9 instead of BA^3, hence B^2=A^8 and B=+-A^4 (70 A^4 mentions). It then chased that corrupted branch, declared the system underdetermined, and only stumbled onto a consistent center by integer guessing at the very end, too late to finish. Three correct rollouts briefly flirted with the same A^4 slip, and 'another fixed point' hunts appear in 5 of 8 tails. Rounds 9 and 10 already tried exponent-audit wording and both lost heldout, so instead this revision lifts the round-7 add/subtract rule from numeric conditions to the unknown functions themselves: p+q constant on the sign-flipped branch pins the center as an average, converts any known value of one map into the other, and shows the center is forced so the fixed-point hunt ends."
12,10,3843,149.247,149.257,ce69be40ed567eba12a96f0a63ea1462e4b13c7ba9b4265dd1382a154fe82da4,1e3acbae873bc435b7dfe5ef08152ba300c78d6c321ecbd752834208236d2a85,1e3acbae873bc435b7dfe5ef08152ba300c78d6c321ecbd752834208236d2a85,0.75,0.75,0.0,0.1375,0.1875,0.04999999999999999,1.4375,1.6875,0.25,181,194,kept,L-parallel-swaps-not-one-transposition-plus-proper-divisor-minimality-check,"2/8 correct with the incumbent; all six failures ran to the 16384-token cap. Four collapsed each block swap into a single transposition, declared the composite a product of disjoint 2-cycles, and concluded order 2 -- one even wrote cycle products on non-overlapping index sets -- without ever writing the state after two full repeats to check. The rest thrashed between mutually inconsistent per-size counts (one asserted 12 for a size, then invented piecewise formulas depending on n) and never committed. Nobody tested minimality, so nothing caught the too-small count. The revision keeps the incumbent's state-rewriting and single-convention mechanisms but adds the quantitative reason the order-2 story is wrong (a length-L block swap is L parallel swaps moving 2L slots, and nested ranges cannot be disjoint) plus an explicit proper-divisor minimality check that forces any small candidate to be exhibited rather than assumed."
13,1,28054,149.258,149.268,a3a9805f3b37695536ecf7628ac6a588215a3f9ca6cb77ede20cc39aa1b660f1,66d05542448bd705d51663a5296ac978341367faa744ac432accd7a5c908e60a,a3a9805f3b37695536ecf7628ac6a588215a3f9ca6cb77ede20cc39aa1b660f1,0.125,0.0,-0.125,0.225,0.1875,-0.037500000000000006,1.25,0.9375,-0.3125,184,186,discarded,propagate-first-speaker-membership-test-plus-ban-aesthetic-tiebreakers,"My 8 rollouts scored 1/8 (execution 149.258). The failures split two ways: three hit the 16384-token cap looping on ""but he could just divide, so this case is impossible"", and four boxed a value chosen by an unstated aesthetic criterion (143 three times as the factor pair that merely looked special, 13 once justified explicitly by primality). Not one rollout converted the first announcement into a membership condition on that speaker's value and then applied it as a filter to the second speaker's candidate partners; every rollout evaluated the second announcement against the raw factor list only. Even the single correct rollout reached its answer by elimination-then-assertion, not by that filter. So the revision keeps the pooled per-value counting frame but makes the propagate-the-earlier-test step concrete, adds an explicit ban on unstated tie-breakers (naming primality and looking special, the two seen), and keeps the sweep-once rule that curbs the cap-burning loop."
13,2,30302,149.259,149.269,59b3d8b787e142b5557010de60e2aaf179f67e91a57adadbbb61e6f1a74bd7e2,d64c59d2b557d10973880b9db8d06fc37e7c9227ad8f286d5ed1578a4d2ebb80,d64c59d2b557d10973880b9db8d06fc37e7c9227ad8f286d5ed1578a4d2ebb80,1.0,1.0,0.0,0.1875,0.2,0.012500000000000011,1.9375,2.0,0.0625,190,189,kept,prime-power-exponent-rule-for-k-plus-conjugate-expansion-replaces-x-plus-iy,"7/8 correct. The one failure (18 'Wait' hedges, 5.6k tokens) obeyed the incumbent's ordering rule perfectly but botched k: it rewrote |c| as a cube rather than a 6th power and read k off that base, doubling it. It then ran a flawless completing-the-square and produced a self-consistent circle, so nothing downstream caught it, and its own root enumeration was never checked against the original equation. All 7 correct rollouts got the same k from mental recall, not a procedure. So the incumbent's weak link is the unspecified 'k^n=|c|' step. The revision replaces recall with an exponent-arithmetic rule (factor |c| to a prime power, divide the exponent by n), which is portable to any n and any constant. It also swaps the verbose x+iy expansion for w*wbar, cutting algebra and the sign errors that made a negative-radius guard necessary."
13,3,8554,149.260,149.270,e706044d3f2b50b5b56d612f00e693ef4bbb86f0d16e53200f96da94b7c7109e,7d21868f47a0bedc77bad233d3867dbbaba721c653dbb1a0d47bcf89e48d22b4,e706044d3f2b50b5b56d612f00e693ef4bbb86f0d16e53200f96da94b7c7109e,0.75,0.5,-0.25,0.2,0.15,-0.05000000000000002,1.75,1.25,-0.5,190,194,discarded,replace-containment-ban-with-tiling-sum-contradiction,"Round-13 training scored 6/8 (all rollouts finish_reason=stop, so no budget loss). Both failures die identically and never test coverage at all: each places the shared point at the origin, then compares a reach radius (max origin-to-vertex distance of S, ~0.707) against the big shape's half-diagonal (~1.414), concludes S is wholly inside, sets overlap = area(S), and answers summed-areas-minus-area(S). One failure even had the correct axis-aligned coordinates in hand and overwrote them with an origin-to-side distance argument that silently treats the corner as a center. The incumbent already bans containment verdicts and point-to-side distances, but a bare prohibition loses to a concrete-looking radius number. This revision converts the ban into an arithmetic contradiction the student can execute: the k rotated wedges tile around the origin, so their pieces of S must sum to area(S); containment would force k*area(S), which is absurd, and the same tiling delivers the constant fraction."
13,4,25003,149.261,149.271,71bbac004964e95216c81767dcfcedba54fed6a04125845418ad992501b8e093,4866979d164e32f6cce13be88373d98019f929af56b6cc00e1d64d5caffa0fda,71bbac004964e95216c81767dcfcedba54fed6a04125845418ad992501b8e093,1.0,0.875,-0.125,0.1625,0.1625,0.0,1.8125,1.6875,-0.125,190,190,discarded,separate-roles-construction-attains-bound-caps,"My 8 rollouts scored 5/8. All three failures shared one root cause: they treated a construction as if it capped the count. Two built the shift family P_{k+1} = P_k + d across adjacent board entries, saw it work for exactly N terms, and reported N (one stopped there, one truncated arguing N+1 impossible) - they never grouped indices by function, so the per-group root cap never appeared. The third had already derived the per-group product, then called it 'very high', reopened the construction to re-verify, and truncated mid-check. So a working-but-small scheme is being mistaken for an upper bound, and a proven bound is being re-litigated against it. Rather than add prohibitions (round 11's reject-rules collapsed to 3/8), this revision keeps the proven skeleton and adds one portable role separation up front: constructions prove attainability only, they never cap, so a scheme reaching merely N cannot shrink the bound."
13,5,30418,149.262,149.272,85f213d578062adcf883b7f1f27d6adaf1b87fd1ff0c18c817da13cc0a477ef6,dd070f95d027a3c202cc5aa7f3c051775ffb4649512505b186415266a36af365,85f213d578062adcf883b7f1f27d6adaf1b87fd1ff0c18c817da13cc0a477ef6,0.75,0.5,-0.25,0.2,0.2,0.0,1.75,1.5,-0.25,193,189,discarded,"small-argument-positive-height, closure-as-f(t+dx)=f(t)+dy with midpoint ban, failed-root-test blames the factor","5/8 correct; all 3 failures hit the 16384-token cap, each on a different step of the incumbent's pipeline. One reduced correctly and found both roots, then read log_{1/2} of an argument below 1 as a NEGATIVE height, so its vertex fell off the graph and it wrote 16 lines about the problem being contradictory. One judged the on-curve closure a tautology, decided the system was under-determined, and manufactured a second equation from equal diagonal midpoints (28 mentions), which forced the unknown vertex onto a given one and collapsed the figure. One inverted the argument factor into a square, got a cubic, tested the given vertex's x and got nonzero, then re-verified its expansion instead of suspecting the reduction. So the revision adds the small-argument positive-height rule, states the closure as f(t+dx)=f(t)+dy and bans a second midpoint condition, and routes a failed root test to the factor rather than the algebra."
13,6,26989,149.263,149.273,466facab1208fc7a47986ab237293f5be9ec980670b8f43f1612be39eae83ed6,40f95ed4950fe23e751bafb0454b3a7b04b2370e997c7f4b8f29907ec9bc480e,40f95ed4950fe23e751bafb0454b3a7b04b2370e997c7f4b8f29907ec9bc480e,0.0,0.375,0.375,0.2125,0.2,-0.012499999999999983,1.0625,1.375,0.3125,91,175,kept,mark-each-step-forced-or-free-in-explicit-move-word-plus-arrival-rank-and-run-of-choices,"0/8; the graded quantity is the last sub-answer and all 8 botched it, even those whose earlier part used sane branch counting. Two clusters: (i) five (idx 0,1,2,4,7) called the destination order a uniformly random permutation and read the answer off as 1/4 or 1/24, and four of those also inverted the pile, calling the destination bottom the LAST item carried instead of the first, which makes the asked position untestable; (ii) two (idx 5,6) stayed probabilistic but priced the whole event with one lone 1/2, as if only the final step mattered. Some also miscounted run length, jumping to 1/2^n. So the live defects are the orientation flip, importing symmetry for a later part, and undercounting how many genuine choices the event pins. This revision keeps the incumbent's near-minimal length and 1/2-per-free-step pricing, adding only arrival-rank orientation plus step-by-step forced/free marking of an explicit move word, making the run of choices visible."
13,7,3836,149.264,149.274,b2a22f64742db6de717ce4677f47425adbfad7620c3372bf9f96e9c222adbfaa,c35fc3b27d5643b21b15f7398e48796deffed09c908798e3800d89841173b869,b2a22f64742db6de717ce4677f47425adbfad7620c3372bf9f96e9c222adbfaa,0.75,0.125,-0.625,0.075,0.0625,-0.012499999999999997,1.125,0.4375,-0.6875,186,188,discarded,ban-full-size-symbolic-expansion-detour+scale-last-elimination-order+back-substitute-check,"3/8 correct. The 3 winners (7.6k-12.4k tokens) all did the same thing: solve n=2,3,4 toys, read the law, substitute. Failures split three ways. Two rollouts abandoned the small-case ladder for a full-size symbolic product and hit the 16384 cap trying to extract one coefficient from its expansion. One solved n=2 and n=3 correctly, then botched the n=4 elimination into a nonsense denominator and spent the rest of the budget inventing formula families to justify it rather than redoing the arithmetic. Others burned thousands of tokens re-arguing how many conditions the toy should have before any algebra. So this revision bans the full-size expansion detour outright, prescribes an elimination order that keeps toy arithmetic small (zero conditions fix ratios, the nonzero one fixes scale) plus a back-substitution check, and rules that a toy clashing with the law is miscomputed."
13,8,23443,149.265,149.275,c95e850295d7d46363b417a65c65f3fccae7a2862d061e29125d32dbcaa06131,d6e761f5cca43ef948238db65074ea53c3f8953ec6c1f76a4fc7f307db54c5db,d6e761f5cca43ef948238db65074ea53c3f8953ec6c1f76a4fc7f307db54c5db,1.0,0.875,-0.125,0.15,0.175,0.024999999999999994,1.75,1.75,0.0,181,185,kept,add-bounded-count-divisor-selection-branch,"All 8 public rollouts scored reward 1 (train_i=1.0), so training is saturated and the only headroom is transfer (incumbent 12/80). The waste is not arithmetic: rollouts ran 2.5k-6.7k tokens with 7-22 'wait' backtracks, and nearly every backtrack re-litigated two things - what the integrality clause constrains, and which surviving common divisor to take. The group-factoring clause works (rollouts do reach N = groups x per-group), but after listing candidates they stall comparing them and pick the largest only because the hint asserts it. History shows that merely justifying maximality (r11, r12) did not transfer. So I added the missing selection branch: many unseen items of this class bound the count in words (a range, at least/at most/about), where the right pick is the divisor inside that window, not the gcd. That converts a hardcoded 'always gcd' rule into a two-case filter, generalising while keeping the gcd default that holds train at 8/8."
13,9,3980,149.266,149.276,3e5130251127f1cdd38d0a1bb8dd4fb0acfb2a10ba7588ffd823b20e7a983801,82215cd78d801feb42a5bb10c60683020fdda63252eac25d6872aa82e51b0cc4,3e5130251127f1cdd38d0a1bb8dd4fb0acfb2a10ba7588ffd823b20e7a983801,1.0,1.0,0.0,0.2,0.175,-0.025000000000000022,2.0,1.875,-0.125,189,190,discarded,justify-the-shared-center-by-invariance-of-the-p-equals-q-root-set,"All 8 rollouts correct (3.5k-8.6k tokens, none truncated), so training is saturated and every remaining point is transfer. The dominant residual waste is doubt about the centered ansatz itself: 'fixed point' appears 5-29 times per rollout, 'another fixed point / another center' 1-6 times in 6 of 8 tails, and three rollouts relitigate whether assuming the centered form is even legitimate. Each reaches the answer at 45-70% of its trace, then spends the rest re-searching a center it already forced. The 8.6k outlier also mis-nested the composition (BA^9, so B=+-A^4) and chased that corrupted branch. Rounds 9, 10 and 12 tried exponent-audit and p+q wording and all lost heldout, so this revision keeps the proven trigger, centered ansatz, factored both-branch condition, parameter-count closure and symmetric-combination steps, changing only the fixed point from an unexplained assumption into a one-line existence argument that removes the cause of the re-search."
13,10,3843,149.267,149.277,1e3acbae873bc435b7dfe5ef08152ba300c78d6c321ecbd752834208236d2a85,f4937c3e63bb3d174b6b3e34671bca28c3055aabef5214d284bee549d9db04f4,1e3acbae873bc435b7dfe5ef08152ba300c78d6c321ecbd752834208236d2a85,0.75,0.25,-0.5,0.1875,0.1625,-0.024999999999999994,1.6875,1.0625,-0.625,194,194,discarded,trace-one-slot-orbit-plus-fit-gate-forbidding-special-cases-invented-counts-and-shrinking-counts,"4/8 correct. All four failures shared one new fault the incumbent does not catch: they assembled a table of per-size counts that was largely fabricated, then boxed a formula contradicting their own entries. Two boxed 2^(n-1) while explicitly writing that it disagrees with their own smallest-size count and calling that a permissible special case. One asserted a large count for a mid size it never traced, then fit an exponent pattern to it. One produced counts that shrank as size grew (order 2 for the two largest sizes, 4 for a smaller one) and answered piecewise. Every failure invented cycle structures ('four transpositions', 'cycles 2,4,2') rather than tracing, so the incumbent's minimality/lcm advice had nothing real to act on. The revision replaces expensive whole-state repetition with tracing one slot's orbit and adds an explicit fit gate: no invented counts, formula must match every size including the smallest, no special-case excuses, shrinking counts signal a tracing error."
