round,hint_id,train_qid,sampling_slurm_job_id,proposal_eval_slurm_job_id,incumbent_hash,proposal_hash,final_hash,old_train,new_train,delta_train,old_heldout,new_heldout,delta_heldout,old_J,new_J,delta_J,old_tokens,new_tokens,decision,mutation,subagent_summary
3,1,28054,149.57,149.67,0fa96053d79aac037ffbeaa924500a0114b1fad8dab76251534170a8d16f138f,7bfb7a0d8f83d797ba13b71ed1076d9e3bc7002785faa9b3a27625fa42b6c21f,7bfb7a0d8f83d797ba13b71ed1076d9e3bc7002785faa9b3a27625fa42b6c21f,0.0,0.25,0.25,0.1875,0.15,-0.037500000000000006,0.9375,1.0,0.0625,135,146,kept,knowledge-inventory-plus-no-guess-bar,"All 8 round-3 rollouts scored 0: six explicitly argued that a speaker who knows their own number plus the public number can compute the partner, concluded both the sum reading and the product reading are impossible, and then emitted an arbitrary divisor of the public number to fill the answer box (three separate divisors appeared across the eight samples), while three burned the token cap looping on that same contradiction. The revision front-loads an explicit per-speaker knowledge inventory that forbids 'just subtract/divide', replaces group-deletion language with a concrete per-private-value count of partners across readings, and adds an explicit bar on guessing when every reading looks contradictory - the exact point where every failure went astray."
3,2,30302,149.58,149.68,65a545bc36267d194340d7e9cea8a5fc006f707b001219525d3396c4903feb34,1f201f288fcb54e8912556e65d37575844f34bb6254ce56a76fd292e0482315d,1f201f288fcb54e8912556e65d37575844f34bb6254ce56a76fd292e0482315d,1.0,1.0,0.0,0.1875,0.1875,0.0,1.9375,1.9375,0.0,199,198,kept,diameter-endpoints-shortcut-plus-center-not-on-circle-warning,"All 8 round-3 rollouts scored 1 (3.3k-7.7k tokens), so training is saturated and the loss is transfer: every rollout got |z-a|=k|z-b| within a few hundred tokens, but then 4 of 8 burned 12-40 exponential expressions re-deriving individual roots to spot-check the locus, and 3 of 8 (including the two most hedged, 16-18 'Wait's) stalled on a self-inflicted contradiction from testing the center point itself and concluding the circle was wrong. The revision therefore adds a portable constant-work route to the circle's data (the two collinear points where the bars drop, which bound a diameter, giving center as midpoint and radius as half the distance), demotes the coordinate expansion to a single cross-check, and states explicitly that the center is not on the circle so |z| varying is expected."
3,3,8554,149.59,149.69,a3268d480f0c74f9a8026bf5c2b6dd432a3ba1363673f43d20f5ae1256a63607,1205be011a301eed49e2a6ed6ef748f5c1393aaa0804c33b10ef9bf173087112,a3268d480f0c74f9a8026bf5c2b6dd432a3ba1363673f43d20f5ae1256a63607,0.75,0.375,-0.375,0.0875,0.1375,0.05000000000000002,1.1875,1.0625,-0.125,169,183,discarded,coordinate-vertex-audit-before-invariance-check,"Round-3 training reproduced 7/8 with the incumbent; the single failure never ran the incumbent invariance test properly because it mis-listed the large square vertices and then evaluated the aligned orientation as full containment (overlap = whole small square) instead of the actual corner region, so its two test values disagreed and it settled on a verbally asserted rotated fraction with no computed region. Held-out also fell to 0.0875 under the incumbent, indicating its bespoke k-fold-wedge criterion is being applied by fiat rather than checked, while the round-2 shoelace variant lifted held-out to 0.2 but collapsed train. This revision therefore prepends a cheap coordinate/vertex audit and an explicit ban on uncomputed overlap fractions, keeps the invariance-then-stop control flow that trains well, and routes disagreement back to re-checking the region instead of a costly general clipping search."
3,4,25003,149.60,149.70,c88c72a8af76a0349016b46bf3a91690c7375399032fa6e2fedac91359b1f577,0d7624081f4a992aa82591cf8525706fc082722e4d07498d140313eb0793fab8,c88c72a8af76a0349016b46bf3a91690c7375399032fa6e2fedac91359b1f577,0.625,0.0,-0.625,0.1625,0.125,-0.037500000000000006,1.4375,0.625,-0.8125,176,187,discarded,kill-the-per-function-consecutive-difference-trap,"My 8 public rollouts scored 6/8; both failures were token-cap truncations, never wrong answers. One never partitioned indices at all and burned the budget building a recursive shift construction from adjacent-term differences; the other quoted the hint's product late but then re-imposed a constant successive difference within a single polynomial's own values, concluded 'each function contributes at most one term', and looped. The revision therefore targets that specific trap: it states that a function's index group need not be consecutive so its own successive differences carry no information, and adds a discard rule for any line ending in 'P must be affine' or 'one term per function'."
3,5,30418,149.61,149.71,bf462b403f17cd428257353852dc46039314abb29f7a1232a8b7b962384878f2,7062684d5bae525d34d57b9a13efc1ad3c4184ce06fcb57a0955b87bb17f1ed2,bf462b403f17cd428257353852dc46039314abb29f7a1232a8b7b962384878f2,1.0,0.625,-0.375,0.1375,0.075,-0.06250000000000001,1.6875,1.0,-0.6875,151,189,discarded,substitute-back-vertex-check-before-area,"Train fell to 5/8 with the incumbent. All three failures shared one root cause: after solving the reduced rational equation they assigned the translated vertex a y-value that does not satisfy the curve (P off the graph), and two of them noticed the contradiction, called the problem inconsistent, and reported the area anyway; the third burned its whole budget on a mis-fit parameter pair it never sanity-checked against the given points. The revision keeps the reduction pipeline but replaces the discriminant flip-and-redo advice with two cheap closures: re-derive the given points' y from the fitted parameters, and evaluate f at every new vertex before any area is computed."
3,6,26989,149.62,149.72,99c30a3f882f054f77512e4fdca1d19befb3e5426d7d857d52f4369a95c4f820,ab7fb02c765a14922053e501904b3361aa53ec39f67a65e3fe31c827952a0a3d,99c30a3f882f054f77512e4fdca1d19befb3e5426d7d857d52f4369a95c4f820,0.0,0.125,0.125,0.1875,0.125,-0.0625,0.9375,0.75,-0.1875,83,129,discarded,orientation-to-delivery-rank-plus-forced-move-branch-counting,"My 8 rollouts under the incumbent scored 2/8; the two successes were the only ones that used the rule 'bottom of the shed is the first bag delivered' and then multiplied 1/2 per real branch point, while five failures assumed uniformity (1/24, 1/4 from 'each bag equally likely to be last') and one inverted the orientation to conclude the outcome was forced. Rounds 1-2 already showed that long enumerate-the-whole-tree hints hurt held-out badly, so this revision stays near the incumbent's length and adds only the two steps the successful rollouts used: translate the asked position into a delivery rank, then count genuine 1/2 branch points versus forced moves."
3,7,3836,149.63,149.73,39e2668fb5cca7669288765276aabe0dba01769397daa33b16a9dd7c0174a8f4,d636b3a5b5b8102e6bfabcd395a8cce725811581805e973f2b7d415e7b426729,39e2668fb5cca7669288765276aabe0dba01769397daa33b16a9dd7c0174a8f4,0.125,0.0,-0.125,0.1875,0.1625,-0.024999999999999994,1.0625,0.8125,-0.25,82,148,discarded,apply-rows-to-test-polynomial-dual-basis,"All 8 rollouts scored 0 with a single shared error: each set P(x)=sum_i a_i x^i and reinterpreted row k as P(k)=0, swapping the node index with the condition exponent; the resulting degree-2005 polynomial with only 2004 roots left one free parameter, so rollouts either stalled declaring the system inconsistent/underdetermined or resolved the free root arbitrarily and reported a harmonic-sum, 1/2005, or 0 value. Rounds 1-2 already tried longer prose warnings against that swap and lost heldout accuracy, so this revision drops the warning framing and instead gives the positive mechanical rule -- apply the rows to a test polynomial evaluated at the nodes, chosen to isolate one weight -- keeping the text near incumbent length since the shorter incumbent transfers best."
3,8,23443,149.64,149.74,149cabea90724683bc818e06d11bef6dc0c07209cfe1b68f2300dc838be4613d,f5ed76c60d421a1e9567f5df7d50b2fc936dfb2d46c4a9113fede876040d8c34,149cabea90724683bc818e06d11bef6dc0c07209cfe1b68f2300dc838be4613d,1.0,0.875,-0.125,0.1125,0.1125,0.0,1.5625,1.4375,-0.125,77,86,discarded,minimal-delta-genericize-nouns-keep-length,"All 8 of my round-3 public rollouts scored reward 1 (train_i = 1.0), the third saturated round, so the only headroom is transfer, where the incumbent gets 9/80. Every correct rollout ran the same spine (divide-every-total -> gcd -> take max count -> sum -> scale by 1.2), and their only wasted effort was 6-23 backtracks re-deriving that the gcd is the maximum admissible count and re-reading the domain nouns; rounds 1 and 2 showed that replacing the incumbent with a longer, restructured generic paragraph (137 and 162 tokens) collapses train to 3/8 and 4/8 for only +2 and +3 heldout. So instead of another rewrite I made a minimal-delta edit at nearly the incumbent's length: same sentence skeleton and same operative phrases, but the house/street/construction nouns swapped for domain-neutral ones and the gcd-is-the-largest-N step stated explicitly, which should keep the training spine intact while letting the method apply to non-housing items of this class."
3,9,3980,149.65,149.75,8c6cf2ad54328ef6d5d7727c427a0f3b4e2872fcbd87df2e3a186687f9e272bd,639ef1aaea5466e5ec2541d329bfd26d7725952c998e3c95d3e186a3b31cd4f1,8c6cf2ad54328ef6d5d7727c427a0f3b4e2872fcbd87df2e3a186687f9e272bd,1.0,1.0,0.0,0.1625,0.1125,-0.05,1.8125,1.5625,-0.25,175,191,discarded,justify-sign-branch-and-add-centered-evaluation-shortcut,"All 8 public rollouts were correct again this round (8/8, 3.8k-6.1k tokens, none truncated), so the training question is saturated and the only loss is transfer and wasted reasoning. Every rollout still burned its first ~800 tokens writing out the generic ax^3+bx^2+cx+d pair before recentering, and each re-derived the B=+-A branch and then argued from scratch about why B=-A, because the incumbent asserts the odd-n sign without a reason. The revision explicitly bans the generic-coefficient opening, supplies the reason (B=A collapses to p=q, which distinct given data forbids), and adds the read-off rule that the fixed point is free and an input at distance d costs only A*d^n, so evaluation needs no expansion; the round-2 attempt to widen the trigger to all polynomial functional identities cost train 5/8, so the p(q)=q(p) trigger is kept concrete."
3,10,3843,149.66,149.76,f5e98cb83b7d21cc59c0ef6c4bdd6b70731bf33bd4636ee98ff25a9b5546eb9d,ce69be40ed567eba12a96f0a63ea1462e4b13c7ba9b4265dd1382a154fe82da4,ce69be40ed567eba12a96f0a63ea1462e4b13c7ba9b4265dd1382a154fe82da4,0.625,0.75,0.125,0.0875,0.1375,0.05000000000000002,1.0625,1.4375,0.375,135,181,kept,single-direction-convention-plus-no-piecewise-patching,"4/8 correct: one failure asserted the composite of the overlapping block swaps was disjoint transpositions and answered 2 without ever tracing it, and the three length-capped failures thrashed because their position map disagreed with their own string simulation after they silently switched between ""slot i receives"" and ""label at i goes to"" (one produced a non-injective map with two positions sent to the same target and never noticed). Two of those reached self-consistent counts for the smallest sizes, then abandoned them and burned the remaining budget inventing piecewise formulas for different n instead of rechecking the smaller simulation."
4,1,28054,149.83,149.87,7bfb7a0d8f83d797ba13b71ed1076d9e3bc7002785faa9b3a27625fa42b6c21f,dda7dce2c8320627a98906ada2f4d33b1e4f60a7bea77a7e4707d60a0a189d85,7bfb7a0d8f83d797ba13b71ed1076d9e3bc7002785faa9b3a27625fa42b6c21f,0.25,0.0,-0.25,0.15,0.125,-0.024999999999999994,1.0,0.625,-0.375,146,157,discarded,one-table-no-global-case-split,"My 8 public rollouts scored 2/8 and not one of the six failures ever evaluated both readings for a single private value: each opened independent global ""case: sum"" and ""case: product"" branches, killed the sum branch by noting a speaker can just subtract, then enumerated only divisors of the public number and emitted an unjustified one (143 twice, 11 once), while three others burned the 16k token cap restarting the same case analysis. The revision converts the incumbent's prose per-value instruction into a concrete single table (rows = candidate private values swept beyond divisors, columns = readings, filled-cell count decides know/don't-know) and adds explicit bars on restarting and on reporting a value with no surviving row, which are exactly the steps the wrong rollouts skipped."
4,2,30302,149.77,149.88,1f201f288fcb54e8912556e65d37575844f34bb6254ce56a76fd292e0482315d,b638ea8d1175c89a1ddb7cc91c21df93b1f6d9387e03c659ed649306eca5da85,1f201f288fcb54e8912556e65d37575844f34bb6254ce56a76fd292e0482315d,1.0,1.0,0.0,0.1875,0.125,-0.0625,1.9375,1.625,-0.3125,198,191,discarded,harden-k-extraction-with-nth-root-verification,"All 8 round-4 rollouts scored 1, so training is saturated and the real loss is transfer; the informative signal is the outlier 14.2k-token rollout that derailed for thousands of tokens on the modulus constant (misapplying |c|^(1/n), trying to absorb the constant into the bracket as (4z)^6, and settling on a wrong k before recovering), plus a 9.4k-token rollout whose first ~40 hedges were the same constant-vs-power confusion. Extracting k is thus the only fragile step in this family, so the revision adds a portable guard (write |c| as a prime power, take the exact nth root, verify k^n = |c|, never fold the constant into the bracket) while keeping the diameter-endpoints shortcut and center-not-on-circle warning that already work."
4,3,8554,149.84,149.89,a3268d480f0c74f9a8026bf5c2b6dd432a3ba1363673f43d20f5ae1256a63607,12ca35d8eb1c90348cad76d7ffd06b60ac04aa2e8bf55dff87141c5343e05d37,12ca35d8eb1c90348cad76d7ffd06b60ac04aa2e8bf55dff87141c5343e05d37,0.75,0.625,-0.125,0.0875,0.175,0.0875,1.1875,1.5,0.3125,169,165,kept,wedge-not-containment-half-plane-membership-test,"Round-4 training reproduced 7/8 with the incumbent; the sole failure placed the shared point correctly but then asserted from bounding extents that the small square lay wholly inside the large one, so its aligned test value was the whole small square, its two test orientations disagreed, and it drifted to a verbally guessed rotated fraction. A winning rollout also briefly hit the same containment mistake at the rotated orientation before recovering, so mis-deciding inside/outside is the live failure mode, not the min-overlap framing. Held-out has stayed low (0.0875) under the incumbent's bespoke wedge-tiling wording while earlier shoelace and vertex-audit variants raised held-out but collapsed train, so this revision keeps the invariance-then-stop control flow and adds only a portable rule that a touching corner is a wedge whose membership must come from signed half-plane tests."
4,4,25003,149.78,149.90,c88c72a8af76a0349016b46bf3a91690c7375399032fa6e2fedac91359b1f577,bba776fa3be966edafa3029ec593f6b1ada50dc742794dbd230f73ceafe1caef,c88c72a8af76a0349016b46bf3a91690c7375399032fa6e2fedac91359b1f577,0.625,0.25,-0.375,0.1625,0.1625,0.0,1.4375,1.0625,-0.375,176,186,discarded,structure-first-skip-degenerate-cases,"My 8 public rollouts with the incumbent hint scored 7/8; the single failure was again a token-cap truncation, not a wrong final answer, and it had already recovered the correct N x deg P bound in its last thousand tokens but never got to box it. That rollout burned most of its budget on degenerate side-cases (can all terms be equal? can a fifth-degree polynomial be constant? is it 1 or 5 terms?) before ever partitioning indices by function. The revision therefore front-loads the partition step, explicitly tells the solver to skip zero-difference / one-term-per-function detours as bound-irrelevant, and replaces the old 'trust the product' line with a commit-and-box-early budget rule."
4,5,30418,149.79,149.91,bf462b403f17cd428257353852dc46039314abb29f7a1232a8b7b962384878f2,4151ae883ff7737da230690451856fc9722cc757b1719689b8203656e15b7c23,bf462b403f17cd428257353852dc46039314abb29f7a1232a8b7b962384878f2,1.0,1.0,0.0,0.1375,0.1375,0.0,1.6875,1.6875,0.0,151,153,discarded,drop-redundant-midpoint-constraint,"All 8 public rollouts were correct, so train is saturated and only transfer binds; across rounds heldout has moved inversely with hint length (73 tok -> 0.15, 151 -> 0.1375, 161 -> 0.125, 189 -> 0.075), so this revision is shorter than the incumbent. The three longest rollouts (and the only ones that thrashed or declared the problem contradictory) all wasted thousands of tokens after adding a spurious second closure condition - equating diagonal midpoints or vertex sums - which over-determines the system and forces the new vertices to coincide with the given ones; the short clean rollouts never invoked it and simply carried one free on-curve parameter. The hint therefore names that over-constraint trap explicitly, keeps only the portable reduction lever (y-shift becomes a multiplicative argument factor) plus the degenerate/out-of-domain root filter, and drops the narrow base-under-one and discriminant-flip advice."
4,6,26989,149.80,149.92,99c30a3f882f054f77512e4fdca1d19befb3e5426d7d857d52f4369a95c4f820,2fc30a9994b2a22c6bb46e09481442ad199a056d8c5593e92b6599c2689bfded,99c30a3f882f054f77512e4fdca1d19befb3e5426d7d857d52f4369a95c4f820,0.0,0.125,0.125,0.1875,0.1125,-0.075,0.9375,0.6875,-0.25,83,147,discarded,add-variability-probe-before-orientation-and-branch-weighting,"All 8 of my public rollouts scored 0 under the incumbent: four asserted the delivery order is deterministically reversed (answering 1 and 0), three assumed uniformity (1/24, or 1/4 from 'each item equally likely to be last'), and one blew its token budget on unstructured case-by-case enumeration. Six also inverted orientation, equating the bottom of the destination pile with the last item delivered rather than the first. The revision therefore front-loads a cheap variability probe (exhibit two sequences with different outcomes) to kill the forced-outcome claim that dominated this round, then states the last-in-on-top rule and the 1/2-versus-forced branch weighting, while staying short since rounds 1-2 showed long enumerate-the-whole-tree hints hurt held-out."
4,7,3836,149.81,149.93,39e2668fb5cca7669288765276aabe0dba01769397daa33b16a9dd7c0174a8f4,c2d73b7c54ee94e5abbec59926fbbaa4601e0a2e414304553c49336544b8793c,39e2668fb5cca7669288765276aabe0dba01769397daa33b16a9dd7c0174a8f4,0.125,0.125,0.0,0.1875,0.1,-0.0875,1.0625,0.625,-0.4375,82,132,discarded,weighted-sum-of-given-equations-recipe,"All 8 rollouts scored 0 (7 hit the 16384-token cap) with one shared root cause: each set P(x)=sum_i a_i x^i and reread equation k as P(k)=0, transposing the unknown's index with the condition's exponent; the resulting degree-2005 polynomial with only 2004 roots left a free linear factor, so rollouts stalled calling the system inconsistent/underdetermined or resolved it arbitrarily and reported 1/2005, 0, a harmonic sum, or 1/4008. Rounds 1-3 lost heldout accuracy with long jargon-heavy warnings against the transpose, so this revision instead states the technique jointly as a concrete operation the student can execute -- take your own weighted combination of the equations, which forces evaluation at the listed values and makes the allowed exponent span explicit -- and jointly caps effort by isolating one unknown and evaluating rather than expanding."
4,8,23443,149.85,149.94,149cabea90724683bc818e06d11bef6dc0c07209cfe1b68f2300dc838be4613d,631be8eed5f087f7cdab1dec25cead2e9d0ae8ea0b579379c5e58836f770dc11,631be8eed5f087f7cdab1dec25cead2e9d0ae8ea0b579379c5e58836f770dc11,1.0,0.625,-0.375,0.1125,0.2125,0.09999999999999999,1.5625,1.6875,0.125,77,169,kept,generic-nouns-plus-unconditional-max-count,"All 8 of my round-4 public rollouts scored reward 1 (train_i = 1.0), the fourth saturated round, so the only headroom is transfer, where the incumbent sits at 9/80. Every rollout ran the same spine (each total divisible by N -> gcd -> take it as the count -> sum -> scale by 1.2) with 6-23 'wait' backtracks spent re-litigating the vacuous 'equal-street layout constrains N arithmetically' clause and the total-versus-per-unit reading. Comparing rejected rounds, the two generic rewrites (train 3/8 and 4/8) both made the max-count choice conditional ('if the wording asks for the maximum feasible count'), while the incumbent and the noun-swap round (8/8, 7/8) assert it flatly, so I kept that assertion unconditional while replacing the vacuous grouping clause with the portable rule that group wording only imposes a multiple constraint, and stated the total-versus-per-unit reading is fixed once."
4,9,3980,149.86,149.95,8c6cf2ad54328ef6d5d7727c427a0f3b4e2872fcbd87df2e3a186687f9e272bd,04a69263190fd4f767fe115eb73caa4ee8db2e1b919aa79153b8901e41a4a102,8c6cf2ad54328ef6d5d7727c427a0f3b4e2872fcbd87df2e3a186687f9e272bd,1.0,1.0,0.0,0.1625,0.1,-0.0625,1.8125,1.5,-0.3125,175,171,discarded,keep-working-spine-add-ansatz-jettison-test-fallback,"All 8 public rollouts were correct again (8/8, 3.8k-6.1k tokens, none truncated), so the training question is saturated under the incumbent and the entire remaining loss is transfer (heldout 0.1625). Round 2 showed that rewriting the concrete p(q)=q(p) trigger into abstract normalize-invariants language raises heldout slightly but costs train 5/8, and round 3 showed that piling on ansatz-specific micro-detail (generic-setup ban, centered read-off rule) drops heldout to 0.1125, so this revision keeps the proven centered-fixed-point spine almost intact and jettisons only the assertive odd-n sign claim in favor of a jointly-derived reason plus an explicit jettison-test fallback, which should stop unseen problems from being forced into an ansatz that does not fit their data."
