round,hint_id,train_qid,sampling_slurm_job_id,proposal_eval_slurm_job_id,incumbent_hash,proposal_hash,final_hash,old_train,new_train,delta_train,old_heldout,new_heldout,delta_heldout,old_J,new_J,delta_J,old_tokens,new_tokens,decision,mutation,subagent_summary
6,9,3980,149.126,149.136,379c17a37ce59d87b284ce8a3da735f1f64ff50b56d7336619bd74033c49cb1a,274e5c180b887844082fe65ff845acd6cc09142fabae1df8dfd1d5dd8c6afa48,379c17a37ce59d87b284ce8a3da735f1f64ff50b56d7336619bd74033c49cb1a,1.0,1.0,0.0,0.1875,0.125,-0.0625,1.9375,1.625,-0.3125,192,186,discarded,add-verification-closes-search-stopping-rule,"All 8 public rollouts were correct again (8/8, 4.1k-5.6k tokens, none truncated), so the training question stays saturated and every remaining point is transfer. The one uniform waste is post-solution second-guessing: each rollout reaches the centered solution by roughly its midpoint, verifies the identity, and then spends the rest re-litigating whether another center, sign, or family could work (7-14 'wait' restarts and 11-20 're-check' detours per rollout), which is exactly the behaviour that ran out of room in round 1. This revision keeps the proven trigger, centered ansatz, factored both-branch condition, and symmetric-data steps intact and adds only a portable closure rule stating that verification ends the search, which should convert wasted re-derivation into budget on harder unseen problems."
6,10,3843,149.127,149.137,ce69be40ed567eba12a96f0a63ea1462e4b13c7ba9b4265dd1382a154fe82da4,496282342ecd4858441dbcdd9ceaa239e6ca982b25b5262ff7bdb0c5d66c7f2e,ce69be40ed567eba12a96f0a63ea1462e4b13c7ba9b4265dd1382a154fe82da4,0.75,0.25,-0.5,0.1375,0.1375,0.0,1.4375,0.9375,-0.5,181,188,discarded,refute-order2-then-single-label-orbit-lcm,"Only 2/8 correct and all six failures hit the 16384-token cap; every one of them collapsed the block swap into a single transposition, declared the composite a product of disjoint 2-cycles, and answered 2, or thrashed between mutually inconsistent per-size counts (one even reported 12 for one size) without ever verifying anything. The revision states that swapping length-L blocks is L parallel position swaps rather than one transposition, adds a cheap falsification test (apply the FULL operation twice and compare) that kills the order-2 story immediately, and replaces expensive repeated whole-state rewriting with tracking a single label orbit and taking the lcm of orbit lengths."
7,1,28054,149.138,149.148,1624391b1ea234720db50aada7f5e2f22f58c8f7853e976d277c7b07bec2a58d,9b89eed918fa2ff42962b6b7fac8ffc449f316c862cffbd30b6b745bc0411367,1624391b1ea234720db50aada7f5e2f22f58c8f7853e976d277c7b07bec2a58d,0.25,0.125,-0.125,0.1625,0.0875,-0.07500000000000001,1.0625,0.5625,-0.5,142,186,discarded,replay-verification-plus-widen-unstated-features,"All 8 rollouts (execution 149.138) scored 0: despite the incumbent's ban on global case splits, every rollout still opened separate 'sum' and 'product' cases, and inside the sum case argued that a holder of v immediately knows 2002-v, which credits the speaker with knowing the public number's role; four then declared the puzzle contradictory and boxed an arbitrary factor (143, 154, 13) while three burned the 16k cap looping. The revision replaces abstract 'recount jointly' language with two concrete steps the failures skipped: evaluate each statement strictly from that speaker's own view using only facts they were told, and replay every statement against any surviving scenario before answering, with an explicit widen-the-unstated-features rule instead of guessing when nothing survives."
7,2,30302,149.139,149.149,1f201f288fcb54e8912556e65d37575844f34bb6254ce56a76fd292e0482315d,59b3d8b787e142b5557010de60e2aaf179f67e91a57adadbbb61e6f1a74bd7e2,59b3d8b787e142b5557010de60e2aaf179f67e91a57adadbbb61e6f1a74bd7e2,1.0,1.0,0.0,0.1875,0.1875,0.0,1.9375,1.9375,0.0,198,190,kept,coordinate-route-primary-drop-endpoint-shortcut-add-length-magnitude-guard,"All 8 round-7 rollouts scored 1, so training is saturated and the signal is token waste and transfer: the shortest, cleanest rollout (3.7k tokens, 6 hedges) ignored the incumbent's diameter-endpoints shortcut entirely and went straight to z=x+iy, square, divide by the x^2+y^2 coefficient, complete the square, while the four longest (5.1k-12.2k tokens, up to 37 hedges) all entered the endpoint/midpoint route early and only reached the coordinate route much later. The 12.2k outlier then stalled on two self-inflicted crises the endpoint route creates: a negative-looking radius from a negative 1-k^2 denominator (10 'negative' mentions) and applying the 1/n root while nth powers still stood. The revision therefore inverts the priority to make the coordinate route primary, explicitly drops the endpoint shortcut, and adds a portable rule that lengths are magnitudes so a negative expression is a sign of the divisor, not an error."
7,3,8554,149.140,149.150,9ebe8ddbf8a5d9daaae8e0a4357cd7a942e10529d116c36fa43a25d554e232f5,fb51b21593ed905cd5a002358e62f833d6da9e1c02aa884460885af4ac2cb21a,fb51b21593ed905cd5a002358e62f833d6da9e1c02aa884460885af4ac2cb21a,0.5,0.75,0.25,0.2,0.175,-0.025000000000000022,1.5,1.625,0.125,192,194,kept,explain-why-wedge-cannot-contain-S-via-boundary-through-interior,"This round scored 5/8; all three failures collapsed the same way, asserting from extent alone that the 1x1 shape lies wholly inside the 2x2 one (one committed 4 outright, two burned the 16384-token cap oscillating between that containment claim and unsuccessful tangency/distance-to-side searches). The incumbent already forbids the containment claim but gives no checkable reason, so the student overrides the ban with a size argument. This revision supplies the mechanism: a corner covers only the intersection of two half-planes whose boundary lines run through S's interior, so some of S is necessarily outside, which makes extent-based containment self-refuting and keeps the rotation-partition proof that earned the best held-out score."
7,4,25003,149.141,149.151,c88c72a8af76a0349016b46bf3a91690c7375399032fa6e2fedac91359b1f577,f1e86f9a34510e1d671256d508eaab2ff3cd6ff909ba9c25c39f2ea7f3c39654,c88c72a8af76a0349016b46bf3a91690c7375399032fa6e2fedac91359b1f577,0.625,0.375,-0.25,0.1625,0.15,-0.012500000000000011,1.4375,1.125,-0.3125,176,188,discarded,non-consecutive-groups-plus-finish-immediately,"My 8 public rollouts with the incumbent scored 5/8 and, unlike round 5, all three failures were token-cap truncations rather than wrong answers, so the fix must target looping, not aggregation. Two of the three re-imposed a constant step inside a single function's own values, concluded 'each function contributes at most one term', hit the contradiction with the hint's product, and oscillated until truncation; the third had already accepted the product and begun a clean final write-up but restarted the exposition and ran out of space. The revision therefore adds the one missing fact that kills the loop (a function's index group need not be consecutive, so its own successive differences carry no information) and a terminate-once-settled rule, trimming the verbose construction clause to stay under the token cap."
7,5,30418,149.142,149.152,bf462b403f17cd428257353852dc46039314abb29f7a1232a8b7b962384878f2,b60ca35e99e07fde4431c328214f7b133b1c5c8f2d3d1548af02a19e0a0ff35f,bf462b403f17cd428257353852dc46039314abb29f7a1232a8b7b962384878f2,1.0,0.875,-0.125,0.1375,0.15,0.012499999999999983,1.6875,1.625,-0.0625,151,190,discarded,normalize-fractional-base-and-ban-midpoint-restatement,"All 8 public rollouts were correct (train_i=1.0), so train is saturated and transfer binds. The two most expensive rollouts (13360 and 10264 tokens) each spent hundreds of lines restating the single vector equality as equal diagonal midpoints or vertex sums; one of them derived a y-gap of 3 instead of 1 from that restatement and then wrote six passages about the problem being contradictory before recovering, while every clean short rollout took the displacement directly off the vector and never mentioned midpoints. Prior-round failures on this question had the same shape plus assigning a translated vertex a y from the carried shift rather than from f, so this revision replaces the base-under-1 warning with a one-line base flip that removes the direction trap outright, names the redundant-midpoint detour as the thing to skip, and keeps only the reduction lever, root filter, and evaluate-f rule."
7,6,26989,149.143,149.153,99c30a3f882f054f77512e4fdca1d19befb3e5426d7d857d52f4369a95c4f820,466facab1208fc7a47986ab237293f5be9ec980670b8f43f1612be39eae83ed6,466facab1208fc7a47986ab237293f5be9ec980670b8f43f1612be39eae83ed6,0.0,0.0,0.0,0.1875,0.2125,0.024999999999999994,0.9375,1.0625,0.125,83,91,kept,shorter-than-incumbent-event-to-move-constraint-weighting,"This round scored 2/8; both successes converted the asked position into a requirement on which move happens last, then multiplied 1/2 only over the genuinely free binary steps, while five of the six failures used a uniformity shortcut (1/4 from 'each bag equally likely per position', 1/2, or 1/16 from 1/2^n) and one still claimed the order is forced. Rounds 1-6 show every rewrite longer than the 83-token incumbent lost held-out monotonically, so this proposal is deliberately near incumbent length and keeps only the one mechanism the successful rollouts used plus the orientation rule."
7,7,3836,149.144,149.154,39e2668fb5cca7669288765276aabe0dba01769397daa33b16a9dd7c0174a8f4,896aa1fa5df49665bce33f3b3f1e2f4f9048d7be128d3b6fd7d926dd118bdd73,39e2668fb5cca7669288765276aabe0dba01769397daa33b16a9dd7c0174a8f4,0.125,0.0,-0.125,0.1875,0.125,-0.0625,1.0625,0.625,-0.4375,82,130,discarded,compact-minimal-delta-test-polynomial-rule,"All 8 rollouts scored 0 (7 hit the 16384-token cap) with the same failure seen every round: each set P(x)=sum a_i x^i and reread condition k as P(k)=0, swapping the node with the condition exponent, then spent the budget on the resulting phantom free root and reported 1/2005, 0, 1/4008, -1/2004, or a harmonic sum. Six prior proposals at 132-184 tokens all lost heldout accuracy relative to the 82-token incumbent, roughly monotonically in length, so this round tests the untried short region: keep the incumbent's proven functional register and add only the one missing operational move, a combination of the given conditions forming a test polynomial that isolates a single weight."
7,8,23443,149.145,149.155,631be8eed5f087f7cdab1dec25cead2e9d0ae8ea0b579379c5e58836f770dc11,2fbf96592d47b43c38e33fe2ab9820d903707cf2b5798507a1ea6d8adb893301,631be8eed5f087f7cdab1dec25cead2e9d0ae8ea0b579379c5e58836f770dc11,0.625,1.0,0.375,0.2125,0.125,-0.0875,1.6875,1.625,-0.0625,169,187,discarded,label-what-each-given-number-counts,"6/8 public rollouts were correct and both failures shared one mode: they never mentioned gcd or maximality at all, instead lifting the stated group count directly as the unit count, dividing every listed total by it, finding each quotient whole, and treating that as confirmation. Rounds 5 and 6 attacked this by expanding the gcd machinery (front-loaded warning, maximality certificate) and both raised train while collapsing heldout from 0.2125 to 0.1125 and 0.0625, so more narrow divisibility apparatus demonstrably hurts transfer. Since lambda=5 I instead replaced the incumbent's near-vacuous grouping clause with a broadly portable quantity-labelling discipline - state in words what each given number counts before using it, and confirm you reported the quantity asked - which blocks the observed substitution without adding item-specific gcd steps."
7,9,3980,149.146,149.156,379c17a37ce59d87b284ce8a3da735f1f64ff50b56d7336619bd74033c49cb1a,a6b899fe065325aa4eb8aa78affd24badba40d6f15d870876bab02f9a3c2d5fd,a6b899fe065325aa4eb8aa78affd24badba40d6f15d870876bab02f9a3c2d5fd,1.0,1.0,0.0,0.1875,0.1875,0.0,1.9375,1.9375,0.0,192,189,kept,generalize-symmetric-sum-difference-step-to-portable-rule,"All 8 public rollouts were correct again (8/8, 3.5k-5.7k tokens, none truncated), so the training question is saturated under the incumbent and every remaining point is transfer. Reading them, the centered ansatz and the factored both-branch condition are picked up verbatim and cause no trouble, but the incumbent's data step is stated only as a fact about this problem's two values ('their sum pins r, their difference pins A'), so rollouts treat it as a lookup rather than a method and several detour into re-solving the pair one equation at a time. This revision keeps the proven trigger, centered ansatz, branch derivation, and verification spine byte-identical and rewrites only that step as the portable rule that constraints differing in the sign of one part should be added and subtracted to decouple the unknowns, which should carry to unseen problems whose given data is not p(0),q(0)."
7,10,3843,149.147,149.157,ce69be40ed567eba12a96f0a63ea1462e4b13c7ba9b4265dd1382a154fe82da4,40cb5e8cfaa966f8f8ad606dee530da9d332b5db270377c89e0b8cb0256375e4,ce69be40ed567eba12a96f0a63ea1462e4b13c7ba9b4265dd1382a154fe82da4,0.75,0.25,-0.5,0.1375,0.0625,-0.07500000000000001,1.4375,0.5625,-0.875,181,187,discarded,define-one-application-then-distrust-the-small-case,"Only 2/8 correct; six failures shared two root causes. Several rollouts spent thousands of tokens unsure whether one application is the whole loop over k or a single block swap, then counted sub-steps as applications (one reported 3 for the 4-letter size, another invented a k=n sub-step that does not exist), and the rest collapsed a length-L block swap into one transposition and asserted order 2 untraced. Two length-capped rollouts had a small-size count that contradicted their own larger-size counts and concluded no single formula exists instead of redoing the cheap small case, so the revision defines the application boundary up front, guards the sub-step range, and tells the student to distrust the small case rather than go piecewise."
8,1,28054,149.158,149.168,1624391b1ea234720db50aada7f5e2f22f58c8f7853e976d277c7b07bec2a58d,201354a92ede8d8aac1cb60ea727c71fda8c2a78ad6bed1e1f28858eb6defeef,201354a92ede8d8aac1cb60ea727c71fda8c2a78ad6bed1e1f28858eb6defeef,0.25,0.125,-0.125,0.1625,0.2125,0.04999999999999999,1.0625,1.1875,0.125,142,147,kept,index-by-own-private-value-not-public-data,"All 8 public rollouts scored 0 (execution 149.158): every one opened separate global sum and product cases and judged uncertainty from the public number alone (""many pairs sum to 2002""), then flipped to ""but he can just subtract/divide"", called the puzzle contradictory, and boxed an arbitrary factor 143 (four times) or burned the 16k cap looping (four hit finish_reason=length). The revision replaces the incumbent's abstract joint-recount language with the concrete step the failures skipped, indexing every knowledge judgement by the speaker's own private value with the unstated structural choice carried inside each scenario, and it is deliberately shorter because in this hint's history longer, more problem-specific hints have consistently transferred worse."
8,2,30302,149.159,149.169,59b3d8b787e142b5557010de60e2aaf179f67e91a57adadbbb61e6f1a74bd7e2,87bd1b9dc5dd16adb393c3ccb90e8691515ab42645fca918cd8c168081be2c01,59b3d8b787e142b5557010de60e2aaf179f67e91a57adadbbb61e6f1a74bd7e2,1.0,0.875,-0.125,0.1875,0.1375,-0.04999999999999999,1.9375,1.5625,-0.375,190,190,discarded,modulus-vs-argument-split-and-center-is-not-on-locus-check-rule,"All 8 round-8 rollouts scored 1, so training is saturated and the loss is transfer and token waste: every rollout reached the modulus ratio within the first 5-17% of its text, yet 6 of 8 then spent the middle half of the response re-deriving individual roots as exponentials (7-27 e^{...} expressions each), and the two longest (5.9k and 6.0k tokens, 12-14 hedges) opened by taking a 6th root of the equation itself before recovering. The clearest self-inflicted stall came from a rollout that tested the center point against the locus equation, found it failed, and questioned the whole circle. The revision therefore states the modulus/argument division of labour so enumeration is visibly unnecessary rather than merely forbidden, keeps the moduli-before-exponents ordering, and replaces the incumbent's vague verification advice with a concrete rule that spot-checks use a point at the radius, not the center, which never satisfies the locus."
8,3,8554,149.160,149.170,fb51b21593ed905cd5a002358e62f833d6da9e1c02aa884460885af4ac2cb21a,c72f433a0ef92c5d5f1390bb47ee07af9709ba7318774127e46a0e95b4ab5374,fb51b21593ed905cd5a002358e62f833d6da9e1c02aa884460885af4ac2cb21a,0.75,0.375,-0.375,0.175,0.2125,0.037500000000000006,1.625,1.4375,-0.1875,194,189,discarded,wedge-frame-axes-and-kill-center-to-side-distance-reasoning,"Training scored 5/8; all three failures ran out the 16384-token cap rather than committing a wrong answer, and each died in the same place: reasoning about the large square's center-to-side distance as if the shared point were its center, concluding from that distance and from size that the small square must lie wholly inside, then oscillating between that claim and an unclosed tangency search. One failure had already computed the correct aligned overlap and then abandoned it after the distance argument contradicted it. The revision makes the wedge concrete by putting the axes on the corner's own edges so uncovered points are exactly those with a negative coordinate, names the center-vs-corner confusion as the specific fallacy, and closes with an explicit stop that forbids the angle/tangency retesting loop."
8,4,25003,149.161,149.171,c88c72a8af76a0349016b46bf3a91690c7375399032fa6e2fedac91359b1f577,21192c6cb98688e15ec795c973c5e96f06d4ded5712476e931bff9c904fae453,21192c6cb98688e15ec795c973c5e96f06d4ded5712476e931bff9c904fae453,0.625,0.875,0.25,0.1625,0.125,-0.037500000000000006,1.4375,1.5,0.0625,176,189,kept,extremal-framing-plus-cap-is-per-group,"My 8 public rollouts with the incumbent scored 7/8; the lone failure terminated normally rather than truncating, and it failed by never partitioning indices at all: it chained adjacent board entries into P_{i+1}(i+1) - P_i(i) = d, concluded each function may be used only once, and reported N as the count. Rounds 3-7 showed that rewriting or piling reject-rules onto the incumbent collapses train, while round 6's extremal reframe was the only variant to raise heldout, so this revision keeps the incumbent's proven skeleton verbatim and adds only the portable bound-meets-construction opener plus a four-word note that the root cap is per group so N alone is not the count."
8,5,30418,149.162,149.172,bf462b403f17cd428257353852dc46039314abb29f7a1232a8b7b962384878f2,b0d143af6f98f3554bc0bda28c072495eeb5a623b4898622d3cd34e431e577b7,bf462b403f17cd428257353852dc46039314abb29f7a1232a8b7b962384878f2,1.0,0.625,-0.375,0.1375,0.15,0.012499999999999983,1.6875,1.375,-0.3125,151,190,discarded,add-free-degenerate-root-factoring-check,"All 8 public rollouts were correct this round, so train is saturated and only transfer binds (heldout 0.1375 for the incumbent). The one clearly defective trace was also the longest (13360 tokens): it restated the single vector equality as equal diagonal midpoints, copied the y-gap as 3 instead of 1, and ground out an irrational quadratic before backtracking. Round 6's best-ever heldout (0.1625) came from the free-root idea, so this revision keeps the incumbent's proven pipeline, bans the midpoint restatement, and states the degenerate-root test as a one-shot validity check plus a factoring shortcut instead of a redo-loop instruction."
8,6,26989,149.163,149.173,466facab1208fc7a47986ab237293f5be9ec980670b8f43f1612be39eae83ed6,51e5a184e97284354f466633f33a1748452ec207d4788b3100b6c17689d3938c,466facab1208fc7a47986ab237293f5be9ec980670b8f43f1612be39eae83ed6,0.0,0.0,0.0,0.2125,0.175,-0.037500000000000006,1.0625,0.875,-0.1875,91,142,discarded,state-only-direction-is-random-plus-2n-move-count,"All 8 rollouts scored 0: seven explicitly asserted the final order is a uniformly random permutation and answered 1/n (six gave 1/4 or 1/2 for part b, one gave 1/24), and several miscounted the process as n moves with n binary choices (hence 1/2^(n-1) or 1/16) instead of 2n carries. The incumbent already bans symmetry claims and gives the orientation rule, so this revision adds the two structural facts the failures actually lacked: the random draw is over direction only while the item moved is forced by the stack top, and each item is carried twice so the move count is 2n."
8,7,3836,149.164,149.174,39e2668fb5cca7669288765276aabe0dba01769397daa33b16a9dd7c0174a8f4,b2a22f64742db6de717ce4677f47425adbfad7620c3372bf9f96e9c222adbfaa,b2a22f64742db6de717ce4677f47425adbfad7620c3372bf9f96e9c222adbfaa,0.125,0.75,0.625,0.1875,0.075,-0.1125,1.0625,1.125,0.0625,82,186,kept,replace-functional-framing-with-scaled-small-case-ladder-and-formula-refit,"My 8 rollouts scored 1/8, and the single success came purely from solving n=2,3,4 by elimination and fitting a signed-factorial pattern, never from the incumbent's functional/Lagrange framing; two other rollouts reached the same numeric ladder but mis-fit the closed form (off-by-one factorial, or 1/2005!), and the rest burned the 16384-token cap on Vandermonde-inverse or interpolation detours after mis-scaling a toy with more conditions than unknowns and calling it inconsistent. Seven prior rounds of functional/test-polynomial rewordings all lost heldout accuracy, so this proposal switches register entirely to the mechanism that demonstrably produced the win: a correctly-scaled small-case ladder plus an explicit refit-and-verify step against every toy value."
