round,hint_id,train_qid,sampling_slurm_job_id,proposal_eval_slurm_job_id,incumbent_hash,proposal_hash,final_hash,old_train,new_train,delta_train,old_heldout,new_heldout,delta_heldout,old_J,new_J,delta_J,old_tokens,new_tokens,decision,mutation,subagent_summary
14,1,28054,149.278,149.288,a3a9805f3b37695536ecf7628ac6a588215a3f9ca6cb77ede20cc39aa1b660f1,d5ad127de1a0489f9979273aeec66a30d7227b5f2c1ac16ac94f33b7b5602a77,a3a9805f3b37695536ecf7628ac6a588215a3f9ca6cb77ede20cc39aa1b660f1,0.125,0.125,0.0,0.225,0.1375,-0.0875,1.25,0.8125,-0.4375,184,190,discarded,one-table-rows-by-value-columns-by-unsettled-choice-with-ignorance-blanking,"All 8 rollouts scored 0 (execution 149.278): seven boxed 143, one 154, none hit the token cap. Every rollout opened the two readings of the public number as separate self-contained cases, argued inside each that a speaker's own value plus that reading pins the partner, wrote ""contradiction"", then abandoned logic and picked a factor on looks (one explicitly chose the value it wrongly called non-unique among factor pairs). Not one built a single joint object over value and reading, and not one used the first speaker's ignorance as a filter on the second speaker's candidate partners. The prose incumbent already says all this abstractly and still fails, so the revision replaces prose with one concrete artifact - a value-by-choice table with blank-on-illegal cells, filled-cell counting per row, and ignorance propagation as blanking cells whose partner row is not ignorant - giving a mechanical procedure instead of a principle."
14,2,30302,149.279,149.289,d64c59d2b557d10973880b9db8d06fc37e7c9227ad8f286d5ed1578a4d2ebb80,c608cf3e70986473f7ad7a491de9bfd43b306ba0d80aa9b5896943da5d065421,c608cf3e70986473f7ad7a491de9bfd43b306ba0d80aa9b5896943da5d065421,1.0,1.0,0.0,0.2,0.2125,0.012499999999999983,2.0,2.0625,0.0625,189,192,kept,necessity-suffices-stop-rule-replaces-skip-roots-of-unity,"All 8 rollouts correct (3.0k-9.8k tokens, 4-30 hedges), so training is saturated and the cost is transfer plus waste. Diagnosis: the incumbent's bare 'skip roots of unity' was disobeyed by 7 of 8, which enumerated the n solutions via exponentials (14-129 occurrences) after already having the circle, because they doubted a necessary condition suffices. The worst (9.8k tokens, 30 hedges) derived a bogus side-condition from that enumeration, concluded only 2 of 6 roots fit, and spent ~5k tokens escaping a self-inflicted contradiction; another closed by asserting the modulus condition is 'sufficient', right answer via wrong logic that will not transfer. Also 6 of 8 ignored the prescribed w*wbar clearing and used x+iy anyway. So the revision states WHY necessity closes the problem (containment is what is asked), makes it an explicit stop rule capped at a one-root check, and permits either clearing route."
14,3,8554,149.280,149.290,e706044d3f2b50b5b56d612f00e693ef4bbb86f0d16e53200f96da94b7c7109e,fc03b378a90f7d1b7bd03369c687040c43a7d30b264da0df907d49211412e809,e706044d3f2b50b5b56d612f00e693ef4bbb86f0d16e53200f96da94b7c7109e,0.75,0.5,-0.25,0.2,0.225,0.024999999999999994,1.75,1.625,-0.125,190,195,discarded,replace-asserted-overlap-bounds-with-executable-vertex-sign-table-in-corner-frame,"My 8 rollouts scored 6/8, all finish_reason=stop, so no budget loss: both failures commit a wrong answer via the same containment error. One had the covering square as x,y in [0,2] and S spanning -0.5..0.5, then asserted S was entirely inside even though S reaches negative x and y; it had the right corner frame and never sign-tested one vertex. The other compared a reach radius (~0.707 to S's farthest corner) against the big square's half-diagonal (~1.414) and concluded containment. Neither clipped any region; both answered summed-areas-minus-area(S). The incumbent only asserts overlap lies strictly between 0 and area(S), and a bare bound loses to a concrete-looking radius number. This revision makes the bound executable: list S's vertices in the corner frame, covered iff both coordinates are non-negative, which exposes uncovered vertices directly, and defines overlap as S clipped to the quadrant so a computation follows."
14,4,25003,149.281,149.291,71bbac004964e95216c81767dcfcedba54fed6a04125845418ad992501b8e093,f5f90c043608c07ddd9504666626fb515dc978572313001bf17abb93b3b5030a,71bbac004964e95216c81767dcfcedba54fed6a04125845418ad992501b8e093,1.0,0.875,-0.125,0.1625,0.15,-0.012500000000000011,1.8125,1.625,-0.1875,190,197,discarded,define-T-as-the-progressions-own-degree-1-formula-and-unify-position-with-argument,"5/8 correct. All three failures came from misreading T. One quoted the hint's cap verbatim, then assumed T was itself a fifth-degree polynomial value, so 'degree-1 T cannot cancel P's leading term' carried no force; it dropped the per-group cap and drifted to N=10. One computed N x d correctly, called it 'too high', and reverted to a small guess before truncating. The third never grouped at all: it chained adjacent board entries, built the P+d shift family, and reported N=10. So the live fault is that T is not recognised as the progression's own affine formula, and that position index versus substituted argument look like two variables. The revision states T's degree explicitly, folds the consecutive-input shift into one variable so P keeps degree d, and keeps the per-group cap, the N x d aggregation, and the block construction."
14,5,30418,149.282,149.292,85f213d578062adcf883b7f1f27d6adaf1b87fd1ff0c18c817da13cc0a477ef6,051ec9aa6fc5d9bdd4a80c1395fda3b8e9ece62f61d1cedf91385242a6d94fa4,85f213d578062adcf883b7f1f27d6adaf1b87fd1ff0c18c817da13cc0a477ef6,0.75,0.625,-0.125,0.2,0.1875,-0.012500000000000011,1.75,1.5625,-0.1875,193,186,discarded,verify-each-log-height-by-exponentiating-back,"6/8 correct (jobs 149.282). Both failures hit the token cap on the same jam, not on the reduction: they fit the curve, formed the closure f(t+dx)=f(t)+dy, and got the right quadratic with jointly the degenerate root and the wanted one. They then read the non-degenerate vertex's height off the log with the exponent's sign flipped (an argument well under 1 was assigned a negative height), so the translated vertex missed the curve. Both jointly declared a contradiction: one looped re-expanding identical algebra, the other pivoted to the banned equal-diagonal-midpoints condition, collapsed the figure onto a given vertex, then produced a negative discriminant and 11 'no real solution' jams. The incumbent already says 'take each height from f', so the missing mechanism is a cheap verification of that single log evaluation: exponentiate the height back and compare it to the argument, and treat a curve miss as one wrong exponent sign to repair rather than a broken problem."
14,6,26989,149.283,149.293,40f95ed4950fe23e751bafb0454b3a7b04b2370e997c7f4b8f29907ec9bc480e,59c76237a5c51e6761287ff5255da6d064a12391b02b31cccf4c7905d6fd2273,40f95ed4950fe23e751bafb0454b3a7b04b2370e997c7f4b8f29907ec9bc480e,0.375,0.0,-0.375,0.2,0.125,-0.07500000000000001,1.375,0.625,-0.75,175,190,discarded,hand-check-model-on-two-item-instance-plus-compact-in-out-move-string,"3/8 correct (idx 0,2,7) and even those got 1/8 unsoundly: idx 7 pattern-matched 1/2^(n-1), idx 0 and 2 inverted the pile (bottom = last carried) yet luckily still multiplied three halves. Failures: idx 3,6 called the shed a uniform random permutation (1/24, then 1/4); idx 5 declared the order always reversed (1, 0); idx 1 paired a right part a with a non-probabilistic 1/3; idx 4 hit the token cap oscillating over which end of the shed is the bottom. So the incumbent states the orientation rule and bans 1/n, yet the flip survives in 6 of 8 and prose narration of moves burns tokens. This revision keeps arrival-rank orientation and forced/free 1/2 pricing, adding two mechanisms: first hand-check the model on the two-item instance, which concretely refutes forced-order and uniformity and pins orientation, and record moves as a compact in/out letter string instead of prose. Measured 190 tokens."
14,7,3836,149.284,149.294,b2a22f64742db6de717ce4677f47425adbfad7620c3372bf9f96e9c222adbfaa,bf8917df8e428960f80d51070d9c159b26a541b8cfec74724b518f1eb812f558,bf8917df8e428960f80d51070d9c159b26a541b8cfec74724b518f1eb812f558,0.75,0.625,-0.125,0.075,0.1,0.02500000000000001,1.125,1.125,0.0,186,189,kept,ban-symbolic-general-size+ratio-law+computed-cases-outrank-formulas,"4/8. All four winners did only this: solve n=2,3,4 numerically, fit a signed reciprocal-factorial law, substitute. Three of the four failures hit the 16384 cap the same way: after spending 1000+ tokens re-arguing how many conditions a size-n toy carries, each abandoned numbers for symbolic general-size algebra (coefficient of x in a product of linear factors, elementary symmetric sums, harmonic sums); when that formula clashed with a toy they had computed correctly, all three kept re-deriving the symbolic formula instead of trusting the number. The fourth built no toy at all, named 'moment theory', and asserted a wrong sign and factorial argument. So this revision bans carrying the stated size as a symbol, replaces formula-guessing with consecutive ratios (growth and sign come out mechanically), makes computed cases authoritative over any law, and routes ambiguity to one extra numeric case."
14,8,23443,149.285,149.295,d6e761f5cca43ef948238db65074ea53c3f8953ec6c1f76a4fc7f307db54c5db,2640cac3c47582e5a1b883fa49849a547dc246732dafe270ce4d275ede7d85eb,d6e761f5cca43ef948238db65074ea53c3f8953ec6c1f76a4fc7f307db54c5db,0.875,0.75,-0.125,0.175,0.125,-0.04999999999999999,1.75,1.375,-0.375,185,190,discarded,replace-decide-once-with-well-posedness-usefulness-test,"All 8 public rollouts scored reward 1 (train 8/8), so headroom is transfer only (incumbent 14/80). But runs were expensive and unstable: 5.6k-11.2k completion tokens with 10-41 'wait' backtracks, and every rollout kept resurrecting the group-count reading (3-21 mentions of the rival price it implies) before returning to the gcd count. The churn is not arithmetic; it is re-litigating whether each listed figure is a village grand total or a per-house amount. The incumbent only says 'decide once', giving no test, so rollouts oscillate. Prior rounds show deleting the gcd/max-count mechanic collapses train (8/8 to 3/8) and a maximality certificate hurt heldout (5/80), so I kept round 13's structure and swapped the vague 'decide once' clause for a portable well-posedness test: prefer the reading under which every stated condition does work and the hidden count is determined. That should terminate the same oscillation on unseen items of this class."
14,9,3980,149.286,149.296,3e5130251127f1cdd38d0a1bb8dd4fb0acfb2a10ba7588ffd823b20e7a983801,d154b728d566b43723d258e73c12a723a3b026de4c8f67cd1a95d80ef439aa46,3e5130251127f1cdd38d0a1bb8dd4fb0acfb2a10ba7588ffd823b20e7a983801,1.0,1.0,0.0,0.2,0.1875,-0.012500000000000011,2.0,1.9375,-0.0625,189,190,discarded,enumerate-all-roots-of-the-like-power-difference-and-forbid-collapsing-it-to-A-minus-B,"7 of 8 rollouts correct (3.4k-4.8k tokens). The single failure burned the full 16384-token cap from one algebra slip: it read the incumbent's AB(A^(n-1)-B^(n-1))=0 and rewrote AB^3-BA^3 as AB^2(B-A), so the only surviving branch was B=A. That contradicts distinct p(0),q(0), so it concluded no common fixed point exists (38 'fixed point', 9 'another', 11 'A = B', 5 'contradiction' mentions), abandoned the centered ansatz, and never recovered. The 7 correct rollouts all wrote B=-A within their first page and finished quickly, so the branch enumeration is the whole gap. This revision keeps the proven trigger, ansatz, parameter-count closure, symmetric-combination and verification spine and changes only the branch step into a portable root-enumeration rule, plus a switch-roots-not-ansatz recovery instruction."
14,10,3843,149.287,149.297,1e3acbae873bc435b7dfe5ef08152ba300c78d6c321ecbd752834208236d2a85,1b9bc8a8aea0a5a6e619df7118fee1bff92e28bac8a6fb1875aebead15bfa939,1e3acbae873bc435b7dfe5ef08152ba300c78d6c321ecbd752834208236d2a85,0.75,0.5,-0.25,0.1875,0.15,-0.037500000000000006,1.6875,1.25,-0.4375,194,192,discarded,forbid-reading-cycle-type-off-substeps-plus-refit-against-smallest-size,"4/8 correct. All four failures share one move: they never traced a state, they wrote cycle notation inferred from the sub-steps' shapes. Two announced the composite was disjoint transpositions/short cycles and reported an off-by-one exponent; one invented per-size cycle lists (2,4,2 then 2,8,2,4) that no trace produced; one fabricated counts for the two smallest sizes, got contradictory numbers, and fit an inflated exponent. One failure explicitly noticed its formula contradicted the smallest size and excused it as a special case; another oscillated between order 2 and a growing order and burned the whole budget. Correct rollouts instead traced slot movement and reported one consistent growth law. So the revision bans deriving cycle type from sub-step shapes, demands each count come from a written state trace, and forces the fitted formula to be re-checked against the smallest size with no exceptions allowed."
15,1,28054,149.298,149.308,a3a9805f3b37695536ecf7628ac6a588215a3f9ca6cb77ede20cc39aa1b660f1,a341ac25546bd3148f68423f6989f1a1a8a8783b984bfdee76ca45caf26ea6d5,a3a9805f3b37695536ecf7628ac6a588215a3f9ca6cb77ede20cc39aa1b660f1,0.125,0.125,0.0,0.225,0.075,-0.15000000000000002,1.25,0.5,-0.75,184,192,discarded,substitute-partner-into-prior-condition-with-strictly-stronger-check,"All 8 rollouts of the incumbent (exec 149.298) ran the same path: split the public number into a sum case and a product case, note inside each that a speaker's own value plus that fixed reading pins the partner, write ""contradiction/impossible"", then abandon logic. Boxed 143 three times, 13 once justified explicitly by primality, one looped to 1001 without deduction; 3 of 8 burned the 16384-token cap on that loop. Even the single scoring rollout reached its value by asserting it after declaring its own reasoning flawed. Not one rollout ever used the first announcement as a condition and substituted the second speaker's candidate partners into it - the only step that actually narrows anything. The revision names that substitution concretely (partners of speaker 2 are speaker 1's value, so they must satisfy C1) and adds a self-check, C2 strictly stronger than C1, whose failure is flagged as the cause of ""impossible"" and of aesthetic guesses like primality."
15,2,30302,149.299,149.309,c608cf3e70986473f7ad7a491de9bfd43b306ba0d80aa9b5896943da5d065421,1dd40c889d1353703f0db3d1e49e4cebaa5f93d6f86339e27d2399368a6ae025,c608cf3e70986473f7ad7a491de9bfd43b306ba0d80aa9b5896943da5d065421,1.0,0.75,-0.25,0.2125,0.15,-0.0625,2.0625,1.5,-0.5625,192,189,discarded,ban-ratio-form-at-the-source (block [(z-a)/(z-b)]^n = c rewrite) plus general-conic collection A(x^2+y^2)+Bx+Cy+D=0,"All 8 rollouts were correct, so training is saturated and the only lever is transfer and budget. Every rollout still detoured: the incumbent bans roots of unity only AFTER the locus is found, so the model first rewrites the equation into ratio form, nth-roots it into branch solutions, and then spends thousands of tokens re-deriving and re-checking them. Rollouts averaged ~4600 completion tokens; the longest hit 8378 with 30 'Wait' restarts and 37 exponential-branch expressions, and one rollout re-argued necessary-vs-sufficient three times. The fix moves the prohibition upstream: forbid the ratio rewrite itself, naming why (nth-rooting a ratio spawns one root-of-unity branch per solution). I also replaced the vague 'coefficient of x^2+y^2' step with an explicit general-conic form A(x^2+y^2)+Bx+Cy+D=0 so the line-vs-circle test and the divide-then-complete-square step are mechanical on unseen loci, and tightened the stop rule to one clause to free tokens."
15,3,8554,149.300,149.310,e706044d3f2b50b5b56d612f00e693ef4bbb86f0d16e53200f96da94b7c7109e,1f93a6a12a54a7502378bc62ea58f6fe0885605076e70d4e3680b11e8fd1253b,e706044d3f2b50b5b56d612f00e693ef4bbb86f0d16e53200f96da94b7c7109e,0.75,0.125,-0.625,0.2,0.15,-0.05000000000000002,1.75,0.875,-0.875,190,191,discarded,replace-conditional-k-fold-clause-with-executable-rotate-S-recheck-and-anti-reopen-stop,"3/8 correct. 4 of 5 failures died at the 16384 cap, and in each the correct aligned-orientation overlap was already computed within the first ~6k chars and the union stated; they then reopened 'but maybe rotating shrinks it' and burned the rest on tangency (40-63 'tangent' hits each) without ever closing. The 5th ended cleanly but computed nothing: it argued verbally to zero overlap and committed summed areas. Winners reached the same first value and closed only by asserting rotation cannot help. So the anchor step works; the missing piece is a cheap executable way to discharge the rotated case. The incumbent offers only a long conditional k-fold clause, which no failure ever invoked (zero 'k-fold'/'rotation center' mentions). This revision makes the recheck concrete (rotate S, keep the quadrant, reuse the sign tests), adds an explicit anti-reopen stop, and keeps the corner-vs-center warning that still blocks the containment error."
15,4,25003,149.301,149.311,71bbac004964e95216c81767dcfcedba54fed6a04125845418ad992501b8e093,434a5b33a421ff322b05010754e0225c58d962b0e5024edb496605baf5b8b873,71bbac004964e95216c81767dcfcedba54fed6a04125845418ad992501b8e093,1.0,1.0,0.0,0.1625,0.1125,-0.05,1.8125,1.5625,-0.25,190,190,discarded,license-function-reuse-deny-the-N-cap,"5/8. All three failures collapsed to N=10 or stalled. Two (one stop, one truncation) read the incumbent's 'neighbours may differ' as 'neighbours must differ': each asked whether every term needs a distinct polynomial, argued reuse would force one polynomial's own consecutive values to step by d - impossible at degree 5 - concluded one index per function and answered N. One also built the P+d shift family and treated that scheme as a cap. The third truncation did reach N x d, called it 'very high', reopened verification, and looped over whether suitable polynomials exist, never using the hint's construction device. So the live faults are the prohibition being misread as forbidding reuse, and the bound being re-litigated because tightness is never certified. The revision licenses reuse, denies the N cap, keeps the per-group cap and N x d aggregation, and makes the block device a terminating certificate."
15,5,30418,149.302,149.312,85f213d578062adcf883b7f1f27d6adaf1b87fd1ff0c18c817da13cc0a477ef6,8ca611073f644922ae0805a32f0418f69c00ec224c5ecb5e8186809c03400570,85f213d578062adcf883b7f1f27d6adaf1b87fd1ff0c18c817da13cc0a477ef6,0.75,0.75,0.0,0.2,0.1875,-0.012500000000000011,1.75,1.6875,-0.0625,193,194,discarded,replace-exponent-read-with-monotonicity-ranking-of-heights,"7/8 correct (149.302); every rollout finished, none hit the cap, so the pipeline itself is fine and only one step leaks. The lone failure fit the curve, took the displacement correctly, formed the closure, got the right quadratic and correctly discarded the degenerate root reproducing a given vertex. It then read the surviving vertex height by rewriting its argument as a power of the reciprocal base and copying that exponent, so a small argument got a NEGATIVE height; the partner height inherited the same sign error, both new points fell off the curve, and the cross product came out too small. The incumbent only warns about the forward height-to-argument direction, which that rollout used flawlessly. So the revision adds a sign-free way to read the reverse direction: rank the new argument against a given vertex's and use base-below-1 monotonicity, which flags the flip immediately."
15,6,26989,149.303,149.313,40f95ed4950fe23e751bafb0454b3a7b04b2370e997c7f4b8f29907ec9bc480e,693bf0fc8659be4ffb62402fb998c4ff6ca0a1a08008a6187d00ae6bc9897ee3,40f95ed4950fe23e751bafb0454b3a7b04b2370e997c7f4b8f29907ec9bc480e,0.375,0.125,-0.25,0.2,0.2,0.0,1.375,1.125,-0.25,175,190,discarded,operational-anti-flip-orientation-check-plus-2n-move-count,"0/8; the graded quantity is the last sub-answer and all 8 missed it. Six (idx 0,1,2,3,5,7) wrote that the shed's bottom bag is the one carried LAST, inverting the pile, then read the answer off a uniform model (each bag equally likely to be last, or 3!/4!) and answered 1/4; idx 4 did the same after 1/24. Idx 6 declared the order always reversed (1, 0). Three also miscounted the process as n moves with 2^(n-1) equally likely sequences. So the incumbent already states the arrival-rank rule and bans 1/n, yet the flip survives because 'each bag is placed on top of the existing stack' locally suggests bottom=last. This revision replaces the declarative rule with an operational check (the second delivery sits directly above the first; catching yourself writing bottom=last means you flipped) and adds the 2n move count, keeping the forced/free 1/2 pricing."
