round,hint_id,train_qid,sampling_slurm_job_id,proposal_eval_slurm_job_id,incumbent_hash,proposal_hash,final_hash,old_train,new_train,delta_train,old_heldout,new_heldout,delta_heldout,old_J,new_J,delta_J,old_tokens,new_tokens,decision,mutation,subagent_summary
1,1,28054,149.13,149.23,98f0bbb6f87c7e50634956da8a0905b30a66997aa33a5e4bc67a2609ec487ed8,0fa96053d79aac037ffbeaa924500a0114b1fad8dab76251534170a8d16f138f,0fa96053d79aac037ffbeaa924500a0114b1fad8dab76251534170a8d16f138f,0.0,0.0,0.0,0.175,0.1875,0.012500000000000011,0.875,0.9375,0.0625,77,135,kept,model-unknown-role-as-hidden-variable,"With the incumbent hint 2/8 public rollouts scored 1; the six failures all committed early to one reading of the public number, found that reading self-contradictory for a single private value, and then either looped to the token cap (3 of 8 hit the length limit) or emitted a guessed divisor. The revision makes the sum-vs-product role an explicit hidden coordinate of the candidate state and adds the rule that a branch dies only when it fails for every private value, which is exactly the step the wrong rollouts skipped."
1,2,30302,149.14,149.24,e926ca1d6f04d597d4b99af9d15b2597417b40fc28c3c0397d67f147cfa99917,65a545bc36267d194340d7e9cea8a5fc006f707b001219525d3396c4903feb34,65a545bc36267d194340d7e9cea8a5fc006f707b001219525d3396c4903feb34,0.875,1.0,0.125,0.125,0.1875,0.0625,1.5,1.9375,0.4375,81,199,kept,generalize-to-apollonius-modulus-first,"All 8 training rollouts were correct, so the incumbent's weakness is transfer (heldout 0.125), not this question: it prescribes the problem-specific substitution w=(z-1)/z and a Mobius image argument rather than a portable rule. The successful rollouts all converged only after reducing to a modulus condition |z-1|=2|z| and completing the square, while the longest ones burned 8k-12.5k tokens enumerating the six roots and fitting a circle through sampled points, hitting self-contradictions; none named the Apollonius circle. One rollout nearly rejected the circle because |z| was not constant, so the revision moves modulus-first to step one, names the Apollonius/perpendicular-bisector dichotomy, and warns that a non-origin-centered circle has varying |z|."
1,3,8554,149.15,149.25,00f433b6ea19dfe2336efbb3476fea529c0993179016a67ce16e4288905f3cd0,a3268d480f0c74f9a8026bf5c2b6dd432a3ba1363673f43d20f5ae1256a63607,a3268d480f0c74f9a8026bf5c2b6dd432a3ba1363673f43d20f5ae1256a63607,0.25,0.75,0.5,0.175,0.0875,-0.0875,1.125,1.1875,0.0625,86,169,kept,replace-angle-minimization-with-rotational-symmetry-invariance-check,"All 8 rollouts framed union = 5 - overlap correctly, but 6 of 6 failures ended with finish_reason=length at the 16384-token cap and the 2 successes only barely finished (~15.5-15.9k tokens), so the failure mode is budget exhaustion, not a wrong setup. The incumbent hint's instruction to parameterize the angle and minimize a piecewise triangle/sector expression drove exactly that: failures looped over trial angles and tangency guesses (30+ 'but how' restarts each, repeated 'too complex to visualize') and never reached a closing computation. The revision replaces the open-ended minimization with a decisive invariance test at the k-fold symmetry center plus an explicit stop condition, which is the step both winners stumbled onto only after heavy flailing."
1,4,25003,149.16,149.28,93b35723e9cc953d39ac835ae67c34590b0c25060143ab50c99c75c21cbb1ff2,d21f8fdfb7b030dd855ee44da6cf4c805a32548098ce56539000ab07255c6b86,d21f8fdfb7b030dd855ee44da6cf4c805a32548098ce56539000ab07255c6b86,0.0,0.75,0.75,0.2,0.125,-0.07500000000000001,1.0,1.375,0.375,94,172,kept,group-by-function-not-adjacent-differences,"All 8 public rollouts scored 0 (three ran out of tokens). Every one applied the equal-spacing condition to adjacent board entries, which may come from different polynomials, derived the vacuous contradiction 'a degree-5 polynomial would have to be constant', then guessed a small number (2, 5, 6, 10) or declared the count unbounded. None ever partitioned the indices by which polynomial was chosen, so the per-polynomial root bound and the multiply-by-family-size step never happened; the revised hint forbids the adjacent-difference move explicitly and spells out the grouping, non-degeneracy, product bound, and tightness construction."
1,5,30418,149.17,149.31,b807d87e8e00cc91a6166db0fb3921c3d3651d016bdd936e3700d0c9bde5fa81,bf462b403f17cd428257353852dc46039314abb29f7a1232a8b7b962384878f2,bf462b403f17cd428257353852dc46039314abb29f7a1232a8b7b962384878f2,0.75,1.0,0.25,0.15,0.1375,-0.012499999999999983,1.5,1.6875,0.1875,73,151,kept,fix-log-base-direction-and-contradiction-recovery,"7/8 public rollouts were correct; the single failure ran out of tokens after inverting the argument-ratio direction when converting the y-difference of two base-1/2 logs, which produced a negative discriminant. It then spent thousands of tokens re-verifying identical algebra and finally guessed, so the hint now names the base<1 direction trap, adds a cheap ratio sanity-check on the known points, and converts 'no real/in-domain root' into a signal to flip the sign/branch assumption once rather than loop."
1,6,26989,149.18,149.32,99c30a3f882f054f77512e4fdca1d19befb3e5426d7d857d52f4369a95c4f820,7ef0fd480030bf7c9b5776821dda74bdc16df94504e48835f37a89ccc5d66a91,99c30a3f882f054f77512e4fdca1d19befb3e5426d7d857d52f4369a95c4f820,0.0,0.0,0.0,0.1875,0.175,-0.012500000000000011,0.9375,0.875,-0.0625,83,151,discarded,name-stack-model-and-forbid-forced-outcome-and-uniformity-fallacies,"All 8 training rollouts scored 0. Five concluded the delivery order is deterministically reversed (answering 1 and 0), and three instead assumed every item is equally likely to be last (answering 1/4), with several also treating the last item delivered as the bottom of the pile rather than the top. The incumbent hint's abstract state-graph advice did not stop these; the revision names the stack push/pop model, states the bottom/top orientation rule, and explicitly rejects both the forced-outcome and equiprobable-path fallacies while keeping the forced-move probability-1 weighting."
1,7,3836,149.19,149.33,39e2668fb5cca7669288765276aabe0dba01769397daa33b16a9dd7c0174a8f4,305096a438d4e11c68dbda3282e218455add06b84f8a6d7051bb154a4218232f,39e2668fb5cca7669288765276aabe0dba01769397daa33b16a9dd7c0174a8f4,0.125,0.0,-0.125,0.1875,0.1375,-0.04999999999999999,1.0625,0.6875,-0.375,82,171,discarded,functional-vs-coefficient-role-fix+single-node-test-polynomial,"All 8 rollouts (0/8) collapsed the same way: they set P(x)=sum a_i x^i and read the rows as P(k)=0, swapping node with exponent, then burned the budget hunting a spurious extra root or chasing the x-coefficient of a Vandermonde product (six hit the 16384-token cap; one concluded a_1=0, another 1/2005). The revised hint forbids that role swap, states explicitly that the unconstrained constant term is why L(p) reads off the top coefficient, and gives a one-node test-polynomial recipe plus a small-case check so the same technique transfers to any moment/weight system."
1,8,23443,149.20,149.34,149cabea90724683bc818e06d11bef6dc0c07209cfe1b68f2300dc838be4613d,7c7fa7f0c104bcb95dc03ff1ead192815a99a1a1e4438e98dd9be61ec3b01523,149cabea90724683bc818e06d11bef6dc0c07209cfe1b68f2300dc838be4613d,1.0,0.375,-0.625,0.1125,0.1375,0.02500000000000001,1.5625,1.0625,-0.5,77,137,discarded,generalize-to-portable-constraint-mining,"All 8 public rollouts scored reward 1 (train_i = 1.0), so the training question is saturated and the only headroom is transfer, where the incumbent scores just 9/80. The incumbent's phrasing is bound to this item's surface features ('equal-street layout', 'every listed stage total', 'maximum-feasible-count interpretation'), and rollouts spent long stretches re-litigating that undefined jargon (4-15 restatements plus 6-23 'wait' backtracks each, up to 6928 tokens), so it reads as item-specific scaffolding rather than portable method. I replaced it with the same underlying procedure stated generically - name the hidden count, derive it from integrality/gcd plus structural grouping constraints, state the tie-break assumption, then aggregate-scale-divide and sanity-check - which should carry to unseen problems of this class."
1,9,3980,149.22,149.35,d95dbbc2898bc6c58c3684891a45d7c76fe4e0835ddd91bed1a4955ddf89942a,8c6cf2ad54328ef6d5d7727c427a0f3b4e2872fcbd87df2e3a186687f9e272bd,8c6cf2ad54328ef6d5d7727c427a0f3b4e2872fcbd87df2e3a186687f9e272bd,0.0,1.0,1.0,0.15,0.1625,0.012500000000000011,0.75,1.8125,1.0625,71,175,kept,name-centered-fixed-point-ansatz-and-forbid-brute-coefficient-grind,"All 8 rollouts scored 0 and 7 of 8 hit the 16384-token cap: every one set up p=ax^3+bx^2+cx-24, q=ex^3+fx^2+gx+30 and tried to match all ten coefficients of the degree-9 composition, then looped on self-contradictions (a^2=a, 3a^2=0) it could not resolve. The incumbent hint gestured vaguely at 'a shared affine coordinate' but never told the student what that coordinate is, so nobody tried a centered ansatz; the revision names the common-fixed-point substitution, gives the leading-coefficient consequence that forces the odd-degree sign flip, and says to recover the center by adding the two supplied values."
1,10,3843,149.21,149.36,95005ec62835dbef2cc6b52c26e1bc8efa75d3d939090ada63716aa06be7a5b5,f5e98cb83b7d21cc59c0ef6c4bdd6b70731bf33bd4636ee98ff25a9b5546eb9d,f5e98cb83b7d21cc59c0ef6c4bdd6b70731bf33bd4636ee98ff25a9b5546eb9d,0.25,0.625,0.375,0.1125,0.0875,-0.02500000000000001,0.8125,1.0625,0.25,72,135,kept,tabulate-permutation-then-cycle-lcm,"Only 2/8 rollouts were correct and five of the six failures hit the token cap while trying to derive an abstract bitwise/affine formula for the composed permutation, exactly what the incumbent hint asks for first. The failures that did terminate asserted cycle structures they never traced (order 2 for the size-4 case, a bogus odd-length cycle for size 8), so the revision front-loads concrete tabulation of one full operation plus an explicit disjoint-cycle lcm step and defers any symbolic formula."
2,1,28054,149.37,149.47,0fa96053d79aac037ffbeaa924500a0114b1fad8dab76251534170a8d16f138f,7081bc33cce4aa7e0825a327f187b2e274351922a791f7bc9c88b25f949cf011,0fa96053d79aac037ffbeaa924500a0114b1fad8dab76251534170a8d16f138f,0.0,0.125,0.125,0.1875,0.125,-0.0625,0.9375,0.75,-0.1875,135,164,discarded,count-partners-across-readings-per-private-value,"Round-2 rollouts scored 2/8; every wrong rollout read ""I don't know"" as global ambiguity among all factor pairs, then noticed that a speaker's own number plus one fixed reading pins the partner, declared a contradiction, and substituted an invented tie-breaker about the hidden aggregate's uniqueness (three of eight also burned the token cap looping on that contradiction). The revision names the actual source of residual uncertainty - several readings alive for one private value - and gives a concrete per-value partner-counting rule plus a bar on inventing tie-breakers, which is the exact step the failures skipped."
2,2,30302,149.38,149.48,65a545bc36267d194340d7e9cea8a5fc006f707b001219525d3396c4903feb34,5019c021f2699abf588834f79f03ebfbbed8de65374aa589e92b0aee4b69cdb1,65a545bc36267d194340d7e9cea8a5fc006f707b001219525d3396c4903feb34,1.0,1.0,0.0,0.1875,0.125,-0.0625,1.9375,1.625,-0.3125,199,177,discarded,broaden-trigger-to-locus-invariant-and-stress-necessity,"All 8 rollouts scored 1 and every one reached the modulus ratio within the first few hundred tokens, so training accuracy is saturated and the remaining cost is transfer plus wasted verification: after already completing the square, 6 of 8 rollouts re-derived individual roots from nth roots of unity (11-29 exponential expressions each) and one spent 22 'Wait' hedges questioning whether the locus really held because |z| was not constant. The incumbent fires only on the literal template (z-a)^n=c(z-b)^n and names Apollonius as a label, so the revision keys the trigger on the general goal ('locus of all solutions'), states the modulus mechanism |AB|=|A||B| that generates the ratio, and asserts that a necessary condition already IS the locus so the model stops refitting circles through sampled roots."
2,3,8554,149.39,149.49,a3268d480f0c74f9a8026bf5c2b6dd432a3ba1363673f43d20f5ae1256a63607,ccfc91dca4e41fae13028465bd3bd459da0d298496e5f952724d5b84c5084512,a3268d480f0c74f9a8026bf5c2b6dd432a3ba1363673f43d20f5ae1256a63607,0.75,0.125,-0.625,0.0875,0.2,0.11250000000000002,1.1875,1.125,-0.0625,169,164,discarded,require-computed-polygon-areas-at-sampled-orientations,"Round-2 training hit 7/8 with the incumbent, and every rollout (including the winners) reached a verdict by verbal plausibility rather than by any actual area computation; the single failure talked itself into a 'sides tangent, so overlap is half the small square' claim and reported it without ever clipping a region. Meanwhile heldout fell from 0.175 to 0.0875 under the incumbent, so its narrow k-fold-wedge-tiling criterion is not transferring. This revision keeps the min-overlap framing and the invariance-then-stop control flow but replaces the bespoke symmetry criterion with a portable half-plane/shoelace recipe plus an explicit ban on uncomputed overlap values, and falls back to breakpoint-and-stationary-point search only when sampled values disagree."
2,4,25003,149.40,149.50,d21f8fdfb7b030dd855ee44da6cf4c805a32548098ce56539000ab07255c6b86,c88c72a8af76a0349016b46bf3a91690c7375399032fa6e2fedac91359b1f577,c88c72a8af76a0349016b46bf3a91690c7375399032fa6e2fedac91359b1f577,0.75,0.625,-0.125,0.125,0.1625,0.037500000000000006,1.375,1.4375,0.0625,172,176,kept,trust-the-product-and-verify-by-interpolation-then-stop,"My 8 public rollouts with the incumbent hint scored 5/8; all three failures hit the 16384-token cap rather than reaching a wrong answer. One did reach the N x deg-P product but then spent thousands of tokens doubting it as 'too large for a competition' and re-litigating the construction; the other two never partitioned indices by function and looped on the vacuous adjacent-difference contradiction until truncation. The revision therefore keeps the grouping/root-bound skeleton but adds an explicit stop rule: accept the product, justify it once by block-interpolation (free coefficients remain), and terminate instead of re-deriving."
2,5,30418,149.41,149.51,bf462b403f17cd428257353852dc46039314abb29f7a1232a8b7b962384878f2,9763a2b8d200801a8763a998b61753425f4deb3148dc5eb985f9c5a6a4b83876,bf462b403f17cd428257353852dc46039314abb29f7a1232a8b7b962384878f2,1.0,0.625,-0.375,0.1375,0.125,-0.012500000000000011,1.6875,1.25,-0.4375,151,161,discarded,generalize-plus-extraneous-degenerate-root-filter,"All 8 public rollouts were correct this round (train_i=1.0), so the training question is saturated and the binding constraint is transfer, which fell from 0.15 to 0.1375 when the incumbent grew to 151 tokens. Every rollout's real decision point was not the log-base direction the incumbent warns about but the quadratic yielding two in-domain roots, one of which reproduces a given vertex and collapses the figure; rollouts burned many tokens rediscovering that filter. The revision drops the discriminant flip-and-redo advice and states the portable pipeline: fit parameters, use the displacement to reduce to one unknown, exploit y-shift as a multiplicative argument factor, then reject degenerate and out-of-domain roots before the cross-product area."
2,6,26989,149.42,149.52,99c30a3f882f054f77512e4fdca1d19befb3e5426d7d857d52f4369a95c4f820,799dfd7ee6975a319656183ff16b41113c39659444024eb701a4df04b4013c56,99c30a3f882f054f77512e4fdca1d19befb3e5426d7d857d52f4369a95c4f820,0.0,0.125,0.125,0.1875,0.05,-0.1375,0.9375,0.375,-0.5625,83,151,discarded,add-first-in-is-bottom-orientation-rule-and-enumerate-over-intuition,"All 8 of my public rollouts scored 0 with two recurring errors: four asserted the delivery order is deterministically reversed (answering 1 and 0), and four treated outcomes as uniform over permutations or over which item lands last (answering 1/24 or 1/4). Six also inverted the pile orientation, treating the last item delivered as the bottom rather than the top, which makes the position asked about untestable. The revision therefore states the first-in-is-bottom rule and the position-to-arrival-rank translation explicitly, and replaces the incumbent's abstract state-graph advice with an explicit enumerate-then-weight recipe that names the forced-move weight 1 and bans favorable/total counting."
2,7,3836,149.43,149.53,39e2668fb5cca7669288765276aabe0dba01769397daa33b16a9dd7c0174a8f4,aebc888467d4bac12a1c4af028c4122c04afcf4ec7f7986434285074c186ba70,39e2668fb5cca7669288765276aabe0dba01769397daa33b16a9dd7c0174a8f4,0.125,0.125,0.0,0.1875,0.1375,-0.04999999999999999,1.0625,0.8125,-0.25,82,157,discarded,role-audit+small-case-falsification+single-target-probe,"All 8 rollouts scored 0 with one shared root cause: each recast the unknowns as coefficients of a polynomial evaluated at the row index, swapping the weight index with the condition exponent, then burned the budget (7 of 8 hit the token cap) chasing a phantom extra root or a harmonic-sum coefficient. Two rollouts did construct the small analogue and found it inconsistent or underdetermined, yet read that as their own confusion instead of proof the setup was wrong, so this revision makes the small case an explicit falsification test of the setup and replaces full-system solving with a single-target probe step."
2,8,23443,149.44,149.54,149cabea90724683bc818e06d11bef6dc0c07209cfe1b68f2300dc838be4613d,69f105e73d4f79d4d0bde5a9a545738bf16f242ec966c713a80753532c8422d0,149cabea90724683bc818e06d11bef6dc0c07209cfe1b68f2300dc838be4613d,1.0,0.5,-0.5,0.1125,0.15,0.03749999999999999,1.5625,1.25,-0.3125,77,162,discarded,pin-readings-once-keep-gcd-maxcount,"All 8 of my round-2 public rollouts scored reward 1 (train_i = 1.0), so the training item is saturated and the only headroom is transfer, where the incumbent gets 9/80. The wasted effort was not arithmetic but ambiguity churn: each rollout burned 16-29 'wait' backtracks re-arguing whether the listed figures were village totals or per-house amounts and whether the 20 percent markup applied to the total or to the per-unit cost, running 2.7k-6.8k tokens. Round 1 showed that genericizing away the gcd / maximum-feasible-count mechanic costs train (8/8 down to 3/8) for only +2 heldout, so I kept that mechanic and added portable instructions to fix both readings once and to note that a uniform percentage commutes with the division, which should cut backtracking on unseen items of this class."
2,9,3980,149.45,149.55,8c6cf2ad54328ef6d5d7727c427a0f3b4e2872fcbd87df2e3a186687f9e272bd,cd2936d6d9b661814c9309439f45d4f6c0908f6f5cef4a191740061871834ca3,8c6cf2ad54328ef6d5d7727c427a0f3b4e2872fcbd87df2e3a186687f9e272bd,1.0,0.625,-0.375,0.1625,0.175,0.012499999999999983,1.8125,1.5,-0.3125,175,175,discarded,generalize-to-normalize-invariants-then-recenter-and-branch,"With the incumbent hint all 8 public rollouts were correct (8/8, avg ~5.2k tokens vs 7 of 8 hitting the 16k cap in round 1), so the training question is saturated and the remaining loss is transfer (heldout 0.1625). Reading the correct rollouts, the one wasted stretch is that each spends many lines re-deriving the B=+-A sign because the hint asserted B=-A without the factored form, and several first restate the full ax^3+bx^2+cx+d setup before recentering. The revision therefore states the general normalize-invariants-then-recenter procedure, gives the factored leading-term condition AB(A^(n-1)-B^(n-1))=0 with an instruction to carry both branches, and widens the trigger from commuting cubics to polynomial functional identities generally so it can transfer."
2,10,3843,149.46,149.56,f5e98cb83b7d21cc59c0ef6c4bdd6b70731bf33bd4636ee98ff25a9b5546eb9d,c0f3359a71da2dd86f338f44cc7a21ea781943a5eb9b7de66750790b91fc4aa2,f5e98cb83b7d21cc59c0ef6c4bdd6b70731bf33bd4636ee98ff25a9b5546eb9d,0.625,0.375,-0.25,0.0875,0.1125,0.02500000000000001,1.0625,0.9375,-0.125,135,156,discarded,simulate-labeled-string-with-bijection-check,"4/8 correct; all four failures came from mis-tracing the block swap rather than from missing the lcm idea the incumbent already supplies. One rollout produced a non-injective position map (two positions sent to the same target) and never noticed, one asserted the composition of the overlapping swaps was an involution and answered 2, and two burned the token cap guessing closed forms after generating mutually inconsistent per-size counts. The revision therefore replaces abstract index tracing with rewriting a concrete labeled string, adds a per-stage every-label-exactly-once check, and replaces cycle-structure guessing with counting repeats until the string returns."
