round,hint_id,train_qid,sampling_slurm_job_id,proposal_eval_slurm_job_id,incumbent_hash,proposal_hash,final_hash,old_train,new_train,delta_train,old_heldout,new_heldout,delta_heldout,old_J,new_J,delta_J,old_tokens,new_tokens,decision,mutation,subagent_summary
17,3,8554,149.340,149.350,2d11bf4a5b7189e1adf872d81d0aa917b7c4dfdc59258854a4b0dc37d27a2c46,6fd21cbb8e82d8f2a51dd7cb23a1d2a9710ffcaef2379353c67c37eda93706b7,2d11bf4a5b7189e1adf872d81d0aa917b7c4dfdc59258854a4b0dc37d27a2c46,0.875,0.5,-0.375,0.2,0.175,-0.025000000000000022,1.875,1.375,-0.5,189,195,discarded,constructive-cover-vertices-as-nonnegative-edge-combinations-plus-executable-rotation-congruence-closure,"5/8 correct; all three failures died at the 16384 cap. Two never built the edge frame: they placed the covering square by offsetting the shared point a full side or half-diagonal in BOTH directions (-0.5..1.5, -1.5..2.5), which makes that point interior, so the small square looked wholly covered, overlap 1, and one committed that value. The third did compute the correct clipped area and union early (~3.9k chars), then reopened the angle question and burned ~50k chars on rotated-square algebra (112 rotation mentions) without closing. Winners reached the same first value and closed fast. The incumbent only forbids extending a full side both ways, and a bare ban loses to a concrete-looking offset; its rotation clause stayed conditional and unused. So the frame becomes constructive (list the cover's vertices as P plus non-negative multiples of its two edge directions, a negative coefficient being a self-check failure) and the closure becomes an executable congruence argument."
17,4,25003,149.341,149.351,71bbac004964e95216c81767dcfcedba54fed6a04125845418ad992501b8e093,903dd62479cd089fd4952649e099566998aae3073dafc4c839f1c02dee0a465a,903dd62479cd089fd4952649e099566998aae3073dafc4c839f1c02dee0a465a,1.0,0.875,-0.125,0.1625,0.2,0.037500000000000006,1.8125,1.875,0.0625,190,190,kept,affirm-large-product-plus-one-pointwise-tightness-check,"4/8 with the incumbent; 3 of the 4 failures truncated at the token cap after already deriving N x d. Each stalled the same way: it called the product 'too high / seems too large', reopened tightness, argued a function's own consecutive values would have to step by the common difference and so 'must be linear', then oscillated (one drifted from the product down to d and boxed that). None ever performed the incumbent's P = T + c*prod(x-n_j) check concretely; they debated it instead. The fourth failure stopped normally, never grouped at all: it labelled a polynomial per term, chained adjacent board entries, and answered N. So the live faults are doubt about a legitimately large product and an uncertified construction, not aggregation. This revision keeps the proven skeleton, states affirmatively that exceeding N is expected, and converts tightness into a single terminating substitution check rather than a claim to be re-litigated."
17,5,30418,149.342,149.352,85f213d578062adcf883b7f1f27d6adaf1b87fd1ff0c18c817da13cc0a477ef6,9b72d775b5b90b0f4a3bb10a97778be955594fc3b27c36d41e63cc6dc4ef005f,9b72d775b5b90b0f4a3bb10a97778be955594fc3b27c36d41e63cc6dc4ef005f,0.75,0.875,0.125,0.2,0.1875,-0.012500000000000011,1.75,1.8125,0.0625,193,192,kept,forward-numeric-verification-instead-of-re-deriving-the-same-inverse-log,"7/8 correct (149.342). The lone failure is deterministic and identical across recent rounds: it fits the parameters, finds the right t, rejects the degenerate root, then evaluates the new height by rewriting an argument below 1 as a power of the base's reciprocal and copying that exponent, producing a negative height where the correct one is positive. Both new vertices inherit the flipped sign, so the cross product is computed on a reflected pair and the area is wrong. Critically, the rollout DID substitute back to check, but re-ran the same inverse conversion, so the check was circular and confirmed the error. The incumbent's 'take each new height from f' is precisely the step that fails. The revision therefore demands a forward, non-circular test (does base^y reproduce the argument) and states the resulting sign rule, while compressing the pipeline into a portable form."
17,6,26989,149.343,149.353,40f95ed4950fe23e751bafb0454b3a7b04b2370e997c7f4b8f29907ec9bc480e,3ce70f3e1c1eed8837801705f3d18e0ebd88b3b1cd5acedf8a85b7ace63c2b01,40f95ed4950fe23e751bafb0454b3a7b04b2370e997c7f4b8f29907ec9bc480e,0.375,0.0,-0.375,0.2,0.1125,-0.08750000000000001,1.375,0.5625,-0.8125,175,191,discarded,operational-freeness-via-pile-sizes-plus-ban-template-exponents,"1/8 (idx 1, and it wavered between 1/16 and 1/8 before committing). Three failure clusters. (i) Uniformity re-imported for the graded part: idx 0 gave 1/24 then 1/4 from each bag equally likely to move last; idx 3 said each element has equal chance of any position. (ii) Template exponents guessed with no walk of the moves: 1/2^(n-1), 1/2^n, 1/2^(2n-1) produced 1/8, 1/16, 1/128 on part a. (iii) Undercounting the run: idx 4,5,7 priced the graded event using only the target's own two carries (1/4) or a lone 1/2, ignoring the choices needed to clear the items above it. Idx 2,3,6 hit the token cap oscillating between rival formulas. So the incumbent states arrival-rank and bans 1/n, yet the pricing step is guessed rather than executed. This revision makes freeness operational (free exactly when both piles can be drawn from, so track pile sizes while walking the word), says clearing choices count too, and bans template exponents in favour of hand-walking the smallest instance."
17,7,3836,149.344,149.354,bf8917df8e428960f80d51070d9c159b26a541b8cfec74724b518f1eb812f558,88288617e0fc7cfd3217efa30aab177db8dd930000c4f1f09e37efded2064d42,bf8917df8e428960f80d51070d9c159b26a541b8cfec74724b518f1eb812f558,0.625,0.125,-0.5,0.1,0.0875,-0.012500000000000011,1.125,0.5625,-0.5625,189,190,discarded,name-the-three-detours-as-an-explicit-tripwire+abort-and-return-to-numeric-cases,"All 8 rollouts scored 0. Each built the n=2 and n=3 toy, but only 3 reached n=4+, and 5 abandoned numbers midway to expand (x-1)...(x-2004) at full size, chase its x-coefficient, or introduce harmonic sums H_n (40-100 mentions of 2004! or H_n each). 5 hit the 16384-token cap without answering. The 3 that finished guessed a law from only two cases and shipped 1/2005, 1/6, 1/2004 -- no back-substitution, no ratio comparison, and one even declared even/odd cases exceptional. The incumbent already bans symbolic general-size algebra, but the model does not recognize the long-product / harmonic-sum expansion as an instance of that ban. So I name those three concrete detours as an explicit tripwire with an order to drop the line and return to numeric cases, and I keep the ratio-of-consecutive-answers law, the fixed toy count-match, and back-substitution."
17,8,23443,149.345,149.355,d6e761f5cca43ef948238db65074ea53c3f8953ec6c1f76a4fc7f307db54c5db,8bd24a74aa09f74b5501441cfdbbd0c4c78b7085031cf054891fea5c2bc7b9db,d6e761f5cca43ef948238db65074ea53c3f8953ec6c1f76a4fc7f307db54c5db,0.875,1.0,0.125,0.175,0.1375,-0.03749999999999998,1.75,1.6875,-0.0625,185,190,discarded,forbid-units-per-group-equals-1-escape-and-plausibility-tiebreak,"7/8 rollouts correct; the single failure (and the longest, 15.5k tokens) is not arithmetic. Every rollout derived the divisor set from integrality correctly, then stalled on a tie between the maximum candidate and a much smaller one equal to the group count, spending 40 backtracks re-arguing whether each group could hold exactly one unit. The loser resolved it by narrative plausibility (""most reasonable interpretation""), picked the group-count candidate and lost; winners reached the maximum but only via weak ad-hoc appeals, so the tie-break is luck. The incumbent already says a group count is never N by itself, but rollouts evade that by asserting units-per-group = 1, which is formally consistent. So I named that specific escape hatch: the per-group factor is a separate unknown that must not be silently set to 1, and ties are never broken by which story sounds plausible. Kept the divisor/gcd and bounded-window branches intact since removing them cost train in rounds 1-2."
17,9,3980,149.346,149.356,3e5130251127f1cdd38d0a1bb8dd4fb0acfb2a10ba7588ffd823b20e7a983801,acadd9db4ec067725d32490079552636daa11b68593148c21bfed0ac776b61f4,3e5130251127f1cdd38d0a1bb8dd4fb0acfb2a10ba7588ffd823b20e7a983801,1.0,0.875,-0.125,0.2,0.15,-0.05000000000000002,2.0,1.625,-0.375,189,189,discarded,validate-derived-relations-against-the-known-p-equals-q-solution-family,"7/8 correct (3.4k-5.3k tokens). The one failure burned the full 16384-token cap: centering correctly, it then substituted p(x)-r=A(x-r)^n twice, writing q(p(x))=r+B[A^3(x-r)^3]^3, so it got BA^9 and concluded B^2=A^8, B=+-A^4 (8 mentions). Both branches gave high-degree equations in the center; it trial-substituted integer centers for most of its output and only stumbled onto a consistent center too late to finish. Correct rollouts all reached A^3=B^3 in their first page. Rounds 9/10 (exponent audits), 14/15 (factoring rules) and 16 (no-ratio) all lost heldout, so instead of another audit this revision adds a portable validation rule: any necessary condition must hold for a solution family you already know (here p=q), which flags the mis-nesting in one line and transfers to any functional equation."
17,10,3843,149.347,149.357,1e3acbae873bc435b7dfe5ef08152ba300c78d6c321ecbd752834208236d2a85,1c955c38348ff82acbed67dd0a8b66cb30a4216813ea4d283aa3716762223a27,1e3acbae873bc435b7dfe5ef08152ba300c78d6c321ecbd752834208236d2a85,0.75,0.625,-0.125,0.1875,0.1875,0.0,1.6875,1.5625,-0.125,194,182,discarded,involutions-commute-test-kills-order-2 + prime-divisor-minimality-certificate,"2/8 correct with the incumbent. Three of six failures boxed 2 by the same argument: each sub-step is a self-inverse block swap, therefore the composite is a product of transpositions of order 2. The incumbent's 'nested ranges never compose to disjoint swaps' clause states the conclusion but gives no test, so rollouts overrode it with the plausible involution/lcm-of-2s claim and never traced a state. One boxed a linear formula after inventing cycle lists (a 6-cycle for one size, an 8-cycle for the next) it never traced. Two hit the token cap thrashing over whether the composed map or its inverse was right after a small-size trace. So the revision replaces the assertion with a checkable reason (involutions compose to order 2 only when they commute, and overlapping ranges do not), bans uncited cycle lengths, and turns vague minimality into a concrete certificate: show m returns and m/p does not for each prime p dividing m."
18,1,28054,149.358,149.368,a3a9805f3b37695536ecf7628ac6a588215a3f9ca6cb77ede20cc39aa1b660f1,29d0d674d4ffc67e084a8a05ee6cf0b102de27671a41445a894465c4da5577d6,a3a9805f3b37695536ecf7628ac6a588215a3f9ca6cb77ede20cc39aa1b660f1,0.125,0.0,-0.125,0.225,0.1,-0.125,1.25,0.5,-0.75,184,192,discarded,state-what-each-speaker-was-told-plus-pooled-partner-list-and-partner-must-satisfy-prior-condition,"All 8 rollouts scored 0 (exec 149.358) and every one boxed the same wrong divisor 143; none hit the token cap, so this is a reasoning error, not looping. Shared path: open the sum reading and the product reading as separate self-contained cases, argue inside each that the holder of v plus that reading pins the partner, write impossible/contradiction (22-56 times in six rollouts), then abandon logic and pick the factor pair that merely looks special (two invoked primality). Not one rollout pooled the partners one private value admits across BOTH readings into a single list, and none carried the first speaker's ignorance onto the second speaker's partners. The incumbent says predicate abstractly and the model echoes the word without doing it, so the revision leads with the fact the failures violate - nobody was told which quantity N is - bans the per-option case split that manufactures the contradiction, and leaves only the pooled count and the prior-condition filter."
18,2,30302,149.359,149.369,c608cf3e70986473f7ad7a491de9bfd43b306ba0d80aa9b5896943da5d065421,785ca2ef872ccccce97df7e3ace57957e1cdaecfc0b0bc2d4aad7e8d9097a6c9,c608cf3e70986473f7ad7a491de9bfd43b306ba0d80aa9b5896943da5d065421,1.0,1.0,0.0,0.2125,0.15,-0.0625,2.0625,1.75,-0.3125,192,193,discarded,"add-center-is-not-on-locus-guard (ban testing or re-deriving the center via the distance condition), replacing bare roots-of-unity ban","All 8 rollouts were correct (train saturated at 1.0), so the incumbent's cost is transfer and wasted budget, and both leaks trace to one confusion: treating the completed-square center as a point of the locus. Every rollout reached the modulus ratio and the right circle within ~1k tokens, then the four longest (5.2k-6.2k tokens, 4-29 'Wait' hedges) burned the rest on center confusion. One substituted the center into the ratio, saw it fail, concluded the circle was wrong, and re-derived individual solutions from a sixth-root/roots-of-unity branch (8 'unity' mentions). Another tried to LOCATE the center by imposing the distance condition on a candidate center on the real axis, produced two bogus centers, and oscillated between them and the correct algebra. The incumbent's stop rule bans enumerating roots but never says the center must violate the condition, so the revision adds that guard and keeps the necessity-suffices close."
18,3,8554,149.360,149.370,2d11bf4a5b7189e1adf872d81d0aa917b7c4dfdc59258854a4b0dc37d27a2c46,34aa95973c9729cc3875e836fe1651013c1bce0fa7ce585a327af368406aea70,2d11bf4a5b7189e1adf872d81d0aa917b7c4dfdc59258854a4b0dc37d27a2c46,0.875,0.25,-0.625,0.2,0.15,-0.05000000000000002,1.875,1.0,-0.875,189,191,discarded,replace-frame-ban-with-boundary-step-audit-plus-box-first-union,"5/8. All 3 failures hit the 16384 cap. Two never built the corner frame: they offset P a full side in BOTH directions (-0.5..1.5 and -1.5..2.5), which makes P interior, so S looked wholly covered, overlap 1, and one boxed that union. The third did build the wedge and computed the correct clipped area and union by ~3.9k chars, then reopened the angle question and burned ~50k chars on rotated-square algebra (112 rotation mentions, 25 restatements of its own value) without ever closing. Winners reached the same first value and boxed it fast. The incumbent only forbids extending a full side both ways, but a bare ban loses to a concrete-looking offset. So the frame ban becomes an executable local test (P is a boundary point: a backward step must exit) and the anchor gets an immediate-box order so the first computed union is committed before any angle re-litigation."
18,4,25003,149.361,149.371,903dd62479cd089fd4952649e099566998aae3073dafc4c839f1c02dee0a465a,a93dd8a599182cf52aad539e9a1e7ac261f24ad9a5bce4ea42313b90a226bdd8,903dd62479cd089fd4952649e099566998aae3073dafc4c839f1c02dee0a465a,0.875,1.0,0.125,0.2,0.1375,-0.0625,1.875,1.6875,-0.1875,190,188,discarded,state-the-pinned-only-where-used-freeness-fact-that-kills-the-per-function-step-objection,"8/8 with the incumbent, so the skeleton is sound; the diagnosis is budget, not aggregation. Every rollout still fought the same phantom obstruction on its way to the answer: 5 explicitly computed a single function's own successive difference, found it degree d-1 not constant, concluded 'must be linear', and only later recovered; 6 also called the product 'too high / seems too large' and reopened tightness. Token spend ran 8k-15k, and prior rounds show these same loops truncate when they start earlier. The incumbent only forbids chaining adjacent terms; it never says why one function may repeat, so the model re-derives that from scratch. This revision adds the one portable fact that settles it directly - a function is constrained only at the indices it served and free elsewhere, so its consecutive values need not step by the common difference - licenses reuse up front, and keeps the per-group cap, N x d aggregation, and the terminating substitution check."
18,5,30418,149.362,149.372,9b72d775b5b90b0f4a3bb10a97778be955594fc3b27c36d41e63cc6dc4ef005f,6ee5c458e0e61d858cbb115f8a18ba3992a40f78cec3fbf57c6fd847f8cf590c,9b72d775b5b90b0f4a3bb10a97778be955594fc3b27c36d41e63cc6dc4ef005f,0.875,1.0,0.125,0.1875,0.15,-0.037500000000000006,1.8125,1.75,-0.0625,192,189,discarded,calibrate-argument-factor-from-given-pair-instead-of-log-identities,"5/8 correct; all 3 failures hit the 16384-token cap on the SAME step, the argument factor, not on the steps the incumbent guards. Two combined the two curve equations with log identities and treated log_{1/2}2 as +1, so the factor came out inverted (divide instead of multiply); one got discriminant -92, the other x^2=-5/3. The third slipped the parameter fit, self-corrected, then dropped dy entirely and equated the two arguments, getting 1/3=-7/3. None then applied the incumbent's degenerate-root test, because with no real root there was nothing to test; all three instead declared the problem contradictory and manufactured equal-diagonal-midpoint conditions (3, 6 and 14 mentions) until the cap. So the revision removes the identity step: calibrate the factor numerically from the given pair, which already realizes (dx,dy), and route any impossible root to the factor rather than to the problem."
18,6,26989,149.363,149.373,40f95ed4950fe23e751bafb0454b3a7b04b2370e997c7f4b8f29907ec9bc480e,33d0aa1a6fd049fdd5b66624b1ecc586b7ce7ed1cacd9080b3185ebe65e733b9,40f95ed4950fe23e751bafb0454b3a7b04b2370e997c7f4b8f29907ec9bc480e,0.375,0.0,-0.375,0.2,0.1375,-0.0625,1.375,0.6875,-0.6875,175,187,discarded,require-answer-be-explicit-per-move-product-and-derive-exponent-by-counting-not-recall,"1/8 (idx 6, and it reached the graded value by dividing 1 by 8 sequences, not by pricing steps). Not one of the 8 rollouts ever wrote down a single concrete move order with per-step legality; all reasoned in prose then jumped to a remembered exponent. Part a came out as 1/24 (idx 0,2), 1/8 (idx 1,3), 1/16 (idx 4,7), 1/256 (idx 5) with totals variously guessed as 4!, 2^3, 2^4, 2^8. Six (idx 0,1,2,3,4,5,7 minus 6) then answered the graded part from uniformity: each item equally likely to be last, or a random permutation. So the incumbent's bans on 1/n and its run-of-halves warning are read past because the pricing walk is never started. This revision makes the move-by-move product the required deliverable, keeps arrival-rank orientation and the both-piles-drawable freeness test, and says the exponent must be counted, never recalled."
18,7,3836,149.364,149.374,bf8917df8e428960f80d51070d9c159b26a541b8cfec74724b518f1eb812f558,982657f442e01f23fe681823b90a75541ed34e603a4f5d3a64dda5d1a8b7c7a3,bf8917df8e428960f80d51070d9c159b26a541b8cfec74724b518f1eb812f558,0.625,0.0,-0.625,0.1,0.1125,0.012499999999999997,1.125,0.5625,-0.5625,189,190,discarded,answer-first-budget-rule+cheap-consecutive-difference-elimination+two-cases-cannot-fix-growth,"0/8 (this same hint scored 5/8 in r14, so the ladder is fragile, not absent). Six rollouts hit the 16384-token cap having never written any answer; only two terminated, and both fit a law from n=2,3 alone (one shipped 1/2005, one declared even/odd cases exceptional). Only 3 of 8 ever reached n=4: rollouts burned hundreds of lines re-litigating n=2 and n=3 (36 mentions each) and then left numbers to expand (x-1)(x-2)... at the stated size chasing its x-coefficient (81-152 coefficient-of-x mentions, 44-100 of 2004!) or to introduce harmonic sums. The incumbent already orders n=2,3,4 and bans symbolic work at the stated size, but supplies no cheap way to solve a toy and no deadline, so the budget dies before n=4 and before any answer exists. This revision gives a concrete cheap elimination (consecutive differences), says outright that two cases cannot separate growth families, and adds an answer-first rule: state an answer as soon as a law fits, then refine."
18,8,23443,149.365,149.375,d6e761f5cca43ef948238db65074ea53c3f8953ec6c1f76a4fc7f307db54c5db,b5d75e5fb05cee7447623d07d661fcdb9be25ccb0a8c92525bd11d97b36c9fa4,d6e761f5cca43ef948238db65074ea53c3f8953ec6c1f76a4fc7f307db54c5db,0.875,1.0,0.125,0.175,0.1125,-0.062499999999999986,1.75,1.5625,-0.1875,185,189,discarded,verify-by-substitution-plus-no-story-tiebreak,"My 8 public rollouts scored 7/8 (train_i 0.875). The seven winners follow the incumbent cleanly: common divisors of the four listed totals, take the gcd, split, apply the markup. The single failure (longest run, ~15.5k tokens) also derives the full divisor list and the gcd, but then spends most of its length re-litigating whether the listed figures are aggregates or per-house amounts (chasing absurd counts), and at the very end downgrades N from the gcd to the group count, explicitly justifying it as the 'most reasonable' story reading and declaring both candidates valid. So the loss is not arithmetic but an endgame tie-break by narrative plausibility onto a number lifted from the text. I kept the incumbent's divisor core and bounded-count branch, banned the plausibility tie-break, and replaced the passive integrality check with substitute-back verification that every stated condition is satisfied and none left idle - a portable habit that should also help unrelated held-out items."
