round,hint_id,train_qid,sampling_slurm_job_id,proposal_eval_slurm_job_id,incumbent_hash,proposal_hash,final_hash,old_train,new_train,delta_train,old_heldout,new_heldout,delta_heldout,old_J,new_J,delta_J,old_tokens,new_tokens,decision,mutation,subagent_summary
18,9,3980,149.366,149.376,3e5130251127f1cdd38d0a1bb8dd4fb0acfb2a10ba7588ffd823b20e7a983801,6d314f788d6b5464c2f4ac4dbc2666ad10419b47e2a5ffb24bd97c8eb9f57635,3e5130251127f1cdd38d0a1bb8dd4fb0acfb2a10ba7588ffd823b20e7a983801,1.0,0.75,-0.25,0.2,0.1625,-0.037500000000000006,2.0,1.5625,-0.4375,189,196,discarded,conjugate-to-the-fixed-point-with-an-explicit-y-substitution-so-composition-becomes-a-monomial,"All 8 rollouts correct (4.1k-9.1k tokens, none truncated), so training is saturated and every point is transfer. Two wastes recur. (1) The 9.1k outlier (2x median) mis-nested the composition, substituting the already-cubed offset again to get BA^9, hence B^2=A^8 and B=+-A^4 (81 A^4 mentions); it then ratioed the two given conditions into a high-degree equation in the center and burned half its output trial-substituting integers. (2) All 8 rollouts re-hunt the center: 7-31 'fixed point' and 5-10 'another' mentions, mostly after the answer was already verified. Rounds 9/10 (exponent audits), 14/15 (factoring rules), 16 (no-ratio) and 17 (validate-against-p=q) all added corrective wording and all lost heldout. So instead of another audit this revision changes the representation: an explicit y=x-r conjugation turns both maps into monomials Ay^n, so composition is one syntactic step that cannot be mis-nested and the origin is the center by construction, ending the hunt."
18,10,3843,149.367,149.377,1e3acbae873bc435b7dfe5ef08152ba300c78d6c321ecbd752834208236d2a85,cf0d76d52a85e6fc4964f117d182512e211a15a15fe07faa0ee6500bf4042832,1e3acbae873bc435b7dfe5ef08152ba300c78d6c321ecbd752834208236d2a85,0.75,0.25,-0.5,0.1875,0.1125,-0.075,1.6875,0.8125,-0.875,194,195,discarded,count-completed-repeats-not-substeps + orbit-length-ceiling + refit-smallest-pair-fix-exponent-offset,"4/8 correct. Failures never traced a full repeat. idx0 and idx4 read cycle type off sub-step shapes ('n transpositions, so order 2'), got counts that SHRANK with size, then answered piecewise or excused n=1 as special. idx7 fit a formula while writing that it contradicts its own smallest count, calling that acceptable. idx6 numbered every sub-step as a separate application, so its per-size counts were inflated by the sub-step count and it fit a doubled exponent (2^{2n-1}); idx4/idx7 landed one exponent off. Correct rollouts all followed one slot's orbit under whole repeats and got one growth law. So the revision adds: count only completed repeats (the inflation signature the incumbent misses), an orbit-length ceiling (no orbit exceeds the slot count) that kills invented large counts, and refit-against-the-smallest-pair with an off-by-one-exponent nudge instead of vague minimality."
19,1,28054,149.378,149.388,a3a9805f3b37695536ecf7628ac6a588215a3f9ca6cb77ede20cc39aa1b660f1,63a89f2cd0ed76608369f4f83dfd2ebf423fba103da365f212bc744abc7f10b2,63a89f2cd0ed76608369f4f83dfd2ebf423fba103da365f212bc744abc7f10b2,0.125,0.375,0.25,0.225,0.2125,-0.012500000000000011,1.25,1.4375,0.1875,184,175,kept,contrapositive-certify-ignorance-by-exhibiting-two-partners,"My 8 rollouts scored 1/8 (exec 149.378). Every failure judged ignorance from 2002 itself, then said the holder of v can just subtract or divide, wrote impossible/contradiction (17-54 times in five rollouts), and finished on looks: 143 boxed three times, 13 once justified explicitly by primality, 14 once. Three burned the 16384-token cap. Not one rollout pooled the partners a single v admits across BOTH unstated readings into one list, so none located the residual ambiguity, and none ever exhibited two concrete legal partners for any v. The incumbent says predicate abstractly and the model echoes the word without executing it, so the revision inverts the direction: solve first for the v that WOULD know (pooled list of size one), let ignorance delete exactly those, and require two exhibited partners before calling a v ignorant - a positive check that cannot be satisfied by declaring a contradiction."
19,2,30302,149.379,149.389,c608cf3e70986473f7ad7a491de9bfd43b306ba0d80aa9b5896943da5d065421,ad75af2776457d78ed95a733980f31b985d8eefaea5ab7ddb8008c33b8df1252,c608cf3e70986473f7ad7a491de9bfd43b306ba0d80aa9b5896943da5d065421,1.0,1.0,0.0,0.2125,0.1625,-0.04999999999999999,2.0625,1.8125,-0.25,192,192,discarded,redirect-verification-into-reexpand-completed-square-check (with attribution rule) and replace the roots-of-unity ban clause; add no-guessed-center clause,"8/8 correct, so training is saturated (train_i 1.0) and the only lever is transfer and wasted budget. Every rollout had the modulus ratio and the completed-square circle inside its first ~900 tokens, then spent most of the remainder on verification the incumbent already forbids: 8-40 explicit exponential root expressions each, re-deriving individual solutions to spot-check them. The worst (8378 tokens, 30 hedges, 76 'center' mentions) instead posited a center at (h,0), imposed the distance condition on that point, got two bogus centers, and oscillated ~5k tokens between them and its own correct algebra before recovering. Diagnosis: a bare prohibition leaves the checking urge nowhere legitimate to go. So the revision redirects it to a cheap portable check inside the same algebra (re-expand the completed square, r > 0) plus an attribution rule, and bans imposing the locus condition on an unproven point."
19,3,8554,149.380,149.390,2d11bf4a5b7189e1adf872d81d0aa917b7c4dfdc59258854a4b0dc37d27a2c46,f13ad13339c215b4b55c71ab22e00671c20a8cc9032fc6403d759edefa11aa99,2d11bf4a5b7189e1adf872d81d0aa917b7c4dfdc59258854a4b0dc37d27a2c46,0.875,0.625,-0.25,0.2,0.1375,-0.0625,1.875,1.3125,-0.5625,189,190,discarded,two-sided-vertex-sign-test-pins-overlap-strictly-between-0-and-area-S,"1/8 correct; wrong verdicts moved off the frame error the incumbent spends most of its tokens banning. Three failures built the wedge correctly and then declared the shapes disjoint (cover 'lies outside' S), overlap 0, answering the summed areas; one declared containment and subtracted all of area(S). The incumbent's 'P inside S kills disjointness' is a bare assertion and none of them ran it. Four other failures computed the correct clipped area and union early (4-6k chars), then reopened the rotation question and burned the whole 16384 cap (104-196 rotation mentions) without ever boxing; the lone winner reached the same value and closed. So the revision spends the freed tokens on one executable two-sided sign test that pins overlap strictly between 0 and area(S), killing both wrong verdicts at once, and orders the first computed union boxed before any angle is weighed, with congruence as the closing proof."
19,4,25003,149.381,149.391,903dd62479cd089fd4952649e099566998aae3073dafc4c839f1c02dee0a465a,4b29a3e838c34cc62795f8d0b91c768dcf20887744930f17ab53d69185d4b733,903dd62479cd089fd4952649e099566998aae3073dafc4c839f1c02dee0a465a,0.875,0.875,0.0,0.2,0.1,-0.1,1.875,1.375,-0.5,190,190,discarded,pointwise-only-constraint-plus-cap-then-sum-per-class,"8/8 correct, so the skeleton is sound and the remaining cost is budget and clarity: rollouts spent 8.0k-14.4k tokens (mean ~11k) and every one detoured before the answer. Five re-litigated whether reuse forces a single function's own consecutive values to step by the common difference ('must be linear'); four called the product 'too high' and reopened tightness; and the incumbent's 'never chain adjacent terms: neighbours may differ' was repeatedly misparsed as 'each term must use a different polynomial' (9, 9, 18 hits in three rollouts), forcing a rebuild of the setup. So the prohibition is read as a constraint on assignment rather than on inference. This revision states the positive rule the model kept rederiving - the constraint is purely pointwise, P(n)=T(n), and a source may repeat - which makes neighbour-differencing vacuous without a ban, adds cap-one-class-then-sum to block reporting N, and separates a construction's size from the bound."
19,5,30418,149.382,149.392,9b72d775b5b90b0f4a3bb10a97778be955594fc3b27c36d41e63cc6dc4ef005f,e4c3f0a8b4d88586a5edd87676b35db11bda7947a63176305b6f510f60a5485a,9b72d775b5b90b0f4a3bb10a97778be955594fc3b27c36d41e63cc6dc4ef005f,0.875,0.625,-0.25,0.1875,0.1375,-0.04999999999999999,1.8125,1.3125,-0.5,192,193,discarded,"ban-parameter-as-log-base and treat negative-discriminant/absurd-identity as an inverted-factor signal, with numeric calibration from the given pair","6/8 correct; both failures hit the 16384-token cap after the closure equation came out with the argument factor inverted, and neither ever reached the root test the incumbent relies on because there was no real root to test. One rollout wrote log U = log V - 1 when its own two lines gave log V = log U - 1, i.e. it added dy to the wrong vertex, and got discriminant -92. The other substituted the function's parameter letter b as the LOG BASE in the log-difference identity, producing a bogus factor, roots outside the domain, then a diagonal-midpoint detour that forced Q onto M. Correct rollouts instead exponentiated each point alone and read the factor with the printed base. So the revision bans using an argument parameter as the base, calibrates the factor from the given pair which already realizes (dx,dy), and converts negative-discriminant or absurd-constant-identity into one reciprocal flip instead of endless re-derivation."
19,6,26989,149.383,149.393,40f95ed4950fe23e751bafb0454b3a7b04b2370e997c7f4b8f29907ec9bc480e,a804d282a5d9559e8d902894a89e2169404330b3a8b782b32e806d7b4d32d844,40f95ed4950fe23e751bafb0454b3a7b04b2370e997c7f4b8f29907ec9bc480e,0.375,0.0,-0.375,0.2,0.2,0.0,1.375,1.0,-0.375,175,192,discarded,orientation-selects-which-end-of-run-to-analyse-bottom-question-is-about-opening-moves,"0/8; the graded quantity is the last sub-answer and every rollout missed it. All 8 explicitly wrote that the shed's bottom bag is the one carried LAST, then read the answer off a uniform model: 1/4 from 'each bag equally likely to be moved last' (idx 0,1,2,3,4,5,7), or 0 after declaring the order always reversed (idx 6). Part a came from templates: 1/2^(n-1) (idx 0,1,2,5), 1/24 (idx 4,7), 1/256 (idx 3). Not one rollout wrote a concrete move order with per-step legality. So the incumbent's declarative arrival-rank rule keeps losing to the flip. This revision makes orientation decide WHICH END of the run to analyse: last carried answers about the top, so a bottom or k-th-from-bottom question is about the earliest arrivals and is settled from the opening moves. Forced/free 1/2 pricing and the run-of-halves warning are kept."
19,7,3836,149.384,149.394,bf8917df8e428960f80d51070d9c159b26a541b8cfec74724b518f1eb812f558,acd14ef99ff0382af430dea10bc972e8bfeca18ec550c2707174b99dc1cec607,bf8917df8e428960f80d51070d9c159b26a541b8cfec74724b518f1eb812f558,0.625,0.125,-0.5,0.1,0.1,0.0,1.125,0.625,-0.5,189,183,discarded,ratio-irregularity-as-arithmetic-error-detector (replace back-substitution check with a cross-case consistency test that catches a mis-solved small case before any law is fitted),"0/8. Diagnosis: the ladder ran, but a single corrupted small case poisoned every fit. Six rollouts reached 3+ sizes, yet not one produced a clean value set. One built the smallest case with equal instead of one-fewer zero conditions, got a spurious value, then spent ~9k tokens forcing signed-factorial, power, and (n-1)!-type laws onto that inconsistent triple before hitting the cap. Another got a different corrupted smallest value, fit a clean power-of-2 law to it, and shipped it confidently. Two others abandoned numbers for full-size product/coefficient expansion (55-142 coefficient-of-x mentions). The incumbent asks for back-substitution, but rollouts never do it (0 hits). So this revision replaces the ignored per-case check with a cheap cross-case test the model already gravitates to: consecutive ratios plus signs must be regular, and irregularity means re-solve a case rather than invent a law."
19,8,23443,149.385,149.395,d6e761f5cca43ef948238db65074ea53c3f8953ec6c1f76a4fc7f307db54c5db,ed082979ff7e5cd0e17f0c1d681fd535e744dc7471f6dae62276dfcb38ef7b92,d6e761f5cca43ef948238db65074ea53c3f8953ec6c1f76a4fc7f307db54c5db,0.875,0.875,0.0,0.175,0.125,-0.04999999999999999,1.75,1.5,-0.25,185,188,discarded,screen-readings-upfront-for-self-refutation-instead-of-decide-once,"7/8 rollouts correct. All eight derive the common divisors and the maximal candidate correctly, so the divisor core works; the loss is entirely in reading management. The failure (longest, 15.5k tokens, 40 backtracks, 6 self-declared contradictions) adopted a reading where each listed aggregate was simultaneously a per-unit amount, which forces the count to cancel to a nonsense value; it then spent most of its length looping on that dead branch, and once exhausted it accepted both surviving candidates as valid and picked the smaller one, the group count, as the 'most reasonable' story. Winners never entered that branch. Rounds 14-18 tried tie-break bans and substitute-back checks after the fact and lost heldout, so instead of policing the endgame I added an up-front screen: a reading in which N cancels, is forced to 1, or aggregates double as per-unit amounts is self-refuting and gets dropped, not explored. That kills the branch that produces the bad tie."
19,9,3980,149.386,149.396,3e5130251127f1cdd38d0a1bb8dd4fb0acfb2a10ba7588ffd823b20e7a983801,446bd760c04686b86cae366d5d30229a6cc72db8140fb8ec60f38bec3383e1e6,3e5130251127f1cdd38d0a1bb8dd4fb0acfb2a10ba7588ffd823b20e7a983801,1.0,1.0,0.0,0.2,0.1125,-0.08750000000000001,2.0,1.5625,-0.4375,189,190,discarded,order-the-elimination-branch-relation-first-and-read-a-high-degree-equation-as-wrong-order,"7/8 correct (3.5k-5.4k tokens); the one failure burned the full 16384-token cap and ended in a degenerate loop repeating one subtraction hundreds of times. It adopted the centered ansatz, then mis-nested the composition (substituting the already-cubed offset again, BA^9, so B^2=A^8, B=+-A^4, 16 mentions). Fatally, it then eliminated in the wrong direction: it solved each given for the scale, A=(r+24)/r^3 and B=(r-30)/r^3, and pushed those into the branch relation, producing (r-30)^2*r^14=(r+24)^8, then trial-substituted integer centers. All 7 correct rollouts imposed the branch relation on the givens first and added the pair, closing in one line. Rounds 9/10 (exponent audits), 14/15 (factoring), 16 (no-ratio), 17 (validate) and 18 (conjugation) all lost heldout, so this revision changes only the elimination order and adds a portable back-up trigger: a high-degree equation in one unknown means wrong order, not a root hunt."
19,10,3843,149.387,149.397,1e3acbae873bc435b7dfe5ef08152ba300c78d6c321ecbd752834208236d2a85,b2fc86612a07d7e59d68fa5da7e71160c5c1d0b7fc5a041dd8710c5786bc5d3e,1e3acbae873bc435b7dfe5ef08152ba300c78d6c321ecbd752834208236d2a85,0.75,0.625,-0.125,0.1875,0.1125,-0.075,1.6875,1.1875,-0.5,194,193,discarded,block-swap-j-to-j+L-offset-rule + cross-size grow-and-divide consistency filter that blames the larger trace,"3/8 correct; 3 of 5 failures hit the 16384-token cap. Mechanical root cause: three rollouts collapsed a length-L block swap into a single-slot transposition (writing 'swap 0-1, swap 0-2, swap 0-4'), so idx6 got n disjoint 2-cycles and boxed 2, idx5 invented a 6-cycle+2-cycle and boxed 2n. idx1 built a position table where the length-2 swap moved slot 1 back to 1; it contradicted its own state trace and it burned 16k tokens re-arguing instead of trusting the states. Fit-stage cause: every failure held per-size counts that did not grow (idx7 traced 4 for size 4 then a botched 4 for size 8; idx2 listed 4,4,8), then fit an off-by-one exponent or went piecewise/special-case rather than redoing the larger trace. So the revision adds the explicit j <-> j+L slot rule, a two-repeat order-2 falsifier, and a cross-size filter (counts grow, smaller divides larger, bounded by slot count) that blames the LARGER trace."
20,1,28054,149.398,149.408,63a89f2cd0ed76608369f4f83dfd2ebf423fba103da365f212bc744abc7f10b2,91f0922b4554a8c606d729e905ec6b07559e7945b0a1a135336694edbd867409,63a89f2cd0ed76608369f4f83dfd2ebf423fba103da365f212bc744abc7f10b2,0.375,0.125,-0.25,0.2125,0.0875,-0.125,1.4375,0.5625,-0.875,175,190,discarded,ban-per-reading-consistency-case-split-plus-survivor-count-audit,"My 8 rollouts scored 1/8 (exec 149.398). Four burned the 16384-token cap with no box; the four that terminated wrong all boxed 143. New evidence: the incumbent's contrapositive did get echoed (pooled appears up to 27 times, 'two distinct' in 6 rollouts) yet no rollout ever finished a pooled list. Instead the dominant path is a global case split - open sum-reading and product-reading, check each is consistent with both statements, find BOTH are, then declare a winner on looks (one explicitly called 14x143 'unique', another invoked primality 30 times). That whole-reading consistency test is the trap: it never discriminates, so the rollout must guess. So this revision names and bans it up front, notes each unsettled option yields only one partner per v (making the list cheap to finish), and adds a survivor-count audit whose zero branch diagnoses the illegal fixing rather than licensing a guess."
20,2,30302,149.399,149.409,c608cf3e70986473f7ad7a491de9bfd43b306ba0d80aa9b5896943da5d065421,3123f1aae90c3fdf78b539a540cd906298899a7d90873fdc41d6df838cf087f8,c608cf3e70986473f7ad7a491de9bfd43b306ba0d80aa9b5896943da5d065421,1.0,0.875,-0.125,0.2125,0.1,-0.11249999999999999,2.0625,1.375,-0.6875,192,191,discarded,predict-the-locus-shape-from-a-conic-classification-table and make that match the only check; move the ratio-form ban upstream into the derivation,"8/8 correct, so train is saturated (train_i 1.0) and the lever is transfer plus wasted budget. Every rollout had the modulus ratio and the completed-square circle inside its first ~2k chars, then spent 4-8x more tokens on verification the incumbent bans only at the end: all 8 rewrote to ratio form and nth-rooted it into per-solution branches (10-41 exponential expressions each). The worst (6590 tokens, 25 hedges, 12 'mistake', 6 'contradiction') mis-solved a branch, got a point failing its own modulus ratio, then doubted the modulus law itself for ~4k tokens. Three others closed by calling the condition 'necessary and sufficient': right answer, wrong logic that will not transfer. Diagnosis: a terminal ban leaves the checking urge nowhere legal. So the ratio ban moves upstream into the derivation, and the urge is redirected to a free portable check: classify the locus shape from the condition's form before any algebra, then require only that the completed square match it."
20,3,8554,149.400,149.410,2d11bf4a5b7189e1adf872d81d0aa917b7c4dfdc59258854a4b0dc37d27a2c46,eaa406414e7de01ff53256a1880cd1b3d03224fb713c6e1d36917a710454dc0c,2d11bf4a5b7189e1adf872d81d0aa917b7c4dfdc59258854a4b0dc37d27a2c46,0.875,0.25,-0.625,0.2,0.2375,0.03749999999999998,1.875,1.4375,-0.4375,189,190,discarded,replace-verbal-containment-ban-with-numeric-range-intersection-test-and-shoelace-box-order,"1/8 correct. No rollout ever computed a clipped area: shoelace appears 0 times in all 8. Three failures used the wedge frame yet ruled by prose: two said the cover ""lies outside"" S (overlap 0, answered summed areas) and one said S lies wholly inside the aligned cover (overlap = area(S)); each cited coordinate ranges that visibly straddle 0 without comparing them. Four hit the 16384 cap: they reached the right clipped value early, then re-litigated rotation (104-196 rotation mentions, 18-38 tangency) and never boxed. The lone winner reached the same value and closed. The incumbent asserts sign facts (""one negative coordinate kills containment"") but never asks for numbers, so nothing is executed. This revision demands numeric vertices then an axis-by-axis range intersection, which refutes both the disjoint and the containment verdict from the same table, and orders shoelace-then-box before any angle talk."
20,4,25003,149.401,149.411,903dd62479cd089fd4952649e099566998aae3073dafc4c839f1c02dee0a465a,4959ad937117c4366fc365597757e9fe7902bd3b615fb7c92b3cd663d8c138b9,903dd62479cd089fd4952649e099566998aae3073dafc4c839f1c02dee0a465a,0.875,0.125,-0.75,0.2,0.15,-0.05000000000000002,1.875,0.875,-1.0,190,190,discarded,name-the-over-quantification-that-triggers-must-be-linear,"8/8 correct with the incumbent, so aggregation is sound; the cost is one shared detour. All 8 rollouts built a difference operator on the board (P(n+1)-P(n) or P(x+1)-P(x)), demanded it be constant for ALL n, got a degree d-1 polynomial, and concluded ""must be linear/constant"" - 98 hits total, up to 37 in one rollout - then had to recover. Six also called the product ""too large"" (18 hits) and reopened tightness. Spend was 8.0k-15.3k tokens with 207 ""Wait"" restarts; earlier rounds show these loops truncate when they start sooner. The incumbent only bans chaining adjacent terms, justified by ""neighbours may differ"", which round 19 found is misparsed as ""each term needs a distinct polynomial"". This revision instead names the real logical error - promoting finitely many point conditions to an identity in x - voids the ""must be linear"" conclusion outright, and keeps the per-group cap, the sum, and the substitution certificate."
