round,hint_id,train_qid,sampling_slurm_job_id,proposal_eval_slurm_job_id,incumbent_hash,proposal_hash,final_hash,old_train,new_train,delta_train,old_heldout,new_heldout,delta_heldout,old_J,new_J,delta_J,old_tokens,new_tokens,decision,mutation,subagent_summary
15,7,3836,149.304,149.314,bf8917df8e428960f80d51070d9c159b26a541b8cfec74724b518f1eb812f558,4823cd2da36c76420efcca5c9f3fc2fd0d370105c4dc74c0b41010cd5edceaaa,bf8917df8e428960f80d51070d9c159b26a541b8cfec74724b518f1eb812f558,0.625,0.0,-0.625,0.1,0.125,0.024999999999999994,1.125,0.625,-0.5,189,189,discarded,solve-all-unknowns+back-substitute-full-solution+predict-and-verify-one-extra-case,"0/8 this round (same hint scored 5/8 in r14), so the ladder is fragile, not absent. Six rollouts hit the 16384 cap after abandoning numbers for a symbolic product of linear factors, hunting one coefficient via elementary-symmetric/harmonic sums and looping on sign errors; two of those also mis-scaled a toy, called it inconsistent or redundant, and never recovered. The two that terminated did build the ladder but reported unchecked toy values (one gave n=4 as 1/3, another as -1/4) and fit a confident wrong law (1/(n-1), then a power of 2) from those corrupted numbers. So the gap is verification, not framing: the incumbent asks only for the target and only a loose check. This revision forces solving all unknowns and back-substituting the full solution into every condition before a value is recorded, and converts fitting into a prediction test on one extra independently computed case, which catches exactly the wrong-law failures observed."
15,8,23443,149.305,149.315,d6e761f5cca43ef948238db65074ea53c3f8953ec6c1f76a4fc7f307db54c5db,b2cc1622789de6ea535da56282978f2d98345e1bd5ee89140ccea4f07da6e977,d6e761f5cca43ef948238db65074ea53c3f8953ec6c1f76a4fc7f307db54c5db,0.875,0.75,-0.125,0.175,0.1125,-0.062499999999999986,1.75,1.3125,-0.4375,185,189,discarded,contradiction-recovery-keep-max-divisor-plus-rebuild-check,"My 8 rollouts under the incumbent scored 7/8. The one failure (also the longest, 15.5k tokens, 104 mentions of the group noun) did the divisor work correctly and reached the right maximal N, then abandoned it: it had earlier tangled itself in a reading where the listed figures were per-unit, derived an absurd N, and out of that panic re-anchored on the literal group count from the story, declaring both candidates 'valid' and picking the smaller one as 'most reasonable'. So the incumbent's group-count clause was read but overridden once a contradiction appeared. The correct rollouts never entered that loop. My change adds explicit contradiction-recovery discipline - when a reading fails, discard the reading rather than the maximum-divisor rule, never re-anchor on a story number - plus a portable rebuild check (N times each share must reproduce its listed total) replacing the weaker 'decide once' clause."
15,9,3980,149.306,149.316,3e5130251127f1cdd38d0a1bb8dd4fb0acfb2a10ba7588ffd823b20e7a983801,dbf6f788bd067b591c78ce0ea0831f946ab6572fa5fe7b4b0cb0f6c1b265c851,3e5130251127f1cdd38d0a1bb8dd4fb0acfb2a10ba7588ffd823b20e7a983801,1.0,0.875,-0.125,0.2,0.1625,-0.037500000000000006,2.0,1.6875,-0.3125,189,190,discarded,require-full-linear-factorisation-and-debug-in-place-instead-of-abandoning-ansatz,"7/8 correct; the single failure (reward 0) burned the full 16384-token cap. It adopted the centered ansatz correctly, then mis-factored the leading-coefficient condition AB^3=BA^3 as AB^2(A-B)=0, concluding A=B, hence p=q, which the distinct givens forbid. Reading that as proof the ansatz was wrong, it abandoned centering, went back to generic ax^3+bx^2+cx+d, and spent thousands of tokens hand-computing x^7 and x^6 coefficients of the degree-9 composition before running out of room. Round 12's and 14's failures had the same shape: a factoring/branch slip misread as a dead method. The incumbent says 'factor once as AB(A^(n-1)-B^(n-1))=0 and carry both branches', which the student can satisfy while still cancelling the (A+B) root. The revision demands full linear factorisation (AB(A-B)(A+B) for n=3) and adds an explicit rule: a contradiction means debug the algebra in place, never revert to brute expansion."
15,10,3843,149.307,149.317,1e3acbae873bc435b7dfe5ef08152ba300c78d6c321ecbd752834208236d2a85,896223d69a721b23b6ebeb997f0c286c9f75075dac0e278f267f04cd42643766,1e3acbae873bc435b7dfe5ef08152ba300c78d6c321ecbd752834208236d2a85,0.75,0.25,-0.5,0.1875,0.1125,-0.075,1.6875,0.8125,-0.875,194,190,discarded,lcm-divisibility-filter-plus-ban-constant-or-max-over-sizes-answers,"4/8 correct; two failure shapes the incumbent misses. (a) Answer shape: one rollout, holding per-size counts 2,4,2,2, decided the answer had to be one number valid for every n and boxed the maximum over sizes; another boxed a bare constant. The incumbent's 'fit ONE closed form' never says the answer is a function of the size parameter, nor bans constants and maxima. (b) Order-2 relapse via squaring: one rollout traced a 4-cycle correctly, then squared the permutation, saw two 2-cycles, and read that as order 2; the incumbent's minimality clause missed it since no proper divisor was ever tested for identity. The truncated rollout thrashed on the same confusion. Correct rollouts followed one slot's orbit under whole repeats. So the revision keeps trace-not-theorize and the L-parallel-swaps fact, swaps vague minimality for an lcm-divisibility filter plus a note that shorter cycles after squaring are not order 2, and pins the answer to a growing formula in the size parameter."
16,1,28054,149.318,149.328,a3a9805f3b37695536ecf7628ac6a588215a3f9ca6cb77ede20cc39aa1b660f1,91aeb473f9e018e01c235b9d6d08a54422bb47b881e979f021ed850ea4bc28cf,a3a9805f3b37695536ecf7628ac6a588215a3f9ca6cb77ede20cc39aa1b660f1,0.125,0.25,0.125,0.225,0.1375,-0.0875,1.25,0.9375,-0.3125,184,182,discarded,ignorance-is-about-own-value-plus-carry-condition-P-into-partner-list,"My 8 rollouts scored 1/8 (exec 149.318): 3 hit the 16384-token cap, 4 boxed a wrong divisor (143 x3, 13 once justified explicitly by primality). Every failure judged ignorance by counting pairs consistent with 2002 itself rather than by what the holder of v can still not distinguish; several wrote 'she knows the other is public minus v, so she knows', called that reading impossible (impossible appears 17-54 times in the loopers), then collapsed to one reading and picked a factor on looks. Not one rollout carried the first announcement forward as a condition and applied it to the second speaker's candidate partners. The incumbent already says 'predicate' abstractly and the model even echoes the word without doing it, so the revision leads with the misconception itself (ignorance is about your own value, not the public count) and states the carry-forward concretely: the second speaker's partners ARE the first speaker's value, so they must satisfy P and two must remain."
16,2,30302,149.319,149.329,c608cf3e70986473f7ad7a491de9bfd43b306ba0d80aa9b5896943da5d065421,43492947261d165e21b35fdbf23a36a3d6af079b8a2a72e7c3b05b42e874b0d3,c608cf3e70986473f7ad7a491de9bfd43b306ba0d80aa9b5896943da5d065421,1.0,1.0,0.0,0.2125,0.1625,-0.04999999999999999,2.0625,1.8125,-0.25,192,190,discarded,replace-bare-stop-rule-with-bounded-two-point-diameter-audit,"All 8 rollouts correct (3.8k-6.6k tokens, 4-25 hedges), so training is saturated and the lever is transfer and wasted budget. Every rollout had the right circle inside its first ~600 tokens, then spent most of the rest enumerating the n solutions (11-44 exponential/root-of-unity expressions each) despite the incumbent's flat ban. The worst (6.6k tokens, 25 hedges) rewrote to ratio form, mis-solved a branch, got a point failing its own modulus condition, and burned ~4k tokens escaping that self-inflicted contradiction. Two others closed by calling the condition 'necessary and sufficient': right answer, wrong logic that will not transfer. Diagnosis: a prohibition with no substitute leaves the verification urge nowhere to go. So the revision keeps modulus-first plus the exponent-arithmetic k rule and swaps the bare stop rule for a bounded portable audit: the two collinear locus points end a diameter, a two-point check on center and radius that also catches a wrong k."
16,3,8554,149.320,149.330,e706044d3f2b50b5b56d612f00e693ef4bbb86f0d16e53200f96da94b7c7109e,2d11bf4a5b7189e1adf872d81d0aa917b7c4dfdc59258854a4b0dc37d27a2c46,2d11bf4a5b7189e1adf872d81d0aa917b7c4dfdc59258854a4b0dc37d27a2c46,0.75,0.875,0.125,0.2,0.2,0.0,1.75,1.875,0.125,190,189,kept,constructive-edge-direction-wedge-frame-plus-vertex-sign-test-and-no-second-orientation,"6/8 correct. Both failures hit the 16384 cap, neither committing a wrong answer. Failure A never built the corner frame: it put the big square's corner at the shared point but extended it a full side BOTH ways on each axis (-1.5..2.5), so that point became interior, the small square looked wholly covered (overlap 1), and it then spent 70 'tangent' mentions before guessing 4.5. Failure B did use the quadrant frame, computed the correct aligned overlap by ~4.5k chars and stated the union, then reopened 'maybe rotating shrinks it' and burned ~55k chars building rotated-square inequalities and vertices without closing. Winners reached that same first value and closed fast. So this revision makes the frame constructive (edge directions from the shared point; the cover is the plus-side wedge, so a corner cannot surround the point), makes the bound executable via per-vertex sign tests, and hard-bans a second orientation."
16,4,25003,149.321,149.331,71bbac004964e95216c81767dcfcedba54fed6a04125845418ad992501b8e093,a0c9867129f17582f4b4ab5a65d82f350e23b1a295b122b707dd81cdf1bc28d9,71bbac004964e95216c81767dcfcedba54fed6a04125845418ad992501b8e093,1.0,0.75,-0.25,0.1625,0.15,-0.012500000000000011,1.8125,1.5,-0.3125,190,189,discarded,pigeonhole-derivation-plus-unused-indices-are-free,"5/8 with the incumbent. All 3 failures shared one setup error: they labelled a polynomial per term (P_i at index i), imposed P_{i+1}(x+1)-P_i(x)=d, found it non-constant, and concluded one term per function. Two stopped there, answering N=10 and even 1; the N=10 one had already read the N x d cap and explicitly overrode it as inapplicable. The third truncated while chaining adjacent terms into a per-term construction, never grouping indices by function. So the per-group cap keeps losing to the belief that reuse would force one function's own consecutive values to step by d, and stating Bound = N x d as a rule invites override. This revision derives the product instead of asserting it: pigeonhole forces some function to serve k/N indices, whose root count caps k. It also adds that a function is constrained only at its own indices and free elsewhere, which is exactly what kills the reuse objection."
16,5,30418,149.322,149.332,85f213d578062adcf883b7f1f27d6adaf1b87fd1ff0c18c817da13cc0a477ef6,dbbaead7d39b16e96f80cd232fc0a54913ad6f58ed97a68fc4858d1666a0561d,85f213d578062adcf883b7f1f27d6adaf1b87fd1ff0c18c817da13cc0a477ef6,0.75,0.25,-0.5,0.2,0.1125,-0.08750000000000001,1.75,0.8125,-0.9375,193,194,discarded,anchor-new-heights-to-given-vertices-instead-of-evaluating-a-fresh-log,"7/8 correct (149.322); every rollout finished, none hit the cap, so the pipeline is sound and exactly one step leaks. The failure fit a=1,b=-1, took the displacement correctly, formed the closure, got the right quadratic, and correctly rejected the degenerate root reproducing a given vertex. It then evaluated the surviving vertex's height as a fresh log of an argument below 1 and copied the reciprocal exponent, getting a negative height where the true one is positive; the partner height inherited the flip, both new points left the curve, and the cross product came out about a third of the true area. The incumbent only fixes the forward height-to-argument direction, which that rollout used flawlessly. So the revision removes the reverse log evaluation entirely: express the new argument as a given vertex's argument times a power of the base as written and offset that vertex's known height, cross-checked from both given vertices, which flags any sign flip immediately."
16,6,26989,149.323,149.333,40f95ed4950fe23e751bafb0454b3a7b04b2370e997c7f4b8f29907ec9bc480e,e17b6f4c4ee2fe3f493fd4d0584fda727d3acce4fda441f7c3f2a8ac06bb0457,40f95ed4950fe23e751bafb0454b3a7b04b2370e997c7f4b8f29907ec9bc480e,0.375,0.0,-0.375,0.2,0.125,-0.07500000000000001,1.375,0.625,-0.75,175,190,discarded,replace-uniformity-ban-with-catalan-reachability-fact-and-derive-orientation-from-last-carry,"1/8 this round (idx 0, and even it reached the value after writing bottom = carried last). Six of eight (idx 1,2,3,4,5,6) explicitly declared the destination bottom to be the item carried LAST, inverting the pile, then read the answer off a uniform model: 1/4 from 'each bag equally likely to be last' (idx 1,3,5,6) or a bare 1/2 (idx 2,4); idx 3,6 also gave 1/24 for the earlier part. Idx 7 used favourable-over-total, 1 of 2^4, giving 1/16. So the incumbent's declarative arrival-rank rule and its verbal ban on 1/n both fail: the flip survives and uniformity is re-imported for the graded part. This revision derives orientation from the last carry instead of asserting it, and replaces the ban with a reason uniformity is impossible: reachable orders are Catalan-many, not n!, and unequally weighted. Forced/free 1/2 pricing and the run-of-halves warning are kept."
16,7,3836,149.324,149.334,bf8917df8e428960f80d51070d9c159b26a541b8cfec74724b518f1eb812f558,cd1094ee6bf838766a106c973f47d5ae889547184c3c6fd6ca322dbd940ec58a,bf8917df8e428960f80d51070d9c159b26a541b8cfec74724b518f1eb812f558,0.625,0.0,-0.625,0.1,0.1,0.0,1.125,0.5,-0.625,189,195,discarded,make-toy-condition-count-explicit-and-give-the-repair-for-an-overdetermined-toy,"0/8 this round (same hint scored 5/8 in r14), so the ladder is fragile and the failure is concentrated in one place: building the toy. Every rollout tried small cases, but 7 of 8 wrote n zero conditions PLUS the nonzero one, i.e. n+1 conditions for n unknowns. That toy forces all unknowns to 0, so rollouts read it as a contradiction or as the method failing, spent 1000-3000 tokens re-arguing the scaling, then abandoned numbers for symbolic work at the stated size (products of linear factors, harmonic sums); 6 hit the 16384 cap. The two that terminated reported laws fit from corrupted toys. The incumbent says 'n conditions' but never says the zero conditions therefore number n-1, so the miscount is not detectable from it. This revision states the total-count rule, names the all-zeros symptom, and gives the one-line repair instead of only forbidding renegotiation."
16,8,23443,149.325,149.335,d6e761f5cca43ef948238db65074ea53c3f8953ec6c1f76a4fc7f307db54c5db,a0433ae3afc4ae81f942a791909bf25acb7c24d5bb24c0c1809f775e6dfefb6c,d6e761f5cca43ef948238db65074ea53c3f8953ec6c1f76a4fc7f307db54c5db,0.875,0.875,0.0,0.175,0.0625,-0.11249999999999999,1.75,1.1875,-0.5625,185,191,discarded,label-fixes-figure-role-no-role-swap-under-difficulty,"7/8 public rollouts correct (train_i 0.875, receipt 149.325). The single failure was not arithmetic: it derived gcd 15, listed admissible counts, and had both candidate per-unit splits verified, then reopened the aggregate-vs-per-unit reading of the listed figures, re-read village totals as per-house amounts, produced an absurd count, declared a contradiction, and looped that same paragraph four times (15.5k tokens, 40 backtracks) before abandoning the maximum and lifting the story's group count as N. Correct rollouts showed the same churn more weakly (10-48 backtracks). So the incumbent's promise to 'decide once ... then stop revisiting' is not actionable, because nothing tells the student how to decide or what to do when stuck. I replaced it with a rule that fixes each figure's role from its own label and forbids reassigning a role or shrinking N to escape a stuck step, keeping every proven mechanism intact."
16,9,3980,149.326,149.336,3e5130251127f1cdd38d0a1bb8dd4fb0acfb2a10ba7588ffd823b20e7a983801,019280931861d740677e63668a63f9360640d56f1d593b5f2af45befcda8fb7d,3e5130251127f1cdd38d0a1bb8dd4fb0acfb2a10ba7588ffd823b20e7a983801,1.0,0.875,-0.125,0.2,0.175,-0.025000000000000022,2.0,1.75,-0.25,189,190,discarded,forbid-ratio-of-conditions-and-restrict-cancellation-to-common-factor,"All 8 rollouts correct (~4.1-9.1k tokens), so training is saturated and the loss is transfer. Two recurring detours dominate the wasted tokens. (1) Mis-cancellation: several rollouts reduce AB^n=BA^n by dividing out AB^2 (or B^3=A^3), collapse to A=B, then spend long passages declaring the ansatz contradictory before recovering the sign-flipped branch. (2) The 9.1k outlier both mis-raised the outer coefficient (getting B=+-A^4) and then divided one given condition by the other; the ratio produced a degree-9 equation in the center, and it burned roughly half its output trial-substituting integer centers before stumbling onto the branch. The revision therefore pins cancellation to the common factor AB only, and explicitly bans ratioing two conditions in favour of add-to-pin-the-center / subtract-to-pin-the-scale, both portable moves for any two-condition symmetric system."
16,10,3843,149.327,149.337,1e3acbae873bc435b7dfe5ef08152ba300c78d6c321ecbd752834208236d2a85,daee740dad6e9b0855a61b189dfa66c2cc657f3807038c66eee0b2ae7eeec534,1e3acbae873bc435b7dfe5ef08152ba300c78d6c321ecbd752834208236d2a85,0.75,0.25,-0.5,0.1875,0.1,-0.0875,1.6875,0.75,-0.9375,194,189,discarded,final-substep-is-not-the-operation + written-trace-overrides-contradicting-permutation-table + no-uncited-cycle-lengths,"2/8 with the incumbent. Three failures boxed 2 by writing confident cycle notation for the composite that is really just the LAST sub-step's swap (e.g. pairing each slot with the one a half-length shift away), i.e. earlier sub-steps silently vanished; the incumbent's nested-ranges clause did not catch it because they never traced a state at all. One capped-out rollout had a correct 4-repeat trace for the smallest nontrivial size, built a permutation table with the inverse convention, saw order 2, and burned its whole budget re-arguing which was right instead of trusting the states. Two more fabricated cycle lengths never traced (a 5-cycle plus 3-cycle; a 6-cycle for one size, an 8-cycle for the next) and fit growth laws to those invented numbers. So the revision names the drop-all-but-last-sub-step signature, makes the written trace override a contradicting table, and bans uncited cycle lengths."
17,1,28054,149.338,149.348,a3a9805f3b37695536ecf7628ac6a588215a3f9ca6cb77ede20cc39aa1b660f1,8922f5c62d982c7785488906bf7d873b92636b08a7c91ea4426a3cd1cbca4fa2,a3a9805f3b37695536ecf7628ac6a588215a3f9ca6cb77ede20cc39aa1b660f1,0.125,0.0,-0.125,0.225,0.2125,-0.012500000000000011,1.25,1.0625,-0.1875,184,188,discarded,pool-partners-across-unstated-choices-plus-intersect-survivors-and-ban-aesthetic-ties,"My 8 rollouts scored 1/8 (exec 149.338). Every failure judged ignorance by counting pairs consistent with the public number itself, then said the holder can just subtract or divide, wrote contradiction/impossible (17-54 times in the loopers), and finished on looks: 143 boxed three times, 13 once justified explicitly by primality, one pair endorsed for being non-prime. Three burned the 16384-token cap on that loop. Not one rollout pooled the partners a single private value admits across BOTH unstated readings, so none ever saw where residual ambiguity lives, and none allowed the two values to be equal. The incumbent says predicate abstractly and the model echoes the word without executing it, so the revision makes the pooled per-value count the one operation, states that pinning under a single choice is not a contradiction, replaces guessing with an intersect-the-survivors termination rule, and names the two aesthetic tie-breakers actually observed as banned."
17,2,30302,149.339,149.349,c608cf3e70986473f7ad7a491de9bfd43b306ba0d80aa9b5896943da5d065421,7f30954750d076f062116b89abd5a09b6c9c3aef851e2cbd815ef7b7109bb1b2,c608cf3e70986473f7ad7a491de9bfd43b306ba0d80aa9b5896943da5d065421,1.0,0.875,-0.125,0.2125,0.1625,-0.04999999999999999,2.0625,1.6875,-0.375,192,194,discarded,"extend-nth-root-rule-to-absorbing-c-into-the-power, plus attribution rule replacing the bare no-enumeration ban","All 8 rollouts correct (3.5k-10.2k tokens, 3-42 hedges), so training is saturated and the lever is transfer plus wasted budget. Every rollout had the locus within its first ~2k characters, then enumerated roots anyway (10-66 branch expressions each) despite the incumbent stop rule. The instructive one (10.2k tokens, 42 hedges) absorbed the constant into the power, writing c(z-b)^n as (cz)^n without nth-rooting c, so its branch solved to a point that failed its own modulus ratio; it then spent ~6k tokens doubting the modulus law itself before recovering. Two more re-litigated necessary-vs-sufficient and one manufactured a rival constant-|z| circle from a bad rearrangement. Diagnosis: the k rule covers only the explicit nth root, not the equivalent absorb-into-the-power move, and a bare enumeration ban leaves a contradiction unattributed. So the revision extends the nth-root rule to absorption and adds an attribution rule: a violating candidate indicts the algebra, not the law."
