round,hint_id,train_qid,sampling_slurm_job_id,proposal_eval_slurm_job_id,incumbent_hash,proposal_hash,final_hash,old_train,new_train,delta_train,old_heldout,new_heldout,delta_heldout,old_J,new_J,delta_J,old_tokens,new_tokens,decision,mutation,subagent_summary
4,10,3843,149.82,149.96,ce69be40ed567eba12a96f0a63ea1462e4b13c7ba9b4265dd1382a154fe82da4,f76c7d2d17a3abede35f14ff3a8817e1b927b38924563d6ec0a4de2401f57ff1,ce69be40ed567eba12a96f0a63ea1462e4b13c7ba9b4265dd1382a154fe82da4,0.75,0.125,-0.625,0.1375,0.1625,0.024999999999999994,1.4375,0.9375,-0.5,181,191,discarded,one-simulation-then-iterate-permutation-cycles,"3/8 correct with the incumbent; every failure came from re-simulating the whole state for the 2nd, 3rd and 4th applications, accumulating block-swap slips until the student concluded the word oscillates and never returns, or from asserting the composite is disjoint transpositions of order 2 without tracing any cycle. Four of five failures also hit the token cap thrashing between mutually inconsistent per-size counts, so the revision confines hand simulation to a single operation, extracts the permutation once, and moves all repetition into cheap cycle iteration plus lcm."
5,1,28054,149.97,149.107,7bfb7a0d8f83d797ba13b71ed1076d9e3bc7002785faa9b3a27625fa42b6c21f,da4fa41138fb2d2e02827afeeaf4716733f4a932070f06cee247429ab7632e08,7bfb7a0d8f83d797ba13b71ed1076d9e3bc7002785faa9b3a27625fa42b6c21f,0.25,0.125,-0.125,0.15,0.1125,-0.03749999999999999,1.0,0.6875,-0.3125,146,189,discarded,cross-filter-candidates-through-prior-speaker-set,"My 8 public rollouts scored 2/8 (execution 149.97); all six failures enumerated the divisor pairs of the public number but never fed Sasha's announcement back as a constraint on Masha's candidate partners, so they collapsed to a single reading, declared ""the partner is uniquely determined, contradiction"", and emitted an unjustified divisor (143 three times, 11 once) while two burned the token cap looping on that contradiction. The revision keeps the two-candidates-per-private-value counting rule but adds the missing mechanism explicitly: turn the earlier announcement into a set of admissible partner values and re-count each later speaker's candidates only within that set."
5,2,30302,149.98,149.108,1f201f288fcb54e8912556e65d37575844f34bb6254ce56a76fd292e0482315d,8726311eca322f6252c2bcc41d2ed1f414d51e492fa8f070fb7a093bc45ddf97,1f201f288fcb54e8912556e65d37575844f34bb6254ce56a76fd292e0482315d,1.0,1.0,0.0,0.1875,0.175,-0.012500000000000011,1.9375,1.875,-0.0625,198,188,discarded,split-modulus-step-and-give-closed-form-center-radius,"All 8 round-5 rollouts scored 1, so training is saturated and the loss is transfer plus wasted tokens. The dominant failure was the incumbent's compressed modulus line: rollouts wrote |z-a|^n = |c|^(1/n)|z-b|^n (mixing the power and the root in one step) and then carried a wrong ratio for thousands of tokens before self-correcting, with the two longest rollouts (12.2k and 7.0k tokens, 37 and 35 hedges) spending most of their length on that constant. A second sink is that the incumbent gives only a procedure for the circle, so rollouts re-derived the midpoint/half-distance from scratch or ran a full x+iy completion of the square as well; the revision splits the modulus into two explicit steps and supplies closed-form center and radius so the circle step is a substitution."
5,3,8554,149.99,149.109,12ca35d8eb1c90348cad76d7ffd06b60ac04aa2e8bf55dff87141c5343e05d37,9ebe8ddbf8a5d9daaae8e0a4357cd7a942e10529d116c36fa43a25d554e232f5,9ebe8ddbf8a5d9daaae8e0a4357cd7a942e10529d116c36fa43a25d554e232f5,0.625,0.5,-0.125,0.175,0.2,0.025000000000000022,1.5,1.5,0.0,165,192,kept,prove-rotation-partition-invariance-then-stop,"Round-5 training with the incumbent fell to 4/8, and all four failures share one root cause: the invariance check is run as two independently guessed sample orientations, so a botched rotated-case value (one rollout got a single-point overlap and answered 5, another got a whole-shape overlap, a third got a value disagreeing with the aligned case) either ends the rollout wrong or triggers an open-ended piecewise search that ran out the 16384-token budget in three of eight. Winners instead trusted the aligned computation and argued invariance directly. This revision replaces sample-and-compare with an explicit one-line rotation-symmetry proof (rotating by 2*pi/k maps S to itself and permutes the k wedge positions, partitioning S into k equal pieces) plus a hard floor rejecting single-point and full-containment overlaps, so the student never needs a second computed orientation to commit."
5,4,25003,149.100,149.110,c88c72a8af76a0349016b46bf3a91690c7375399032fa6e2fedac91359b1f577,ce36182bcfaa4c4b721018be157cb8138f1e0a53390625dae23b06f0587b7fa5,c88c72a8af76a0349016b46bf3a91690c7375399032fa6e2fedac91359b1f577,0.625,0.125,-0.5,0.1625,0.15,-0.012500000000000011,1.4375,0.875,-0.5625,176,194,discarded,per-function-cap-must-be-multiplied-by-N,"My 8 public rollouts scored 5/8 and, unlike earlier rounds, all three failures terminated normally with wrong answers rather than truncating. Two derived a correct per-function root bound but then reported that cap as the final count instead of summing over the N functions, and one of those used the interpolation count deg P + 1 rather than the root count deg P; the third never used the root bound and assumed each function contributes exactly one index. The revision therefore fixes the cap to the root count and adds an explicit aggregation step plus reject-rules for the two observed off-by-a-factor endings."
5,5,30418,149.101,149.111,bf462b403f17cd428257353852dc46039314abb29f7a1232a8b7b962384878f2,edd3a8dc0a0c500fda8fe9ae9b613d02a9e8fcb61f60d2021aa1a1f5a1f77d2c,bf462b403f17cd428257353852dc46039314abb29f7a1232a8b7b962384878f2,1.0,0.375,-0.625,0.1375,0.1125,-0.02500000000000001,1.6875,0.9375,-0.75,151,148,discarded,shorten-and-merge-overconstraint-and-substitute-back-checks,"All 8 public rollouts were correct (train_i=1.0), so train is saturated and only transfer binds; heldout has tracked hint length inversely across rounds (73 tok -> 0.15, 151 -> 0.1375, 161 -> 0.125, 189 -> 0.075), so this revision is shorter than the 151-token incumbent. The three longest correct rollouts thrashed on hundreds of midpoint/vertex-sum lines and contradiction talk after adding a redundant second closure condition, while the short clean rollouts carried one on-curve parameter; historical failures on this hint instead assigned the translated vertex a y from the carried shift rather than from f, got a point off the graph, and reported an area anyway. The hint keeps only the portable pipeline plus those two cheap guards and drops the narrow discriminant-flip and exponential-form verbosity."
5,6,26989,149.102,149.112,99c30a3f882f054f77512e4fdca1d19befb3e5426d7d857d52f4369a95c4f820,35534215ceae3e5593a438cb851575c6b4b33b0f4690acbd42de916943544094,99c30a3f882f054f77512e4fdca1d19befb3e5426d7d857d52f4369a95c4f820,0.0,0.0,0.0,0.1875,0.1625,-0.024999999999999994,0.9375,0.8125,-0.125,83,142,discarded,unique-push-pop-word-per-output-order-then-price-it,"My 8 public rollouts scored 0/8 in two clusters: four asserted the delivery order is deterministically reversed, and three assumed uniformity (one answer per permutation, or per which item lands last); one exhausted its token budget on unstructured enumeration. Rounds 1-4 showed that longer enumerate-the-tree hints all cost held-out relative to the 83-token incumbent, so this revision stays short and swaps the abstract state-graph advice for one portable structural fact: an output order corresponds to a unique legal push/pop word, which simultaneously refutes the forced-outcome and equiprobable-permutation fallacies and reduces the task to pricing that word by its free-versus-forced moves."
5,7,3836,149.103,149.113,39e2668fb5cca7669288765276aabe0dba01769397daa33b16a9dd7c0174a8f4,01cb715a3d1d9d867b8114ae92c5f429cfcdda1dced6ccd8cd287be6f1f1e51b,39e2668fb5cca7669288765276aabe0dba01769397daa33b16a9dd7c0174a8f4,0.125,0.0,-0.125,0.1875,0.15,-0.037500000000000006,1.0625,0.75,-0.3125,82,156,discarded,shift-exponents-to-degree-zero+scale-the-toy-analogue,"All 8 rollouts scored 0 (7 hit the 16384-token cap): every one reinterpreted the rows as a polynomial in the condition number rather than the node, producing a degree-2005 polynomial with only 2004 roots, then spent the budget resolving the phantom free root and reported 1/2005, 0, or a harmonic sum. Two rollouts built a small analogue but gave it more conditions than unknowns, so the toy came out inconsistent and they abandoned the correct framing. This revision keeps the incumbent's proven functional opening and adds the two missing mechanical steps: absorb one node power into each weight so the annihilated exponents start at degree 0 (which is why the functional reads off a top coefficient), and scale the toy's condition count with its unknown count."
5,8,23443,149.104,149.114,631be8eed5f087f7cdab1dec25cead2e9d0ae8ea0b579379c5e58836f770dc11,f15a59be5e32bbac0f45dc9166f4040b794a9430087eeb08df27860054369005,631be8eed5f087f7cdab1dec25cead2e9d0ae8ea0b579379c5e58836f770dc11,0.625,0.875,0.25,0.2125,0.1125,-0.09999999999999999,1.6875,1.4375,-0.25,169,190,discarded,front-load-group-count-trap-divisibility-not-sufficient,"5/8 public rollouts were correct; all three failures shared one mode, and it was not arithmetic: they read the stated number of equal groups as the unit count, divided every listed total by it, saw each quotient come out whole, and treated that successful divisibility check as confirmation, so they never ran the gcd/maximum-admissible-count step at all. The incumbent already warns that group wording only imposes a multiple constraint, but it sits mid-paragraph after the gcd sentence and was missed. I front-loaded that warning and added the portable closing of the loophole, namely that divisibility is necessary but not sufficient because every divisor of the gcd also passes, so one must continue to the maximum."
5,9,3980,149.105,149.115,8c6cf2ad54328ef6d5d7727c427a0f3b4e2872fcbd87df2e3a186687f9e272bd,379c17a37ce59d87b284ce8a3da735f1f64ff50b56d7336619bd74033c49cb1a,379c17a37ce59d87b284ce8a3da735f1f64ff50b56d7336619bd74033c49cb1a,1.0,1.0,0.0,0.1625,0.1875,0.024999999999999994,1.8125,1.9375,0.125,175,192,kept,factor-leading-condition-and-carry-both-branches,"All 8 public rollouts were correct again (8/8, 4.4k-6.0k tokens, none truncated), so the training question stays saturated and every remaining point is transfer; the one visible waste is that some rollouts burned ~3k tokens looping on the algebra of AB^n=BA^n (repeatedly mis-cancelling before recovering B=+-A) and others accepted B=-A purely on the hint's authority. Across rounds only the round-2 proposal raised heldout (0.175), and its distinctive ingredient was the factored condition AB(A^(n-1)-B^(n-1))=0 with an instruction to carry both branches and let data eliminate one, while its train loss came from abstracting the trigger and dropping the fixed-point/verify steps. This revision therefore keeps the incumbent's concrete p(q)=q(p) trigger, centered ansatz, and verification spine untouched and swaps only the asserted odd-n sign for that factored both-branch derivation, so unseen problems whose data favours the B=A branch are not forced into a sign flip."
5,10,3843,149.106,149.116,ce69be40ed567eba12a96f0a63ea1462e4b13c7ba9b4265dd1382a154fe82da4,696ab4c241f7d13d35d173fbf8ef6f4e902fa9d60e1130386bc63757b8bf880d,ce69be40ed567eba12a96f0a63ea1462e4b13c7ba9b4265dd1382a154fe82da4,0.75,0.125,-0.625,0.1375,0.15,0.012499999999999983,1.4375,0.875,-0.5625,181,195,discarded,carry-current-contents-and-commit-after-confirmation,"Only 2/8 correct and six of six failures hit the token cap; all six produced a smallest-size count that contradicted their own larger-size count and then looped for thousands of tokens re-deriving it. Tracing the block swaps shows the shared root cause is refilling a swapped block from the original letters instead of the state the previous sub-step produced, which silently undoes an earlier sub-step and makes the operation look like an involution. The revision therefore states the rigid-unit rule with CURRENT contents, adds a came-from-the-previous-line check, and tells the student to commit once one larger size confirms the closed form instead of restarting."
6,1,28054,149.118,149.128,7bfb7a0d8f83d797ba13b71ed1076d9e3bc7002785faa9b3a27625fa42b6c21f,1624391b1ea234720db50aada7f5e2f22f58c8f7853e976d277c7b07bec2a58d,1624391b1ea234720db50aada7f5e2f22f58c8f7853e976d277c7b07bec2a58d,0.25,0.25,0.0,0.15,0.1625,0.012500000000000011,1.0,1.0625,0.0625,146,142,kept,uncertainty-lives-in-the-unstated-coordinate,"All 8 rollouts (execution 149.118) scored 2/8; every one of the six failures reasoned that a speaker who knows their own value plus the public number can just subtract or divide, declared both readings of the public number impossible, and then filled the box with an arbitrary divisor (143 three times, 11 once) or burned the 16k cap looping on that contradiction (three of eight hit finish_reason=length). The revision keeps the incumbent's short elimination frame but names the mechanism the failures skipped: residual uncertainty can live entirely in the unstated coordinate, so candidates must be counted jointly across all coordinates rather than inside one committed reading, and a dead end signals over-credited knowledge rather than a contradictory puzzle."
6,2,30302,149.119,149.129,1f201f288fcb54e8912556e65d37575844f34bb6254ce56a76fd292e0482315d,09a3f539da4139be31cce0495ef80072afa92029867895a043fe591eae05bbdb,1f201f288fcb54e8912556e65d37575844f34bb6254ce56a76fd292e0482315d,1.0,1.0,0.0,0.1875,0.175,-0.012500000000000011,1.9375,1.875,-0.0625,198,186,discarded,verify-k-numerically-at-a-collinear-point,"All 8 rollouts scored 1 so training is saturated; the diagnostic signal is that the two longest rollouts (12.2k and 7.0k tokens, 37 and 35 hedges) each botched the modulus constant in opposite directions - one applied the 1/n root twice and carried k=2^(1/6), the other took a square root and carried k=8 - then spent thousands of tokens on a self-inflicted contradiction before recovering. Prior rounds tried to fix this with symbolic exponent lectures (verify k^n=|c|, split the modulus step) and both lost heldout, so this revision instead keeps the raw |z-a|^n=|c||z-b|^n form and adds a cheap numeric audit at one collinear point, which is what actually let the derailed rollouts detect the wrong k, and it drops the redundant x+iy completion-of-the-square cross-check."
6,3,8554,149.120,149.130,9ebe8ddbf8a5d9daaae8e0a4357cd7a942e10529d116c36fa43a25d554e232f5,73e9a5572d27ca560e7cadfbcfb39a419f01e3abfc31a7fbe934b1993a81c5de,9ebe8ddbf8a5d9daaae8e0a4357cd7a942e10529d116c36fa43a25d554e232f5,0.5,0.5,0.0,0.2,0.15,-0.05000000000000002,1.5,1.25,-0.25,192,191,discarded,ban-tangent-line-detour-and-stop-after-first-area,"This round's 8 rollouts split 4/4 and every one of the 4 failures ended at the 16384-token cap, never on a wrong committed answer: two of them had already reached the correct union value and then kept re-deriving and restating it until truncation, while the other two abandoned the invariance argument to hunt for a tangent line or an origin-to-side distance that determines the rotation angle and never closed that search. The winners instead computed one wedge area in the aligned orientation and terminated promptly. This revision keeps the rotation-partition proof but adds a named ban on the tangent-line/point-to-line detour that consumed two failures and an explicit stop-after-the-first-area instruction to kill the restatement loop that consumed the other two."
6,4,25003,149.121,149.131,c88c72a8af76a0349016b46bf3a91690c7375399032fa6e2fedac91359b1f577,95e2af1cf5a56e868c1b5649c74bcb0cc5d90016b1716072ab7daae123db4ca7,c88c72a8af76a0349016b46bf3a91690c7375399032fa6e2fedac91359b1f577,0.625,0.125,-0.5,0.1625,0.1875,0.024999999999999994,1.4375,1.0625,-0.375,176,181,discarded,bound-meets-construction-with-explicit-jointly-summed-group-caps,"My 8 public rollouts scored 5/8 and all three failures terminated normally with wrong counts, every one of them an aggregation error at the last step: one reported the per-polynomial root cap as the whole answer, one assumed each polynomial contributes exactly one index, and one used the interpolation count (degree plus one) for a single group and never summed over groups. Rounds 3-5 showed that adding jargon-heavy prohibition or reject rules to the incumbent collapses both train and heldout, so this revision instead reframes the hint around the portable extremal principle (upper bound plus matching construction) and states the summation over all N groups as an ordinary jointly required step rather than a list of forbidden endings."
6,5,30418,149.122,149.132,bf462b403f17cd428257353852dc46039314abb29f7a1232a8b7b962384878f2,c44d2c3bfcdec6bd95e10fd406d7fd5b8d6d0fe5cec6d156c1d3e70ae9f18d75,bf462b403f17cd428257353852dc46039314abb29f7a1232a8b7b962384878f2,1.0,0.5,-0.5,0.1375,0.1625,0.024999999999999994,1.6875,1.3125,-0.375,151,188,discarded,known-vertex-must-be-a-root-reduction-check,"Train fell to 3/8 with the incumbent, and all five failures split into two mechanisms: three ran out of length after botching the reduction (one produced irrational roots, another a quadratic with four-digit coefficients) and never noticed that the reduction was wrong, while one solved the quadratic correctly but then assigned the translated vertex a y-value from the carried displacement instead of from f, putting the point off the graph and yielding a wrong area. The revision therefore adds a cheap, portable validity test on the reduced equation - the known vertex's x must satisfy it, since the degenerate coincident configuration trivially meets every stated condition - which both catches a mis-derived equation immediately and turns the remaining quadratic into a linear read-off, and it makes evaluating f the only sanctioned way to get a new vertex's y."
6,6,26989,149.123,149.133,99c30a3f882f054f77512e4fdca1d19befb3e5426d7d857d52f4369a95c4f820,9c235952e8b7fd3ddd6a3cc542d5b9f1582fddc1b7a0a5acc73c58c7ba7864f2,99c30a3f882f054f77512e4fdca1d19befb3e5426d7d857d52f4369a95c4f820,0.0,0.0,0.0,0.1875,0.1125,-0.075,0.9375,0.5625,-0.375,83,158,discarded,minimal-edit-add-variability-probe-and-arrival-index-conversion,"All 8 of my public rollouts scored 0 again: four asserted the delivery order is deterministically reversed (answering 1 and 0), two assumed uniformity over permutations plus 'each item equally likely to be last' (1/24 and 1/4), one mixed a correct-style branch product for part a with the same uniformity error for part b, and one exhausted its token budget on unstructured enumeration. Four also inverted the pile orientation, equating the bottom of the destination with the last item delivered rather than the first. Rounds 1-5 showed every long rewrite of the 83-token incumbent cost held-out, so this is a minimal edit that keeps the incumbent's wording and inserts only the two clauses the failures demand: a cheap two-sequence variability probe that kills both the forced-outcome and the equally-likely claims, and a position-to-arrival-index conversion before testing the event."
6,7,3836,149.124,149.134,39e2668fb5cca7669288765276aabe0dba01769397daa33b16a9dd7c0174a8f4,276943e411cff53cc8239caa81cd3587d62be37aa5281e06340328bf68e60a7b,39e2668fb5cca7669288765276aabe0dba01769397daa33b16a9dd7c0174a8f4,0.125,0.125,0.0,0.1875,0.1125,-0.075,1.0625,0.6875,-0.375,82,184,discarded,tabulate-rows-vs-columns-first+row-combination-probe+swap-detector,"All 8 rollouts scored 0 (7 hit the 16384-token cap) with the identical root cause seen in rounds 1-5: each read the incumbent's 'linear functional' framing but still built a polynomial whose coefficients are the unknowns and whose argument is the condition number, producing a degree-2005 polynomial with only 2004 roots, then burned the budget resolving that phantom free factor and reported 1/2005, 0, or a harmonic sum; two also declared the system inconsistent from a mis-shaped toy. Since five prior rewordings of the abstract warning all lost heldout accuracy, this revision leads with a concrete row/column tabulation step that makes the swap impossible to commit, states the isolation move as a row combination with an explicit allowed-exponent constraint, and turns 'missing root or inconsistent' into a self-check trigger to rebuild rather than a rabbit hole."
6,8,23443,149.125,149.135,631be8eed5f087f7cdab1dec25cead2e9d0ae8ea0b579379c5e58836f770dc11,67989b2723eaff5614ef892c3094d26aa9a276fd0807a360200c77b6480fc2a8,631be8eed5f087f7cdab1dec25cead2e9d0ae8ea0b579379c5e58836f770dc11,0.625,1.0,0.375,0.2125,0.0625,-0.15,1.6875,1.3125,-0.375,169,190,discarded,add-gcd-1-maximality-certificate,"6/8 public rollouts were correct; both failures shared one mode and it was not arithmetic - they equated the stated group count with the unit count, divided every listed total by it, saw each quotient come out whole, and treated that as confirmation, so the gcd/maximum-count step was never run. The incumbent already says group wording only imposes a multiple constraint, but it gives no way to detect that a passing candidate is non-maximal, and round 5 showed that merely front-loading that warning costs heldout (0.2125 down to 0.1125). So I kept the incumbent's order and length and added a concrete portable maximality test: after dividing by the candidate N the per-unit shares must have no remaining common factor, and any shared factor k means kN is also admissible."
