round,hint_id,train_qid,sampling_slurm_job_id,proposal_eval_slurm_job_id,incumbent_hash,proposal_hash,final_hash,old_train,new_train,delta_train,old_heldout,new_heldout,delta_heldout,old_J,new_J,delta_J,old_tokens,new_tokens,decision,mutation,subagent_summary
8,8,23443,149.165,149.175,631be8eed5f087f7cdab1dec25cead2e9d0ae8ea0b579379c5e58836f770dc11,a4a170b281a9552c335bee350351250c6757b4fdb470b93211e9c5fe5839c7c2,631be8eed5f087f7cdab1dec25cead2e9d0ae8ea0b579379c5e58836f770dc11,0.625,1.0,0.375,0.2125,0.1375,-0.07499999999999998,1.6875,1.6875,0.0,169,190,discarded,swap-dead-commute-clause-for-percentage-base-discipline,"6/8 public rollouts were correct; both failures shared the known mode, silently equating the stated group count with the unit count, confirming divisibility, and never invoking gcd or maximality at all. Rounds 5, 6 and 7 each attacked exactly that mode with more divisibility apparatus (front-loaded warning, maximality certificate, quantity-labelling) and every one raised train while collapsing heldout from 0.2125 to 0.1125, 0.0625 and 0.125, so with lambda=5 adding more anti-substitution machinery is a demonstrated loss. I therefore left the incumbent's spine and ordering untouched and spent the budget on dead weight instead: no correct rollout ever used the 'scaling and dividing commute' clause, so I replaced it with a portable percentage-base discipline (markup on cost multiplies by 1+p, whereas a percentage of the selling price or final total requires division), which is a distinct and common failure source on unseen percent word problems."
8,9,3980,149.166,149.176,a6b899fe065325aa4eb8aa78affd24badba40d6f15d870876bab02f9a3c2d5fd,3e5130251127f1cdd38d0a1bb8dd4fb0acfb2a10ba7588ffd823b20e7a983801,3e5130251127f1cdd38d0a1bb8dd4fb0acfb2a10ba7588ffd823b20e7a983801,1.0,1.0,0.0,0.1875,0.2,0.012500000000000011,1.9375,2.0,0.0625,189,189,kept,add-parameter-count-closure-rule-for-auto-satisfied-identity,"All 8 public rollouts were correct again (8/8, 3.1k-6.5k tokens, none truncated), so the training question stays saturated and every remaining point is transfer. The uniform new waste is that once the centered ansatz is substituted the composition identity becomes a tautology, and rollouts misread this as the constraints being insufficient: they relitigate uniqueness (3-6 'unique' passes each) and one spends ~2k tokens arguing the family is underdetermined with infinitely many solutions before recovering. This revision keeps the proven trigger, centered ansatz, factored both-branch condition, symmetric-combination rule and verification spine and adds only a portable closure rule - an auto-satisfied identity is expected, so compare the family's free parameters to the independent given conditions instead of doubting uniqueness."
8,10,3843,149.167,149.177,ce69be40ed567eba12a96f0a63ea1462e4b13c7ba9b4265dd1382a154fe82da4,28180ceeca5e342776b5ecb5f933c2a332d032a32a288f92a6f21f85426e5ab6,ce69be40ed567eba12a96f0a63ea1462e4b13c7ba9b4265dd1382a154fe82da4,0.75,0.25,-0.5,0.1375,0.15,0.012499999999999983,1.4375,1.0,-0.4375,181,190,discarded,index-overlap-test-kills-disjoint-transposition-order-2,"Only 2/8 rollouts were correct; three failures that terminated all answered 2 by asserting one switcheroo is a product of disjoint transpositions (they literally wrote block-swap cycle products with non-overlapping index sets) and never applied the full loop twice to check, while another mislabelled each sub-step as a separate application before drifting to a different closed form. The revision adds a cheap structural falsifier the incumbent lacks -- write down the index set each sub-step touches and observe they share indices, so the composite cannot be independent swaps of order 2 -- and reinforces the application boundary by recording state only after each complete loop."
9,1,28054,149.178,149.188,201354a92ede8d8aac1cb60ea727c71fda8c2a78ad6bed1e1f28858eb6defeef,98258c0a96374547989ea0f726615dab9ba0a82877767e1bac5dcaca924b344f,201354a92ede8d8aac1cb60ea727c71fda8c2a78ad6bed1e1f28858eb6defeef,0.125,0.0,-0.125,0.2125,0.175,-0.037500000000000006,1.1875,0.875,-0.3125,147,177,discarded,symbolic-conditions-single-pass-no-restart,"With the incumbent hint 1/8 rollouts scored 1 (execution 149.178) and 7 of 8 hit finish_reason=length at the 16384-token cap, so the dominant failure is non-termination, not a missing concept: the failures re-derived 'but the speaker could just subtract/divide, so this case is impossible', restarted the same two-case enumeration many times, and either ran out of tokens or gave up and boxed a plausible factor. The revision states outright that a speaker's own value pinning the partner under one fixed option is not a contradiction, converts 'I don't know' into a reusable condition on the speaker's value that later speakers intersect, and asks for one symbolic forward pass with an explicit ban on restarting, which targets the loop that consumed seven rollouts."
9,2,30302,149.179,149.189,59b3d8b787e142b5557010de60e2aaf179f67e91a57adadbbb61e6f1a74bd7e2,e7669775a83269444fc85314c12adae557ae8b65af5783c96661c5bae63c0003,59b3d8b787e142b5557010de60e2aaf179f67e91a57adadbbb61e6f1a74bd7e2,1.0,1.0,0.0,0.1875,0.15,-0.037500000000000006,1.9375,1.75,-0.1875,190,189,discarded,exponent-match-k-and-verify-against-original-equation,"7 of 8 round-9 rollouts scored 1; the single failure took the 6th root of 64 as 4 (treating 64 as 4^3) and then ran the incumbent's coordinate route flawlessly on the wrong ratio, producing a clean self-consistent circle. Critically it did spot-check points, but only against its own derived condition, so the check confirmed the error instead of catching it; several correct rollouts also burned tokens re-deriving individual roots. The revision therefore keeps the kept round-7 coordinate route and adds two portable guards: fix k by matching exponents and confirming k^n = |c| by multiplying out, and require any verification to return to the original equation rather than the derived modulus condition."
9,3,8554,149.180,149.190,fb51b21593ed905cd5a002358e62f833d6da9e1c02aa884460885af4ac2cb21a,e5c09246e3ccfc2e63903c52b94f6ed100e8cd5f9ca4fc360ebec8c05fbcce77,fb51b21593ed905cd5a002358e62f833d6da9e1c02aa884460885af4ac2cb21a,0.75,0.625,-0.125,0.175,0.1875,0.012500000000000011,1.625,1.5625,-0.0625,194,190,discarded,add-strictly-positive-overlap-floor-and-inequality-sign-check,"Training fell to 3/8 and the failure mode flipped from the containment error the incumbent was built to block: four of five failures now argue the overlap is ZERO (one committed the summed-areas answer outright, others derived disjointness from wrongly-signed edge inequalities or from a center-to-side distance exceeding the small shape's half-width), and the fifth burned the token cap on an unclosed tangency search. The incumbent only forbids overlap = all of S, giving no lower floor, so this revision adds the local argument that a corner at an interior point covers a positive-angle wedge of a surrounding set (so overlap cannot be zero or a single point) plus a cheap sign-orientation check for edge inequalities, which is the concrete step that produced the spurious disjointness."
9,4,25003,149.181,149.191,21192c6cb98688e15ec795c973c5e96f06d4ded5712476e931bff9c904fae453,e609be06d51136a9b15f97051f120800ef345cec17e42f13c14884b22ba71163,21192c6cb98688e15ec795c973c5e96f06d4ded5712476e931bff9c904fae453,0.875,0.625,-0.25,0.125,0.1375,0.012500000000000011,1.5,1.3125,-0.1875,189,194,discarded,index-by-function-not-by-term,"My 8 public rollouts with the incumbent scored 7/8; the lone failure terminated normally, not by truncation, and it had already restated the partition advice before discarding it. It set P_k as the polynomial used for term k, so reuse was notationally impossible, then chained P_{k+1}(x_{k+1}) - P_k(x_k) = d, concluded consecutive polynomials differ by a constant hence each is usable once, and reported N. The revision keeps the incumbent's proven skeleton and adds the one missing notational rule - never index a function by the term index; a function owns a set of indices - and names the bijection trap that adjacent chaining creates."
9,5,30418,149.182,149.192,bf462b403f17cd428257353852dc46039314abb29f7a1232a8b7b962384878f2,85f213d578062adcf883b7f1f27d6adaf1b87fd1ff0c18c817da13cc0a477ef6,85f213d578062adcf883b7f1f27d6adaf1b87fd1ff0c18c817da13cc0a477ef6,1.0,0.75,-0.25,0.1375,0.2,0.0625,1.6875,1.75,0.0625,151,193,kept,normalize-fractional-base-plus-degenerate-root-validity-test,"Train fell to 3/8, and all five failures reduce to one mechanism applied at three different stages: reading log_{1/2} u = y as argument = 2^y instead of 2^{-y}. One botched the parameter fit that way, two botched the reduction factor (yielding a negative discriminant and an irrational quadratic, then thrashing to the length cap), and two reduced correctly but read a vertex's y with the sign flipped and reported an area from an off-graph point. The revision kills the direction trap at its source with the base identity plus an explicit large-argument-for-negative-y check, and adds the free degenerate-root test, which I confirmed evaluates to zero on the one correct reduction and to nonzero on both botched ones, so it catches exactly the failing traces before they burn their budget."
9,6,26989,149.183,149.193,466facab1208fc7a47986ab237293f5be9ec980670b8f43f1612be39eae83ed6,d8745e059c3f28cc7a9c6f3b1107936bdc4745f7c2c15646c6c84ebef4bab40a,466facab1208fc7a47986ab237293f5be9ec980670b8f43f1612be39eae83ed6,0.0,0.0,0.0,0.2125,0.15,-0.0625,1.0625,0.75,-0.3125,91,156,discarded,replace-uniformity-ban-with-smallest-case-falsification-test,"All 8 rollouts scored 0 and seven of them explicitly asserted the final order is a uniformly random permutation, then read the answers straight off that model (1/24 and 1/4); the eighth spent its whole budget on unstructured case work without committing. The incumbent already forbids symmetry claims in words, and rounds 1-8 show that adding more bans or structural facts only lengthened the hint and cost held-out, so this revision keeps the incumbent's pricing mechanism and swaps the passive ban for an active falsification step: enumerate the smallest instance by hand and check the uniform model against it before using it."
9,7,3836,149.184,149.194,b2a22f64742db6de717ce4677f47425adbfad7620c3372bf9f96e9c222adbfaa,db00fc03a1569199b36842a218a6387611b0e688e66fd6d7f73925837d21649d,b2a22f64742db6de717ce4677f47425adbfad7620c3372bf9f96e9c222adbfaa,0.75,0.25,-0.5,0.075,0.0875,0.012499999999999997,1.125,0.6875,-0.4375,186,188,discarded,generalize-pattern-menu+terminate-on-first-verified-fit+ban-named-theorem-guess,"My 8 rollouts scored 4/8 and every success came from the ladder: solve n=2,3,4 by elimination, fit a signed reciprocal-factorial form, substitute the real size. The four failures split into one that skipped small cases entirely and guessed from a named 'moment theory' framing, two that abandoned a working ladder for a polynomial-coefficient framing and burned the token cap in self-contradiction loops, and one that had a fully verified closed form yet kept re-deriving until it hit the cap without emitting an answer. So this revision replaces the question-specific 'expect factorial growth' cue with a short menu of standard closed-form families (better transfer at lambda=5), adds an explicit stop-and-box trigger at first verified fit, and localizes any disagreement to the toy's arithmetic instead of a rebuild."
9,8,23443,149.185,149.195,631be8eed5f087f7cdab1dec25cead2e9d0ae8ea0b579379c5e58836f770dc11,658d14a77fab3f1b24022e2e567a31a203e5d0e5e043320a7ecf4315f1a0abd1,631be8eed5f087f7cdab1dec25cead2e9d0ae8ea0b579379c5e58836f770dc11,0.625,0.875,0.25,0.2125,0.075,-0.1375,1.6875,1.25,-0.4375,169,190,discarded,compute-gcd-not-eyeball-plus-verify-max-selection,"5/8 public rollouts were correct. Two failures showed the known substitution mode (took the stated group count as the unit count, saw every total divide evenly, and never invoked gcd), but the third failed differently and revealingly: it correctly enumerated candidate counts including the gcd, then in its own maximum-selection step named a smaller listed candidate as the maximum and answered from it. Since rounds 5-8 showed that adding more anti-substitution apparatus collapses heldout (0.2125 down to 0.1125/0.0625/0.125/0.1375), I kept the incumbent spine and ordering intact and spent the budget on the unused commute clause, replacing it with a portable selection discipline: compute the gcd by successive pairwise gcd instead of eyeballing a divisor list, and if candidates are enumerated, verify the kept one is a multiple of all others."
9,9,3980,149.186,149.196,3e5130251127f1cdd38d0a1bb8dd4fb0acfb2a10ba7588ffd823b20e7a983801,265e6b1e4b5fdb2465348a3002d260456fbe9b4106bde164384df468147520bf,3e5130251127f1cdd38d0a1bb8dd4fb0acfb2a10ba7588ffd823b20e7a983801,1.0,1.0,0.0,0.2,0.1125,-0.08750000000000001,2.0,1.5625,-0.4375,189,193,discarded,add-composition-exponent-audit-via-ab-swap-symmetry,"All 8 public rollouts were correct (8/8, 4.1k-9.1k tokens, none truncated), so the training question stays saturated and every remaining point is transfer. The one rollout that cost 9.1k tokens - roughly double the median - botched the composition step itself, substituting the outer coefficient into the wrong slot so it produced a lopsided relation whose exponents were not an A<->B swap, then spent thousands of tokens solving that corrupted relation, integer-guessing the center, and only recovered by accident. This revision keeps the proven trigger, centered ansatz, factored both-branch condition, parameter-count closure and symmetric-combination rule and adds only a portable composition rule (raise the inner offset, not the outer coefficient) plus a cheap swap-symmetry audit that catches a mis-raised exponent before any algebra is spent on it."
9,10,3843,149.187,149.197,ce69be40ed567eba12a96f0a63ea1462e4b13c7ba9b4265dd1382a154fe82da4,add5510a111ac924699a0bd97f9132912ea804d1b03680af83561778d95d181c,ce69be40ed567eba12a96f0a63ea1462e4b13c7ba9b4265dd1382a154fe82da4,0.75,0.5,-0.25,0.1375,0.1375,0.0,1.4375,1.1875,-0.25,181,181,discarded,block-swap-plus-or-minus-L-index-rule-then-commit,"2/8 correct and all six failures ended at the 16384-token cap without committing an answer. The shared mechanical fault is the block swap: rollouts tracking an index through the sub-steps dropped or mis-shifted the earlier swaps (one wrote that an index stayed fixed under a swap that must move it, another effectively kept only the final sub-step), producing a composite of disjoint 2-cycles that contradicted their own state simulation, after which they thrashed between mutually inconsistent per-size counts. The revision states the exact +/-L offset-preserving shift and that it must be applied to the index currently held, and replaces the incumbent's open-ended redo instruction with reject-the-formula-not-the-simulation plus box-it-immediately so the budget is not burned."
10,1,28054,149.198,149.208,201354a92ede8d8aac1cb60ea727c71fda8c2a78ad6bed1e1f28858eb6defeef,289fc65da74cf0c66c5db0ccd20a54ee61c5be590ac064d63aa7e2f6a2b058a3,201354a92ede8d8aac1cb60ea727c71fda8c2a78ad6bed1e1f28858eb6defeef,0.125,0.0,-0.125,0.2125,0.175,-0.037500000000000006,1.1875,0.875,-0.3125,147,190,discarded,propagate-announcement-to-partner-coordinate-plus-single-sweep,"With the incumbent hint only 1/8 rollouts scored 1 and all seven failures hit finish_reason=length at the 16384-token cap (execution 149.198), so non-termination is the dominant failure: each one re-derived ""but that speaker could just subtract or divide, so this reading is impossible"", restarted the same two-reading enumeration, and either exhausted tokens or boxed an unjustified factor. The revision states explicitly that a private value pinning the partner under one fixed structural choice is not a contradiction, adds the mechanism the failures skipped of applying each announcement to the partner coordinate of surviving scenarios rather than only to the speaker's own value, and imposes a build-once/sweep-once budget rule with an explicit ban on restarting."
10,2,30302,149.199,149.209,59b3d8b787e142b5557010de60e2aaf179f67e91a57adadbbb61e6f1a74bd7e2,119e6c8839791946dfce05347bdc35c3bcdd9e51099a89789d386e1b5b150c8e,59b3d8b787e142b5557010de60e2aaf179f67e91a57adadbbb61e6f1a74bd7e2,1.0,1.0,0.0,0.1875,0.1875,0.0,1.9375,1.9375,0.0,190,190,discarded,general-conic-coefficient-formula-replaces-completing-the-square,"All 8 round-10 rollouts scored 1 (2999-6016 tokens), so training is saturated and the loss is transfer plus token waste: every rollout reached the modulus ratio early, but the two longest (6016 and 5918 tokens, 12-14 hedges) burned their middle halves on the completing-the-square bookkeeping the incumbent prescribes and on a self-inflicted crisis from evaluating the center point against the locus and concluding the circle was wrong. The incumbent already forbids the sign-error-prone endpoint shortcut but leaves completing the square as a multi-step manual reduction, so this revision replaces it with the portable general-conic reading (A, B, C, D to center and radius with |A|), which is constant-work, sign-safe on any such locus, and diagnoses the line case by A = 0, and it states plainly that the center is not on the locus so spot-checks never land there."
10,3,8554,149.200,149.210,fb51b21593ed905cd5a002358e62f833d6da9e1c02aa884460885af4ac2cb21a,241663f940cdcbb94cae17260a498a09abd97fac29741a85a1f665c493d3bc6b,fb51b21593ed905cd5a002358e62f833d6da9e1c02aa884460885af4ac2cb21a,0.75,0.625,-0.125,0.175,0.1875,0.012500000000000011,1.625,1.5625,-0.0625,194,194,discarded,far-edges-out-of-range-so-cover-is-just-the-wedge,"Training scored 3/8 and all five failures ended at the 16384-token cap rather than on a committed wrong answer; each burned its budget building the rotated big square's far vertices and edge lines (repeatedly deriving side vectors and lines like y=-x+2*sqrt(2)), then testing distances and tangency against them, and one had already reached the right union before losing it in that search. The incumbent asserts a corner covers only a wedge but gives no license to discard the other edges, so the student keeps carrying them. This revision supplies the checkable range condition (the non-adjacent edges lie a full side length from the corner, beyond the farthest point of S, so they cannot cut it) which collapses the cover to two signed linear tests and removes the vertex/tangency computation that consumed every failure."
10,4,25003,149.201,149.211,21192c6cb98688e15ec795c973c5e96f06d4ded5712476e931bff9c904fae453,cfd221f96601c768c674155cae1b1bf5da8ceab825508c5ae2c116994550bf59,cfd221f96601c768c674155cae1b1bf5da8ceab825508c5ae2c116994550bf59,0.875,0.75,-0.125,0.125,0.1625,0.037500000000000006,1.5,1.5625,0.0625,189,193,kept,explicit-T-plus-c-times-product-tightness-device,"My 8 public rollouts with the incumbent scored 6/8 and both failures were token-cap truncations, not wrong answers; each had already accepted the N x deg P bound and then stalled on the tightness step. Both looped on the same false obstruction, demanding that a single function's own values across its block themselves step by the progression's difference and concluding the function 'would have to be linear, which it isn't', so they discarded the construction and restarted. The revision keeps the proven bound skeleton verbatim but replaces the vague 'interpolate, free coefficients remain' clause with the explicit portable device P = T + c times the product of (x - n_j) over the block's d indices, which visibly keeps full degree while agreeing with the target exactly there."
10,5,30418,149.202,149.212,85f213d578062adcf883b7f1f27d6adaf1b87fd1ff0c18c817da13cc0a477ef6,9579cace08af3b27af893515979d4bdc68eb33ee73b60baabc07fb80b01be330,85f213d578062adcf883b7f1f27d6adaf1b87fd1ff0c18c817da13cc0a477ef6,0.75,0.5,-0.25,0.2,0.1625,-0.037500000000000006,1.75,1.3125,-0.4375,193,197,discarded,add-inverse-log-read-rule-and-argument-magnitude-check,"7/8 rollouts correct; the single failure did the whole pipeline right and died on one step, evaluating the recovered vertex height by rewriting the small argument as a power of the reciprocal base and copying that exponent, so it got a height of the wrong sign and an area from an off-graph point. All seven correct rollouts instead matched the argument to a power of the base as literally written (one visibly caught itself mid-slip), so the revision adds that inverse-direction read rule plus an argument-magnitude sign check, since the incumbent only covered the forward height-to-argument direction."
10,6,26989,149.203,149.213,466facab1208fc7a47986ab237293f5be9ec980670b8f43f1612be39eae83ed6,69c3d8421ef18a1390f89484b73fd3d076f565551bdb5e4b0d7a7270d9c9300e,466facab1208fc7a47986ab237293f5be9ec980670b8f43f1612be39eae83ed6,0.0,0.0,0.0,0.2125,0.125,-0.0875,1.0625,0.625,-0.4375,91,158,discarded,shortest-deciding-prefix-plus-reuse-same-method-per-part,"My 8 rollouts scored 1/8: five reached 1/8 on part a by counting free binary steps but then abandoned that mechanism for part b, substituting an equally-likely-position shortcut (1/4) or a single lone 1/2, and two instead claimed the outcome is forced. So the incumbent's pricing rule is usable but the students drop it mid-problem and never bound the run they need to control. The revision names the shortest deciding prefix as the object to price, notes that later steps cost nothing, and demands the same procedure be reused on every sub-question."
