round,hint_id,train_qid,sampling_slurm_job_id,proposal_eval_slurm_job_id,incumbent_hash,proposal_hash,final_hash,old_train,new_train,delta_train,old_heldout,new_heldout,delta_heldout,old_J,new_J,delta_J,old_tokens,new_tokens,decision,mutation,subagent_summary
4,8,23443,150.82,150.90,149cabea90724683bc818e06d11bef6dc0c07209cfe1b68f2300dc838be4613d,63b3a9fe36af68021b3a687f112ab4f8fc6cc03d9e123b50064e9677527ee0a9,149cabea90724683bc818e06d11bef6dc0c07209cfe1b68f2300dc838be4613d,1.0,1.0,0.0,0.1625,0.1125,-0.05,1.325,1.225,-0.09999999999999987,77,112,discarded,prepend one-sentence per-unit-vs-total scope-labeling opener to the verbatim incumbent and gloss the markup as an explicit (1+p/100) multiplier,"All 8 fresh rollouts scored reward 1 with clean stops at 2.7-5.6k tokens, so train_i is saturated at 1.0 and every remaining gain must come from transfer. The rollouts still burn their first 1-2k tokens oscillating over whether each listed figure is a per-unit amount or a whole-collection total before any arithmetic starts, and the scope-labeling opener is the one mutation whose earlier trial coincided with the best transfer score seen so far, so I add exactly that sentence plus an explicit percent-as-multiplier gloss while leaving the incumbent's train-preserving sentences untouched, since the two prior wholesale rewrites each collapsed train."
4,9,3980,150.80,150.91,3bc4a8fb988c1eb05c38ceb4f4bd0bb3b1f52a692bff540b0be46ed42b51bd06,652ee8dc58008e69bb7e90163e071e0708bc579422e2fd3d5a546ca1fb63ccad,652ee8dc58008e69bb7e90163e071e0708bc579422e2fd3d5a546ca1fb63ccad,0.625,1.0,0.375,0.2375,0.25,0.012500000000000011,1.1,1.5,0.3999999999999999,172,180,kept,"force the opposite-sign centered branch with no extra offset, and make the add-the-two-values step a cancellation check that must yield a linear center equation, treating a quadratic/irrational center as a sign bug","Six of eight fresh rollouts were correct, all finishing under 13k tokens by committing early to a single shared-center antisymmetric pair and solving the two given values by adding and subtracting them; both failures ran to the 16384-token cap after mis-parameterizing that ansatz - one carried separate centers/offsets and derived a quadratic for the center with irrational roots, then abandoned the structure for full expansion of the composition, and the other explored inverse/same-sign variants and coefficient matching before ever fixing the signs. The revision therefore pins the exact centered form to use, forbids extra offsets and same-sign branches, and reframes the add-the-two-values step as a cancellation check whose failure signals a sign error to repair in place rather than a cue to expand."
4,10,3843,150.81,150.92,ae55ce3989859ea6f512c3e2c3fa5c48cffc4b29cf1ba69ccbf46e955fbe0f0d,dd96dfb992052dea62ab2214a4d147f14aa95c0c6f35b1224c4d06d84cf346cb,dd96dfb992052dea62ab2214a4d147f14aa95c0c6f35b1224c4d06d84cf346cb,0.25,0.625,0.375,0.2,0.1625,-0.037500000000000006,0.65,0.95,0.29999999999999993,148,178,kept,"add bijection self-check on hand-built maps and rule that a piecewise split contradicting the clean small-case pattern means a mis-traced case, not a real split","3 of 8 rollouts were correct; all 5 failures hit the 16384-token cap, and every one of them first got the two smallest cases right, then mis-traced the next-larger case into a claimed period of 2 and spent the rest of the budget oscillating over a piecewise formula it knew could not be the intended single expression. Two of those traces were visibly non-bijective (an element with two images, absurd cycle lengths), which the student read as exotic structure instead of bookkeeping error. The revision therefore keeps the concrete rewrite-the-row discipline but adds a bijection self-check and an explicit rule to distrust the odd larger case rather than the clean pattern, so the student resolves the contradiction and commits instead of looping."
5,1,28054,150.93,150.103,cbbaaafa1907efc60835e2a44f805271c9a2f4cd4fe5d3988c244caa7b7e5f7b,51faa7632c7e8f5853c2b20a4d3332a54596c42d31b943d30dce3968485c5180,cbbaaafa1907efc60835e2a44f805271c9a2f4cd4fe5d3988c244caa7b7e5f7b,0.25,0.25,0.0,0.1375,0.125,-0.012500000000000011,0.525,0.5,-0.025000000000000022,144,168,discarded,separate the candidate list per reading (divisors vs all smaller values) and force a check of symmetric/extremal candidates,"Fresh sampling with the incumbent hint scored 0/8 with 5 of 8 truncating at the token cap; every rollout built only the divisor pairs of the displayed number and then applied that same divisor list to the sum reading, so both readings looked contradictory and the student either looped re-deriving the same two cases or emitted a divisor it had already refuted. The incumbent flags label ambiguity but never says each reading induces a different candidate list, and it never prompts the symmetric or extremal candidate that a divisor enumeration cannot reach, so I added both plus a stricter no-restart rule."
5,2,30302,150.94,150.104,64b0f516c4150af456f05fd043eae6476f571e240a578af063256e2ea28e9e9a,572d8aeebd5773637ec29e532a817266a1c0181d6878a6e069c76dda6d68e1d5,64b0f516c4150af456f05fd043eae6476f571e240a578af063256e2ea28e9e9a,1.0,0.875,-0.125,0.175,0.1125,-0.062499999999999986,1.35,1.1,-0.25,155,181,discarded,"make the spot-check itself robust: evaluate sample points via modulus identities, and on conflict test a second instance rather than re-auditing the derivation","Seven of eight fresh rollouts were correct in 5.7k-9.1k tokens; the lone failure reached the correct locus equation quickly, then mis-evaluated one sample point (a dropped reciprocal/sign when inverting the map), and because the incumbent told it to recheck that one line it re-audited the same correct derivation roughly sixty times and burned the full 16384-token cap without ever committing a result. So the incumbent's no-restart rule fires but sends the student into a self-audit loop; I therefore make the check cheap and self-correcting (use modulus identities to evaluate an instance, and on conflict test a different instance instead of re-reading the derivation, since two agreeing instances outweigh one disagreeing one) and move the commit instruction ahead of all checking."
5,3,8554,150.95,150.105,e73c55e27100ae936358bb7823761096f52d3e52bbb1bf81a9e7298441eeb331,8f25577e4683f930be12d1eb38b0fb5e52a35602b299f74b854e1be8798d9a3b,e73c55e27100ae936358bb7823761096f52d3e52bbb1bf81a9e7298441eeb331,0.5,0.5,0.0,0.2,0.1375,-0.0625,0.9,0.775,-0.125,131,141,discarded,"add output-budget discipline: lead the visible reply with the result, ban restating the setup after reasoning closes","Four of eight rollouts scored; all eight reached the correct value early (within the first ~9k of ~55-62k characters), so the incumbent's containment and symmetry advice is working and is kept. The decisive new detail is that three of the four failures did close the reasoning block but then spent every remaining token re-introducing the setup, redefining coordinates and re-deriving the union identity, and were truncated before emitting any result; so this revision reallocates tokens from the wedge wording to an explicit short-output rule that puts the result on the first visible line and forbids restating the problem afterwards."
5,4,25003,150.96,150.106,40644c5ad3884d8dd2e32629b2968c787adfe9e53d2fb9166561d803c1e485f1,b270c73527d105efeee7a8d7a478c823ba0b83fcdb78c2ef9eec3f0252863353,40644c5ad3884d8dd2e32629b2968c787adfe9e53d2fb9166561d803c1e485f1,0.625,0.375,-0.25,0.1625,0.1875,0.024999999999999994,0.95,0.75,-0.19999999999999996,189,187,discarded,state that pieces are reusable so the piece count is never the cap; disambiguate residual-vanishing from the progression's own step,"The incumbent scored only 2 of 8 fresh rollouts (train_i=0.25), well below its 0.625 last round, so the signal is high-variance. The dominant failure, in 4 of the 8, was answering the number of available objects: each rollout insisted every progression term needs its own distinct polynomial, and one further collapsed the summed per-object budget back to a single residual's root count. The revision therefore declares pieces reusable and reserves the word difference for the progression's step, naming the residual separately."
5,5,30418,150.97,150.107,83c896bc82082c6ed4cb8791f9d2a555f90a25b05e0dc438a5532b3b8a6282c8,a886215a89b379b97607624fc787296ad177d6a8d1060dc531812253522f7da8,83c896bc82082c6ed4cb8791f9d2a555f90a25b05e0dc438a5532b3b8a6282c8,0.875,0.625,-0.25,0.175,0.1625,-0.012499999999999983,1.225,0.95,-0.27500000000000013,63,133,discarded,"target sign/factor slips in the elimination step with numeric back-substitution and a redo-that-step-only rule, plus shared-vertex cross product for area","Only three of eight fresh rollouts were correct: three died at the 16384-token cap still mid-elimination, one mangled a sign while moving the constant across the logarithm and then declared the system unsolvable before asserting an invented area, and one solved a wrongly cross-multiplied quadratic, took the extraneous root, and then applied the shoelace formula to a self-intersecting vertex order. The incumbent asks for verification by a second method but never says what to verify, so I made the check concrete (numerically substitute each candidate root into the original conditions), localized the retry to the failing elimination step instead of a full restart, and replaced the ambiguous area step with a cross product of two edge vectors from a shared vertex."
5,6,26989,150.98,150.108,45b2c0df517f87901f5a1ad921b228f3059ad2ca08158d9c5eb6939a11ecf4b4,da6322f1cc58c1ba4ef1d57de6c1838c3873ee3b6607f96014dad2692c6159df,45b2c0df517f87901f5a1ad921b228f3059ad2ca08158d9c5eb6939a11ecf4b4,0.125,0.0,-0.125,0.2125,0.2125,0.0,0.55,0.425,-0.12500000000000006,200,199,discarded,replace the first-vs-last hedge with the concrete LIFO orientation fact (a pile's bottom is its earliest arrival) and forbid reading 'bottom' as 'moved last',"Fresh sampling with the incumbent scored 0/8; six rollouts terminated normally at 11k-15k tokens and two hit the cap while relitigating, so length is secondary. Every failure on the second part came from one shared root cause: the rollouts equated the requested bottom slot with 'the item moved last' and then priced that event by an asserted uniform draw (1/n, 1/(n-1)) or by dividing a permutation count by a branch count, while two more collapsed the whole process to certainty. The revision therefore replaces the incumbent's vague 'FIRST or LAST arrival' hedge with the explicit last-in-first-out orientation rule, bans the 'bottom means moved last' reading, and keeps the free-versus-forced 1/2 accounting that transferred best in earlier rounds while naming 1/2^(all moves) as an additional wrong denominator."
5,7,3836,150.99,150.109,970826b6d808a016748fe1e6cda39b71098679265ead772ffa8f52eeb6eaed54,212ae3ed4e3da095f15cd1f79f5d91ef37a8189ca056cf0528bb7c0566837b66,970826b6d808a016748fe1e6cda39b71098679265ead772ffa8f52eeb6eaed54,0.25,0.125,-0.125,0.1125,0.1125,0.0,0.475,0.35,-0.125,132,137,discarded,add index-vs-exponent representation check and a substitute-once no-re-solve rule,"Fresh sampling scored 2 of 8 and all six failures hit the 16384-token cap. Every one of them died the same way: after solving a tiny case they recast the problem as a polynomial, silently swapped which variable was the summation index and which was the exponent, discovered the mismatch, and then spent thousands of tokens oscillating between the two readings and re-solving the same 3x3 system with different arithmetic each pass. The revision therefore front-loads an explicit index-versus-exponent check on the smallest case before any reinterpretation and replaces open-ended re-derivation with a single substitute-back verification that closes the case."
5,8,23443,150.102,150.110,149cabea90724683bc818e06d11bef6dc0c07209cfe1b68f2300dc838be4613d,bd8c43666474bc6f0a067640511b581b50c287ce73e50167bdaf63e3cf511d88,149cabea90724683bc818e06d11bef6dc0c07209cfe1b68f2300dc838be4613d,1.0,0.375,-0.625,0.1625,0.175,0.012499999999999983,1.325,0.725,-0.6,77,81,discarded,"compress rather than extend: recast the divisibility scaffold in unit-generic wording at incumbent length, naming gcd inline and replacing the vague integrality/units clause with multiply-back plus early bare-number commitment","All 8 fresh rollouts scored reward 1 with clean stops at 10-16k characters, so train_i stays saturated at 1.0 and every point of gain must come from transfer. Every prior proposal for this hint grew the text (112-138 tokens) and every one lost transfer ground, while the rollouts still spend 20-70 restatements per trace re-litigating per-unit versus whole-collection scope and 13-23 restatements circling the gcd, so this round tests the opposite axis: same 81-token budget as the incumbent, unit-generic nouns so the scaffold applies beyond this setting, gcd named inline, and a decide-once plus multiply-back plus commit-to-a-bare-number close in place of the vague integrality-and-units clause."
5,9,3980,150.100,150.111,652ee8dc58008e69bb7e90163e071e0708bc579422e2fd3d5a546ca1fb63ccad,36a9ce529320c4e27a4e0a83b56bc39018e2ec01d1109e42b02d457b5567d950,652ee8dc58008e69bb7e90163e071e0708bc579422e2fd3d5a546ca1fb63ccad,1.0,0.875,-0.125,0.25,0.175,-0.07500000000000001,1.5,1.225,-0.2749999999999999,180,182,discarded,immunize the centered family against self-inflicted sign/parity objections and treat a degenerate center as an arithmetic slip to redo in place rather than a cue to abandon the ansatz,"Seven of eight fresh rollouts were correct, all finishing under 13k tokens by adopting the shared-center antisymmetric pair and solving the two given values by sum and difference; the single failure ran to the 16384-token cap after reaching that exact ansatz twice, then discarding it because it mis-added the two given values into a degenerate center and separately convinced itself the inner-plus-outer sign parity forbade odd k, after which it fell back to naming coefficients and expanding the degree-nine composition. The revision therefore pre-refutes the parity objection by noting both compositions reduce to the same form, and reclassifies a degenerate or value-clashing center as a one-line arithmetic slip to repair in place instead of grounds to change methods."
5,10,3843,150.101,150.112,dd96dfb992052dea62ab2214a4d147f14aa95c0c6f35b1224c4d06d84cf346cb,7b8324d5ceaa0cfee314c71edfe10b629143432eb4c46496000fd2642412e289,dd96dfb992052dea62ab2214a4d147f14aa95c0c6f35b1224c4d06d84cf346cb,0.625,0.25,-0.375,0.1625,0.175,0.012499999999999983,0.95,0.6,-0.35,178,166,discarded,"forbid untraced cycle-structure period claims, make refuted periods permanently discarded, and require the closed form to fit the smallest verified count so off-by-one exponents get corrected instead of relitigated","Only 1 of 8 rollouts scored; 6 hit the 16384-token cap and one filled its budget with a literally repeating sentence. The shared mechanism was asserting a period from unverified cycle-structure narration, then re-raising the same refuted candidate dozens of times and settling on an off-by-one exponent that contradicted its own smallest verified case. The revision therefore bans untraced period claims, forces refuted candidates to stay discarded, and makes disagreement with the smallest verified count diagnose an exponent slip in the formula rather than reopen the case."
6,1,28054,150.114,150.124,cbbaaafa1907efc60835e2a44f805271c9a2f4cd4fe5d3988c244caa7b7e5f7b,8e11c7f00b42bfc6977b278336ccf5c7012d79da8279ebc0fd74472abfb81a24,cbbaaafa1907efc60835e2a44f805271c9a2f4cd4fe5d3988c244caa7b7e5f7b,0.25,0.0,-0.25,0.1375,0.2,0.0625,0.525,0.4,-0.125,144,161,discarded,recast contradictions as branch-eliminating deductions and ban selecting a candidate on plausibility instead of checked conditions,"Fresh sampling with the incumbent hint scored 0/8, with 3 of 8 truncating at the token cap; every rollout enumerated the divisor pairs of the displayed number, correctly noticed that a speaker's own value pins the partner within one reading, then treated the resulting contradiction as a broken problem and either looped re-deriving the same cases until truncation or selected the most compound-looking divisor purely because it 'fits the logic' without checking a single condition. The incumbent already names the label ambiguity but never tells the student that a contradiction eliminates one branch or assumption rather than the setup, and its ban on unverified guessing was too weak to stop plausibility-based selection, so I made both explicit and cut length to help transfer."
6,2,30302,150.115,150.125,64b0f516c4150af456f05fd043eae6476f571e240a578af063256e2ea28e9e9a,376ba16b6f0d85dff02d94f76a112f9cbe72ecc2a13021f9c721a129ce1a12e9,64b0f516c4150af456f05fd043eae6476f571e240a578af063256e2ea28e9e9a,1.0,0.75,-0.25,0.175,0.1,-0.07499999999999998,1.35,0.95,-0.40000000000000013,155,175,discarded,"replace open-ended recheck rule with a verification budget: probe the simplest degenerate instance, stop after one confirmation, and let the symbolic derivation outrank a disagreeing numeric probe after a single recheck","Seven of eight fresh rollouts were correct in 5.7k-9.1k tokens; the lone failure derived the correct locus and even confirmed it on the easy real instance, then mis-evaluated a complex instance (a dropped sign when inverting a reciprocal), and because the incumbent only says to recheck that one line it re-audited the same sound derivation dozens of times and exhausted the 16384-token cap without stating a result. The incumbent already had a correct verification instinct but no stopping rule, so I bound the checking: probe the simplest degenerate instance where signs and reciprocals cannot bite, stop after one confirmation, and after a single recheck let the symbolic derivation outrank a disagreeing numeric probe."
6,3,8554,150.116,150.126,e73c55e27100ae936358bb7823761096f52d3e52bbb1bf81a9e7298441eeb331,d10cc63b74b45dc4fd69bb8b8f4ebaee9a7430da6d0c6d8015ace148248b49c8,e73c55e27100ae936358bb7823761096f52d3e52bbb1bf81a9e7298441eeb331,0.5,0.5,0.0,0.2,0.2,0.0,0.9,0.9,0.0,131,156,discarded,add a two-sided containment guard (overlap cannot vanish when the apex lies inside the region) and reframe invariance as a proof that makes extra angle checks redundant,"Only three of eight rollouts scored. Two distinct failures appeared: one asserted the larger square could be rotated so the overlap vanished entirely and reported the plain sum of areas, which the incumbent's one-sided anti-containment warning actually encourages, and another reached the right overlap early but then talked itself out of it while re-testing rotations; three more never closed the reasoning block at all before the token cap. The revision therefore makes the wedge caution two-sided (a wedge whose apex sits inside a region must clip a positive share of it, so a zero-overlap conclusion is a red flag) and replaces the bare stop instruction with a logical reason to stop: an invariance argument is itself a proof, so additional angle checks are redundant rather than prudent."
6,4,25003,150.117,150.127,40644c5ad3884d8dd2e32629b2968c787adfe9e53d2fb9166561d803c1e485f1,eca3b4412e445ded8672345c6e9da47f2a69b603722059804ba4ddcfcd39d53c,40644c5ad3884d8dd2e32629b2968c787adfe9e53d2fb9166561d803c1e485f1,0.625,0.0,-0.625,0.1625,0.15,-0.012500000000000011,0.95,0.3,-0.6499999999999999,189,186,discarded,anchor the per-tool cap at exactly d (forbid further differencing) and shorten the reusability/impossibility guidance for earlier commitment,"Only 2 of 8 fresh rollouts were correct. The dominant error, in 4 of 8, was reporting the number of available tools as the cap after asserting each item needs its own tool; two others mis-sized the per-tool root budget, one landing one above the degree and one one below it after taking an extra difference. The revision therefore states plainly that tools are reusable so their count is never the cap, pins the per-tool budget at exactly the degree in both directions, bans further differencing of the residual, and trims wording so the count is stated earlier."
6,5,30418,150.118,150.128,83c896bc82082c6ed4cb8791f9d2a555f90a25b05e0dc438a5532b3b8a6282c8,f545e3426a09ee0a1bf02f5f6b814a972709619b48346034d8cdc9df2dbf7c78,83c896bc82082c6ed4cb8791f9d2a555f90a25b05e0dc438a5532b3b8a6282c8,0.875,0.75,-0.125,0.175,0.1375,-0.03749999999999998,1.225,1.025,-0.20000000000000018,63,98,discarded,"make root screening concrete (substitute the number, not a remembered interval) and add a degenerate-outcome-means-wrong-root reversal rule","Seven of eight fresh rollouts were correct and all eight terminated normally under 12k tokens, so non-termination is no longer the failure mode; the single wrong rollout had both correct candidate roots in hand, wrongly declared one out of the domain by appealing to a remembered interval, kept the root that made the two new vertices coincide with the given ones, and then reported the resulting collapse as the value instead of treating it as a red flag. I therefore kept the incumbent's terse name-reduce-crosscheck spine and sharpened only its discard clause: screen roots by substituting the number into the original conditions and the stated domain, and read a degenerate or trivial outcome as evidence the other root was the right one."
