round,hint_id,train_qid,sampling_slurm_job_id,proposal_eval_slurm_job_id,incumbent_hash,proposal_hash,final_hash,old_train,new_train,delta_train,old_heldout,new_heldout,delta_heldout,old_J,new_J,delta_J,old_tokens,new_tokens,decision,mutation,subagent_summary
16,2,30302,150.315,150.325,64b0f516c4150af456f05fd043eae6476f571e240a578af063256e2ea28e9e9a,5a353b1c94c86503aa094e87e4b2baccf018f410af4f1fc5b4692104a2623330,64b0f516c4150af456f05fd043eae6476f571e240a578af063256e2ea28e9e9a,1.0,0.875,-0.125,0.175,0.175,0.0,1.35,1.225,-0.125,155,181,discarded,"replace the incumbent's spot-check/symmetry-axis clause with a generic-member rule (carry one symbolic representative, avoid hand-computing instances) plus a stay-polynomial squared-modulus directive","7 of 8 fresh rollouts were correct; the lone failure reached the correct simplified locus and center/radius by clean symbolic algebra, then destroyed itself hand-computing an individual instance: it inverted a reciprocal (mishandling 1/(-i*sqrt3)), got a point off its own circle, and burned all 38k tokens re-auditing an already-correct derivation and declaring the substitution broken, never committing a value. Fifteen rounds of tuning the recheck/spot-check language have not removed this loop, so I removed the encouragement to test explicit points at all: prefer one generic symbolic member so the case index cancels, keep everything polynomial by imposing squared-modulus conditions and rooting only at the end, and repair rather than restart. This also transfers as general anti-case-enumeration and exactness discipline."
16,3,8554,150.316,150.326,19fa4d72a92c2cb9fa9637a396188fbd19d57aa30794d82e0b9637f8a43322b1,80c2b5a034e39fa67c295e794276c4af76df31083853accce597b007d433d5f6,19fa4d72a92c2cb9fa9637a396188fbd19d57aa30794d82e0b9637f8a43322b1,0.75,0.375,-0.375,0.15,0.175,0.024999999999999994,1.05,0.725,-0.32500000000000007,162,168,discarded,"add a reference-point discipline: name the pinned distinguished point and forbid swapping a corner for a center, and require a concrete test point instead of a distance-to-sides containment argument","Six of eight rollouts scored, so the incumbent's two-sided wedge bound and trade test are working and are kept. Both failures shared one specific slip, not a budget problem: each silently replaced the pinned corner with the big square's center, then argued that every side sits distance 1 from that center while the small piece only reaches 0.5, concluding total containment and a too-small union. One even reached the right partial overlap first and then talked itself back into containment; the other never closed reasoning while oscillating on that same claim. So this revision adds a reference-point rule (name the distinguished point the condition pins, never trade a corner for a center, a bound measured from the wrong reference voids what follows) and demands one concrete test point rather than a distance-to-sides containment argument."
16,4,25003,150.317,150.327,2f7b2098363b9a53549fa724b1dc1c9431fbed1120452254cacf4f6a7a8218ff,7e62e118e1941776f34bc7d372dfc88481bf35ce1cf618fdcb34095ae65a053c,2f7b2098363b9a53549fa724b1dc1c9431fbed1120452254cacf4f6a7a8218ff,0.875,0.0,-0.875,0.1375,0.175,0.03749999999999998,1.15,0.35,-0.7999999999999999,194,188,discarded,"add a residual-degree audit (subtracting a line leaves the leading term, so degree stays d, never d-1), assert reuse is allowed unless forbidden, and swap the open-ended count audit for a shrunken-case check","Fresh 8 rollouts with the incumbent scored 4/8, no truncations, so length is not binding. The four failures split cleanly: two subtracted the affine target, declared the residual one degree below the piece degree, and reported a product one factor short per piece; one asserted each called number needs its own distinct piece and answered the bare piece count; one applied the per-piece root cap to the entire pattern and answered the bare degree. All four successes used the shared-affine-target residual framing, so that stays. The revision adds a one-clause degree audit (subtracting a line cannot touch the leading term, so the residual keeps full degree d, never d-1), states outright that reuse is allowed unless forbidden, and replaces the open-ended use-every-number audit with a small-case check, which is cheaper and transfers to other extremal counts."
16,5,30418,150.318,150.328,83c896bc82082c6ed4cb8791f9d2a555f90a25b05e0dc438a5532b3b8a6282c8,438891967ec49a9bff9dfd36021b2282b8a797aa6fc08326e828ab8dd93de77d,83c896bc82082c6ed4cb8791f9d2a555f90a25b05e0dc438a5532b3b8a6282c8,0.875,0.625,-0.25,0.175,0.1125,-0.062499999999999986,1.225,0.85,-0.3750000000000001,63,94,discarded,"insert a look-for-pattern-invariant-symmetry-via-small-cases clause ahead of the general algebra, keeping the rest of the incumbent intact","Fresh sampling reproduced train 7/8 exactly as in the last round, so train is effectively pinned and only transfer can move J. The one failure was not arithmetic: it did the algebra correctly, then mis-screened a candidate against the domain, kept only the branch that collapses the figure, and reported the collapse instead of suspecting its own screening. Nine prior rounds already attacked that screening step directly with ever more specific root-checking clauses, and every one lost heldout; the incumbent's terse version scores best. So instead of a tenth restatement I left the incumbent wording intact and added one genuinely new and broadly useful step: probe small concrete cases for a pattern, invariant, or symmetry before committing to long general algebra."
16,6,26989,150.319,150.329,605dd6784c9f1f6f9bb9f5068b8e9744aad3781c1b1d0e9028b48e9692b555e2,6cc0498766a54216a935bbbc0ce499f24702bc049ad32425cc35a2cc06164549,6cc0498766a54216a935bbbc0ce499f24702bc049ad32425cc35a2cc06164549,0.25,0.125,-0.125,0.1625,0.2375,0.07499999999999998,0.575,0.6,0.025000000000000022,182,189,kept,"replace the vague first-vs-last mechanics clause with a forced disambiguation: write both readings of the asked slot, then eliminate one by tracing one concrete run before any counting","Fresh sampling with the incumbent gave 1/8; all rollouts ended normally around 10-15k tokens, so length is not the bottleneck. The first part is largely solved (5/8 got it), and every loss came from the slot-naming part: six of eight priced it as 1/n or 3!/4! by asserting each item equally likely in every position, and each of those had first silently reworded the deepest slot as ""whatever was moved last"", the opposite of what stacking on top implies. The incumbent only tells the student to pin whether the slot is the first or last arrival, which it obeys by picking a reading without checking. The revision makes that step adversarial: state both readings, then eliminate one by tracing a single concrete run to the end before any counting begins."
16,7,3836,150.320,150.330,9300bc3ffa577ffd05cfd6854f99348ead9ab916c0aac6c6e36fca997ad1b786,faab49ad8e897f0d9b6230422999b6d3fcef68cac929ca585925bd0107179f84,9300bc3ffa577ffd05cfd6854f99348ead9ab916c0aac6c6e36fca997ad1b786,0.125,0.0,-0.125,0.175,0.1125,-0.062499999999999986,0.475,0.225,-0.24999999999999997,167,171,discarded,add the weighted-combination lever (build weights that cancel every unwanted term to isolate the single requested unknown) and a label-vs-condition-index discipline that reframes an inconsistent miniature as a translation slip rather than grounds for doubting the statement,"All 8 fresh rollouts scored 0; 7 of 8 hit the token cap without landing anything. The incumbent's small-instance advice was followed, but it backfired: rollouts mis-transcribed the miniature (confusing the summation label with the quantity that changes from condition to condition), got a contradictory tiny system, then spent thousands of tokens re-litigating whether the stated problem was even consistent, or distrusted small cases entirely. The two that reached a value pattern-matched a two-entry table onto the wrong family. Small cases alone cannot carry this: the revision keeps the commit-early and confirm-by-substitution discipline but adds a real structural lever -- take a weighted sum of the given conditions with weights chosen so every unwanted term cancels -- and pins the transcription so an inconsistent miniature is repaired instead of triggering an unbounded consistency loop."
16,8,23443,150.321,150.331,8a6dfd748e0553b9accc3ad13afe0c4aa08f94103b64259ab984bac22622e13d,f7869e1a095beb5920f6dd4e70fa08044810cf8237833cce4def1d786e05799d,8a6dfd748e0553b9accc3ad13afe0c4aa08f94103b64259ab984bac22622e13d,1.0,1.0,0.0,0.2,0.1625,-0.037500000000000006,1.4,1.325,-0.07499999999999996,130,169,discarded,"keep the train-safe opening, small-cases clause and exact-arithmetic clause verbatim; insert an untried structure-exploiting lever menu (substitution, factoring/completing the square, symmetric sums, telescoping, complementary counting) before the closing commit-and-check","All 8 fresh rollouts again scored reward 1 with clean stops at 3.0-7.0k tokens, so train is saturated and every gain must come from transfer. Reading the rollouts, the student's whole solution is one divisibility+percent chain; it never exercises the small-cases or exact-fractions clauses, and its only real waste is repeatedly relitigating which divisor to pick. Prior rounds show removing the question-anchored opening always collapses train (0.25-0.5), and further divisibility, scope-labelling, output-form, arithmetic-reliability, uniqueness-forcing, backward-reasoning and representation-change tails all lost held-out ground. So I kept the whole incumbent intact and inserted the one untried family of advice: concrete algebraic levers that eliminate unknowns before grinding, which should help transfer problems that are algebraic rather than divisibility-flavoured."
16,9,3980,150.322,150.332,652ee8dc58008e69bb7e90163e071e0708bc579422e2fd3d5a546ca1fb63ccad,6f9715fcff6e314cf53acd220b05a2af3a25c7b68ebe4a5b9c048502216c3d54,652ee8dc58008e69bb7e90163e071e0708bc579422e2fd3d5a546ca1fb63ccad,1.0,0.875,-0.125,0.25,0.225,-0.024999999999999994,1.5,1.325,-0.17500000000000004,180,192,discarded,ban the vague relation-survey opening (commit to one structured form on line one and test it against the data at once) and add a free-parameter release rule: a parameter that cancels from every requested quantity means the problem is finished,"Seven of eight fresh rollouts were correct; the six shortest recentered on line one, pinned the center from the sum of the two given values, and stopped. The single failure ignored the coefficient ban, opened with eight unknowns, then drifted through a speculative survey (inverses, ad-hoc reduced forms, repeated ""this is too vague"") and ran to the token cap while grinding a degree-nine expansion. A near-miss pattern in earlier evidence was the same stall ending in an under-determined panic, where a leftover leading coefficient looked like a missing equation. So the revision keeps the working centered core but adds two guards: commit to one structured form immediately and test it against the data rather than surveying relations, and treat a parameter that cancels from everything asked as free rather than a reason to keep hunting equations."
16,10,3843,150.323,150.333,dd96dfb992052dea62ab2214a4d147f14aa95c0c6f35b1224c4d06d84cf346cb,c6b2f9561c1e6af3526f6a1e843cacc706a6ef966672074d7847253f229087de,c6b2f9561c1e6af3526f6a1e843cacc706a6ef966672074d7847253f229087de,0.625,0.625,0.0,0.1625,0.175,0.012499999999999983,0.95,0.975,0.025000000000000022,178,180,kept,"use the requested answer shape as a falsification test: a parameterized result cannot be constant, so constant small cases are mis-traced and must be repaired before fitting, and the formula must reproduce the smallest trusted case","3 of 8 rollouts were correct. Four failures exhausted the 16384-token budget; the one finisher among the rest reported an exponent one too low. The shared root cause is new evidence: traces produced the SAME constant value at the first two or three sizes, after which the student either fitted an off-by-one exponent to that table or looped for thousands of tokens arguing ""this suggests a constant, but it must be an expression in the parameter, so it is more complex"". One dead rollout also built a map sending four inputs to one output and theorized about it instead of redoing the trace. The revision therefore turns the requested answer shape into a falsification test: a parameterized result cannot be constant, so constant small cases are mis-traced and must be repaired before any formula is fitted, the formula must reproduce the smallest trusted case, a non-injective hand map is a slip, and a fitting value is stated at once."
17,1,28054,150.334,150.344,fda1791300f21976dd72f9eebe700de3cfaba1edb06bf4fc0339ea25871f6960,08022e4cd4ab92fdbb0346bf68c0aaf1f4af2f2d8918d76268a2a14efbafd71d,fda1791300f21976dd72f9eebe700de3cfaba1edb06bf4fc0339ea25871f6960,0.25,0.0,-0.25,0.1875,0.1875,0.0,0.625,0.375,-0.25,170,184,discarded,"replace vague 'intersect constraints across readings' with a constructive two-witness test for ignorance, and state that readings disagreeing on the pinned value is itself ignorance so a candidate refuted under one fixed reading survives","Fresh sampling with the incumbent scored 0/8; 2 hit the 16384 cap and all eight burned 13k-16.4k tokens. Every rollout proved that under each fixed reading a speaker's own value pins the partner, declared both readings impossible, and then reported a factor or complement its own text had just refuted. One even reached the balanced split, said it forced knowledge, and reported a neighbour. So the binding error is not the ordering or the guessing ban but the criterion for ignorance itself: the student equates it with many partners inside one reading. I replaced the intersect-across-readings clause with a constructive test -- name two scenarios matching what the speaker was told but differing in the unknown -- and stated that two readings each pinning a DIFFERENT value already create ignorance, so a candidate refuted only under one fixed reading must be kept."
17,2,30302,150.335,150.345,64b0f516c4150af456f05fd043eae6476f571e240a578af063256e2ea28e9e9a,df05c61753575854db641a80cf5f650dcaaa6da5be5010f5ff818c7cc1b22559,64b0f516c4150af456f05fd043eae6476f571e240a578af063256e2ea28e9e9a,1.0,0.75,-0.25,0.175,0.075,-0.09999999999999999,1.35,0.9,-0.45000000000000007,155,170,discarded,"restate the opening move as the general homogeneity/equal-degree trigger for dividing to a single ratio and w^n=c, keeping the incumbent's second paragraph intact","7 of 8 fresh rollouts were correct in 5.8k-9.1k tokens. The single failure reached the correct locus and radius by 2.4k tokens, then mis-inverted a purely imaginary reciprocal while probing one root, and spent the remaining 14k tokens re-deriving the same sound algebra (60 restarts of reasoning, 9 claims of contradiction) until the cap with nothing recorded. Rounds 5-16 all rewrote the second paragraph to bound, redirect or replace that audit loop, and all twelve lost transfer, so the loop language is not the lever. The untouched lever is the opening move, which since round 4 has read as a bare recipe for this equation. I keep the second paragraph verbatim and restate the first as its transferable trigger: equal degree on both sides licenses dividing to a single ratio, giving w^n = c and a pinned modulus."
17,3,8554,150.336,150.346,19fa4d72a92c2cb9fa9637a396188fbd19d57aa30794d82e0b9637f8a43322b1,d7118d5f6ad759b37801606980ef1ccb4de559b44d5407c3b69d46f2f19ac9a4,19fa4d72a92c2cb9fa9637a396188fbd19d57aa30794d82e0b9637f8a43322b1,0.75,0.25,-0.5,0.15,0.15,0.0,1.05,0.55,-0.5,162,183,discarded,"make the non-containment check computational: test each vertex of the pinned piece against the two edge inequalities at the corner, instead of a qualitative wedge claim","Five of eight scored, so the sum-minus-overlap frame and trade test are kept. All three failures shared one error, not a budget problem: each asserted that the large piece's sides all sit at distance 1 from its center while the pinned piece only reaches 0.5, so containment holds at every rotation and the overlap equals the whole piece. One wrote that conclusion out confidently and stopped early with tokens to spare; the other two never closed reasoning, cycling 109-139 rotation retests around the same claim while repeatedly calling the geometry too complex to compute. The incumbent's qualitative wedge sentence and reference-point warning did not block it. This revision replaces them with a computational test: express the two edges leaving the pinned corner as inequalities and check each vertex of the other piece, so one failing vertex refutes containment numerically."
17,4,25003,150.337,150.347,2f7b2098363b9a53549fa724b1dc1c9431fbed1120452254cacf4f6a7a8218ff,499fa73c7e36d8f6734f733e3dfd8a941491161f4fddb5e355163c28f6a06e22,2f7b2098363b9a53549fa724b1dc1c9431fbed1120452254cacf4f6a7a8218ff,0.875,0.5,-0.375,0.1375,0.1125,-0.02500000000000001,1.15,0.725,-0.42499999999999993,194,192,discarded,"lead with a do-not-invent-constraints rule (reuse allowed unless forbidden; a whole-pattern condition need not hold piecewise) and an exit for impossible/unbounded branches, plus an agreement-count framing that pins the per-piece cap at the stated degree","Fresh rollouts: 3/8 correct. No truncation and no arithmetic slips - every loss came from a self-invented constraint. Two rollouts decided each piece may be used only once and reported the bare piece count; a third first argued the count was unbounded, then retreated to that same piece count as the ""practical"" choice. Two more applied the multiplied budget correctly in form but with a per-piece cap one below the degree stated in the problem, having subtracted the affine target and then differenced again. One stalled mid-derivation. So the incumbent needs less residual bookkeeping and more license discipline: state up front that reuse is permitted unless forbidden and that a whole-pattern condition need not hold piece by piece, give impossible/unbounded branches a one-line exit, and pin the per-piece cap by counting agreements with the line at the degree exactly as given."
17,5,30418,150.338,150.348,83c896bc82082c6ed4cb8791f9d2a555f90a25b05e0dc438a5532b3b8a6282c8,d0cc608af71edf1cce78c5a6c8da2e4bf7005ad7e886454d37f8c6cae44dcc6d,d0cc608af71edf1cce78c5a6c8da2e4bf7005ad7e886454d37f8c6cae44dcc6d,0.875,0.875,0.0,0.175,0.225,0.05000000000000002,1.225,1.325,0.09999999999999987,63,94,kept,"swap the costly second-method verification for substitute-back checking, a no-re-verify stop, and a re-read-the-question step","Fresh sampling gave 7/8 correct at 20-27k characters, the same score as the incumbent's recorded train_i, so train is near saturated and held-out (weighted double) is the only real lever. The lone failure derived the constants and the translation equation correctly, then wrongly threw away one of two roots on a botched domain check, accepted the resulting degenerate figure, and spent its remaining budget re-deriving the same shoelace sum instead of doubting the discard. Fifteen earlier rounds already tried rewriting the root-screening clause and every one lost held-out ground, so I left that clause untouched and instead replaced the expensive 'verify by a second, different method' instruction with cheap substitute-back checking, an explicit no-re-verification stop, and a re-read-the-question step so budget goes to the quantity actually requested."
17,6,26989,150.339,150.349,6cc0498766a54216a935bbbc0ce499f24702bc049ad32425cc35a2cc06164549,f9c3fd907123965e11872632baf4ba8be79e653c73c88d8b0ecfba733c4adc7f,6cc0498766a54216a935bbbc0ce499f24702bc049ad32425cc35a2cc06164549,0.125,0.0,-0.125,0.2375,0.2,-0.03749999999999998,0.6,0.4,-0.19999999999999996,189,198,discarded,"make orientation mechanical (label the source pile, buffer releases top first) so the asked slot becomes an exact opening load block, and forbid overwriting a step-listed value with an unlisted symmetry claim","Fresh sampling gave 2/8; seven rollouts stopped normally and one hit the cap relitigating, so length is secondary. Part (a) is mostly solved (five reached the free-step count), and every loss was the slot part: six asserted a uniform random permutation and read off 1/n or 3!/4!, each having first equated the deepest slot with 'moved last'. Two rollouts even derived the correct free-step value and then explicitly overwrote it with a symmetry story a paragraph later. Several also mislabelled the start pile orientation, so they named the wrong item. The revision makes orientation mechanical rather than a reading to pick, adds the buffer rule that an item leaves only after later entrants, converts the slot event into an exact opening block of loads, and forbids overwriting a step-listed value with an unlisted symmetry claim."
