round,hint_id,train_qid,sampling_slurm_job_id,proposal_eval_slurm_job_id,incumbent_hash,proposal_hash,final_hash,old_train,new_train,delta_train,old_heldout,new_heldout,delta_heldout,old_J,new_J,delta_J,old_tokens,new_tokens,decision,mutation,subagent_summary
17,7,3836,150.340,150.350,9300bc3ffa577ffd05cfd6854f99348ead9ab916c0aac6c6e36fca997ad1b786,57aac1fcb1f772db09b0f6097e86b16002b9ce58e2a9d6844c55e39d2f8632bc,9300bc3ffa577ffd05cfd6854f99348ead9ab916c0aac6c6e36fca997ad1b786,0.125,0.125,0.0,0.175,0.125,-0.04999999999999999,0.475,0.375,-0.09999999999999998,167,170,discarded,turn self-reported stalling into an explicit stop-and-commit trigger; ban restating the setup; require a third instance to distinguish growth types,"All eight fresh rollouts hit the generation cap and none emitted a result, so this round scored zero purely on budget exhaustion, not on reasoning ability. Every transcript spent its opening paragraphs re-paraphrasing the given conditions in new notation, then cycled through abstract framings, and several literally wrote that they were stuck or out of ideas and opened yet another approach instead of landing anything. Some had already computed correct small instances and still never committed. The incumbent asks for early commitment but gives no trigger for it, so the revision bans restating the setup, demands a written value from the smallest instance immediately, requires a third instance to separate factorial from power growth, and converts the model own stuck/how-do-I-proceed language into an explicit stop-and-commit deadline."
17,8,23443,150.341,150.351,8a6dfd748e0553b9accc3ad13afe0c4aa08f94103b64259ab984bac22622e13d,56458f13eed4fc94493da26c1a45f3b9dd8c356264b1d2a0d495169edeec3cac,8a6dfd748e0553b9accc3ad13afe0c4aa08f94103b64259ab984bac22622e13d,1.0,0.875,-0.125,0.2,0.15,-0.05000000000000002,1.4,1.175,-0.22499999999999987,130,171,discarded,"keep the train-safe opening and small-cases clause verbatim; replace the never-exercised exact-fractions clause with an untried candidate-screening rule (reject values violating positivity/integrality/range, re-test extraneous roots) plus an all-givens-used misread check","All 8 fresh rollouts scored reward 1 and stopped cleanly at 3.0-7.0k of 16384 tokens, so train_i is pinned at 1.0 and length is not the binding constraint; every remaining gain must come from transfer. The rollouts never once used the exact-fractions clause (all arithmetic is small-integer), so that clause is dead weight on transfer while occupying budget. What the rollouts do spend real effort on is enumerating divisor candidates and then arguing which survive the stated conditions, and they only converge after discarding the ones that conflict with a given. I generalized exactly that observed move into a reusable candidate-screening rule covering positivity, integrality, range limits and extraneous roots from squaring or clearing denominators, and added an all-givens-used check since misreads are the residual failure class. Screening and extraneous-root discipline are untried in prior rounds here."
17,9,3980,150.342,150.352,652ee8dc58008e69bb7e90163e071e0708bc579422e2fd3d5a546ca1fb63ccad,0b9c5e64cffbfc9329ac794d10e363ad2b485f3bf6b57542e299a7a89615befa,652ee8dc58008e69bb7e90163e071e0708bc579422e2fd3d5a546ca1fb63ccad,1.0,0.875,-0.125,0.25,0.1625,-0.0875,1.5,1.2,-0.30000000000000004,180,182,discarded,"forbid re-expansion into standard powers when reading off results and add a settled-value rule (a checked value outranks a later disagreeing rewrite), replacing the redundant same-sign/factor-out warnings","Fresh sampling gave 3/8 correct, down from the incumbent's earlier 8/8, and the failures split cleanly. Four rollouts never adopted the centered form and burned all 16384 tokens matching coefficients of the degree-9 composition, chasing sign contradictions in their own expansions. The one rollout that terminated wrong had already recentered, pinned the center and scale correctly, and verified both supplied values, then re-expanded into standard powers, wrongly re-added the given constant on top of the center, distrusted its verified values, and overwrote them with the corrupted ones. The revision therefore keeps the recentering core but spends its tokens on the two live traps: evaluate only inside the centered form, and treat a value that already matched the data as settled so a later disagreeing rewrite is discarded instead of the value."
17,10,3843,150.343,150.353,c6b2f9561c1e6af3526f6a1e843cacc706a6ef966672074d7847253f229087de,c228f6cb9b1667fc2502b13379c044a5cfbc7564593937e92d1c815a433c7ebc,c6b2f9561c1e6af3526f6a1e843cacc706a6ef966672074d7847253f229087de,0.625,0.125,-0.5,0.175,0.1125,-0.062499999999999986,0.975,0.35,-0.625,180,179,discarded,"add an explicit sufficiency/stopping rule (agreeing cases are enough, no general proof owed) and make self-repetition or confusion a hard exit signal rather than a cue to restart symbolically","5 of 8 rollouts were correct and every one read the pattern straight off two or three literal small traces, then stopped. All 3 failures ran to the 16384-token cap, and none failed for lack of a correct case: each had already produced small-case values matching the eventual pattern, then discarded them as 'tedious' and switched to a symbolic product-of-permutations derivation. Two degenerated into verbatim repetition loops of one cycle expression; one drifted into a bogus larger count and hunted an unrelated integer sequence. So the binding constraint is no longer how cases get traced, since the incumbent's clause already works, but the absence of permission to stop once cases agree. The revision keeps the parameter-shape check and literal tracing, adds an explicit sufficiency rule (agreeing cases mean done, no general proof owed), and makes self-repetition or 'confusing' a hard exit."
18,1,28054,150.354,150.364,fda1791300f21976dd72f9eebe700de3cfaba1edb06bf4fc0339ea25871f6960,cfabdedcd9329a99029b02882586691d243c26e9dbec3321380c9ec06e96fb02,fda1791300f21976dd72f9eebe700de3cfaba1edb06bf4fc0339ea25871f6960,0.25,0.0,-0.25,0.1875,0.1875,0.0,0.625,0.375,-0.25,170,181,discarded,replace abstract intersect-across-readings with a concrete compute-the-partner-under-each-role-and-compare test for ignorance,"Fresh sampling with the incumbent scored 0/8; 3 hit the 16384 cap and all eight burned 13k-16.4k tokens. Every rollout fixed one role for the shown number, proved that inside that role a speaker's own value determines the partner, called both roles impossible, then reported a divisor its own text had just refuted or admitted was recalled from a classic puzzle. Two reached the balanced equal split, said it forced knowledge, and reported a neighbour. So the binding error is the ignorance criterion itself: the student never compares the DIFFERENT partners the competing roles compute from the same private value. I replaced the incumbent's abstract intersect-constraints clause with that concrete compute-and-compare test, plus the rule that a case dying only under one fixed role is not dead."
18,2,30302,150.355,150.365,64b0f516c4150af456f05fd043eae6476f571e240a578af063256e2ea28e9e9a,ffeb8054e6dfa4577b35e0d316f6ded16ce4ab810695331a83fe1820f6e3f98b,64b0f516c4150af456f05fd043eae6476f571e240a578af063256e2ea28e9e9a,1.0,1.0,0.0,0.175,0.125,-0.04999999999999999,1.35,1.25,-0.10000000000000009,155,175,discarded,"replace generic no-restart/spot-check discipline with the two concrete misdiagnoses that cause the contradiction spiral (non-origin center, equal-coefficient conic is a circle) and promote the modulus-to-distance-condition route over angle parametrization","All 8 rollouts were correct, so length and transfer carry the signal. The clean short runs (4.5k-6k tokens) read the pinned modulus as a distance ratio, squared it in coordinates and completed the square. The 14.2k outlier instead parametrized by an angle, then wrecked itself on two specific misreadings: it saw roots at differing distances from the origin and concluded no single circle existed, and it read a conic with equal x^2 and y^2 coefficients as an ellipse, declaring the problem ill-posed 5 times across 51 restarts. Twelve prior rounds tuned generic no-restart/recheck language and all lost transfer, so instead of managing the spiral I name the two reusable geometric facts that dissolve it, and make the distance-condition route explicit."
18,3,8554,150.356,150.366,19fa4d72a92c2cb9fa9637a396188fbd19d57aa30794d82e0b9637f8a43322b1,ce99c40dada4cd59a1acf0bf48202163b244feb168cd101a44b17608c2ee58fa,19fa4d72a92c2cb9fa9637a396188fbd19d57aa30794d82e0b9637f8a43322b1,0.75,0.375,-0.375,0.15,0.125,-0.024999999999999994,1.05,0.625,-0.42500000000000004,162,178,discarded,state why parameter sampling can never terminate and add a bound-plus-witness stop licence; forbid guessing a plausible round number when a case feels too complex; trim the now-absorbed containment warning,"Four of eight scored and no failure was mathematical in the usual sense: three hit the 16384-token cap while already holding the right overlap from ~3-5k chars in, having spent 114-195 rotation re-tests and 58-75 restarts; the fourth closed reasoning but, after writing that the geometry was too complex, guessed a round-looking value and committed to it. The incumbent's containment warning is now fully absorbed (zero rollouts claimed containment), so that wording is trimmed. Its trade test is kept but subordinated to an explicit reason the sampling loop can never terminate, plus a bound-and-witness alternative, so a proof licenses stopping. A new clause turns 'too complex' into an order to compute concrete coordinates rather than a licence to guess a plausible number."
18,4,25003,150.357,150.367,2f7b2098363b9a53549fa724b1dc1c9431fbed1120452254cacf4f6a7a8218ff,fbe4347321528cc688dc051c3a65b52af85963d99e57817a658932a091c92640,2f7b2098363b9a53549fa724b1dc1c9431fbed1120452254cacf4f6a7a8218ff,0.875,0.625,-0.25,0.1375,0.175,0.03749999999999998,1.15,0.975,-0.17499999999999993,194,194,discarded,add a one-time audit-then-settle stop rule so the bound is not re-litigated after it is proved,"Fresh rollouts: 5/8 correct. All 3 failures were token-limit truncations, not wrong reasoning: two of them had already derived the correct per-piece-times-pieces product early, then spent tens of thousands of tokens re-litigating it with repeated ""but wait"" restarts and re-arguing whether reuse is allowed; the third never got past the interpolation red herring that a degree-d piece is pinned by d+1 points. The successes all reached the product quickly and stopped. So the residual failure mode is now overthinking after the bound is proved, not misunderstanding the bound. This revision keeps the working residual/shared-affine-target core and adds a single-audit stop rule: check the count once against the given numbers, then treat it as settled, because re-deriving a proved step is not new evidence and relooping is what exhausts the budget."
18,5,30418,150.358,150.368,d0cc608af71edf1cce78c5a6c8da2e4bf7005ad7e886454d37f8c6cae44dcc6d,612bc0d9bb65191e25242890d53aadb4e31f20186296bbf71078dcf7cac9b096,d0cc608af71edf1cce78c5a6c8da2e4bf7005ad7e886454d37f8c6cae44dcc6d,0.875,0.5,-0.375,0.225,0.125,-0.1,1.325,0.75,-0.575,94,165,discarded,"add impossibility triage: no-real-root means an earlier conversion reversed direction (log/base-below-one), probe that one step numerically instead of re-expanding or guessing","Fresh sampling with the incumbent gave 6/8, and both failures were identical: each folded a constant across the log in the wrong direction while equating the two graph conditions, got a negative discriminant, then spent the whole remaining budget re-expanding the very same cross-multiplication before guessing a value and running to the token cap. The incumbent tells them to discard bad roots but says nothing about what to do when nothing survives, so re-derivation loops are unpunished. I added an explicit impossibility-triage rule: an empty solution set means an earlier conversion reversed direction (base below one flips it), so probe the unrechecked step at one number, correct it, and continue rather than re-expanding or guessing."
18,6,26989,150.359,150.369,6cc0498766a54216a935bbbc0ce499f24702bc049ad32425cc35a2cc06164549,8310256c06fbf986d81702caccb7c055f80942cd16504a06d98e3b87f03302dd,6cc0498766a54216a935bbbc0ce499f24702bc049ad32425cc35a2cc06164549,0.125,0.0,-0.125,0.2375,0.1375,-0.09999999999999998,0.6,0.275,-0.32499999999999996,189,183,discarded,replace choose-between-two-readings with a measured step-numbering of one concrete run; name 'equally likely to be last' as the banned guess and forbid step-free symmetry from overturning a step-counted value,"Fresh sampling with the incumbent gave 0/8; all eight stopped normally at 12k-16k tokens, so length is not the block. Six of eight reached a free-step count on part one, then every single rollout answered the slot part with 1/n by asserting each item equally likely in every position; each had first equated the deepest slot with the item handled last, and two explicitly overwrote a step-counted value with that symmetry story. The incumbent asks the student to write both readings of the slot and kill one by tracing a run, but it picks a reading and never traces. This revision replaces that choose-a-reading step with a measurement: number the steps of one run, write the destination in arrival order, and see which step filled the slot; it states the upward-growth orientation outright, names the equally-likely-to-be-last phrasing as the same banned guess, and forbids a step-free symmetry claim from overturning a step-counted value."
18,7,3836,150.360,150.370,9300bc3ffa577ffd05cfd6854f99348ead9ab916c0aac6c6e36fca997ad1b786,58496dbeeb3f70dd227e9ef6def5891d94287766f583ce5941ffd8226336dc98,9300bc3ffa577ffd05cfd6854f99348ead9ab916c0aac6c6e36fca997ad1b786,0.125,0.0,-0.125,0.175,0.175,0.0,0.475,0.35,-0.125,167,166,discarded,"make the reduced-instance condition count explicit, treat a contradictory miniature as an off-by-one translation slip to repair instead of grounds for abandoning small cases, and require three confirmed entries with a re-test","Fresh sampling scored 1 of 8; 4 of 8 hit the token cap and the 3 that landed were wrong. Nearly every failure ran through the same trap: the student built a reduced instance that miscounted how many conditions vanish versus how many are set nonzero, got a contradictory miniature, then either declared the small case unlike the real problem and fled into unclosable symbolic algebra, or reasoned that the stated system must be inconsistent. Two who stopped there guessed. The one success instead solved three clean instances, fit a form, and re-tested it on each. The revision therefore makes the miniature's condition count explicit, reframes a contradictory miniature as a translation slip to repair by one rather than grounds for abandonment, and demands three confirmed entries plus a re-test to pin the index shift."
18,8,23443,150.361,150.371,8a6dfd748e0553b9accc3ad13afe0c4aa08f94103b64259ab984bac22622e13d,0896404a7766d6aec02f181533a82a79d2acb31efabb5d24feea46ab3558d191,8a6dfd748e0553b9accc3ad13afe0c4aa08f94103b64259ab984bac22622e13d,1.0,0.875,-0.125,0.2,0.1875,-0.012500000000000011,1.4,1.25,-0.1499999999999999,130,170,discarded,"keep the train-safe opening, small-cases clause and exact-arithmetic clause verbatim; insert an untried concretization lever (place convenient coordinates, or pin an invariant free parameter to an easy legal value and compute in that instance) before the closing commit-and-check","All 8 fresh rollouts scored reward 1, stopped cleanly at 3.0-7.0k of 16384 tokens, and followed an identical path: divide out the count, sum the stage totals, apply the percent as a multiplier. Train is saturated, so any gain must be transfer, and no observed failure mode exists to target. Sixteen prior probes show the pattern clearly: rewriting or removing the concrete opening craters train (0.25-0.5), while appending generic advice keeps train at 1.0 and moves transfer only a little. So I again keep the opening verbatim and swap only the tail clause. Previously tried and beaten tails were divisibility restatement, scope labeling, anti-rumination, output-form, arithmetic-recheck, backward reasoning, algebraic levers, and candidate screening. Untried here is concretization: coordinates or pinning a parameter the result cannot depend on, which converts open symbolic problems into a single computable instance."
18,9,3980,150.362,150.372,652ee8dc58008e69bb7e90163e071e0708bc579422e2fd3d5a546ca1fb63ccad,084472454e885a066bd079df1a3b83066ecbe1b259de6d955703f2edb4794953,652ee8dc58008e69bb7e90163e071e0708bc579422e2fd3d5a546ca1fb63ccad,1.0,0.875,-0.125,0.25,0.225,-0.024999999999999994,1.5,1.325,-0.17500000000000004,180,180,discarded,"recognize a derived sum-is-constant relation as the already-pinned center instead of restarting, and turn the under-determined panic into a cancellation check rather than an equation hunt","Seven of eight fresh rollouts were correct, finishing in 4.1k-6.5k tokens by committing to the shared-center antisymmetric pair and solving the two supplied values by sum and difference. The single failure never wrote a centered form: it opened with eight unknown coefficients, surveyed relations speculatively (inverses, reciprocals, scalar multiples), and did eventually derive that the two maps sum to a constant, which is the center in disguise, but failed to recognize it; it then declared the leading coefficient under-determined, burned the remaining budget hunting a missing equation and factoring a cubic, and hit the token cap. The revision therefore supplies the missing bridge: a sum-is-a-constant relation already pins the center, so continue from it rather than restarting, and when a unique result is promised a still-free parameter must cancel from everything asked, which is a check to run, not a reason to hunt equations."
18,10,3843,150.363,150.373,c6b2f9561c1e6af3526f6a1e843cacc706a6ef966672074d7847253f229087de,181de074d76a20fc0bc384bdc26a17c1f9701c3a217430261cb7e7887a18aee0,181de074d76a20fc0bc384bdc26a17c1f9701c3a217430261cb7e7887a18aee0,0.625,0.75,0.125,0.175,0.1375,-0.03749999999999998,0.975,1.025,0.04999999999999993,180,175,kept,"make the literal worked run strictly outrank any compact/structural model and order the model abandoned (not repaired) on conflict, with plain repeated application as the fallback counter","4 of 8 rollouts were correct; all four read the pattern off literal step-by-step runs on the two smallest instances and stopped. The four failures share one new mechanism: each first produced a correct literal run, then rewrote the process in compact cycle notation, got a contradiction between the notation and the run, and spent the rest of the budget trying to repair the notation while treating the run as suspect. Three hit the token cap that way, one of them degenerating into verbatim repetition; the fourth abandoned tracing and fitted an exponent one too low. The incumbent already permits stopping once cases agree, but nothing tells the student which side wins a run-versus-notation conflict. The revision makes the worked run strictly authoritative, orders the compact model abandoned rather than repaired, and keeps counting by plain repetition as the fallback."
19,1,28054,150.374,150.384,fda1791300f21976dd72f9eebe700de3cfaba1edb06bf4fc0339ea25871f6960,1dd8a5e9596d89b84ded4fe083c299967c9f37a67dcb45a2d1f5c95d337c67d4,fda1791300f21976dd72f9eebe700de3cfaba1edb06bf4fc0339ea25871f6960,0.25,0.0,-0.25,0.1875,0.1625,-0.024999999999999994,0.625,0.325,-0.3,170,173,discarded,add a concrete self-monitoring trigger on repeated impossibility claims that forces naming and dropping the over-strict added condition,"Fresh sampling with the incumbent scored 0/8; every rollout ran 13.4k-16.4k tokens and two hit the cap. The failure is not a missing concept but an unbounded loop: rollouts declared cases impossible 28, 51, 94, even 116 times, re-deriving the same two readings, then either truncated or emitted an unverified number their own text had already refuted. The incumbent already says a contradiction kills an added assumption, but that is passive advice with no trigger, so the student never notices it is looping. I replaced the generic no-restart clause with a countable tripwire -- on the second impossibility claim, halt, name the strictest imposed condition, verify the problem stated it, drop it if not -- which converts the abstract rule into an action the student can detect firing, and kept the cross-reading intersection language that earned the incumbent its transfer score."
