round,hint_id,train_qid,sampling_slurm_job_id,proposal_eval_slurm_job_id,incumbent_hash,proposal_hash,final_hash,old_train,new_train,delta_train,old_heldout,new_heldout,delta_heldout,old_J,new_J,delta_J,old_tokens,new_tokens,decision,mutation,subagent_summary
2,10,3843,150.42,150.52,95005ec62835dbef2cc6b52c26e1bc8efa75d3d939090ada63716aa06be7a5b5,448feecd44967af4e06e82d05f4476054234e6e1a16befcf517979d41ef5805f,95005ec62835dbef2cc6b52c26e1bc8efa75d3d939090ada63716aa06be7a5b5,0.375,0.125,-0.25,0.1375,0.1625,0.024999999999999994,0.65,0.45,-0.2,72,143,discarded,"replace symbolic index-formula derivation with concrete label-row simulation, warn that stages compose on the previous result, and require exact counts at two-plus sizes","Only 2 of 8 rollouts were correct and 5 of the 6 failures hit the 16384-token cap while still attempting a symbolic map from index to index, several explicitly abandoning small-case checks as 'too abstract' or 'too long'; the sixth finished but asserted a uniform cycle length one power too small without ever counting. The recurring mechanical error was applying each stage to the original positions instead of to the arrangement the previous stage produced, which yielded impossible cycle lengths and triggered endless re-derivation. The revision therefore swaps the incumbent's bitwise-affine-permutation framing for concrete label-row simulation, names the stage-composition slip as the cause of implausible cycle lengths, and demands exact counts at two or more sizes since the tiniest case underdetermines the pattern."
3,1,28054,150.53,150.63,cbbaaafa1907efc60835e2a44f805271c9a2f4cd4fe5d3988c244caa7b7e5f7b,319fe8d355e0dc9553c5d160edfbe35845d62046af8e4ee26502954554f37755,cbbaaafa1907efc60835e2a44f805271c9a2f4cd4fe5d3988c244caa7b7e5f7b,0.25,0.0,-0.25,0.1375,0.1125,-0.02500000000000001,0.525,0.225,-0.30000000000000004,144,134,discarded,"kill the wrong source of uncertainty: ignorance comes from the unknown reading, not from many factorizations, so intersect feasibility tests across readings","Fresh sampling with the incumbent hint scored 0/8 and 5 of 8 hit the token cap; every rollout attributed ""I don't know"" to the display having many factor pairs, then correctly noticed that a speaker's own value pins the partner uniquely, declared a contradiction, and either looped enumerating pairs until truncation or picked an arbitrary factor. The incumbent flags label ambiguity but still frames uncertainty as multiple partners, so I replaced that with the correct rule -- uncertainty comes only from the unknown reading -- and turned it into an intersect-the-feasibility-tests procedure that terminates quickly."
3,2,30302,150.60,150.64,e926ca1d6f04d597d4b99af9d15b2597417b40fc28c3c0397d67f147cfa99917,28f5940fca6f5c106c6b1b812d8d3d0783186de0eb13a7af8747b9a265995f64,e926ca1d6f04d597d4b99af9d15b2597417b40fc28c3c0397d67f147cfa99917,0.875,0.75,-0.125,0.125,0.1625,0.037500000000000006,1.125,1.075,-0.050000000000000044,81,149,discarded,"replace the problem-specific Mobius substitution with the general modulus route (|z-a|=k|z-b| squared into a circle), warning off the angle-parametrization path","All eight fresh rollouts were correct this round and none truncated, so train is saturated at 1.0 while heldout stays at 0.125; the incumbent's remaining value is mostly its literal naming of this problem's substitution, which cannot transfer. The shortest, cleanest rollouts avoided angle parametrization and instead took absolute values to get a fixed-ratio distance condition, squared it with the conjugate identity, and completed the square, while the only prior failure came from sign slips inside the Moebius-parametrization branch; I therefore promoted the modulus route as the transferable technique and kept exactness, one spot-check, and early commitment."
3,3,8554,150.54,150.65,e73c55e27100ae936358bb7823761096f52d3e52bbb1bf81a9e7298441eeb331,a71ec282166673f98eebbf05af901e78a1fce63d67599d67a059c52543234e4c,e73c55e27100ae936358bb7823761096f52d3e52bbb1bf81a9e7298441eeb331,0.5,0.625,0.125,0.2,0.1125,-0.08750000000000001,0.9,0.85,-0.050000000000000044,131,149,discarded,keep the sector/symmetry core but compress it and add budget discipline: stop re-litigating once the value repeats,"Four of eight rollouts were correct, and the failure mode has shifted: all eight reached the correct value early in reasoning (within the first ~7k characters), but every one of the four failures then kept re-testing rotation angles and re-deriving the setup until it hit the 16384-token cap with the reasoning block still open, so nothing was scored. The containment warning from the incumbent is now working, so this revision shortens that clause and spends the freed tokens on explicit budget discipline: one clean overlap argument plus one extreme case, record the exact value immediately, and treat a repeated value as a stop signal rather than grounds for another angle sweep."
3,4,25003,150.55,150.66,9ad17434e90ac5fbf9203596a47b29dac7558e85f253b13129bb54f81a831763,4e9c9418a15c4194d3667965861938531754dd02fddf311005f8446d2bacd97c,9ad17434e90ac5fbf9203596a47b29dac7558e85f253b13129bb54f81a831763,0.25,0.0,-0.25,0.225,0.225,0.0,0.7,0.45,-0.24999999999999994,177,186,discarded,"separate the degree-d root cap from the d+1 interpolation count, assert the summed budget is already in the asked-for units, and compress the impossibility-branch exit","All 8 fresh rollouts scored 0 and none reached the intended count: four hit the token limit while relooping on a self-inflicted impossibility (forcing one polynomial's own consecutive difference to be constant), and the finishers answered either the number of available objects or a bare degree/interpolation count. One rollout derived the correct product of per-object budgets but then rejected it as ""not directly applicable"" and reinterpreted it as a single object's cap, so the revision distinguishes the root cap from the interpolation count, states that the summed budget is already the quantity being asked for, and shortens the exit from impossibility branches to reduce truncation."
3,5,30418,150.58,150.67,b807d87e8e00cc91a6166db0fb3921c3d3651d016bdd936e3700d0c9bde5fa81,83c896bc82082c6ed4cb8791f9d2a555f90a25b05e0dc438a5532b3b8a6282c8,83c896bc82082c6ed4cb8791f9d2a555f90a25b05e0dc438a5532b3b8a6282c8,0.75,0.875,0.125,0.15,0.175,0.024999999999999994,1.05,1.225,0.17500000000000004,73,63,kept,"compress to a terse generic name-reduce-discard-crosscheck rule, roughly half the length of prior rewrites","All eight fresh rollouts were correct at about 9.4k completion tokens, so train accuracy is saturated and only transfer can move J. The real crux in every successful rollout was rejecting the degenerate root of the reduced one-variable equation and then cross-checking the area by a second formula, so I kept exactly those two transferable moves. Both prior rewrites were long generic discipline lists (136-150 tokens) and lost heldout against a 73-token incumbent, so this proposal tests brevity: about 68 tokens of dense imperatives with no setup-specific vocabulary."
3,6,26989,150.56,150.68,45b2c0df517f87901f5a1ad921b228f3059ad2ca08158d9c5eb6939a11ecf4b4,d8275a49a8c4c5c47f1a038656afc89757cd584f7c8f14fc127016077c3673b7,45b2c0df517f87901f5a1ad921b228f3059ad2ca08158d9c5eb6939a11ecf4b4,0.125,0.125,0.0,0.2125,0.1625,-0.04999999999999999,0.55,0.45,-0.10000000000000003,200,198,discarded,add forced-outcome (0 or 1) trap plus total-moves = items x legs and LIFO first-arrival-is-bottom mechanics,"Fresh sampling with the incumbent scored 0/8 (one rollout hit the 16384-token cap while dithering; the other seven terminated normally), so length is only a marginal issue. Two rollouts newly collapsed the process to a deterministic outcome and reported certainty or impossibility, several miscounted the total number of moves by charging one move per item instead of one per item per leg, and most still fell back on an asserted uniform-permutation shortcut for the second part. The revision keeps the symmetry warning that transferred well, forbids an unargued 0-or-1 claim without two exhibited reachable end states, states the moves = items x legs count and the last-in-first-out fact that a destination's bottom is its earliest arrival, and pushes for an early committed result."
3,7,3836,150.59,150.69,970826b6d808a016748fe1e6cda39b71098679265ead772ffa8f52eeb6eaed54,d5791c5d4416ca9b3e228253dbe8e2420e31df8f7d6b3a3040758c82d7c3a717,970826b6d808a016748fe1e6cda39b71098679265ead772ffa8f52eeb6eaed54,0.25,0.125,-0.125,0.1125,0.1375,0.02500000000000001,0.475,0.4,-0.07499999999999996,132,142,discarded,pin the n-family scaling rule up front and forbid renegotiating the setup mid-solution,"Fresh sampling scored 2 of 8; both successes came from plain elimination on n = 2, 3, 4 followed by an immediate commit to the factored pattern, while all 6 failures hit the 16384-token cap. The dominant failure was not arithmetic but repeated renegotiation of the small-case setup: rollouts kept re-deriving how many conditions the reduced instance should have, then adopted a polynomial reinterpretation that contradicted their own hand-solved case and restarted instead of trusting it. The revision therefore makes the n-family scaling rule an explicit one-time step, forbids revisiting it, and instructs the student to discard a contradicting reinterpretation rather than the verified arithmetic."
3,8,23443,150.62,150.70,149cabea90724683bc818e06d11bef6dc0c07209cfe1b68f2300dc838be4613d,c03778f3bc7724422dfb82291710466ce4ad975bf698a71f3ceda969d5c10745,149cabea90724683bc818e06d11bef6dc0c07209cfe1b68f2300dc838be4613d,1.0,1.0,0.0,0.1625,0.1375,-0.024999999999999994,1.325,1.275,-0.050000000000000044,77,138,discarded,"keep incumbent text verbatim, name gcd explicitly, and append a short domain-neutral transfer clause (fix per-unit-vs-total scope once, gcd = largest admissible count, commit then back-verify)","All 8 fresh rollouts scored reward 1 with clean stops at 2.7-5.6k tokens, so train_i is saturated at 1.0 and every remaining point of gain must come from transfer. Rounds 1 and 2 both rewrote the hint wholesale and each collapsed train (0.25 and 0.5) while transfer barely moved, so this round preserves the incumbent sentences verbatim and only appends reusable strategy. The rollouts show two concrete, repeatable stalls: 20-80 oscillations per rollout over whether a listed figure is per-unit or a collection total, and 6-24 restatements of the maximum-feasible-count clause before concluding the gcd, so I name the gcd inline and add a decide-once/commit-then-back-verify rule."
3,9,3980,150.57,150.71,2bcb5d3e6fb5734eebdd781a83717282b26d1535b8a1350660140759e3a7d0f7,3bc4a8fb988c1eb05c38ceb4f4bd0bb3b1f52a692bff540b0be46ed42b51bd06,3bc4a8fb988c1eb05c38ceb4f4bd0bb3b1f52a692bff540b0be46ed42b51bd06,0.5,0.625,0.125,0.2,0.2375,0.03749999999999998,0.9,1.1,0.20000000000000007,195,172,kept,"name the recenter-plus-antisymmetric-ansatz construction concretely, add add/subtract-the-two-given-values solve step, structural (non-expanding) verification, and an ugly-fractions abort signal with a one-switch cap","Fresh rollouts split 4/8 correct with a sharp pattern: every success terminated under 10k tokens after committing to a shared-center antisymmetric ansatz and solving the two given values by adding/subtracting them, while all four failures ran to the 16384-token cap - two after reverting to full coefficient expansion of the composition, one lost in divisor-hunting over ugly fractions, and one that reached the right ansatz but then tried to verify it by brute expansion. The revision therefore spells out the recentering construction and its two-equation solve, replaces expansion-based verification with a symmetry check, and gives an explicit abort signal plus a one-switch cap so the student stops re-deriving instead of burning the budget."
3,10,3843,150.61,150.72,95005ec62835dbef2cc6b52c26e1bc8efa75d3d939090ada63716aa06be7a5b5,ae55ce3989859ea6f512c3e2c3fa5c48cffc4b29cf1ba69ccbf46e955fbe0f0d,ae55ce3989859ea6f512c3e2c3fa5c48cffc4b29cf1ba69ccbf46e955fbe0f0d,0.375,0.25,-0.125,0.1375,0.2,0.0625,0.65,0.65,0.0,72,148,kept,"attack the premature-shortcut failure mode: force falsification of any guessed closed form against a literal small-case trace, forbid assuming period 2 from swap-shaped stages, and require exact counts at two sizes","Only 2 of 8 rollouts were correct. The dominant new failure was premature abstraction into a plausible-sounding shortcut: three finishing rollouts all asserted the process was a fixed block shift or a product of disjoint 2-cycles and therefore had period 2, without ever tracing labels far enough to falsify that claim, and the four token-capped rollouts burned the budget on symbolic index formulas after abandoning small cases. The revision therefore keeps the incumbent's concrete-trace instinct but reorients it as a falsification test on any guessed shortcut, names the swap-implies-period-2 trap explicitly, and requires exact counts at two sizes before generalizing."
4,1,28054,150.73,150.83,cbbaaafa1907efc60835e2a44f805271c9a2f4cd4fe5d3988c244caa7b7e5f7b,6419f76dc4d52b79fc8a0deba5d7ecd03475115312c18e19e259990f6a704c1d,cbbaaafa1907efc60835e2a44f805271c9a2f4cd4fe5d3988c244caa7b7e5f7b,0.25,0.125,-0.125,0.1375,0.1375,0.0,0.525,0.4,-0.125,144,128,discarded,"chain the second speaker's test through the first speaker's test, and forbid re-deriving cases that caused truncation","Fresh sampling with the incumbent hint scored 1/8 and 5 of 8 truncated at the token cap; every failure enumerated the divisor pairs, noticed each speaker's own value pins the partner within one reading, declared both readings contradictory, and then re-derived the same two cases until truncation or emitted an arbitrary divisor. The incumbent names the label ambiguity but never says the second statement must be evaluated against the first speaker's constraint, so I added that chaining rule plus an explicit ban on re-deriving a case already handled, which is what burned the budget."
4,2,30302,150.74,150.84,e926ca1d6f04d597d4b99af9d15b2597417b40fc28c3c0397d67f147cfa99917,64b0f516c4150af456f05fd043eae6476f571e240a578af063256e2ea28e9e9a,64b0f516c4150af456f05fd043eae6476f571e240a578af063256e2ea28e9e9a,0.875,1.0,0.125,0.125,0.175,0.04999999999999999,1.125,1.35,0.2250000000000001,81,155,kept,"keep the ratio/locus setup; replace round-2 circle-fitting recovery with a no-restart rule that treats a failing spot-check as arithmetic in the check, plus a symmetry shortcut and early commit","Seven of eight fresh rollouts were correct in 5k-12k tokens; the single failure derived the roots and the correct structure, then hit an arithmetic slip while solving a general-circle linear system, concluded the problem was contradictory, and burned the full 16384-token cap on ~50 self-doubt cycles without ever committing a result. Round 2 showed that appending recovery/commit discipline to the incumbent setup raised transfer sharply while its explicit circle-fitting route cost train accuracy, so I keep the setup and the discipline but redirect it: treat a conflicting spot-check as a bug in the check, recheck only that line instead of restarting, use symmetry to pin the locus rather than a large linear system, and state the simplified result before the budget runs low."
4,3,8554,150.75,150.85,e73c55e27100ae936358bb7823761096f52d3e52bbb1bf81a9e7298441eeb331,8f7191662e1d335fcd3228c9812ab2b66042a86fe092a64954cf3fb7eeaf9353,e73c55e27100ae936358bb7823761096f52d3e52bbb1bf81a9e7298441eeb331,0.5,0.375,-0.125,0.2,0.225,0.024999999999999994,0.9,0.825,-0.07500000000000007,131,133,discarded,replace open-ended parameter scanning with a bound-plus-witness optimality certificate that licenses stopping,"Four of eight rollouts were correct; all eight reached the right value very early (within the first ~4.5k characters of reasoning), and every failure was purely a truncation failure - it kept re-testing rotations (100+ mentions of rotation, 50-77 'Wait' restarts) until the 16384-token cap hit with the reasoning block still open, so nothing was graded. The incumbent's containment warning is working and is kept, but its 'commit and stop' clause gives no logical reason to stop, so the revision supplies one: a bound valid for all configurations plus a witness attaining it is a complete optimality proof, which makes further scanning provably pointless."
4,4,25003,150.76,150.86,9ad17434e90ac5fbf9203596a47b29dac7558e85f253b13129bb54f81a831763,40644c5ad3884d8dd2e32629b2968c787adfe9e53d2fb9166561d803c1e485f1,40644c5ad3884d8dd2e32629b2968c787adfe9e53d2fb9166561d803c1e485f1,0.25,0.625,0.375,0.225,0.1625,-0.0625,0.7,0.95,0.25,177,189,kept,recast the cap as a pointwise root condition on one shared affine target; dissolve the same-piece consecutive-difference identity and justify why the disjoint root budgets add to the asked-for length,"Of 8 fresh rollouts only 1 was correct: two hit the 16384-token limit, three declared the task impossible or nearly so by forcing a single piece's own consecutive difference to be constant, and one answered the interpolation point count instead. Most tellingly, one rollout derived the summed per-piece budget and then rejected it because the pattern is a single progression rather than several, so the revision replaces the same-piece difference identity with a pointwise root condition on one shared affine target and states why the disjoint root budgets add to the quantity requested."
4,5,30418,150.77,150.87,83c896bc82082c6ed4cb8791f9d2a555f90a25b05e0dc438a5532b3b8a6282c8,1039fe19deec2f56c5ce10d9aabf74936beb1b44df4f55a2eacc1ed0ca7ea829,83c896bc82082c6ed4cb8791f9d2a555f90a25b05e0dc438a5532b3b8a6282c8,0.875,0.375,-0.5,0.175,0.15,-0.024999999999999994,1.225,0.675,-0.55,63,106,discarded,"replace vague cross-check clause with confirm-constants-early plus a no-guessing, no-restart token-budget rule","Six of eight fresh rollouts were correct in 8-10k tokens; both failures were identical budget deaths at the 16384 cap with finish_reason length, never reaching an area at all. One derived the constants wrongly and only recovered near the cap; the other declared the system unsolvable and burned the remainder substituting guessed numeric values. The incumbent's 'verify with a second, different method' clause invites exactly that extra pass, so I traded it for confirming the constants immediately after solving for them and an explicit ban on numeric guessing and restarting, which targets non-termination generically rather than this setup."
4,6,26989,150.78,150.88,45b2c0df517f87901f5a1ad921b228f3059ad2ca08158d9c5eb6939a11ecf4b4,0c7aee72f2faf607792938b8a1024425a40b808664e635aa0864bfeb7d7cd997,45b2c0df517f87901f5a1ad921b228f3059ad2ca08158d9c5eb6939a11ecf4b4,0.125,0.0,-0.125,0.2125,0.125,-0.0875,0.55,0.25,-0.30000000000000004,200,200,discarded,add asserted-determinism (0/1) trap and a one-sample-space rule; name the 'remaining k equally likely to move last' shortcut explicitly,"Fresh sampling with the incumbent scored 0/8; seven rollouts terminated normally at 11k-16k tokens and one hit the cap while dithering, so length is only marginal. The second part failed in three recurring ways: two rollouts declared the whole process deterministic and reported certainty or impossibility, four fell back on an asserted 'each of the remaining items is equally likely to be moved last' shortcut giving 1/n or 1/(n-1), and one divided a permutation count by a branch-sequence count. The revision therefore names asserted determinism as a second trap alongside asserted symmetry, calls out the 'equally likely to move last' variant by name, keeps the pin-mechanics and free-versus-forced 1/2 machinery that transferred well in earlier rounds, and adds a same-sample-space check on the ratio."
4,7,3836,150.79,150.89,970826b6d808a016748fe1e6cda39b71098679265ead772ffa8f52eeb6eaed54,1223caf49db1e29b027539ab6c3d26a6f21a2251b15bfccca3f51467b3abc2fa,970826b6d808a016748fe1e6cda39b71098679265ead772ffa8f52eeb6eaed54,0.25,0.125,-0.125,0.1125,0.1,-0.012499999999999997,0.475,0.325,-0.14999999999999997,132,145,discarded,add off-by-one repair rule for degenerate small cases plus evaluate-don't-expand coefficient extraction,"Fresh sampling scored 2 of 8; the 6 failures all hit the token cap, and every one of them stalled at the same place: setting up the reduced instance. They wrote a small case with one condition too many or too few, got a redundant or inconsistent tiny system, then spent thousands of tokens debating whether a solution existed instead of fixing the index range. Two failures additionally burned the remaining budget expanding a long product term by term to extract a single low-order coefficient and kept getting contradictory values, so the revision adds an explicit off-by-one repair rule and tells the student to get that coefficient by evaluating or differentiating at a convenient point rather than expanding."
