round,hint_id,train_qid,sampling_slurm_job_id,proposal_eval_slurm_job_id,incumbent_hash,proposal_hash,final_hash,old_train,new_train,delta_train,old_heldout,new_heldout,delta_heldout,old_J,new_J,delta_J,old_tokens,new_tokens,decision,mutation,subagent_summary
8,3,8554,150.156,150.166,e73c55e27100ae936358bb7823761096f52d3e52bbb1bf81a9e7298441eeb331,bc6433e44f38dc9b22298446fc340ddf28574ce81389297687ad41177dc08fe9,e73c55e27100ae936358bb7823761096f52d3e52bbb1bf81a9e7298441eeb331,0.5,0.375,-0.125,0.2,0.125,-0.07500000000000001,0.9,0.625,-0.275,131,167,discarded,make the symmetry step self-checking (confirm the slice fraction by counting the n congruent copies that tile the region) and replace open-ended scanning with a bound-plus-witness certificate,"Four of eight rollouts scored. The incumbent's wedge/anti-containment warning is working, but two failures jumped straight to an axis-aligned configuration and reported a slice fraction that was too large by a factor, then jointly reasoned the overlap wrong; the other two never reached a visible result because they kept re-deriving the setup and re-scanning rotations until the token cap. So the revision keeps the wedge and n-fold-symmetry core but makes the symmetry step verify its own fraction by counting the congruent rotated copies that tile the region, and replaces the bare stop instruction with a bound-plus-witness certificate that logically justifies halting."
8,4,25003,150.157,150.167,40644c5ad3884d8dd2e32629b2968c787adfe9e53d2fb9166561d803c1e485f1,79c2cf2694ad3184cc169433c18cfeef40c24cc249cc44d93e4f1d0cb0c9c999,40644c5ad3884d8dd2e32629b2968c787adfe9e53d2fb9166561d803c1e485f1,0.625,0.0,-0.625,0.1625,0.25,0.0875,0.95,0.5,-0.44999999999999996,189,188,discarded,name the residual explicitly and forbid the word difference; state that a candidate may serve many indices so the candidate count is never the answer,"Only 2 of 8 fresh rollouts were correct. Five of the six failures answered the number of available objects, each first asserting that every progression term needs its own distinct object, and one explicitly misread the hint by calling the constant step a zero-degree difference with no roots; a sixth reached the summed per-object budget and then collapsed it to a single object cap. The revision therefore renames the key quantity the residual and bans the word difference for it, and states plainly that one object may serve many indices so the object count on hand is never the count requested."
8,5,30418,150.158,150.168,83c896bc82082c6ed4cb8791f9d2a555f90a25b05e0dc438a5532b3b8a6282c8,7496d494abde98c93755f70a521ced021e5afcfaff9d3735773efcbd68effe2e,83c896bc82082c6ed4cb8791f9d2a555f90a25b05e0dc438a5532b3b8a6282c8,0.875,0.5,-0.375,0.175,0.0875,-0.0875,1.225,0.675,-0.55,63,107,discarded,"replace the vague second-method check with a one-number test of where an absorbed multiplicative factor belongs, plus recompute-dependent-coordinates-from-the-relation","Only 3 of 8 fresh rollouts were correct: 3 hit the 16384-token cap mid-reduction and 2 terminated but wrong. Every failure traced to the same step -- moving an additive constant across the logarithm as a multiplicative factor on the wrong side -- which produced a different quadratic and then either a no-real-root contradiction that consumed the remaining budget or a plausible-looking wrong pair of vertices. One near-miss reduced correctly but then carried a given point's ordinate over to a new vertex instead of recomputing it from the function. So I replaced the incumbent's unspecific 'verify with a second, different method' clause, which rollouts satisfied cheaply without ever catching this slip, with a concrete one-number test of which side the absorbed factor belongs on, plus an instruction to recompute dependent coordinates from the defining relation. I kept the hint terse: every longer rewrite in rounds 1-7 lost transfer against this incumbent."
8,6,26989,150.159,150.169,605dd6784c9f1f6f9bb9f5068b8e9744aad3781c1b1d0e9028b48e9692b555e2,9e234289042c9f9535cc29bc5686714d664eeb471f7be4b4710ea2a55a84a869,605dd6784c9f1f6f9bb9f5068b8e9744aad3781c1b1d0e9028b48e9692b555e2,0.25,0.125,-0.125,0.1625,0.1625,0.0,0.575,0.45,-0.12499999999999994,182,194,discarded,"turn 2^(free) into a divisibility filter that rejects any 1/n or 1/n! denominator, and route which-item-in-slot-k parts through a short move PREFIX instead of full-history enumeration","Fresh sampling with the incumbent gave 1/8; six rollouts terminated normally at 10k-16k tokens and two hit the cap while dithering, so length is secondary. Five of the eight reached the free-choice atom count on the first part and then abandoned that sample space on the later part, asserting every item is equally likely in every slot and reading off 1/n, while two never left the uniform-permutation framing at all. The revision therefore reuses the shared 2^(free) atom set as an explicit divisibility check that flags 1/n and 1/n! as proof of a false assumption, and gives a cheaper alternative to full enumeration by pinning a slot-occupancy event to a short prefix of steps whose free branches are the only ones priced."
8,7,3836,150.160,150.170,970826b6d808a016748fe1e6cda39b71098679265ead772ffa8f52eeb6eaed54,47e3f3cf1401f2e2f5cd0fd07b7bc5880a4b255fb9813c0669b032b25e01ee52,970826b6d808a016748fe1e6cda39b71098679265ead772ffa8f52eeb6eaed54,0.25,0.0,-0.25,0.1125,0.1375,0.02500000000000001,0.475,0.275,-0.19999999999999996,132,170,discarded,"reframe as isolate-one-unknown-by-annihilation with a one-time notation contract, demoting small cases to a convention check","Fresh sampling under the incumbent scored 2 of 8, and all six failures ran to the 16384-token cap. The visible sink was not arithmetic difficulty but the incumbent's small-case-first framing itself: rollouts spent thousands of tokens renegotiating how many conditions the shrunken instance should carry, then let one symbol stand for both the summation index and the exponent, discovered the mismatch, and oscillated between readings while re-solving the same tiny system with different arithmetic each pass. The revision therefore leads with a transferable technique -- isolate the requested unknown by finding a combination that annihilates the rest -- pins the index-versus-exponent naming as a one-time contract, and demotes small cases to a single settled check for signs and off-by-one conventions so the budget goes to committing a result."
8,8,23443,150.161,150.171,149cabea90724683bc818e06d11bef6dc0c07209cfe1b68f2300dc838be4613d,8a6dfd748e0553b9accc3ad13afe0c4aa08f94103b64259ab984bac22622e13d,8a6dfd748e0553b9accc3ad13afe0c4aa08f94103b64259ab984bac22622e13d,1.0,1.0,0.0,0.1625,0.2,0.037500000000000006,1.325,1.4,0.07499999999999996,77,130,kept,"keep the train-preserving opening verbatim, drop the unused integrality/units tail, and replace it with a domain-neutral small-cases/invariant plus exact-arithmetic heuristic instead of more divisibility or scope advice","All 8 fresh rollouts scored reward 1 with clean stops at 2.7-6.9k completion tokens, so train_i is saturated at 1.0 and every remaining point of J must come from transfer. Across seven rounds every append or rewrite that talked about scope labeling, gcd naming, or anti-rumination lost transfer ground while any change to the opening sentences collapsed train, and the one variant that merely deleted the unused integrality/units tail held transfer flat, which suggests the tail slot is free but that more divisibility/verification talk is off-topic for problems unlike this one. So this round keeps the opening verbatim and spends that slot on a genuinely different reusable lever the traces never exercise: reduce to small cases and extract the pattern or invariant instead of grinding a long computation, keep values exact until the end, and commit to a stated result before spending further tokens."
8,9,3980,150.162,150.172,652ee8dc58008e69bb7e90163e071e0708bc579422e2fd3d5a546ca1fb63ccad,8a56d4558e6f18faae62f9ca948b75f9656e50931604d92606df35ea4b7cc4ff,652ee8dc58008e69bb7e90163e071e0708bc579422e2fd3d5a546ca1fb63ccad,1.0,0.875,-0.125,0.25,0.1875,-0.0625,1.5,1.25,-0.25,180,180,discarded,"block the two observed exits from the centered form: stopping at a mere relation between the maps and then hunting extra equations, and re-expanding the solved centered form into standard powers to substitute","Only 3 of 8 fresh rollouts were correct this round, with four running to the 16384-token cap and one terminating wrong, and the failures share a single shape: each reached the shared-center antisymmetric structure but then left it. Two collapsed it into a bare relation between the two maps, declared the remaining coefficients under-determined, and burned the budget hunting extra equations via full coefficient expansion of the composition; one rewrote the already-solved centered form into standard powers and re-added the given constant that the center already encodes, producing a wrong component. The revision therefore names both exits explicitly, asserts that fixing the center and scale finishes the problem, and requires requested inputs to be evaluated inside the centered form rather than after re-expansion."
8,10,3843,150.163,150.173,dd96dfb992052dea62ab2214a4d147f14aa95c0c6f35b1224c4d06d84cf346cb,66ba8a07b03a7a3021b10cba636c23e75c5cf8380c203638b5c67f75fdd0291c,dd96dfb992052dea62ab2214a4d147f14aa95c0c6f35b1224c4d06d84cf346cb,0.625,0.375,-0.25,0.1625,0.15,-0.012500000000000011,0.95,0.675,-0.2749999999999999,178,172,discarded,"name the degenerate-small-case trap (equal answers at the two smallest sizes is coincidence, push to the first size where stages differ) and make a contradicting trace kill a structural claim immediately","4 of 8 rollouts scored. All four failures converged on the same wrong claim, that the composite is a product of disjoint transpositions and so has period two; two of them asserted it confidently and finished, and the two token-capped ones saw their own row traces refute period two yet kept relitigating the structural claim instead of trusting the trace. Every failure was seeded by the two smallest sizes coincidentally sharing the same return count, which the incumbent already treats as a clean pattern to trust, so the revision names that degeneracy, forces a push to the first size where the stages genuinely differ, and makes a contradicting trace kill a structural claim outright."
9,1,28054,150.174,150.184,fda1791300f21976dd72f9eebe700de3cfaba1edb06bf4fc0339ea25871f6960,1dcc9c6ac5f9ba5eeb7069956f7599027c6c8b5a1ac67ca2583ba0690ec8f0bd,fda1791300f21976dd72f9eebe700de3cfaba1edb06bf4fc0339ea25871f6960,0.25,0.125,-0.125,0.1875,0.15,-0.037500000000000006,0.625,0.425,-0.2,170,172,discarded,diagnose all-candidates-refuted as an over-narrow list and require checking the degenerate equal/extremal case; ban reporting an already-refuted value,"Fresh sampling with the incumbent scored 1/8; every rollout burned 14k-16.4k tokens and 2 truncated. Seven failures built only the factor-pair list of the displayed number, applied it to both readings, refuted every pair, and then reported one of those refuted factors anyway (or a value they called recalled or intended). The lone success was the only rollout that considered the balanced split into two equal parts, a candidate no factor list can reach. So I replaced the incumbent intersect-across-readings clause with a generic diagnosis: all-candidates-refuted means the list was too narrow, and the equal-or-extremal degenerate case must be added and checked. I also hardened the ban to cover reporting an already-refuted value and added a restatement tripwire to cut the token burn."
9,2,30302,150.175,150.185,64b0f516c4150af456f05fd043eae6476f571e240a578af063256e2ea28e9e9a,d4e3c82d127a97a23ded4e4ecb1613caaeff80b3563e31f696ef5bb412580bca,64b0f516c4150af456f05fd043eae6476f571e240a578af063256e2ea28e9e9a,1.0,0.875,-0.125,0.175,0.15,-0.024999999999999994,1.35,1.175,-0.17500000000000004,155,175,discarded,swap the incumbent's symmetry-axis circle shortcut for a representation rule: impose a pinned magnitude as one direct algebraic equation instead of parametrizing by an angle and eliminating trig,"All eight fresh rollouts were correct, so train is saturated at 1.0 while transfer sits at 0.175; length is where the evidence lives. Six finished in 5.7k-8.2k tokens by imposing the magnitude condition as a single algebraic equation in the coordinates, but the outlier ran to 14.6k because it parametrized by an angle and then fought to eliminate the trig, deriving three mutually inconsistent expressions for the cosine and spending thousands of tokens reconciling them before recovering. Rounds 5-8 all tried to manage or repair that self-contradiction loop after it starts and all lost transfer, so I instead remove the representation choice that creates it, and drop the seldom-used symmetry-axis clause to pay for the words."
9,3,8554,150.176,150.186,e73c55e27100ae936358bb7823761096f52d3e52bbb1bf81a9e7298441eeb331,a69022206f815aa610531eaf90a55d289cb8cba855d7fdd86219bae38ef15efe,a69022206f815aa610531eaf90a55d289cb8cba855d7fdd86219bae38ef15efe,0.5,0.625,0.125,0.2,0.2,0.0,0.9,1.025,0.12499999999999989,131,146,kept,diagnose the real truncation cause: replace the symmetry-wedge clause with a bound-plus-witness stop reason and a rule to transcribe (not re-derive) the settled numbers in the visible write-up,"Four of eight rollouts scored. Every failure was pure truncation, not a math error: all four reached the correct value inside the first ~4-7k of ~55-63k characters, then burned 100+ rotation re-tests and 50-82 restarts. Decisively, three of the four had already closed reasoning and were mid-way through a fresh from-scratch write-up (restating the problem, re-deriving the union identity, recomputing the overlap) when the cap hit, so the value never became visible; a fourth was cut off inside its own result markup. The incumbent's symmetry clause is spent, so this trims it and buys two things: a logical licence to halt (a universal bound plus an attaining configuration is already a proof), and an explicit instruction to transcribe the settled numbers rather than re-derive them after reasoning ends."
9,4,25003,150.177,150.187,40644c5ad3884d8dd2e32629b2968c787adfe9e53d2fb9166561d803c1e485f1,2f7b2098363b9a53549fa724b1dc1c9431fbed1120452254cacf4f6a7a8218ff,2f7b2098363b9a53549fa724b1dc1c9431fbed1120452254cacf4f6a7a8218ff,0.625,0.875,0.25,0.1625,0.1375,-0.024999999999999994,0.95,1.15,0.19999999999999996,189,194,kept,split the per-piece root cap from the whole-pattern cap and add a use-every-given-number audit against answering only the degree or only the piece count,"3 of 8 fresh rollouts were correct. Every failure that finished mis-sized the cap in the same two ways: two applied the degree-d root bound to the entire pattern and reported the bare degree, and one insisted each term needs its own distinct object so answered the object count; two more truncated at the token limit while relooping on whether one object can step by a constant. The three successes all reached the summed disjoint-root budget. So the revision keeps the pointwise-residual and false-demand language that is clearly working and sharpens exactly the collapse point: it states that the degree-d bound caps ONE piece and not the pattern, and adds a short audit that the reported count must use every quantity the problem supplied, flagging a lone degree or a lone piece count as a dropped factor."
9,5,30418,150.178,150.188,83c896bc82082c6ed4cb8791f9d2a555f90a25b05e0dc438a5532b3b8a6282c8,69ebb1dc78d1975711028d73f63543fa35630f76f61be8a6fd7d776fede4b09c,83c896bc82082c6ed4cb8791f9d2a555f90a25b05e0dc438a5532b3b8a6282c8,0.875,0.75,-0.125,0.175,0.125,-0.04999999999999999,1.225,1.0,-0.2250000000000001,63,96,discarded,"make the cross-check terminal: agreement freezes the value, later disagreement is the pass at fault, and ban speculating an intended value","Five of eight fresh rollouts were correct. The most diagnostic failure had already reached the right value and cross-checked it by two routes, then re-derived it during write-up, botched one shoelace sign, and overrode its own confirmed result. The two other failures both hit the 16384-token cap: each reached a no-real-root contradiction, then spent the remaining budget guessing what value the problem 'must' intend instead of repairing the single bad rewrite. The incumbent's 'verify with a second, different method' clause is satisfied but has no stopping power, so I made confirmation terminal (agreement freezes the value; a later disagreeing pass is the error) and banned speculating about an intended value. This targets both self-override and budget death generically, and stays terse, since every rewrite above 100 tokens has lost transfer here."
9,6,26989,150.179,150.189,605dd6784c9f1f6f9bb9f5068b8e9744aad3781c1b1d0e9028b48e9692b555e2,80481592530c062c239dfb2d2332b47de5dff526a57a940eed6ec83b0b001016,605dd6784c9f1f6f9bb9f5068b8e9744aad3781c1b1d0e9028b48e9692b555e2,0.25,0.0,-0.25,0.1625,0.2,0.037500000000000006,0.575,0.4,-0.17499999999999993,182,189,discarded,"name the uniform-random-permutation phrase as the trap (many-to-one step sequences, unreachable orderings) and make small-case enumeration a veto over any formula","Fresh sampling with the incumbent gave 1/8; six rollouts stopped normally at 9k-15k tokens and two hit the cap while relitigating, so length is secondary. Seven of the eight reached the 2^(free) atom count on the first part, then abandoned that sample space on the later part and asserted the outcome was a uniform random permutation, reading off 1/n; several equated the requested bottom slot with the item moved last, and two explicitly computed a small case that contradicted 1/n yet kept 1/n anyway. The revision therefore names the uniform-random-permutation phrase as the trap, adds that many step sequences collapse to one ordering and some orderings are unreachable, keeps the shared free-choice atom set and the last-in-first-out orientation, routes slot-occupancy events through a short prefix, and makes a small-case enumeration a veto that overrides any formula."
9,7,3836,150.180,150.190,970826b6d808a016748fe1e6cda39b71098679265ead772ffa8f52eeb6eaed54,624bd880b5b94320846e50c68a8c4de3ea35b048ba853273064bcd1c17d0a2db,624bd880b5b94320846e50c68a8c4de3ea35b048ba853273064bcd1c17d0a2db,0.25,0.125,-0.125,0.1125,0.175,0.062499999999999986,0.475,0.475,0.0,132,168,kept,"front-load commit-then-verify, add deviant-entry arithmetic recheck and evaluate-don't-expand coefficient extraction","Fresh sampling under the incumbent scored 1 of 8; the seven failures all ran to the 16384-token cap without stating any result. Three distinct sinks were visible: one rollout wrote the reduced instance with a wrong power, produced an off-pattern rational, and never questioned that single arithmetic slip; two abandoned already-verified small cases to compute one low-order coefficient of a 2004-factor product via elementary symmetric and harmonic sums, then looped on sign errors; another oscillated over how many conditions the shrunken system carries after letting one symbol be both index and exponent. The lone success committed to the signed factorial shape after two exact small cases. The revision therefore leads with commit-then-verify, routes a deviant table entry to an arithmetic recheck rather than a new theory, and forbids expanding a long product to read off a coefficient."
9,8,23443,150.181,150.191,8a6dfd748e0553b9accc3ad13afe0c4aa08f94103b64259ab984bac22622e13d,2246b9ea8c67515f5197a75646546b66396451d208578f85b38f454b664db5ac,8a6dfd748e0553b9accc3ad13afe0c4aa08f94103b64259ab984bac22622e13d,1.0,1.0,0.0,0.2,0.175,-0.025000000000000022,1.4,1.35,-0.04999999999999982,130,160,discarded,"keep the train-safe opening and small-cases clause verbatim; upgrade the exact-arithmetic sentence to also prescribe factoring out common structure and choosing a fraction-clearing scaling, and make the closing check a substitute-back-into-the-givens check instead of a bare recheck","All 8 fresh rollouts scored 1, so train is saturated and every gain must come from transfer. Round 8's kept edit (small-cases/invariant plus exact arithmetic) is the only mutation in nine rounds that raised transfer, while five wholesale rewrites or scope/divisibility additions each cut train or transfer, so I again preserve the train-carrying opening verbatim and only sharpen the general tail. Rollouts remain very long (10k-21k chars, 32-69 adversative pivots each) and the visible waste is arithmetic churn plus self-rereading: the student recomputes the same divisor and per-unit quantities many times and audits its own prior lines instead of the problem statement. So the tail now prescribes two concrete, domain-neutral economies: factor out common structure and rescale to clear fractions before grinding, and close by substituting back into the given numbers."
