round,hint_id,train_qid,sampling_slurm_job_id,proposal_eval_slurm_job_id,incumbent_hash,proposal_hash,final_hash,old_train,new_train,delta_train,old_heldout,new_heldout,delta_heldout,old_J,new_J,delta_J,old_tokens,new_tokens,decision,mutation,subagent_summary
12,10,3843,150.243,150.253,dd96dfb992052dea62ab2214a4d147f14aa95c0c6f35b1224c4d06d84cf346cb,a85d1d45dd725b878782e2ccb5a8e656fa26ee9c4c72133bd6da1a571cbf219c,dd96dfb992052dea62ab2214a4d147f14aa95c0c6f35b1224c4d06d84cf346cb,0.625,0.375,-0.25,0.1625,0.1375,-0.024999999999999994,0.95,0.65,-0.29999999999999993,178,169,discarded,"ban the permutation/cycle-type translation outright and make row-by-row iteration the only sanctioned method; name reading one pass as position pairs (hence period 2) as the specific trap, and add an anti-loop exit","Only 1 of 8 scored and 5 hit the 16384-token cap. Every failure did the same thing: it correctly rewrote the row for the smallest sizes, then translated that single pass into a table of position pairs, called the composite a product of disjoint transpositions, and concluded period 2 or an exponent one too small. Three then spent thousands of tokens in visible loops ('this is confusing', 'is it a 3-cycle? no, a 2-cycle?') trying to reconcile self-contradictory index maps against their own rows. The incumbent tells the student to trace concretely and warns swap-shaped stages need not have period 2, yet the student still abandons the row for cycle vocabulary the moment one pass finishes. The revision therefore forbids the permutation translation entirely, makes repeated passes the only evidence of a return, and gives an explicit exit when repetition starts."
13,1,28054,150.254,150.264,fda1791300f21976dd72f9eebe700de3cfaba1edb06bf4fc0339ea25871f6960,c96a30c737d0ed4fe76566d7a4497c527907d41206e1c913ddf513133154d833,fda1791300f21976dd72f9eebe700de3cfaba1edb06bf4fc0339ea25871f6960,0.25,0.0,-0.25,0.1875,0.1375,-0.04999999999999999,0.625,0.275,-0.35,170,172,discarded,lead with algebra-over-enumeration and add a no-second-guessing rule: a candidate that already passed every condition must not be discarded on a vague later objection,"Fresh sampling with the incumbent scored 0/8; two rollouts died at the token cap mid-enumeration, and the other six ground through case lists then reported a value their own text had just called impossible. The decisive new evidence: one rollout constructed the equal-split symmetric pair, said it satisfied the constraints, then abandoned it on a hand-waved objection and reported something else. So the incumbent's ban on false assumptions is not the binding failure any more -- self-sabotage after a correct check is. I replaced the branch-intersection language with (a) solve constraints simultaneously rather than walking cases, (b) apply each constraint to both members so the symmetric candidate surfaces early, and (c) once a candidate survives every condition, keep it and audit the objection instead."
13,2,30302,150.255,150.265,64b0f516c4150af456f05fd043eae6476f571e240a578af063256e2ea28e9e9a,2e550a4ab5ddede32b7c6cedb18ddf270ba420037782f08c452f2209152dbb67,64b0f516c4150af456f05fd043eae6476f571e240a578af063256e2ea28e9e9a,1.0,1.0,0.0,0.175,0.1625,-0.012499999999999983,1.35,1.325,-0.025000000000000133,155,170,discarded,"replace the target/form-specification clause with a route-switching trigger: name the concrete symptoms of ballooning algebra and the cheaper equivalent conditions (moduli, symmetry, degree comparison) to switch to","Seven of eight fresh rollouts were correct at 4.6k-10k tokens each; the single failure was the only one to hit the 16384 cap. It took the parametrize-by-angle route, carried x and y as ratios in cos(theta), and produced a degree-4 mess it could not reduce, then burned the rest of the budget re-verifying sample points and repeatedly declaring the setup impossible. Every winner instead noticed the pinned modulus and reduced the whole problem to one small equation in x and y. Prior rounds already tried tuning the recheck loop and pre-specifying the requested form without gains, so I targeted the earlier decision point: name the symptoms of ballooning algebra as a trigger to switch to a cheaper equivalent condition rather than grinding the expensive route."
13,3,8554,150.256,150.266,a69022206f815aa610531eaf90a55d289cb8cba855d7fdd86219bae38ef15efe,552399db595a487e42f6a3b467b1e55d8a70567c97573f5a34f4ac14de74978e,a69022206f815aa610531eaf90a55d289cb8cba855d7fdd86219bae38ef15efe,0.625,0.375,-0.25,0.2,0.15,-0.05000000000000002,1.025,0.675,-0.34999999999999987,146,168,discarded,"replace the abstract bound-plus-witness stop licence with a finite-regime enumeration criterion that makes further parameter sampling provably uninformative, and move the combining arithmetic ahead of any setup recap in the write-up","Only 2 of 8 scored, both by a short write-up that reached the combining step. No failure was mathematical: 7 of 8 held the right overlap inside the first 3-7k of ~52-62k characters, then spent 98-182 rotation re-tests and 45-79 restarts. Four never closed reasoning at all. The two decisive cases did close it but opened with a full setup recap plus multi-heading preamble and were truncated one line short of combining the numbers; one even wrote the correct minimal overlap and then hedged that rotation might reduce it further. So the incumbent's certify clause is too abstract to fire against continuous rotation. This revision gives a concrete, checkable halting test (a continuous parameter has finitely many regimes; once each is named and sampled, more values cannot inform) and orders the write-up so the arithmetic precedes any recap."
13,4,25003,150.257,150.267,2f7b2098363b9a53549fa724b1dc1c9431fbed1120452254cacf4f6a7a8218ff,a1195db8cbc63a285dfb8112c002dedf87e96103a5b715d268381337f3ce5abf,2f7b2098363b9a53549fa724b1dc1c9431fbed1120452254cacf4f6a7a8218ff,0.875,0.5,-0.375,0.1375,0.125,-0.012500000000000011,1.15,0.75,-0.3999999999999999,194,194,discarded,"state that reuse is permitted unless forbidden, and add a trust-the-derived-product directive against retreating from a bound that looks larger than the given numbers","Fresh 8 rollouts with the incumbent scored 3/8. Two failures argued each polynomial could serve only one called number and answered with the polynomial count; two more computed the per-piece root cap one too low and reported that smaller product; one truncated after explicitly writing the correct product but calling it ""too large"" and hunting for a smaller intended value. So the residual-degree audit already in the hint is not the binding leak - the leaks are an invented single-use restriction and a refusal to keep a bound that looks bigger than the numbers in the statement. The revision states that reuse is permitted unless the problem forbids it, keeps the per-piece root cap, and adds an explicit instruction to trust the derived product rather than retreat to a rounder or smaller value."
13,5,30418,150.258,150.268,83c896bc82082c6ed4cb8791f9d2a555f90a25b05e0dc438a5532b3b8a6282c8,2b5ce33046e871dc5060ec87e8093bc1ed2ddab237247abaf5fc824156aca424,83c896bc82082c6ed4cb8791f9d2a555f90a25b05e0dc438a5532b3b8a6282c8,0.875,0.75,-0.125,0.175,0.15,-0.024999999999999994,1.225,1.05,-0.17500000000000004,63,113,discarded,"make root screening concrete (substitute into the stated domain condition, not a remembered interval) and add a reversal rule when only a degenerate root survives","Seven of eight fresh rollouts were correct at about 9k tokens; the one failure got the right reduced quadratic and both roots, then mis-screened them from a remembered domain interval, threw away the admissible negative-fraction root, kept the root that makes two named points coincide, and reported a collapsed figure as the value. Every correct rollout instead recognized that root as degenerate and took the other. So the incumbent clause ""discard roots that are degenerate or outside the domain"" is exactly what backfires: applied from memory it can eliminate the wanted root. I made screening concrete (substitute the number into the stated condition) and added a reversal rule: a degenerate or trivial outcome means the screening was wrong, so restore the other root rather than reporting the collapse."
13,6,26989,150.259,150.269,605dd6784c9f1f6f9bb9f5068b8e9744aad3781c1b1d0e9028b48e9692b555e2,7bd47787b8912e8f11fc63e5258291951a02bb8f37fd33c91ff591fc1ea8ba72,605dd6784c9f1f6f9bb9f5068b8e9744aad3781c1b1d0e9028b48e9692b555e2,0.25,0.25,0.0,0.1625,0.15,-0.012500000000000011,0.575,0.55,-0.02499999999999991,182,194,discarded,"require the asked-slot paraphrase to be validated against one simulated concrete run before any counting, instead of merely stating the arrival-order fact","Fresh sampling with the incumbent gave 0/8, down from 0.25 two rounds ago; six of eight rollouts finished normally, so length is not the block. Part (a) is now largely solved: five rollouts derived the correct branch-count denominator from free 50/50 steps. Every single failure was the second part, and always the same one: the student verbally restates the asked slot as ""the item handled last"", then prices that as 1/n by asserted symmetry. Prior hints stated the arrival-order orientation fact declaratively and the student read past it. This revision instead makes the restatement itself a checkable step: simulate one concrete run, write the destination out in arrival order, and confirm which item occupies the asked slot before any counting begins, and forbids pricing a named-item-in-named-slot event as 1/n."
13,7,3836,150.260,150.270,624bd880b5b94320846e50c68a8c4de3ea35b048ba853273064bcd1c17d0a2db,6bac2fd42e26d50953594b182de87d09a590cdce20b2bd3acfc1d37ebcbb151b,624bd880b5b94320846e50c68a8c4de3ea35b048ba853273064bcd1c17d0a2db,0.125,0.0,-0.125,0.175,0.1125,-0.062499999999999986,0.475,0.225,-0.24999999999999997,168,181,discarded,"add free-parameter diagnostic: an unpinnable constant means an unused given, and block the insufficient-data / set-to-zero exits","Fresh sampling under the incumbent scored 2 of 8. Both successes solved the three smallest instances exactly, read off the signed reciprocal-factorial pattern, and landed. All six failures instead posited a general product-times-linear-factor form with two unspecified constants and tried to pin both from the single non-vanishing condition: five ran to the token cap looping on that, several explicitly concluded there was an infinite family or insufficient data, one forced a constant to zero and gave a wrong value, and the one that terminated dropped a legitimate constraint and landed just off. The revision keeps commit-then-verify and small-instance grounding, but adds the missing diagnostic: a leftover free parameter means an unused given (an absent term, a degree bound, or a value at a special point), and blocks both the insufficient-data and set-it-to-zero exits."
13,8,23443,150.261,150.271,8a6dfd748e0553b9accc3ad13afe0c4aa08f94103b64259ab984bac22622e13d,47a8dc10e45e97cc3566dd12d784d1d6d0122f75f1e6fc0ec22c06636a61df6d,8a6dfd748e0553b9accc3ad13afe0c4aa08f94103b64259ab984bac22622e13d,1.0,1.0,0.0,0.2,0.1125,-0.08750000000000001,1.4,1.225,-0.17499999999999982,130,158,discarded,"keep the train-safe opening and small-cases clause verbatim; replace the never-exercised exact-fractions clause with an arithmetic-reliability rule (recompute each product/quotient/factorisation by a second decomposition, magnitude plausibility check)","All 8 fresh rollouts scored reward 1 with clean stops at 3.0-6.0k tokens, so train is saturated and every gain must come from transfer; twelve rounds of scope-labeling, gcd-naming, representation-switching, output-form and uniqueness-forcing edits all failed, and the incumbent's exact-fractions clause is never exercised (no rollout keeps anything as a fraction). What the rollouts actually do is heavy integer work: 11-29 divisor/gcd mentions each, factorisations redone repeatedly, and 5-23 self-interruptions that are almost all arithmetic re-verification rather than strategy doubt. So I swapped the dead clause for the reliability habit the student is already improvising: recompute each multi-digit product, quotient or factorisation by a second decomposition and sanity-check magnitude. Token count 158, measured with the pinned tokenizer."
13,9,3980,150.262,150.272,652ee8dc58008e69bb7e90163e071e0708bc579422e2fd3d5a546ca1fb63ccad,670a8fc2e3a15f7371cde551ae963b0247071e58c3a4435288f7091287ad8bf1,652ee8dc58008e69bb7e90163e071e0708bc579422e2fd3d5a546ca1fb63ccad,1.0,1.0,0.0,0.25,0.2125,-0.037500000000000006,1.5,1.425,-0.07499999999999996,180,179,discarded,"state the add-step outcome constructively (c is half the sum of the two given numbers) so the numbers cannot be zeroed, name a degenerate center as a sign slip, and reinvest the compressed opening in generic output discipline (exact values, requested form and order)","Seven of eight fresh rollouts were correct, finishing in 4.5k-13k tokens by committing to the shared-center antisymmetric pair and solving the two supplied values by sum and difference. The lone failure reached that exact form immediately, then added the two values as if their right-hand sides were zero, obtained a center of zero, and read that as refutation; it next manufactured a parity objection by dropping the outer sign, and spent the rest of the budget naming coefficients and expanding the degree-nine composition. The revision therefore replaces the passive 'adding must cancel' phrasing with the constructive outcome that the center is half the sum of the two given numbers, so those numbers cannot be discarded, labels a degenerate center a sign slip, and spends tokens freed by compression on guidance that fires on any problem: keep values exact and report precisely what was asked."
13,10,3843,150.263,150.273,dd96dfb992052dea62ab2214a4d147f14aa95c0c6f35b1224c4d06d84cf346cb,1b464dd9d32a5cf196af5c78291d8370f02119ff0ef65136733f3d14269dff84,dd96dfb992052dea62ab2214a4d147f14aa95c0c6f35b1224c4d06d84cf346cb,0.625,0.25,-0.375,0.1625,0.2,0.037500000000000006,0.95,0.65,-0.29999999999999993,178,172,discarded,"ban whole-map construction and replace it with following one single label until it returns, keeping the untraced-disjoint-swaps warning and adding an item-count scaling expectation","3 of 8 correct. Two clean failure modes. One rollout asserted ""a product of disjoint transpositions, so the order is 2"" and answered without ever iterating; three more abandoned row tracing to build an explicit position map, produced non-bijective garbage (one index sent to two places), then burned the 16384-token cap re-deriving it, one degenerating into thousands of tokens of literal repetition of the same product. A fifth mis-counted the small sizes and fitted a wrong exponent to them. The incumbent already forbids period-2 talk and demands bijections, but it still invites the whole-map construction that drives the loops, so this revision bans map-building outright and substitutes following one single label until it returns home: cheap, self-checking, and it yields the count directly."
14,1,28054,150.274,150.284,fda1791300f21976dd72f9eebe700de3cfaba1edb06bf4fc0339ea25871f6960,df4319e2517e30da76e0c796b74672ca6598e0325852a1861defadbf9b9216c4,fda1791300f21976dd72f9eebe700de3cfaba1edb06bf4fc0339ea25871f6960,0.25,0.25,0.0,0.1875,0.1375,-0.04999999999999999,0.625,0.525,-0.09999999999999998,170,179,discarded,"lead with shrink-to-a-small-case plus structure-over-enumeration, and compress the reading-ambiguity rule to a single line","Fresh sampling with the incumbent scored 0/8; two rollouts died at the 16384 cap and all eight burned 13k-16.4k tokens. Every rollout fixed one reading of the displayed number, proved a speaker's own value pins the partner there, then looped: three explicitly declared the problem flawed or contradictory and kept re-arguing the same two cases, and the rest reported a value their own text had just refuted or admitted was recalled from a classic puzzle. The incumbent's intersect-across-readings clause never fires because the student exhausts its budget before reaching it. So I led with a cheap concrete technique it has never been given -- solve a shrunken copy with a small number first, then prefer structure and the balanced case -- and kept only the compact rules against self-refutation and declaring the problem broken."
14,2,30302,150.275,150.285,64b0f516c4150af456f05fd043eae6476f571e240a578af063256e2ea28e9e9a,ce2b2b154076fa10d0edfb3ff653ad1fb487b5986619db7c6d08c02f21ff7e8b,64b0f516c4150af456f05fd043eae6476f571e240a578af063256e2ea28e9e9a,1.0,1.0,0.0,0.175,0.1625,-0.012499999999999983,1.35,1.325,-0.025000000000000133,155,170,discarded,"replace the incumbent's route-agnostic recheck advice with a magnitude/order-of-magnitude plausibility test applied at each computation, plus an instance-swap escape when a conflict persists","7 of 8 fresh rollouts were correct. The single failure was not a strategy error: the setup and reduction were right, but one division by a complex number produced a value larger than the thing being inverted, so a later consistency check appeared to contradict a sound derivation. The rollout then spent the remaining budget re-deriving the same substitution and questioning whether the problem was well-posed, hitting the token cap with no value stated. Earlier rounds already told it to recheck one line and not restart, and that was insufficient because the student cannot see which line is wrong. So I gave it a cheap detector that fires at the moment of the slip - magnitudes must move in the plausible direction - and an escape hatch: if a conflict persists, switch to an easier instance rather than relitigating."
14,3,8554,150.276,150.286,a69022206f815aa610531eaf90a55d289cb8cba855d7fdd86219bae38ef15efe,3a3ef390d6a70880f9b20f6c54499782284552b880fd01f4824a7bb83ea93ac9,a69022206f815aa610531eaf90a55d289cb8cba855d7fdd86219bae38ef15efe,0.625,0.375,-0.25,0.2,0.1875,-0.012500000000000011,1.025,0.75,-0.2749999999999999,146,174,discarded,"replace abstract enumerate/certify licence with a concrete anti-hedging trigger: treat 'too vague/too complex' as an order to evaluate the free parameter numerically at two values and compare, plus a heading-free write-up rule","Only 2 of 8 finished; the other 6 hit the token cap. The cause is not re-derivation this time: the losing traces repeatedly write that a configuration is 'too vague', 'too complex', or impossible 'without exact boundaries', then substitute another qualitative what-if instead of ever computing one rotated case numerically. Two traces did reach the answer inside thinking but were cut off in a long headed markdown write-up before any result surfaced. So the revision keeps the union-minus-overlap and vertex-wedge cores, but replaces the abstract certify/enumerate licence with a concrete trigger: treat 'too complex' as an order to evaluate the free parameter at two concrete values and compare real numbers, which both settles invariance and bans hedging loops, plus a short heading-free write-up rule."
14,4,25003,150.277,150.287,2f7b2098363b9a53549fa724b1dc1c9431fbed1120452254cacf4f6a7a8218ff,2b164c771908e8762a2db4e4af5109d7ad453e809a66076bdb58f23f35dcae48,2f7b2098363b9a53549fa724b1dc1c9431fbed1120452254cacf4f6a7a8218ff,0.875,0.375,-0.5,0.1375,0.15,0.012499999999999983,1.15,0.675,-0.47499999999999987,194,188,discarded,"replace the residual-degree audit with an agreement count (a degree-d curve meeting a line more than d times would be that line), and ban inventing a one-use-per-piece rule","Fresh 8 rollouts with the incumbent scored 4/8, no truncations, so length is not the constraint. All four failures split into two leaks. Two computed the remainder after subtracting the affine target, called its degree one below the piece degree, and reported a product one factor short per piece. One asserted each called number needs its own distinct piece and answered the piece count; one applied the per-piece root cap to the entire pattern and answered the bare degree. The residual-degree wording in the incumbent is itself feeding the off-by-one, so the revision drops the subtract-then-degree step entirely and replaces it with a direct agreement count: a degree-d curve meeting a line at more than d points would have to be that line, which its degree forbids. It also states outright that reuse is allowed unless forbidden."
14,5,30418,150.278,150.288,83c896bc82082c6ed4cb8791f9d2a555f90a25b05e0dc438a5532b3b8a6282c8,8a4fba186646e7776fe79f0562605e487cd19f171736af46f4c912cec9d68425,83c896bc82082c6ed4cb8791f9d2a555f90a25b05e0dc438a5532b3b8a6282c8,0.875,0.625,-0.25,0.175,0.125,-0.04999999999999999,1.225,0.875,-0.3500000000000001,63,124,discarded,replace the generic discard-out-of-domain clause with sign-of-the-difference boundary comparison plus a negative-magnitude warning,"Seven of eight fresh rollouts were correct; the single failure derived the reduced quadratic, both roots, and the domain flawlessly, then misplaced a negative fraction into the wrong interval, discarded the only usable root, kept the one that merely reproduced given data, and declared the figure degenerate. So the incumbent's 'discard roots outside the domain' clause is precisely the step that fires wrongly: the domain reasoning was right and the ordering comparison was wrong. I replaced that clause with a concrete comparison procedure -- test a boundary by the sign of the difference, and remember that for negatives larger magnitude means smaller value -- plus a recovery rule that an empty surviving set indicts the comparison rather than the problem. Both moves are representation-level and transfer to any inequality or interval screening."
