round,hint_id,train_qid,sampling_slurm_job_id,proposal_eval_slurm_job_id,incumbent_hash,proposal_hash,final_hash,old_train,new_train,delta_train,old_heldout,new_heldout,delta_heldout,old_J,new_J,delta_J,old_tokens,new_tokens,decision,mutation,subagent_summary
19,2,30302,150.375,150.385,64b0f516c4150af456f05fd043eae6476f571e240a578af063256e2ea28e9e9a,92ccf5f26e012d5a03467c13e57ad39f7817842b2efe2faa0a7fd66623820361,64b0f516c4150af456f05fd043eae6476f571e240a578af063256e2ea28e9e9a,1.0,1.0,0.0,0.175,0.1375,-0.03749999999999998,1.35,1.275,-0.07500000000000018,155,171,discarded,keep paragraph one verbatim; replace the circle-specific two-points-plus-symmetry shortcut with a general target-routing rule (reach the requested combination directly via summed/multiplied constraints or symmetric functions instead of solving for each unknown),"All 8 fresh rollouts were correct and none hit the token cap, so train_i is saturated at 1.0 and carries no signal; the only lever is heldout, now 0.175. Every rollout took the same route, and the longest one ballooned by chasing x and y separately for each root before collapsing to the locus. History also shows rewriting the opening paragraph reliably hurts transfer, whereas swapping only the second paragraph has held 0.175. So I left paragraph one verbatim and replaced its circle-specific two-points-plus-symmetry shortcut with a broader routing principle: identify which combination of unknowns the target actually needs and reach it directly by adding or multiplying constraints or using symmetric functions, rather than pinning each unknown in turn. The no-restart and record-early discipline that protects train is retained."
19,3,8554,150.376,150.386,19fa4d72a92c2cb9fa9637a396188fbd19d57aa30794d82e0b9637f8a43322b1,0d2523f8c7e64dcd1306f84d3c6b26ffa67468649c5f0e7510131945c01ab26c,19fa4d72a92c2cb9fa9637a396188fbd19d57aa30794d82e0b9637f8a43322b1,0.75,0.125,-0.625,0.15,0.15,0.0,1.05,0.425,-0.625,162,177,discarded,"replace the qualitative enters-vs-leaves trade test with compute-the-symmetric-case-exactly-first, then one concrete off-symmetric comparison, plus a boundary-extremum prior","Four of eight scored. The split is clean and diagnostic: every correct rollout computed the aligned/simplest configuration exactly and kept that number, while all four failures never produced one exact value for any single configuration. Three hit the token cap after 114-195 rotation re-tests, and the fourth wrote that the geometry was too complex to compute, then chose a plausible-looking round fraction and committed to it. The incumbent tells the student to compare what enters against what leaves under a small shift, but that trade test is still qualitative, so it feeds the same adjective loop. This revision replaces it with the winners actual procedure: compute the most symmetric member exactly first to get a real number, then price the parameter with exactly one concrete off-symmetric computation, and note that constrained extrema usually sit at boundary configurations."
19,4,25003,150.383,150.387,2f7b2098363b9a53549fa724b1dc1c9431fbed1120452254cacf4f6a7a8218ff,2c99a4aae7c83a4edad651b07324a231c04fc3ad223cd0bad49775dda650c908,2f7b2098363b9a53549fa724b1dc1c9431fbed1120452254cacf4f6a7a8218ff,0.875,0.0,-0.875,0.1375,0.2375,0.09999999999999998,1.15,0.475,-0.6749999999999999,194,188,discarded,"pin the shared affine target to the substituted input rather than the piece label, and name the d+1 interpolation count as a red herring against the d-root cap","Fresh rollouts: 5/8 correct. All 3 failures were token-limit truncations, not bad arithmetic. One spent its budget on the interpolation red herring - a degree-d piece is pinned by d+1 points, therefore one piece yields d+1 terms - and never reached a per-piece root cap. One indexed the shared affine target by which piece was chosen rather than by the input substituted, then looped trying to force the piece labels themselves into a progression. One derived the correct per-piece-times-pieces product early, called it merely a guess, and relitigated whether consecutive inputs make the pattern impossible. So the revision keeps the residual/shared-target core the successes used, pins the index to the input, names the d+1 interpolation count as a red herring against the d-root cap, and closes the bound instead of inviting an audit."
19,5,30418,150.377,150.388,d0cc608af71edf1cce78c5a6c8da2e4bf7005ad7e886454d37f8c6cae44dcc6d,6484932b2e895d5c76b8eb3c58e9a215e87513569923c6947a3e59a67b78ac8c,d0cc608af71edf1cce78c5a6c8da2e4bf7005ad7e886454d37f8c6cae44dcc6d,0.875,0.75,-0.125,0.225,0.1625,-0.0625,1.325,1.075,-0.25,94,157,discarded,"add token-budget discipline (commit early, then only check) plus rebuild-reduction-once instead of re-expanding","Six of eight rollouts solved it. Both failures ran out of room: neither ever finished. One derived a negative discriminant from a mis-shifted constant across the logarithm, then spent thousands of tokens re-expanding the identical cross-multiplication and trying midpoint reformulations; the other stalled the same way and, at the very end, wrote down a value it had itself just shown invalid. The incumbent already tells the student to substitute back and stop, but says nothing about budget, so a stuck rollout explores forever and emits nothing gradeable. I added a length-discipline clause -- write the value down as soon as one is plausible and spend the rest only checking it -- plus a rebuild-the-reduction-once rule instead of re-expanding, which should transfer to any long derivation that risks running past the limit."
19,6,26989,150.378,150.389,6cc0498766a54216a935bbbc0ce499f24702bc049ad32425cc35a2cc06164549,f8c68bdd09420f226a766ac4453c2e02d3339d4e2d6289254f6c1819239de9de,6cc0498766a54216a935bbbc0ce499f24702bc049ad32425cc35a2cc06164549,0.125,0.0,-0.125,0.2375,0.15,-0.0875,0.6,0.3,-0.3,189,186,discarded,"replace choose-between-two-readings with declarative upward-growth orientation; make 2^(free) one shared space all parts read off, ban unargued certainty/impossibility, and forbid a step-free symmetry claim from overwriting a step-counted value","Fresh sampling with the incumbent gave 2/8. Six of eight reached the free-step count on the first part, but two then explicitly overwrote it a paragraph later (""but the correct count is n!""), one oscillated into 1/2, and one collapsed the process to certainty then impossibility. On the slot part five asserted every item equally likely in any position and read off 1/n, each having first equated the deepest slot with whatever moved last; one burned the token cap relitigating. The incumbent tells the student to write both readings of that slot and kill one by tracing a run, but it picks a reading and never traces. This revision drops that step for a declarative upward-growth orientation, makes the free-step atoms one space every part must be read off (n or n! flagged as proof of leaving it), bans unargued certainty or impossibility, and forbids a step-free symmetry paragraph from replacing a step-counted value."
19,7,3836,150.379,150.390,9300bc3ffa577ffd05cfd6854f99348ead9ab916c0aac6c6e36fca997ad1b786,edd63dedfc2cd4f811713079912585c4245b6fc4824ef9e929313bdcc27e2b2e,9300bc3ffa577ffd05cfd6854f99348ead9ab916c0aac6c6e36fca997ad1b786,0.125,0.0,-0.125,0.175,0.125,-0.04999999999999999,0.475,0.25,-0.22499999999999998,167,173,discarded,"target the invented-extra-condition loop: check small cases only against the listed conditions, treat a clash as a restatement slip to repair, and gate any recast on an unknowns-versus-unspent-givens count","Fresh sampling with the incumbent scored 0 of 8; 7 of 8 hit the token cap and the one that terminated was wrong. The incumbent's advice to work small instances was followed, but the wreck happened after: several rollouts solved a tiny system correctly, then tested it against a condition the statement never imposes, declared a contradiction, and spent the rest of the budget re-deriving that same case. Others adopted a factored recast carrying a free linear factor, could not pin its two parameters from the conditions they had left, and stalled or guessed. So the failure is bad self-checking and an under-determined recast, not reluctance to compute. The revision tells it to verify only against the conditions as listed, treat a clash as its own restatement slip to repair rather than grounds to re-solve, and gate any recast on counting unknowns against unspent givens."
19,8,23443,150.380,150.391,8a6dfd748e0553b9accc3ad13afe0c4aa08f94103b64259ab984bac22622e13d,e0bb5d0a3ecaa892c0441130e00275e04341788c25d5ac7992d341a504134b43,8a6dfd748e0553b9accc3ad13afe0c4aa08f94103b64259ab984bac22622e13d,1.0,1.0,0.0,0.2,0.1375,-0.0625,1.4,1.275,-0.125,130,167,discarded,keep the incumbent verbatim and append an untried two-sided extremal rule (exhibit an attaining case plus a bound argument) for largest/smallest-value questions,"All 8 fresh rollouts scored 1 and stopped cleanly in 3.0-7.0k tokens, so train is saturated and every gain must come from transfer; the incumbent's aggregate transfer has been the best of 18 attempts, and round 14 showed that deleting any of its clauses costs transfer, so I kept it verbatim and only appended. Eighteen prior mutations already tried more divisibility, scope-labelling, back-substitution, representation switching, output formatting, arithmetic rechecking and concretization advice; all lost ground, so I added the one untried and broadly reusable lever: extremal problems need a two-sided argument, a construction attaining the value plus a bound ruling out anything better. The rollouts show the student repeatedly re-litigating which extreme count was intended instead of justifying it, which is exactly that gap."
19,9,3980,150.381,150.392,652ee8dc58008e69bb7e90163e071e0708bc579422e2fd3d5a546ca1fb63ccad,6d301f05f76dc912239dcf7fca4cce2f0ce1a2e41923e45709b19d789878519f,652ee8dc58008e69bb7e90163e071e0708bc579422e2fd3d5a546ca1fb63ccad,1.0,0.875,-0.125,0.25,0.2375,-0.012500000000000011,1.5,1.35,-0.1499999999999999,180,191,discarded,"compress the branch/offset warnings into one clause and spend the freed tokens on generic output discipline: exact non-decimal values, simplification, and reporting precisely the requested quantities in the requested form and order","All 8 fresh rollouts were correct and every one terminated cleanly at 4.1k-8.2k tokens, so the incumbent has eliminated the budget-exhaustion and mis-parameterization failures that dominated earlier rounds; there is no remaining training failure to target. Every success shared one shape: recenter on a shared center, pin it from the sum of the two given values, isolate the scale from their difference, then read off requested inputs inside the centered form without re-expanding. Since train is saturated and transfer is weighted double, the revision preserves that proven core but compresses the redundant branch and offset warnings into a single clause, reinvesting the freed tokens in guidance that fires on any problem rather than only this commuting-map pattern: keep quantities exact instead of decimal, simplify, and emit exactly the requested quantities in the requested form and order."
19,10,3843,150.382,150.393,181de074d76a20fc0bc384bdc26a17c1f9701c3a217430261cb7e7887a18aee0,520b63616cea5889cd45e71f6815eca6cf64b7f3fb1e11044e31d1e539030f1d,181de074d76a20fc0bc384bdc26a17c1f9701c3a217430261cb7e7887a18aee0,0.75,0.25,-0.5,0.1375,0.175,0.03749999999999998,1.025,0.6,-0.42499999999999993,175,188,discarded,"ban re-expressing the run as an abstract map, symbolic formula, or cycle notation; pin one application as the whole listed sequence; define the count as comparing current state to the starting state","Fresh sampling with the incumbent gave 4/8. All four failures repeated one mechanism: the student started a literal small-instance run, then abandoned it to re-express the process as a permutation or index map, mis-read a block move as pairwise swaps, applied steps to original positions instead of the current arrangement, and produced mutually contradictory maps. It then either guessed a period from untraced structure talk (product of disjoint transpositions, so order two) or thrashed to the token cap listing incompatible patterns. Two failures also confused one step with one whole application. The revision keeps the incumbent spine but adds an explicit unit-of-application pin, bans the translation into abstract maps or cycle notation outright, and defines the count as comparing the current arrangement to the starting one, so the concrete run has nowhere to leak into symbols."
20,1,28054,150.394,150.404,fda1791300f21976dd72f9eebe700de3cfaba1edb06bf4fc0339ea25871f6960,05c789c79698e97cbb7e169c6c815c559f12e590924af93b314319068fc3fe52,fda1791300f21976dd72f9eebe700de3cfaba1edb06bf4fc0339ea25871f6960,0.25,0.0,-0.25,0.1875,0.2125,0.024999999999999994,0.625,0.425,-0.2,170,170,discarded,replace the abstract intersect-across-readings clause with an audit-before-discarding rule plus a both-members/symmetric-case test and a second-independent-route verification,"Fresh sampling with the incumbent scored 0/8; two rollouts hit the 16384 cap and all eight burned 13.4k-16.4k tokens, one repeating 'impossible' 130 times. The decisive evidence: six rollouts explicitly constructed the balanced pair where the two picks coincide, verified it against the stated conditions, then talked themselves out of it on a self-invented knowledge claim and reported a factor of the shown number instead. So the binding failure is no longer a missing concept or bad ordering but discarding a candidate that already passed. The incumbent's intersect-across-live-readings clause is too abstract to fire before the budget is gone, so I replaced it with an audit-the-discard rule, an explicit demand to impose each constraint on both members of the pair (which surfaces the symmetric case), and a concrete second-route verification as the stopping condition."
20,2,30302,150.395,150.405,64b0f516c4150af456f05fd043eae6476f571e240a578af063256e2ea28e9e9a,f80e6f8ee593ba5e012581cdaabec2026e593b3ade0c439994355b6e17b7d828,64b0f516c4150af456f05fd043eae6476f571e240a578af063256e2ea28e9e9a,1.0,1.0,0.0,0.175,0.1,-0.07499999999999998,1.35,1.2,-0.15000000000000013,155,170,discarded,"replace the generic clashing-check clause with (a) an irreversible-step guard (divisor zeros, extraneous roots after squaring/clearing) and (b) a widen-the-assumed-form rule for when a supposedly constant quantity comes out varying","Only 6 of 8 fresh rollouts scored; both failures hit the 16384-token cap with no stated value. Both derived the correct reduction and then computed the modulus of each root, found it varying, and concluded the setup or the problem must be broken - they spent thousands of tokens relitigating sound algebra. One eventually recovered the general conic form and verified it, but too late to report. The real defect is a too-narrow assumption (an origin-centered locus, i.e. constant modulus) being read as a contradiction. So I replaced the incumbent's vague recheck-that-line advice with a concrete widen-the-assumed-form rule, plus a transferable guard on the irreversible steps (vanishing divisors, extraneous roots from squaring or clearing denominators) that generate such conflicts elsewhere."
20,3,8554,150.396,150.406,19fa4d72a92c2cb9fa9637a396188fbd19d57aa30794d82e0b9637f8a43322b1,21edb1dcdf3a6ee9d4f46416ada626807044afa4e54e2b3b406723f33ccbcc5b,19fa4d72a92c2cb9fa9637a396188fbd19d57aa30794d82e0b9637f8a43322b1,0.75,0.625,-0.125,0.15,0.1375,-0.012499999999999983,1.05,0.9,-0.15000000000000002,162,182,discarded,"generalize the containment trap to a bigger-never-swallows rule with a no-uncomputed-ratios ban, and swap the qualitative trade test for exact simplest-case computation plus a bound-and-witness stop licence","Six of eight scored, so the sum-minus-overlap frame is kept. Both failures were geometric, not budget: one concluded that because every side of the large piece sits distance 1 from its center while the small piece reaches only 0.5, the small piece is swallowed at every angle, so it reported the plain larger area and stopped early with tokens to spare; the other never closed reasoning, oscillating between whole-piece and partial overlap while re-testing tilts. The incumbent's wedge sentence and its qualitative enters-vs-leaves trade test did not block either. This revision states the containment trap as a general rule (bigger never implies swallowing, and a ratio or a round-looking fraction is not a computed quantity), replaces the trade test with compute-the-simplest-configuration-exactly, and supplies a bound-plus-witness reason that licenses halting."
20,4,25003,150.397,150.407,2f7b2098363b9a53549fa724b1dc1c9431fbed1120452254cacf4f6a7a8218ff,cecc42bde5ecfc4f503eaa211ce021003c40414907e7ac2f2dcd860de754592d,2f7b2098363b9a53549fa724b1dc1c9431fbed1120452254cacf4f6a7a8218ff,0.875,0.0,-0.875,0.1375,0.1375,0.0,1.15,0.275,-0.8749999999999999,194,185,discarded,"generalize the cap into a reusable scarce-resource recipe (cap one unit, multiply by unit count) and add a degree audit pinning the per-piece cap at d rather than d-1","Fresh rollouts: 3/8 correct. Two failures capped each piece at d-1 roots instead of the stated degree d - an off-by-one in the residual step. Two more abandoned reuse entirely and reported the bare piece count, one after first declaring the count unbounded. One burned all tokens chasing consecutive-difference relations between neighbouring pieces. The three winners all ran the same route: shared affine target, residual roots per piece, multiply by the piece count. So the incumbent's structure is right but two numeric slips survive it. This revision lifts the bound step into a reusable recipe (name the scarce resource, cap one unit, multiply by the unit count) so it transfers past polynomials, adds an explicit degree audit pinning the per-piece cap at d rather than d-1, and states that reuse is permitted unless forbidden to block the retreat to the bare piece count."
20,5,30418,150.398,150.408,d0cc608af71edf1cce78c5a6c8da2e4bf7005ad7e886454d37f8c6cae44dcc6d,19c4c734f71aad4dec1ff36a3a3c6c3fea3e812802e7206512aaa60de8ab67e0,d0cc608af71edf1cce78c5a6c8da2e4bf7005ad7e886454d37f8c6cae44dcc6d,0.875,0.875,0.0,0.225,0.175,-0.05000000000000002,1.325,1.225,-0.09999999999999987,94,145,discarded,add evaluate-from-the-definition rule for logs/exponents (base below one flips the sign) and reframe an apparent inconsistency as that slip rather than a reason to loop,"Six of eight fresh rollouts were correct; both failures ran to the token cap on the same mechanical error, not on strategy. Each set up the conditions correctly, solved the reduced quadratic correctly, kept the right root, then evaluated a logarithm with base below one with the wrong sign. The bad value made the recovered vertex fail the substitution check, so the rollout concluded the problem itself was inconsistent and spent thousands of tokens re-expanding the identical algebra, which can never surface an evaluation slip. The incumbent already mandates substitute-back verification but says nothing about what to do when it fails, so I added a transferable rule: evaluate logs/exponents/roots from the definition rather than by pattern-copying, note that a base under one reverses the sign, and treat an apparent contradiction as that slip."
20,6,26989,150.399,150.409,6cc0498766a54216a935bbbc0ce499f24702bc049ad32425cc35a2cc06164549,7658cbd92d8bdbbcbe871accd806cf00d4f3704506e2ed75c7966072a75d4f31,6cc0498766a54216a935bbbc0ce499f24702bc049ad32425cc35a2cc06164549,0.125,0.0,-0.125,0.2375,0.15,-0.0875,0.6,0.3,-0.3,189,187,discarded,"state that which item a step carries is determined by earlier steps (never an independent draw), and route a named-item-at-depth-k event through a short opening block of steps rather than the choose-between-two-readings trace","Fresh sampling with the incumbent gave 0/8; seven rollouts stopped normally at 7k-15k tokens, so length is not the block. Five of eight reached the free-step count on part one, then every rollout priced the slot part by asserted symmetry, reading off 1/n (or 1/2, or 3!/6 of 4!), and each had first equated the deepest slot with whatever moved last. One collapsed the whole process to certainty and then impossibility. The incumbent asks the student to write both readings of the slot and kill one by tracing a run; it picks a reading and never traces. This revision drops that step and instead states the causal fact the failures violate -- which item a step carries is fixed by the earlier steps, never an independent uniform draw -- gives the upward-growth orientation declaratively, and turns the slot event into a short opening block of steps to price, so the same denominator serves both parts."
