round,hint_id,train_qid,sampling_slurm_job_id,proposal_eval_slurm_job_id,incumbent_hash,proposal_hash,final_hash,old_train,new_train,delta_train,old_heldout,new_heldout,delta_heldout,old_J,new_J,delta_J,old_tokens,new_tokens,decision,mutation,subagent_summary
1,1,28054,150.20,150.23,98f0bbb6f87c7e50634956da8a0905b30a66997aa33a5e4bc67a2609ec487ed8,94767b7202cf5d499b1458d492aaa4b942134d41aaf5a5105613a15b33b362ff,98f0bbb6f87c7e50634956da8a0905b30a66997aa33a5e4bc67a2609ec487ed8,0.0,0.0,0.0,0.175,0.1125,-0.062499999999999986,0.35,0.225,-0.12499999999999997,77,142,discarded,"keep unstated labels as part of the candidate, and break the contradiction-relooping that burns the token budget","All 8 fresh rollouts scored 0 and 5 of 8 hit the 16384-token cap; every one split the problem into mutually exclusive global cases, declared each case contradictory, then re-derived the same case repeatedly until it either ran out of tokens or guessed an unverified value. The incumbent hint said to build a candidate set but never told the student that an unstated label is itself part of a candidate, nor how to escape a self-inflicted contradiction, so I added both plus an explicit stop-and-verify to cut the runaway loop."
1,2,30302,150.13,150.24,e926ca1d6f04d597d4b99af9d15b2597417b40fc28c3c0397d67f147cfa99917,522d61457e89465e8a7bfc849b07a03c0da4af9ddc2c5b4491a76e55d53ceeb5,e926ca1d6f04d597d4b99af9d15b2597417b40fc28c3c0397d67f147cfa99917,0.875,0.875,0.0,0.125,0.1,-0.024999999999999994,1.125,1.075,-0.050000000000000044,81,134,discarded,generalize problem-specific Mobius/ratio recipe into reusable structure-finding + exactness + verification strategy,"All 8 fresh training rollouts were correct and none truncated, so train_i is saturated at 1.0 while heldout_i sits at 0.125; the incumbent's gain is therefore almost entirely from naming this problem's exact substitution w=(z-1)/z, which cannot transfer. I rewrote it as the underlying transferable moves the successful rollouts actually used: exploit homogeneity to reduce to one ratio, reduce to a w^n = c form that pins the modulus, recover the original unknown and identify the locus by algebra rather than case enumeration, stay exact, and verify one instance before answering."
1,3,8554,150.16,150.25,00f433b6ea19dfe2336efbb3476fea529c0993179016a67ce16e4288905f3cd0,6895075b3c8d3022684325973d416c0c6de5eaefdb3216294c5b27ade783a059,6895075b3c8d3022684325973d416c0c6de5eaefdb3216294c5b27ade783a059,0.0,0.5,0.5,0.1875,0.1875,0.0,0.375,0.875,0.5,86,117,kept,replace piecewise-angle grind with symmetry/invariance shortcut plus commit-and-stop discipline,"Seven of eight rollouts ran to the 16384-token cap without emitting any answer: they repeatedly rebuilt the coordinate setup and looped on 'the sides are tangent... but this is too vague' while trying to sweep the overlap area as a function of rotation angle, which is exactly what the incumbent hint asks for. The one success and one near-success got there by noticing the overlap is angle-independent, so the revision keeps the union-minus-overlap framing but redirects effort to a rotational-invariance/symmetry check, forbids re-deriving the setup, and demands committing to an exact fraction instead of continuing to search."
1,4,25003,150.17,150.26,93b35723e9cc953d39ac835ae67c34590b0c25060143ab50c99c75c21cbb1ff2,9ad17434e90ac5fbf9203596a47b29dac7558e85f253b13129bb54f81a831763,9ad17434e90ac5fbf9203596a47b29dac7558e85f253b13129bb54f81a831763,0.0,0.25,0.25,0.2,0.225,0.024999999999999994,0.4,0.7,0.29999999999999993,94,177,kept,reframe as bound-plus-construction; forbid the consecutive-difference dead end and require summing per-function root caps,"All 8 fresh rollouts scored 0: four ran out of tokens mid-derivation and the four that finished all produced answers far too small. Each finisher fixated on consecutive differences of one polynomial, concluded a single polynomial cannot sustain the progression, and then reported either one function's root cap or the number of functions instead of summing a per-function cap across all available functions, and none attempted a construction. The revision names the bound-plus-construction structure, blocks the consecutive-difference dead end, tells it to add the per-function caps, and pushes for an early commitment to reduce length-limit truncation."
1,5,30418,150.14,150.27,b807d87e8e00cc91a6166db0fb3921c3d3651d016bdd936e3700d0c9bde5fa81,4dfd4c901532b591e57acb18527ed63a95fff108f57f092b769935d15f97eb88,b807d87e8e00cc91a6166db0fb3921c3d3651d016bdd936e3700d0c9bde5fa81,0.75,0.625,-0.125,0.15,0.125,-0.024999999999999994,1.05,0.875,-0.17500000000000004,73,150,discarded,replace generic procedure with symmetry-center shortcut plus anti-loop rule on contradictions,"Seven of eight fresh rollouts solved it; the single failure hit max tokens after its brute-force elimination produced a negative discriminant and then spent thousands of tokens re-verifying the same cross-multiplication instead of changing approach. The incumbent hint prescribes exactly that expensive eliminate-and-solve path, so I replaced it with a transferable instruction to look for a symmetry center and use reflections plus shoelace, and to treat a contradiction as a signal to switch representation once rather than loop."
1,6,26989,150.15,150.28,99c30a3f882f054f77512e4fdca1d19befb3e5426d7d857d52f4369a95c4f820,0ac1224b31d00697e03ba5c0028a103aff26fa7b283c8ea589f0aad96efd31e0,0ac1224b31d00697e03ba5c0028a103aff26fa7b283c8ea589f0aad96efd31e0,0.0,0.125,0.125,0.125,0.1125,-0.012499999999999997,0.25,0.35,0.09999999999999998,83,172,kept,attack the false-uniformity assumption; require derived path probabilities plus small-case check,"Fresh sampling with the incumbent hint gave 2/8 correct; every rollout finished well within the token budget, so length was never the problem. Six of the eight failures collapsed the process to 'all orderings are equally likely' and read off 1/n or 1/n!, or declared an outcome impossible from intuition, so the revision names that symmetry shortcut as the trap, insists branch weights be multiplied along each concrete path (1/2 only when a choice truly exists, 1 when forced), and adds a small-case hand check plus a sum-to-one test."
1,7,3836,150.18,150.29,39e2668fb5cca7669288765276aabe0dba01769397daa33b16a9dd7c0174a8f4,2aede24f636e400a140c881ae888ef724a71d96f3ec41e5a62769af799ffe0b6,39e2668fb5cca7669288765276aabe0dba01769397daa33b16a9dd7c0174a8f4,0.125,0.125,0.0,0.1625,0.1625,0.0,0.45,0.45,0.0,82,128,discarded,replace abstract-machinery framing with small-case tabulation plus budget-abort rule,"Only 1 of 8 fresh rollouts scored, and 6 of 8 hit the 16384-token cap without ever emitting an answer, so the dominant failure is budget exhaustion rather than a reasoning gap. The incumbent hint's functional/Lagrange/Vandermonde vocabulary is exactly what the doomed rollouts churned on for tens of thousands of characters, while the single success ignored it and instead solved tiny instances and read off the pattern; the two that did finish also showed off-by-one slips in the factorial and sign. The revision therefore prescribes small-case tabulation with explicit sign and index-shift tracking, a brief structural justification, and an abort rule when a general method stalls."
1,8,23443,150.19,150.30,149cabea90724683bc818e06d11bef6dc0c07209cfe1b68f2300dc838be4613d,0d69acbbc22f6b6d010a7598ef5f396aab2ad9b836bc2daa3901cefadc1a3caf,149cabea90724683bc818e06d11bef6dc0c07209cfe1b68f2300dc838be4613d,1.0,0.25,-0.75,0.1625,0.15,-0.012500000000000011,1.325,0.55,-0.7749999999999999,77,121,discarded,de-specialize to domain-neutral divisibility/percent/units checklist,"All 8 fresh rollouts scored reward 1 and terminated normally in roughly 3-5k tokens, so train_i is saturated at 1.0 and every remaining gain must come from transfer; the incumbent's low aggregate transfer score is consistent with its wording being locked to this question's own nouns and stage vocabulary. The rollouts show the student's actual working steps are generic (impose divisibility on several totals, take a gcd, sum before dividing, apply the percent as a multiplier), so I restated exactly those moves in domain-neutral language and added two broadly useful guards the rollouts spent effort re-deriving: substitute back to verify integrality/units, and answer the quantity asked rather than an intermediate."
1,9,3980,150.22,150.31,d95dbbc2898bc6c58c3684891a45d7c76fe4e0835ddd91bed1a4955ddf89942a,eab27d3627aae1499f17984f65024e2ab712331f9350f11716df1e8621e3725f,eab27d3627aae1499f17984f65024e2ab712331f9350f11716df1e8621e3725f,0.0,0.0,0.0,0.0875,0.175,0.0875,0.175,0.35,0.175,71,158,kept,add explicit budget guard against full expansion plus a concrete recenter-at-shared-fixed-point recipe and a contradiction-means-change-representation rule,"All 8 fresh rollouts scored 0: seven of eight ran to the 16384-token cap mid-expansion of the composed identity, looping on coefficient matching and re-deriving contradictory relations, and the single one that terminated invented large coefficients without any check. The incumbent hint named the right ideas but never forbade brute-force expansion or told the student what to do on hitting a contradiction, so the revision makes the cost guard explicit, gives an actionable recentering/symmetry construction, and demands one verifying substitution before answering."
1,10,3843,150.21,150.32,95005ec62835dbef2cc6b52c26e1bc8efa75d3d939090ada63716aa06be7a5b5,075d3405404f1f300e09228ddcff2dbe646c2a4753c235ae8010456f10fb00e8,95005ec62835dbef2cc6b52c26e1bc8efa75d3d939090ada63716aa06be7a5b5,0.375,0.125,-0.25,0.1375,0.2,0.0625,0.65,0.525,-0.125,72,163,discarded,"add orbit-trace lower bound plus small-case table with one verification case, blame indexing for odd cycle lengths, and force early commit to stop token overruns","Only 3 of 8 rollouts were correct and all 5 failures shared one pattern: after building a small-case table the student distrusted it, re-derived the composed map with inconsistent stage order or off-by-one indexing, produced implausible cycle lengths (e.g. 5, 7, 2^n-1), and 4 of the 5 then hit the 16384-token cap mid-loop without committing an answer. The incumbent asked for a 'bitwise affine permutation' and a minimality proof, which invited exactly that open-ended re-derivation, so the revision replaces it with a concrete orbit-trace lower bound, a bounded verify-once-then-stop protocol, and an explicit instruction to suspect indexing rather than exotic cycle structure."
2,1,28054,150.33,150.43,98f0bbb6f87c7e50634956da8a0905b30a66997aa33a5e4bc67a2609ec487ed8,cbbaaafa1907efc60835e2a44f805271c9a2f4cd4fe5d3988c244caa7b7e5f7b,cbbaaafa1907efc60835e2a44f805271c9a2f4cd4fe5d3988c244caa7b7e5f7b,0.0,0.25,0.25,0.175,0.1375,-0.03749999999999998,0.35,0.525,0.17500000000000004,77,144,kept,"reframe 'I don't know' as a divisibility/range test on the speaker's own value under an unlabelled displayed quantity, and forbid boxing an enumerated candidate without checking it","Fresh sampling with the incumbent hint scored 2/8; five of the six failures enumerated the factor pairs of the displayed number, declared both readings contradictory, then boxed an arbitrary member of that enumeration, and one ran to the token cap. The incumbent tells the student to prune information sets but never says the displayed quantity's own label is ambiguous nor how to convert 'I don't know' into a concrete arithmetic test on the speaker's private value, so I added both and an explicit ban on boxing an unverified enumerated candidate."
2,2,30302,150.34,150.44,e926ca1d6f04d597d4b99af9d15b2597417b40fc28c3c0397d67f147cfa99917,c0bacc962b5d9b008c7653bdcfcdd8ab80563aa93224e9cd27a6854775c4ea78,e926ca1d6f04d597d4b99af9d15b2597417b40fc28c3c0397d67f147cfa99917,0.875,0.625,-0.25,0.125,0.2125,0.0875,1.125,1.05,-0.07499999999999996,81,142,discarded,"keep incumbent ratio/locus setup, add sign-check discipline plus a non-looping recovery route (fit general circle to explicit points) and a commit-early boxing rule","Seven of eight fresh rollouts were correct; the single failure exhausted the 16384-token cap after a sign error made one explicitly computed root disagree with its own correct symbolic locus, triggering dozens of self-doubting restarts and no committed result. Round 1 showed that stripping the concrete substitution hurt transfer, so I kept the incumbent setup and appended the transferable fix: verify the parametrization on one explicit instance, and when a spot-check conflicts, recover by fitting the general conic form to a few exact points instead of relitigating, then commit and box early."
2,3,8554,150.35,150.45,6895075b3c8d3022684325973d416c0c6de5eaefdb3216294c5b27ade783a059,e73c55e27100ae936358bb7823761096f52d3e52bbb1bf81a9e7298441eeb331,e73c55e27100ae936358bb7823761096f52d3e52bbb1bf81a9e7298441eeb331,0.5,0.5,0.0,0.1875,0.2,0.012500000000000011,0.875,0.9,0.025000000000000022,117,131,kept,"add explicit anti-containment check: a vertex is only an interior-angle wedge, verify with a test point","Four of eight rollouts solved it; every one of the four failures came from the same wrong belief that the larger square contains the smaller one in all orientations, so they concluded the overlap equals the whole small square and reported a union that was too small (two of them even asserted this confidently and stopped). The incumbent's invariance advice alone did not stop this, so the revision names the geometric trap directly: a vertex only spans its interior angle, verify non-containment with one concrete test point, and only then use the n-fold-symmetry wedge argument to get the overlap fraction without any angle sweep."
2,4,25003,150.36,150.46,9ad17434e90ac5fbf9203596a47b29dac7558e85f253b13129bb54f81a831763,f26aaa574972ad6e146cbf8e3aaa50dcf4ebfa771b9c5642659422047d4beca7,9ad17434e90ac5fbf9203596a47b29dac7558e85f253b13129bb54f81a831763,0.25,0.25,0.0,0.225,0.1875,-0.037500000000000006,0.7,0.625,-0.07499999999999996,177,178,discarded,kill the single-function consecutive-difference contradiction loop; state the caps-product as the answer and forbid retreating to d or the function count,"All 8 fresh rollouts scored 0: four hit the 16384-token limit while relooping on a self-inflicted ""contradiction"" that one polynomial's consecutive difference cannot be constant, and the four that stopped answered with the function count or a single function's root cap. One rollout actually derived the correct caps-product but then talked itself back down to a single function's cap, so the revision names the product as the intended answer, bans the retreat, explicitly dissolves the consecutive-difference contradiction (consecutive terms may use different functions), and orders early abandonment of impossibility branches to cut truncation."
2,5,30418,150.37,150.47,b807d87e8e00cc91a6166db0fb3921c3d3651d016bdd936e3700d0c9bde5fa81,9e3a1cd5e980ec635ebcb8c91cc9fc684f4d427ff4cc4cab8f563f32be17c13e,b807d87e8e00cc91a6166db0fb3921c3d3651d016bdd936e3700d0c9bde5fa81,0.75,0.625,-0.125,0.15,0.1125,-0.03749999999999999,1.05,0.85,-0.20000000000000007,73,136,discarded,"replace problem-specific procedure with general condition-translation, exact-fraction, and validity-constraint discipline","All eight fresh rollouts solved the training question correctly at roughly 9.5k completion tokens each, so train accuracy is saturated and the only remaining lever is transfer, where the incumbent scores low because its wording is tied to one specific setup (logarithmic fractional-linear parameters, oriented vectors, determinant area). The prior round's failure mode was a rollout that mistranslated the point-pairing condition, hit an empty solution set, and then looped on recomputation until it ran out of tokens, so I kept an anti-loop and substitute-back rule but expressed the whole hint as domain-general discipline: translate conditions exactly, reduce to one unknown, keep exact fractions, enumerate validity constraints, and reject extraneous roots."
2,6,26989,150.38,150.48,0ac1224b31d00697e03ba5c0028a103aff26fa7b283c8ea589f0aad96efd31e0,45b2c0df517f87901f5a1ad921b228f3059ad2ca08158d9c5eb6939a11ecf4b4,45b2c0df517f87901f5a1ad921b228f3059ad2ca08158d9c5eb6939a11ecf4b4,0.125,0.125,0.0,0.1125,0.2125,0.09999999999999999,0.35,0.55,0.20000000000000007,172,200,kept,"pin mechanics/first-vs-last arrival, then convert event to an exact move-sequence constraint counted only over free 50/50 choices","Fresh sampling with the incumbent gave 2/8; all eight rollouts terminated normally with 11k-16k tokens, so length is not the bottleneck. The incumbent already suppressed 1/n! on part (a) (four rollouts derived 1/2^(n-1) there) but every failure then reverted to an asserted 'each item equally likely in any position' shortcut on the second part, and several also mixed up whether the target position corresponds to the first or the last arrival on the stack. The revision therefore demands the mechanics and the first-vs-last mapping be pinned before counting, that the event be restated as an exact constraint on the move sequence, that only genuinely free 50/50 branches be multiplied (forced moves contribute 1), and that each part be re-derived independently."
2,7,3836,150.39,150.49,39e2668fb5cca7669288765276aabe0dba01769397daa33b16a9dd7c0174a8f4,970826b6d808a016748fe1e6cda39b71098679265ead772ffa8f52eeb6eaed54,970826b6d808a016748fe1e6cda39b71098679265ead772ffa8f52eeb6eaed54,0.125,0.25,0.125,0.1625,0.1125,-0.05,0.45,0.475,0.024999999999999967,82,132,kept,small-case-first computation with claim-testing and a no-restart stall rule,"Fresh sampling under the incumbent hint scored 0 of 8, and 7 of 8 rollouts hit the 16384-token cap without ever emitting an answer; the abstract functional/Vandermonde/Lagrange framing sent them into long symbolic derivations that repeatedly self-contradicted and restarted. The single rollout that terminated asserted an unchecked structural claim and answered from it, and the only prior success instead solved the smallest instances by hand and read off the pattern. The revision therefore front-loads exact small-case computation, demands that structural claims be tested on the smallest case, and forbids restarting a stalled derivation so the budget is spent on verifiable arithmetic."
2,8,23443,150.40,150.50,149cabea90724683bc818e06d11bef6dc0c07209cfe1b68f2300dc838be4613d,83bf5428d92045ed33fa45e2c5c0acd34c8e20775308e12d640c1599d9ee2f6b,149cabea90724683bc818e06d11bef6dc0c07209cfe1b68f2300dc838be4613d,1.0,0.5,-0.5,0.1625,0.2125,0.04999999999999999,1.325,0.925,-0.3999999999999999,77,117,discarded,"keep question-anchored divisibility scaffold, prepend per-unit-vs-total scope labeling and add back-multiplication check","All 8 fresh rollouts scored reward 1 and stopped cleanly in 2.9-4.6k tokens, so train_i is saturated and gains must come from transfer; last round's fully de-specialized checklist rewrite collapsed train to 0.25 and also lost held-out ground, so I kept the incumbent's concrete anchoring instead of abstracting it away. The dominant observable waste in the rollouts is a long stretch of re-reading to decide whether each listed figure is a per-unit amount or a whole-collection total, so I prepended that scope-labeling step and replaced the vague integrality/units clause with a concrete back-multiplication check, both reusable moves rather than problem-specific facts."
2,9,3980,150.41,150.51,eab27d3627aae1499f17984f65024e2ab712331f9350f11716df1e8621e3725f,2bcb5d3e6fb5734eebdd781a83717282b26d1535b8a1350660140759e3a7d0f7,2bcb5d3e6fb5734eebdd781a83717282b26d1535b8a1350660140759e3a7d0f7,0.0,0.5,0.5,0.175,0.2,0.025000000000000022,0.35,0.9,0.55,158,195,kept,"replace coefficient-matching guidance with a commit-to-a-structured-family-then-fit recipe, plus special-input substitution and center-check shortcuts","All 8 fresh rollouts scored 0 and every one hit the 16384-token cap; each opened by naming eight unknown coefficients for the two cubics and then spent the whole budget expanding the degree-9 composition, looping on contradictory coefficient relations without ever finishing. The incumbent hint told the student to avoid full expansion but still pointed at term matching, so the revision forbids the unknown-coefficient opening outright and gives a concrete alternative: posit a minimal structured family that satisfies the identity automatically, fit it to the two given values, and verify once by substitution."
