round,hint_id,train_qid,sampling_slurm_job_id,proposal_eval_slurm_job_id,incumbent_hash,proposal_hash,final_hash,old_train,new_train,delta_train,old_heldout,new_heldout,delta_heldout,old_J,new_J,delta_J,old_tokens,new_tokens,decision,mutation,subagent_summary
9,9,3980,150.182,150.192,652ee8dc58008e69bb7e90163e071e0708bc579422e2fd3d5a546ca1fb63ccad,81f4d2bb8dae0eac5e7d8bd1d69a48b40c94b267076e9e439b98ea78f96f78c1,652ee8dc58008e69bb7e90163e071e0708bc579422e2fd3d5a546ca1fb63ccad,1.0,1.0,0.0,0.25,0.2125,-0.037500000000000006,1.5,1.425,-0.07499999999999996,180,177,discarded,"reframe the sum/difference step as a general symmetric-data lever, require the given numbers to stay on the right-hand side, and generalize the abort guard into one rule that any contradiction reached (degenerate center or parity objection) is a slipped line rather than refutation of the structure","Seven of eight fresh rollouts were correct, finishing in 4.5k-13k tokens by committing to the shared-center antisymmetric pair and solving via sum and difference. The single failure reached that exact form, then zeroed the given numbers when adding the two supplied values, got a degenerate center, and read that as proof the structure was impossible; it then manufactured a second self-refutation by arguing the inner/outer sign parity forbade odd k, and spent the remaining budget naming coefficients and expanding the degree-nine composition until the cap. The revision therefore keeps the proven centered core but makes retaining the given numbers explicit and collapses the abort guidance into one general rule: any contradiction met inside the structure is a slipped line to recheck, never grounds to abandon it. Wording is also compressed so the hint is shorter than the incumbent."
9,10,3843,150.183,150.193,dd96dfb992052dea62ab2214a4d147f14aa95c0c6f35b1224c4d06d84cf346cb,d0801b4dbae545645f0f8c981c1e6d90ae83514eee538836aba3a37a531c8597,dd96dfb992052dea62ab2214a4d147f14aa95c0c6f35b1224c4d06d84cf346cb,0.625,0.375,-0.25,0.1625,0.2125,0.04999999999999999,0.95,0.8,-0.1499999999999999,178,177,discarded,pin the scope of a block-onto-block step (not pairwise swaps) and make the row trace the explicit authority that overrides any hand-built index map,"3 of 8 scored. Two failures never disputed the row trace but mis-scoped a step, reading a block-onto-block move as pairwise swaps inside the block; that halves the small-case counts and produced a clean but off-by-one exponent. The other three built an index map by re-applying each stage to the already-moved index, got a map that was not one-to-one (several inputs sharing one image), and when the map clashed with their own row trace they defended the map, looping on 'this is confusing' until the token cap. The incumbent warns about bijectivity in the abstract, so the revision instead pins the scope of a block move up front and makes the row trace the explicit authority that kills any map disagreeing with it, plus a terser commit clause to stop cap overruns."
10,1,28054,150.194,150.204,fda1791300f21976dd72f9eebe700de3cfaba1edb06bf4fc0339ea25871f6960,a1dbf8d398dfb6d19cca9d0eb709a291d7b1d3205378ecabffae9fbd80b8f38e,fda1791300f21976dd72f9eebe700de3cfaba1edb06bf4fc0339ea25871f6960,0.25,0.0,-0.25,0.1875,0.1375,-0.04999999999999999,0.625,0.275,-0.35,170,167,discarded,"lead with counting how many partners each branch leaves open, and recast a collapsed branch as eliminated-by-the-statement rather than a contradiction to resolve","Fresh sampling with the incumbent scored 1/8; 2 truncated and every rollout burned 14k-16.4k tokens. Six failures fixed the multiplicative reading, enumerated its factor pairs, then noticed a speaker's own value pins the partner uniquely there, called that a contradiction, and spent thousands of tokens trying to resolve it before reporting a factor they had already refuted or admitted was recalled from a classic puzzle. The lone success skipped enumeration entirely and reasoned about how many partners remain open under the additive reading. The incumbent tells the student to intersect constraints across live readings, but the student never gets that far because it treats a collapsed branch as broken rather than as evidence deleting that branch, so I made counting-partners-per-branch the first move and recast collapse as elimination."
10,2,30302,150.195,150.205,64b0f516c4150af456f05fd043eae6476f571e240a578af063256e2ea28e9e9a,1c0368d638fb2c1dab151143b2ba38237919ed29e5bb18dbc11fc15e720e406d,64b0f516c4150af456f05fd043eae6476f571e240a578af063256e2ea28e9e9a,1.0,0.625,-0.375,0.175,0.125,-0.04999999999999999,1.35,0.875,-0.4750000000000001,155,166,discarded,"reorder verification discipline so the simplified value is recorded before any checking, and require naming the exact wrong line before abandoning a derivation","Seven of eight rollouts were correct in 5.8k-9.1k tokens; the failure derived the correct locus and center/radius by 3k tokens, then mis-evaluated a reciprocal of a purely imaginary number while spot-checking one root, and because it had not yet written any result down it spent the remaining 13k tokens re-auditing a sound derivation and finally doubting the substitution itself, ending with nothing stated. Rounds 5-8 all tried to bound or repair that audit loop and lost transfer; the incumbent already says to state the result early but buries that clause last, after the recheck advice. So I reorder the discipline: record the simplified value the moment it exists, verify only afterwards with whatever room remains, and require pointing at a specific wrong line before abandoning anything."
10,3,8554,150.196,150.206,a69022206f815aa610531eaf90a55d289cb8cba855d7fdd86219bae38ef15efe,84558f6857912cd9680b7fc56568361fe85083f74b635febab65f705551d55b5,a69022206f815aa610531eaf90a55d289cb8cba855d7fdd86219bae38ef15efe,0.625,0.625,0.0,0.2,0.175,-0.025000000000000022,1.025,0.975,-0.04999999999999993,146,172,discarded,"replace abstract bound-plus-witness with a concrete symmetric-case-plus-perturbation substitute for the angle sweep, add a repeat-what-if stop trigger, and end on a three-line no-headings write-up rule","Two of eight scored. All eight found the value early (first 3-6k of ~55-63k chars), so the wedge and inclusion-exclusion advice works; every failure was budget, not math. Three never closed reasoning at all, still numerically re-testing rotation angles (98-205 rotation mentions, 45-82 restarts). Three did close reasoning but then spent all remaining tokens re-arguing from scratch why the symmetric configuration is minimal, restating the setup, and were cut off before any result appeared. The incumbent bound-plus-witness clause is too abstract to trigger and its transcribe rule is buried, so this revision gives a concrete substitute for the parameter sweep (evaluate the most symmetric case, then a perturbation argument), a checkable stop trigger (a repeat what-if means halt), and moves the short-write-up rule to the end where it is acted on."
10,4,25003,150.197,150.207,2f7b2098363b9a53549fa724b1dc1c9431fbed1120452254cacf4f6a7a8218ff,ab69496cb79ce7098870894e922ec0da4b939b987c0f4b49850980897d2c0e65,2f7b2098363b9a53549fa724b1dc1c9431fbed1120452254cacf4f6a7a8218ff,0.875,0.0,-0.875,0.1375,0.1875,0.04999999999999999,1.15,0.375,-0.7749999999999999,194,187,discarded,pin the residual at the piece's full degree d (subtracting an affine part cannot drop it to d-1) and replace the open audit with commit-and-stop once the bound is proved,"3 of 8 fresh rollouts were correct and the pointwise-residual plus reusability framing is clearly landing: every finisher reached the summed m*d budget shape. The dominant error has shifted to degree bookkeeping - three rollouts asserted the residual has degree d-1 after subtracting the affine part and so reported a budget one factor short per piece. One reverted to the old trap of forcing a single piece to step by a constant and concluded each piece serves exactly one index; one hit the token limit after already deriving the right count, then relitigating it. So the revision adds one sentence stating that subtracting an affine part leaves the leading term untouched, so the residual keeps the FULL degree and never d-1, and replaces the open-ended audit with an instruction to state the count once the bound is proved and not reopen it."
10,5,30418,150.198,150.208,83c896bc82082c6ed4cb8791f9d2a555f90a25b05e0dc438a5532b3b8a6282c8,5f08110cff452f4c5cf29f0402aeb9bc345480a8d5a13ccf06648f7b36db2bd2,83c896bc82082c6ed4cb8791f9d2a555f90a25b05e0dc438a5532b3b8a6282c8,0.875,0.625,-0.25,0.175,0.175,0.0,1.225,0.975,-0.2500000000000001,63,69,discarded,replace the vague discard-degenerate clause with substitute-to-test roots plus a reversal rule when the kept root degenerates,"Seven of eight fresh rollouts were correct at about 9k tokens; the single failure reduced correctly to the right two-root equation, then screened the roots against a domain interval it recalled wrongly, threw away the admissible one, kept the root that collapsed the figure, and reported that collapsed value as its result instead of reading the collapse as a signal. The incumbent tells the student to discard degenerate or out-of-domain roots but gives no way to tell them apart, which is exactly the ambiguity that bit here. I sharpened just that clause: test each root by substituting it rather than trusting a remembered rule, and treat a degenerate survivor as proof the other root was correct. Everything else stays terse, since brevity is the only edit that has ever gained transfer for this hint."
10,6,26989,150.199,150.209,605dd6784c9f1f6f9bb9f5068b8e9744aad3781c1b1d0e9028b48e9692b555e2,d8af24efb99c15c33739b300a364e9fc8e77799553326a48cae0e1a46e8ebc59,605dd6784c9f1f6f9bb9f5068b8e9744aad3781c1b1d0e9028b48e9692b555e2,0.25,0.0,-0.25,0.1625,0.2125,0.04999999999999999,0.575,0.425,-0.14999999999999997,182,188,discarded,state that a pile bottom is the FIRST delivery (not the item delivered last) and legitimize two parts sharing the same value so the student stops abandoning the shared atom set on the later part,"Fresh sampling with the incumbent gave 1/8; six rollouts stopped normally at 12k-15k tokens and two hit the cap, so length is secondary. Six of the eight reached the 2^(free) atom count on the first part and then abandoned it on the second, asserting every item is equally likely in every slot and reading off 1/n or 1/2; five of those also equated the requested bottom slot with the item delivered last, and the one correct rollout got there only by keeping the same atom set for both parts, so the two parts coincided. The revision keeps the shared free-step sample space, replaces the vague first-vs-last hedge with the concrete rule that a pile bottom is its FIRST delivery, bans pricing a slot-occupancy event as 1/n, and states outright that two parts may honestly share one value so a repeat is not a reason to switch methods."
10,7,3836,150.200,150.210,624bd880b5b94320846e50c68a8c4de3ea35b048ba853273064bcd1c17d0a2db,65563ba9f4100df9de9d80bb80ffa2162207051bfa779f088bce6d5e8e105446,624bd880b5b94320846e50c68a8c4de3ea35b048ba853273064bcd1c17d0a2db,0.125,0.0,-0.125,0.175,0.0875,-0.0875,0.475,0.175,-0.3,168,173,discarded,"add a formula-vs-hand-solved-instance consistency check, an abort rule for reformulations needing unpinnable constants or long products, and a block on the underdetermined/guess-zero escapes","Fresh sampling scored 2 of 8. Both successes solved the three smallest instances by plain elimination, read off the signed reciprocal-factorial pattern, and landed. All six failures instead recast the setup as a polynomial with a product factor times an undetermined linear factor: five ran to the token cap trying to pin two unknown constants from one condition, and one closed on a wrong value after an unverified coefficient extraction. Two explicitly concluded the system was underdetermined and one committed to zero out of exhaustion, even though the conditions are square and independent. The revision therefore keeps commit-then-verify, adds a mandatory check of any general formula against a hand-solved smallest instance, tells the student to drop a reformulation as soon as it needs a symmetric function, a long product, or an unpinnable constant, and blocks the underdetermined and guess-zero exits."
10,8,23443,150.201,150.211,8a6dfd748e0553b9accc3ad13afe0c4aa08f94103b64259ab984bac22622e13d,3f251668b049ccf1258b2bfc5584ee0a122f63ee6a034206e990b8bdd82b674c,8a6dfd748e0553b9accc3ad13afe0c4aa08f94103b64259ab984bac22622e13d,1.0,1.0,0.0,0.2,0.15,-0.05000000000000002,1.4,1.3,-0.09999999999999987,130,156,discarded,"keep the train-safe opening and small-cases clause verbatim; replace the exact-arithmetic clause with a change-of-representation escalation (condition-to-equation, complementary counting, choose the most-constrained variable)","All 8 fresh rollouts scored reward 1 with clean stops, so train_i is pinned at 1.0 and every gain must come from transfer. The rollouts never invoke exact-fraction or simplify-late reasoning at all (zero occurrences), so that clause is dead weight; what they actually burn tokens on is 5-25 self-interruptions per rollout re-deriving the same arithmetic in the same framing, up to 6.6k tokens. Nine rounds of evidence say the opening must stay verbatim (every wholesale rewrite crashed train to 0.25-0.5) and that only the tail sentence is safe to change. Round 9's tail edit (exact products plus substitute-back) lost transfer, so instead of another arithmetic-hygiene rule I swapped in a second-tier escalation: if the first attack stalls, switch representation rather than grind harder."
10,9,3980,150.202,150.212,652ee8dc58008e69bb7e90163e071e0708bc579422e2fd3d5a546ca1fb63ccad,98f5d89414ab729b0cdfca14a011095ed39a158610d13a446dfacc786c847d3b,652ee8dc58008e69bb7e90163e071e0708bc579422e2fd3d5a546ca1fb63ccad,1.0,0.75,-0.25,0.25,0.2875,0.03749999999999998,1.5,1.325,-0.17500000000000004,180,177,discarded,"compress the centered-ansatz core and spend the freed tokens on generic output discipline: keep values exact rather than decimal, simplify, and emit exactly the requested quantity in the requested form and order","All 8 fresh rollouts were correct and every one stopped cleanly at 3.8k-8.8k tokens, so the incumbent has fully eliminated the budget-exhaustion and ansatz-mis-parameterization failures that dominated rounds 1-8; there is no remaining training failure to target. Successes matched a common shape: commit to the shared-center antisymmetric pair, solve the two data values by sum and difference, then evaluate inside the centered form. Since train is saturated and transfer is weighted double, the revision preserves that proven core verbatim in meaning but compresses its wording, and reinvests the freed tokens in guidance that fires on every problem rather than only on this narrow commuting-map pattern: keep quantities exact instead of decimal, simplify, and report precisely the quantity requested in the requested form and order."
10,10,3843,150.203,150.213,dd96dfb992052dea62ab2214a4d147f14aa95c0c6f35b1224c4d06d84cf346cb,16d32ed13406cbef38b4e155736b37cd6bbe11127880cf5e2adeed1d64e844ae,dd96dfb992052dea62ab2214a4d147f14aa95c0c6f35b1224c4d06d84cf346cb,0.625,0.25,-0.375,0.1625,0.1625,0.0,0.95,0.575,-0.375,178,175,discarded,"pin unit-of-iteration (whole sequence, not a single step) alongside the block-slide scope, and rewrite the block rule as a rigid N-place shift preserving current internal order","3 of 8 scored; the 5 failures split into two mechanical jams, both upstream of any reasoning about order. Two rollouts spent thousands of tokens relitigating whether one application was the entire listed sequence or a single step, then counted intermediate rows as returns and got a count too small. Three others mis-executed the block move: they wrote each block back in its original internal order rather than its current scrambled order, so their traces stopped being rearrangements of the previous row, disagreed with their own structural claims, and looped on 'this is confusing' until the cap. All five also fell back on disjoint-transposition talk to assert period two. The incumbent scopes the block move but never fixes the unit of iteration and never says the block travels rigidly, so the revision pins both up front and keeps the terse commit clause."
11,1,28054,150.214,150.224,fda1791300f21976dd72f9eebe700de3cfaba1edb06bf4fc0339ea25871f6960,113215e3311859eb2cdf6e73ef5fbb320f4a175edc80b6906938c9f74255732f,fda1791300f21976dd72f9eebe700de3cfaba1edb06bf4fc0339ea25871f6960,0.25,0.0,-0.25,0.1875,0.175,-0.012500000000000011,0.625,0.35,-0.275,170,168,discarded,"audit each case-deletion for a fact the constrained party lacks, and require applying every constraint to both members of the pair so the balanced/symmetric case gets tested","Fresh sampling with the incumbent scored 1/8; 4 of 8 truncated and all eight burned 14k-16.4k tokens. Seven failures immediately deleted the additive branch by claiming a party who knows one aggregate and their own value can always deduce the partner, then enumerated only factor pairs of the given number, refuted all of them, and reported a refuted factor or one they admitted was recalled from a classic puzzle. The lone success was the one rollout that stayed in the additive branch and reached the balanced split. So instead of the incumbent's intersect-across-readings clause I added a deletion audit (a case dies only if the constrained party really has that fact) plus a rule to impose every constraint on both members of the pair, which is what points at the symmetric candidate no factor enumeration reaches."
11,2,30302,150.215,150.225,64b0f516c4150af456f05fd043eae6476f571e240a578af063256e2ea28e9e9a,103d2d8e57fbb26e7c11d39bdffe1a69d37a4bf215fdd1b7c842e3cda96e9ec7,64b0f516c4150af456f05fd043eae6476f571e240a578af063256e2ea28e9e9a,1.0,0.875,-0.125,0.175,0.1625,-0.012499999999999983,1.35,1.2,-0.15000000000000013,155,172,discarded,"promote undetermined coefficients (posit the general form of the requested object, pin coefficients from cheap exact instances) as the primary technique, replacing further tuning of the recheck loop","Seven of eight rollouts were correct in 5.8k-9.1k tokens; the failure had the correct locus and radius by ~3k tokens, then spot-checked a root by inverting a purely imaginary number while keeping its modulus instead of inverting it, so a sound derivation appeared to contradict itself and it burned the remaining 13k tokens re-auditing without ever recording a result. Rounds 5-10 all attacked that audit loop with meta-discipline (bound the checking, name the arithmetic rule, reorder commit before verify) and every one lost transfer, while the only proposal that ever beat the incumbent on transfer carried a concrete constructive technique. So I stop tuning the loop and add reusable machinery: when the requested object has a known form, posit that form with unknown coefficients and pin them from a few cheap exact instances rather than pushing a parametrization through trig, keeping the setup and a compressed no-restart clause."
11,3,8554,150.216,150.226,a69022206f815aa610531eaf90a55d289cb8cba855d7fdd86219bae38ef15efe,59cb1d42f961a6499ed61334a40bab60a274717a161a38c0c023a6a82d65fffd,a69022206f815aa610531eaf90a55d289cb8cba855d7fdd86219bae38ef15efe,0.625,0.375,-0.25,0.2,0.15,-0.05000000000000002,1.025,0.675,-0.34999999999999987,146,166,discarded,"front-load the combining arithmetic into the first visible step instead of a generic transcribe-don't-rederive rule, and generalize the obvious-step caution to small-case testing","Two of eight scored, a drop from the incumbent's five, but no failure was mathematical: seven of eight reached the correct value inside the first 3-7k of ~55-62k characters. Four never closed reasoning at all while still numerically re-testing rotations (98-182 rotation mentions, 45-83 restarts). The two decisive cases both closed reasoning and began a tidy headed write-up, but spent their whole visible budget re-establishing coordinates and re-arguing which configuration is minimal, and were truncated mid-sentence one step short of combining the numbers; both successes reached that same combining step. So the incumbent's transcribe-not-rederive clause fires too late to matter. This revision orders the write-up explicitly: do the sum-minus-overlap arithmetic in the very first visible step, and broadens the obvious-step warning to small-case testing for transfer."
11,4,25003,150.217,150.227,2f7b2098363b9a53549fa724b1dc1c9431fbed1120452254cacf4f6a7a8218ff,1abc909eb8fdf9c58239d854312cf83e52586ca6d22a31a7f890a74e1dfe95c1,2f7b2098363b9a53549fa724b1dc1c9431fbed1120452254cacf4f6a7a8218ff,0.875,0.0,-0.875,0.1375,0.2,0.0625,1.15,0.4,-0.7499999999999999,194,183,discarded,pin the shared affine target to position rather than piece label; contrast the d root cap with the d+1 interpolation count; replace the open-ended count audit with a no-re-litigation directive,"5 of 8 fresh rollouts were correct and all three failures were pure token-limit truncations rather than wrong counts, so the residual-root and reusability framing is landing and the remaining loss is budget discipline. One truncated rollout indexed the affine target by which piece was used instead of by position in the pattern, then spiralled trying to force the piece labels themselves into a progression; the other two oscillated between the degree-d root cap and the d+1 points that determine a polynomial, re-deriving both without committing. The revision therefore pins the index to position and bans piece-label indexing, states the d-versus-d+1 distinction in one clause, and replaces the incumbent's open-ended 'check your count uses every number given' audit - which invites reopening an already-proved bound - with an up-front instruction not to re-litigate settled steps."
