round,hint_id,train_qid,sampling_slurm_job_id,proposal_eval_slurm_job_id,incumbent_hash,proposal_hash,final_hash,old_train,new_train,delta_train,old_heldout,new_heldout,delta_heldout,old_J,new_J,delta_J,old_tokens,new_tokens,decision,mutation,subagent_summary
20,7,3836,150.400,150.410,9300bc3ffa577ffd05cfd6854f99348ead9ab916c0aac6c6e36fca997ad1b786,95aca9c58d5fa55d3e1882daa3489cdff6d50b73384a04d3c2690cd5d901b335,9300bc3ffa577ffd05cfd6854f99348ead9ab916c0aac6c6e36fca997ad1b786,0.125,0.0,-0.125,0.175,0.1,-0.07499999999999998,0.475,0.2,-0.27499999999999997,167,178,discarded,"add a notation-separation rule (summation label vs condition index) plus a ban on long-product / subset-sum coefficient extraction in favor of evaluating at a convenient point, keeping hand-solved instances as the arbiter over any general form","Fresh sampling scored 1 of 8; 5 of 8 hit the token cap and the 3 that landed were wrong. The dominant wreck is a notation collapse: rollouts conflated the label being summed over with the index that varies across conditions, so their small hand-solved instance clashed with their own general form. They then either re-derived the same tiny case for thousands of tokens or declared the stated system inconsistent. A second sink is coefficient extraction by brute force: several tried to expand a 2000-plus-factor product or sum products of roots taken all-but-one at a time and never closed. The single success stayed on verified numbers and read the growth rate off them. The incumbent already demands early commitment and small cases but never says how to keep the translation straight or how to lift out one coefficient cheaply, so this revision supplies both."
20,8,23443,150.401,150.411,8a6dfd748e0553b9accc3ad13afe0c4aa08f94103b64259ab984bac22622e13d,8a7895268e948f5e95c14649ae1751715e96360f2a19afec5e9f342923654268,8a6dfd748e0553b9accc3ad13afe0c4aa08f94103b64259ab984bac22622e13d,1.0,1.0,0.0,0.2,0.1125,-0.08750000000000001,1.4,1.225,-0.17499999999999982,130,174,discarded,replace the never-exercised exact-fractions clause with an untried problem-type classification plus canonical-tool recall rule,"All 8 fresh rollouts scored reward 1 with clean stops, so train is saturated at 1.0 for the 13th round running and there is no train signal left; every gain must come from transfer, where the incumbent sits at 0.2. The rollouts show the student never exercises the exact-fractions clause (all stage costs are integers and no fraction survives), so that sentence is dead weight and safe to swap. Nineteen rounds of scope-labeling, anti-rumination, output-form, arithmetic-reliability, backward-reasoning and concretization variants all failed to beat it, so I tried the one broadly-applicable move not yet attempted: name the problem class first and recall the canonical tool for that class, since a 1.7B student mostly loses by improvising ad-hoc algebra where a standard technique applies."
20,9,3980,150.402,150.412,652ee8dc58008e69bb7e90163e071e0708bc579422e2fd3d5a546ca1fb63ccad,08b125c3e67b6f5f596e94fc3fd08f00c703217c4b672ed312e607b7e7394102,652ee8dc58008e69bb7e90163e071e0708bc579422e2fd3d5a546ca1fb63ccad,1.0,0.75,-0.25,0.25,0.225,-0.024999999999999994,1.5,1.2,-0.30000000000000004,180,178,discarded,"compress redundant branch/offset/irrational-center warnings and reinvest in two general guards: a no-symmetry fallback (small concrete cases, extract the invariant) and an ugly-numbers-means-dropped-condition reread rule","All 8 fresh rollouts were correct, each terminating cleanly at 4.1k-8.2k tokens by committing to the shared-center antisymmetric pair, pinning the center by summing the two supplied values, then evaluating inside the centered form. Train is saturated and no failure mode remains to target, so with transfer weighted double the only lever is generality. The revision compresses the redundant branch/offset and irrational-center warnings (the same slip is already covered by the degenerate-center clause) and spends the freed tokens on two guards that fire on problems with no commuting-map structure: when no symmetry exists, work the smallest concrete cases and extract the invariant instead of grinding general algebra; and treat ugly numbers as a signal that a stated condition was dropped, prompting a reread rather than more computation."
20,10,3843,150.403,150.413,181de074d76a20fc0bc384bdc26a17c1f9701c3a217430261cb7e7887a18aee0,50ccb525db09b7d3656522f067332081b217856de7c21bf32e374c5a8cbfe4b1,181de074d76a20fc0bc384bdc26a17c1f9701c3a217430261cb7e7887a18aee0,0.75,0.25,-0.5,0.1375,0.15,0.012499999999999983,1.025,0.55,-0.47499999999999987,175,180,discarded,add a direct minimality test (confirm the candidate works and that one less fails) so untraced small-period claims are refuted instead of re-audited,"Only 3 of 8 rollouts were right. Every failure asserted a repetition count it never ran: three read a count off untraced cycle-type talk (period equals the step count, or one less than the parameter), one guessed a wildly larger power, and two burned the whole budget looping after a bogus 'two passes suffice' claim they kept re-auditing instead of killing. The incumbent already demands a literal run, but says nothing about testing minimality, so the students accepted the first plausible-looking count. The revision keeps the run-outranks-notation core and adds a concrete minimality test: verify the candidate works and that one less does not, which cheaply refutes the small-period guesses that dominate these failures."
