round,hint_id,train_qid,sampling_slurm_job_id,proposal_eval_slurm_job_id,incumbent_hash,proposal_hash,final_hash,old_train,new_train,delta_train,old_heldout,new_heldout,delta_heldout,old_J,new_J,delta_J,old_tokens,new_tokens,decision,mutation,subagent_summary
11,5,30418,150.218,150.228,83c896bc82082c6ed4cb8791f9d2a555f90a25b05e0dc438a5532b3b8a6282c8,4c0613f57f1c34313e7b1f7c82f469f793d0188ccd7663cd2cd75285621b327f,83c896bc82082c6ed4cb8791f9d2a555f90a25b05e0dc438a5532b3b8a6282c8,0.875,0.25,-0.625,0.175,0.2125,0.037500000000000006,1.225,0.675,-0.55,63,70,discarded,"delete the misfiring out-of-domain clause; replace it with a jam-free rule that a root reproducing given data is a setup artifact, so take the other","7 of 8 fresh rollouts were correct and all eight terminated normally under 12k tokens, so budget death is no longer the failure mode. The single failure reduced correctly to the right two-root equation, then declared one root out of the domain by appealing to an interval it recalled wrongly, kept the root that merely reproduced a point it had already been given, watched the figure collapse, and reported that collapse as the value. This is the third round with that exact signature. Rounds 6 and 10 both tried to repair the domain clause by demanding substitution over recall, and both lost transfer, so this time I delete that clause instead of patching it: a root that only reproduces given data is an artifact of your own setup, so use the other. Length stays near the incumbent, since brevity is the only edit that has ever gained here."
11,6,26989,150.219,150.229,605dd6784c9f1f6f9bb9f5068b8e9744aad3781c1b1d0e9028b48e9692b555e2,839a45cee5de7270e7cda865e2fe09935eefbac48bcbc281696addb1cd260e85,605dd6784c9f1f6f9bb9f5068b8e9744aad3781c1b1d0e9028b48e9692b555e2,0.25,0.0,-0.25,0.1625,0.175,0.012499999999999983,0.575,0.35,-0.22499999999999998,182,175,discarded,"encode histories as words over move types with legality as a prefix inequality; free 50/50 steps only where both letters stay legal, and slot questions resolved by a derived arrival index plus shortest forcing prefix","Fresh sampling with the incumbent gave 1/8; seven rollouts stopped normally at 12k-15k tokens and one hit the cap, so length is secondary. Six of eight reached a 2^(free) atom count on the first part then abandoned it on the second: each of those equated the destination pile bottom slot with the item delivered last and asserted every item was equally likely there, reading off 1/4 or 1/2. Two also mis-sized the atom set itself (16 branches, or 4! permutations) because they never tested which steps were legal. The only correct rollout kept one atom set for both parts. The revision replaces the vague first-versus-last hedge with a concrete encoding: a history is a word over move types, legality is a prefix inequality, a step is free only where both letters stay legal, and slot questions are resolved by deriving the arrival index from the stated placement rule and pricing the shortest forcing prefix."
11,7,3836,150.220,150.230,624bd880b5b94320846e50c68a8c4de3ea35b048ba853273064bcd1c17d0a2db,fc36599fe48faa7a7238a59f8e12e453b60d1ce39536620d8016be7e1cb9e45d,624bd880b5b94320846e50c68a8c4de3ea35b048ba853273064bcd1c17d0a2db,0.125,0.125,0.0,0.175,0.075,-0.09999999999999999,0.475,0.275,-0.19999999999999996,168,189,discarded,"add honest sizing rule for the reduced instance (as many conditions as unknowns, inconsistency means an off-by-one exponent range, never conclude unsolvable) and reframe a leftover free constant as an unused given","Fresh sampling under the incumbent scored 0 of 8 with 7 of 8 hitting the token cap. Every rollout recast the setup as a long product times a linear factor, then stalled trying to pin two constants from one condition; several concluded the data was insufficient or that the problem was broken, and the one that terminated forced a constant to zero and landed on a wrong value. Two attempted the small-case route that has produced every past success, but built the miniature with one more exponent condition than unknowns, got a contradictory tiny system, and abandoned the route rather than fixing the range. The revision keeps commit-then-verify but adds an explicit sizing rule for the reduced instance, routes inconsistency to an off-by-one repair, blocks the unsolvable exit, and reframes an unpinnable constant as a signal that a given is still unused."
11,8,23443,150.221,150.231,8a6dfd748e0553b9accc3ad13afe0c4aa08f94103b64259ab984bac22622e13d,ea08f54f06b0d5482616a429ceca89a781193a438c326cfc3610a08c671a107e,8a6dfd748e0553b9accc3ad13afe0c4aa08f94103b64259ab984bac22622e13d,1.0,1.0,0.0,0.2,0.1625,-0.037500000000000006,1.4,1.325,-0.07499999999999996,130,167,discarded,"keep the incumbent verbatim and append an output-form discipline clause (answer the quantity asked, exact reduced form, one simplified number, no decimal or intermediate)","Round 11 sampling again returned 8/8 correct with clean stops at 3.0-6.7k tokens, so train has been pinned at 1.0 for eleven straight rounds and only transfer can move J. The rollouts still solve this question correctly but burn most of their length arguing about which value the setup intends, then close cleanly; the closing sentence is the only clause doing transferable work. Prior rounds already tested anti-rumination, gcd naming, scope labeling and representation-switching tails and all lost held-out ground, so this round leaves the incumbent untouched and appends the one unexplored axis: output-form discipline. Many failures on unfamiliar problems are correct reasoning reported in the wrong form (unreduced fraction, decimalized radical, an expression, or an intermediate quantity), which a grader marks wrong regardless of the work."
11,9,3980,150.222,150.232,652ee8dc58008e69bb7e90163e071e0708bc579422e2fd3d5a546ca1fb63ccad,070529c7a990c45176d44e67e20260bf99235470decd42f00fce0df67f2c9c9a,652ee8dc58008e69bb7e90163e071e0708bc579422e2fd3d5a546ca1fb63ccad,1.0,0.875,-0.125,0.25,0.1875,-0.0625,1.5,1.25,-0.25,180,186,discarded,"order recentering before any exploration, forbid re-expansion into standard powers when evaluating requested inputs, and treat a degenerate center or failed numeric check as a one-line arithmetic slip rather than refutation","Only 3 of 8 fresh rollouts were correct: four ran to the token cap and one terminated wrong. Every failure reached the shared-center antisymmetric form yet left it. Two spent 10k+ tokens surveying inverses and general coefficients before recentering, then hit the cap just as the centered solve worked. Two mis-added the given values, got a degenerate center, read that as refutation, and reverted to expanding the degree-nine composition. The wrong one solved the center correctly, then rewrote the centered form into standard powers and re-added the given constant the center already encodes, so a correct value became wrong. The revision therefore orders recentering first, forbids evaluating outside the centered form, and reclassifies any degenerate center or failed spot-check as one slipped line to recheck rather than grounds to abandon the structure."
11,10,3843,150.223,150.233,dd96dfb992052dea62ab2214a4d147f14aa95c0c6f35b1224c4d06d84cf346cb,21a493f9474dbd8ec37f464fa02cf35255751640fbd3e8bce0202b805500a162,dd96dfb992052dea62ab2214a4d147f14aa95c0c6f35b1224c4d06d84cf346cb,0.625,0.375,-0.25,0.1625,0.1625,0.0,0.95,0.7,-0.25,178,178,discarded,"require the smallest nontrivial count be confirmed two independent ways (iterate the whole row vs. follow one label home) before any pattern is fit, and forbid a moved block from silently reverting to its starting internal order","3 of 8 scored, but the split is not about strategy: every rollout that reasoned at all built a corrupted table of small-case counts and never rechecked it. Four hit the token cap; one finished on an exponent one too small purely because its second-smallest count was wrong; one wrote a row that was not even a rearrangement of the row above (a block reverted to its starting internal order), called it 'very confusing', and looped; another produced a map sending four inputs to one image. The three successes matched no table they had computed, so they were guesses. The incumbent already forbids piecewise splits and untraced period claims, which is why the student never doubts its earliest bad count. The revision therefore forces the smallest nontrivial count to be confirmed two independent ways before generalizing, and names the block-reverts-to-original-order slip that produces the impossible rows."
12,1,28054,150.234,150.244,fda1791300f21976dd72f9eebe700de3cfaba1edb06bf4fc0339ea25871f6960,54453e5dda79d6d264416049a7f7c1e6442050c0206385ea59c2c338b8b0d272,fda1791300f21976dd72f9eebe700de3cfaba1edb06bf4fc0339ea25871f6960,0.25,0.125,-0.125,0.1875,0.125,-0.0625,0.625,0.375,-0.25,170,173,discarded,"diagnose the self-refutation loop: an all-branches-impossible proof means a false added assumption, and a person's options are the union across live branches, not one branch at a time","Fresh sampling with the incumbent scored 0/8; 2 truncated and all eight burned 13k-16.4k tokens. Every rollout split into the two readings, proved inside each that a speaker's own value pins the partner, declared both readings impossible, and then reported a value it had just refuted -- five reported a factor whose refutation they restated in the same breath, one reported a value it explicitly called wrong. One rollout actually reached the balanced equal-split candidate, argued it away as impossible, and reported a neighbour instead. The incumbent asks the student to intersect constraints across readings, but the student never gets there because it treats the collapse as settled truth. So I made the self-refutation itself the trigger: an all-branches-impossible proof means a false assumption was added, and options are the union across live branches, plus a rule not to argue away a candidate that passed."
12,2,30302,150.235,150.245,64b0f516c4150af456f05fd043eae6476f571e240a578af063256e2ea28e9e9a,5acada9306f3b064c7f19c61614a4290e9b40ef29164ffd1bb6293a7665f8948,64b0f516c4150af456f05fd043eae6476f571e240a578af063256e2ea28e9e9a,1.0,1.0,0.0,0.175,0.1625,-0.012499999999999983,1.35,1.325,-0.025000000000000133,155,172,discarded,"prepend an up-front target-and-form specification (which quantity, reduced exact form) replacing the round-11 undetermined-coefficients clause, keeping the setup and a compressed commit/no-restart rule","All eight fresh rollouts were correct, so train is saturated and only length and transfer carry information. Six finished in 5.8k-8.2k tokens, but the outlier ran to 14.6k because after reaching the locus it parametrized by an angle and fought to eliminate the cosine, deriving two contradictory expressions for it and spending thousands of tokens reconciling them. Rounds 5-11 all attacked that self-audit loop with meta-discipline or alternative machinery and every one lost transfer, so the loop is not the lever. Instead I add the cheapest reusable guard that costs no derivation work: pin the requested quantity and its required form up front, since a sound derivation reported as the neighbouring object or left unreduced scores zero, and that risk exists on every problem rather than just this one."
12,3,8554,150.236,150.246,a69022206f815aa610531eaf90a55d289cb8cba855d7fdd86219bae38ef15efe,caae935024d2fcb3bb4129c447eb8daca3270569a349948801d234b60bc32b6d,a69022206f815aa610531eaf90a55d289cb8cba855d7fdd86219bae38ef15efe,0.625,0.375,-0.25,0.2,0.1875,-0.012500000000000011,1.025,0.75,-0.2749999999999999,146,175,discarded,"replace bare bound-plus-witness with symmetry-invariance-or-bound stop licence, cap re-checks at two agreeing passes, and forbid headings/re-derivation in the write-up","Two of eight scored. No failure was mathematical: all eight reached the value inside the first 3-7k of ~52-62k characters. Four never closed reasoning at all, still numerically re-testing rotations (98-182 rotation mentions, 45-83 restarts). The two decisive failures did close reasoning and began a multi-heading write-up, but spent their whole visible budget restating the givens and re-deriving the overlap, and were truncated one step short of combining the numbers; both successes reached that combining step with a shorter reply. So the incumbent transcribe-the-numbers clause fires too weakly. This revision replaces the abstract bound-plus-witness stop with a two-way licence to halt (a symmetry showing the parameter never mattered, or a bound plus an attaining case), caps re-checking explicitly, and forbids headings and re-derivation in the write-up."
12,4,25003,150.237,150.247,2f7b2098363b9a53549fa724b1dc1c9431fbed1120452254cacf4f6a7a8218ff,64cb253901ebb75e3daafadf7282cfe5015ff88279b915b631b9ee36540f3ba8,2f7b2098363b9a53549fa724b1dc1c9431fbed1120452254cacf4f6a7a8218ff,0.875,0.125,-0.75,0.1375,0.1875,0.04999999999999999,1.15,0.5,-0.6499999999999999,194,186,discarded,"add a residual-degree audit (subtracting a line leaves the leading term, so degree stays d, never d-1) and attach the dropped-factor check to the m*d line","4 of 8 fresh rollouts were correct with ZERO token-limit truncations, so the position-indexed residual framing fixed last round only losses. Every remaining failure is now degree bookkeeping or a retreat to a single factor: three finishers subtracted a constant term of the target instead of the whole affine target, declared the residual degree d-1, and reported a budget one factor short per piece; one dropped reusability entirely and answered the bare piece count; one applied the d-root cap to the whole pattern and answered the bare degree. The revision therefore adds an explicit residual-degree audit stating that subtracting a line leaves the leading term alone so the residual keeps full degree d and never d-1, and folds the dropped-factor check directly onto the m*d line where the collapse happens."
12,5,30418,150.238,150.248,83c896bc82082c6ed4cb8791f9d2a555f90a25b05e0dc438a5532b3b8a6282c8,c5379b76be811a50f01056a425777c736ebbaeb00098603747e740c160ae2645,83c896bc82082c6ed4cb8791f9d2a555f90a25b05e0dc438a5532b3b8a6282c8,0.875,0.5,-0.375,0.175,0.1875,0.012500000000000011,1.225,0.875,-0.3500000000000001,63,120,discarded,validate each algebraic rewrite by one-number evaluation before solving; treat no real root as a rewrite error and recompute dependent quantities from the relation,"Only 3 of 8 fresh rollouts were correct, a sharp drop, and every failure came from the same place: the sign/factor bookkeeping in one algebraic rewrite. Three variants of the reduced quadratic appeared across rollouts and only one was right; wrong ones gave a complex or spurious root, after which three rollouts burned the whole budget rationalizing, one shipped an invented value, and one kept a bad root and mis-derived the dependent coordinate. The incumbent says to discard bad roots but never tells the student to validate the rewrite that produced them, so I added a cheap one-number check of each cross-multiplication or absorbed constant, reframed no-real-root as evidence against the rewrite rather than the problem, and required dependent quantities to be recomputed from the defining relation instead of copied."
12,6,26989,150.239,150.249,605dd6784c9f1f6f9bb9f5068b8e9744aad3781c1b1d0e9028b48e9692b555e2,ff9e1a71747a3f074a3c196f9ee7f62a2567540ce10707f16388e81bc5e0bc7c,605dd6784c9f1f6f9bb9f5068b8e9744aad3781c1b1d0e9028b48e9692b555e2,0.25,0.0,-0.25,0.1625,0.1625,0.0,0.575,0.325,-0.24999999999999994,182,183,discarded,"replace abstract atom-counting with a concrete enumerate-and-tabulate rule once the run count is small, and require every part to be read off that single table","Fresh sampling with the incumbent gave 1/8. The incumbent already fixes the first part: five rollouts derived 1/2^(free) correctly there. Every failure came on the later part, where the run immediately abandoned the free-step sample space and asserted ""each item is equally likely in any position"", reporting 1/n; two others burned the whole token budget oscillating between 1/n and a power of two without ever writing out cases. So the abstract atom vocabulary is understood but not acted on. The revision makes the space concrete: size it, and once it is small, tabulate one row per run with the resulting configuration spelled out, then count rows for every part. It keeps the LIFO orientation fact (a pile bottom is its earliest arrival), bans dividing by n, and legitimizes two parts sharing a value so the student stops switching methods to force them apart."
12,7,3836,150.240,150.250,624bd880b5b94320846e50c68a8c4de3ea35b048ba853273064bcd1c17d0a2db,cde8db1831d6ed35af337654fcd0e8775331d40d8b4a834a51223fb77896875d,624bd880b5b94320846e50c68a8c4de3ea35b048ba853273064bcd1c17d0a2db,0.125,0.0,-0.125,0.175,0.1125,-0.062499999999999986,0.475,0.225,-0.24999999999999997,168,174,discarded,"enforce strict ordering: finish small instances numerically before opening any symbolic route, plus an explicit cost tripwire on long-product coefficient extraction","Fresh sampling scored 0 of 8 and all eight ran to the token cap without stating any result. Seven abandoned the small-instance route almost immediately (several started it, then dropped it mid-setup) in favour of a symbolic recast, and then sank the entire budget on one shared sink: extracting a low-order coefficient of a very long product via elementary symmetric or harmonic sums, looping on sign and index conventions. One reached the right shape but declared it contradictory after botching its own small-case check, and one drifted into an ever-messier expression and gave up. Past successes all came from finishing a few tiny instances numerically first, so the revision makes that ordering strict rather than merely recommended and adds an explicit cost tripwire that names the long-product coefficient hunt as the route to abandon."
12,8,23443,150.241,150.251,8a6dfd748e0553b9accc3ad13afe0c4aa08f94103b64259ab984bac22622e13d,c80181376c23f5853e4fb2f561931748d8a78b787a76d1540e23a14a59aaba2b,8a6dfd748e0553b9accc3ad13afe0c4aa08f94103b64259ab984bac22622e13d,1.0,1.0,0.0,0.2,0.125,-0.07500000000000001,1.4,1.25,-0.1499999999999999,130,160,discarded,keep verbatim opening and small-cases clause; replace the never-used exact-fractions clause with a uniqueness-forcing-condition rule for underdetermined-looking givens,"Round 12 sampling returned 8/8 with clean stops at 3.0-7.0k tokens, so train has been pinned at 1.0 for twelve rounds and only transfer can move J. Trace evidence: the incumbent's exact-fractions clause is never exercised (zero hits in all eight traces), so that slot is dead weight, while the students spend their length on underdetermination anxiety (7-21 uses of 'intended', 13-29 hedges per trace) circling which value the setup means before any arithmetic. Prior rounds proved the opening must stay verbatim and that scope-labeling, gcd-naming, anti-rumination, representation-switching and output-form tails all lost ground. So I reclaim only the dead clause with the untested lever the traces actually need: when the givens look too weak, do not argue the reading, locate the uniqueness-forcing condition (integrality, extremum, symmetry, non-degeneracy) and let it settle the choice."
12,9,3980,150.242,150.252,652ee8dc58008e69bb7e90163e071e0708bc579422e2fd3d5a546ca1fb63ccad,ef6849edefb2abff3a3c6e055c49f8dae11e87aff0667cd82948e7b086aa9c99,652ee8dc58008e69bb7e90163e071e0708bc579422e2fd3d5a546ca1fb63ccad,1.0,1.0,0.0,0.25,0.15,-0.1,1.5,1.3,-0.19999999999999996,180,169,discarded,"add an anti-speculation rule (test the first plausible structure against the data at once, never detour through inverses) targeting the observed hypothesis-survey stall, and generalize the sum/difference step as a symmetric-data lever","Seven of eight fresh rollouts were correct, all finishing in 4.1k-6.5k tokens by committing to the shared-center antisymmetric pair and solving the two supplied values by sum and difference. The lone failure never reached that structure at all: it opened by naming eight unknown coefficients, then spent the entire 16384-token budget cycling through speculative hypotheses (are they inverses, reciprocals, scalar multiples, one plus a constant), repeatedly noting each was unpromising without ever testing one against the data, and drifted into degree-8 coefficient extraction of the composition. Prior revisions ordered recentering first but never forbade this open-ended hypothesis survey. The revision therefore adds an explicit anti-speculation rule (commit to the first plausible structure and check it against the given numbers at once) and names the inverse detour as the observed trap, while preserving the proven centered core."
